date,employee_title,location,employee_status,review_title,helpful,pros,cons,advice_to_mgmt,rating_overall,rating_balance,rating_culture,rating_career,rating_comp,rating_mgmt,recommends,positive_outlook,approves_of_CEO
Fri Jan 29 2021, Software Development Engineer,"Boston, MA",Former Employee ,Great company not such a good space for personal growth,0,"Big company, if you work like they want you to you can survive. You learn by doing.
","You always have to keep your head down and work without feedback, managers are not trained to be managers so, your growth is completely dependent on perspective. You are not allowed to ask question about business decisions, everything above manager level is politics and numbers to show that you are here and you are doing something.
Advice to Management
Train your managers take a look what they are doing. Have a regular check in with manager reports to understand what's going on.
Helpfu","Train your managers take a look what they are doing. Have a regular check in with manager reports to understand what's going on.
Helpfu",3.0,2.0,2.0,5.0,2.0,4.0,,,
Mon Jan 11 2021, Senior Product Manager,"Seattle, WA",Current Employee ,Good company in many respects but no work/life balance,1,"Working with smart people on interesting projects. Start-up, entrepreneurial culture
","Emphasis on meeting individual team goals does not encourage cross-functional teamwork. Hugely data driven but you often don’t have the required data to make decisions. Work/life balance is very tough because of short deadlines for almost anything. Almost no support when joining. You’re expected to. One up to speed within days without team members or managers helping.
Advice to Management
Focus on retaining good staff by not burning them out. Do more around diversity and inclusion. Great representation of south Asian Indians and Asian people of color but you need to focus on attracting and retaining qualified African Americans
Helpful (1","Focus on retaining good staff by not burning them out. Do more around diversity and inclusion. Great representation of south Asian Indians and Asian people of color but you need to focus on attracting and retaining qualified African Americans
",4.0,1.0,3.0,2.0,5.0,4.0,Recommends,Positive Outlook,Approves of CEO
Mon Jan 11 2021, Product Manager,"Seattle, WA",Current Employee ,Great for self-starters,1,"Great company for self-starters who want to try to start something without the risk
","Not great at ramping up people
Helpful (1",,4.0,5.0,5.0,5.0,4.0,3.0,Recommends,Positive Outlook,Approves of CEO
Wed Jan 13 2021, Cloud Support Associate,"Dallas, TX",Current Employee ,aws,0,"the support system they have in place is unbelievable
","the goals to meet can be demanding but they aren’t absurd
Helpfu",,5.0,5.0,5.0,5.0,5.0,5.0,,,
Wed Jan 13 2021, Senior HRA,"Bakersfield, CA",Current Employee ,Salary,0,"You are an hourly employee
","Your shift schedule. you can work nights, weekends.
Helpfu",,5.0,5.0,5.0,5.0,5.0,5.0,,,
Wed Jan 13 2021, Whole Foods Shopper,"Chicago, IL",Former Employee ,Great work environment,0,"Good team communication, well structured
","No comments about cons, it was a good place
Helpfu",,5.0,5.0,5.0,5.0,5.0,4.0,,,
Wed Jan 13 2021, Software Development Manager,"Seattle, WA",Current Employee ,Great place to work,0,"Culture, innovative environment, benefits, salary, career plan
","Depending on the team you end up, the level of pressure can be high.
Helpfu",,5.0,4.0,5.0,4.0,5.0,5.0,Recommends,Positive Outlook,
Wed Jan 13 2021, Compliance Manager,,Current Employee ,Fast Pace,0,"Benefits, vacation and fast paced
","Can't think of many cons
Helpfu",,5.0,4.0,5.0,5.0,5.0,5.0,Recommends,Positive Outlook,No opinion of CEO
Wed Jan 13 2021, Stower,"Grapevine, TX",Current Employee ,idc,0,"pay rate was good , ppl nice
","cant b off task 5 min r longer even wen the bathroom 5 min away
Helpfu",,5.0,,,,,,,,
Wed Jan 13 2021, Delivery Station Liaison,"Manassas, VA",Current Employee ,Its a decent job for anyone,0,"good hours, decent pay, mild stress
","somewhat stress, ignorance of customers, etc etc
Helpfu",,5.0,,,,,,,,
Wed Jan 13 2021, Fulfillment Associate,"Dallas, TX",Current Employee ,A good job just pretty stressful working in the warehouse,0,"Good Paying Job for $15 with no qualifications
","A little bit stressful. You are always on your feet. Some positions you are timed
Helpfu",,5.0,5.0,5.0,5.0,5.0,5.0,Recommends,Positive Outlook,Approves of CEO
Wed Jan 13 2021, Customer Service Representative,"Mobile, AL",Current Employee ,Great Company,0,"Work from home... resources. ...equipment provide... benifits
","Not many cons I can think of
Advice to Management
Good job
Helpfu","Good job
Helpfu",5.0,5.0,5.0,5.0,5.0,5.0,Recommends,Positive Outlook,Approves of CEO
Wed Jan 13 2021, Warehouse Worker,"Rialto, CA",Current Employee ,Good pay during pandemic,0,"Team work meet new people
","None for now. Can’t think of anything
Helpfu",,5.0,5.0,5.0,5.0,5.0,5.0,Recommends,Positive Outlook,Approves of CEO
Wed Jan 13 2021, Human Resource Case Manager,,Current Employee ,This is a great experience!!,0,"This is a great experience!! and I get to work from home. I love it!!!
","I took this position due to the pandemic and was laid off from my previous postion. Pay is a lot less than what I was making however the fact that I save on expenses with gas, meals, and travel time makes up for it.
Helpfu",,5.0,,,,,,,,
Wed Jan 13 2021, Senior HRA,,Current Employee ,Amazon needs help developing associates,0,"Great experience in learning new stuff
","Management is not great in developing associates
Helpfu",,5.0,5.0,5.0,,,,Doesn't Recommend,Neutral Outlook,Approves of CEO
Wed Jan 13 2021, Wareshouse Associate,"Kent, WA",Current Employee ,Flexible,0,"Flexible Schedule and decent entry wage
","physically tasking and warehouse environment not for everyone
Helpfu",,5.0,,,,,,,,
Wed Jan 13 2021, Software Engineer,"Bellevue, WA",Current Employee ,Greate company to work for,0,"- Good salary
- Great learning opportunities
","- Work life balance is average
Helpfu",,5.0,,,,,,,,
Wed Jan 13 2021, FC Associate,"Indianapolis, IN",Current Employee ,amazon,0,"opportunities for paid training and advancement
","long hours on your feet
Helpfu",,5.0,,,,,,,,
Wed Jan 13 2021, Warehouse Associate,,Former Employee ,great place,0,"4 days on 3 days off
","the breaks are too short
Advice to Management
longer breaks
Helpfu","longer breaks
Helpfu",5.0,5.0,5.0,5.0,5.0,5.0,Recommends,Positive Outlook,Approves of CEO
Wed Jan 13 2021, Customer Service Representative,N/A,Former Employee ,Really fun,0,"Pay and benefits are really cool
","Sometimes the management can be rude
Helpfu",,5.0,5.0,4.0,5.0,5.0,5.0,Recommends,Positive Outlook,Approves of CEO
Wed Jan 13 2021, Vendor Manager,"Dallas, TX",Current Employee ,Wonderful Company and Opportunity for Growth,0,"Great work environment, relaxed, high compensation.
","lots of men in management that aren't in touch with the business
Helpfu",,5.0,3.0,5.0,3.0,5.0,5.0,Recommends,Positive Outlook,Approves of CEO
Wed Jan 13 2021, Stow Associate,,Former Employee ,Stow Associate,0,"Was great environment seriously caring about health.
","Long work day, small breaks
Helpfu",,5.0,,,,,,,,
Wed Jan 13 2021, Amazon Software Development Engineer,"New York, NY",Former Employee ,:),0,"The experience and being a part of a team
","Long work hours and not too flexible
Helpfu",,5.0,5.0,5.0,5.0,5.0,5.0,,,
Wed Jan 13 2021, Software Engineer,"Newark, NJ",Current Employee ,A great place to work at,0,"You learn a lot at amazon
","hiring bar is sometimes very low
Helpfu",,5.0,,,,,,Recommends,Positive Outlook,Approves of CEO
Wed Jan 13 2021, Associate,"San Diego, CA",Current Employee ,Awesome job,0,"Great benefits, people and good hours
","I do not see any cons so far
Helpfu",,5.0,5.0,5.0,5.0,4.0,5.0,Recommends,Positive Outlook,
Wed Jan 13 2021, Network Scaling Technician I,"Herndon, VA",Former Employee ,A great place to work,0,"Great pay and benefits. plenty of opportunities for vertical improvement.
","Work-life balance is difficult to achieve.
Advice to Management
apply realistic metrics.
Helpfu","apply realistic metrics.
Helpfu",5.0,3.0,4.0,5.0,4.0,4.0,Recommends,Positive Outlook,Approves of CEO
Wed Jan 13 2021, Whole Foods Shopper,"San Mateo, CA",Former Employee ,Friendly,0,"Everyone will help you if needed.
","There is a completive time slot selection
Helpfu",,5.0,,,,,,,,
Wed Jan 13 2021, Sortation Associate,"Kernersville, NC",Current Employee ,Amazon,0,"Great benefits, Pay, vto,pto and upt
","The hours, the mangers, the drama
Helpfu",,5.0,3.0,3.0,4.0,3.0,4.0,Recommends,Neutral Outlook,Approves of CEO
Wed Jan 13 2021, Picker,"Livonia, MI",Current Employee ,nice company,0,"a good benefits and they cooperate with students
","10 hours a day if you want to work full time
Helpfu",,5.0,5.0,5.0,5.0,5.0,5.0,Recommends,Positive Outlook,Approves of CEO
Thu Jan 14 2021," Stower, Packer, Receiver",,Current Employee ,good,0,"never the same job. every day is different
","no cons at all or I can't find any
Helpfu",,5.0,,,,,,,,
Thu Jan 14 2021, Area Manager,"Los Angeles, CA",Current Employee ,Great for Ops minded individuals!,0,"Always a fast paced environment, things are constantly changing - never expect to settle on anything
","nothing at all, love it!
Helpfu",,5.0,5.0,5.0,5.0,5.0,5.0,Recommends,Positive Outlook,Approves of CEO
Thu Jan 14 2021, Area Manager,,Current Employee ,Awesome Place to Work,0,"the work is salary vs. hourly
","you are expected to work a lot of hours
Helpfu",,5.0,,,,,,,,
Thu Jan 14 2021, Fulltime Employee,,Current Employee ,Amazon life,0,"It’s a good place to work and develop
","It’s hard work so you’re tired
Helpfu",,5.0,5.0,5.0,4.0,5.0,5.0,Recommends,Positive Outlook,Approves of CEO
Thu Jan 14 2021, Senior Sales Executive,"New York, NY",Current Employee ,Love this place,0,"Amazing company to work at. Love it
","Prepare to wear many hats not a con but prepare for it.
Helpfu",,5.0,5.0,3.0,2.0,5.0,5.0,Recommends,Positive Outlook,Approves of CEO
Thu Jan 14 2021,Anonymous,,Current Employee ,Great,0,"Great great great great great
","Nothing bad to say about Amazon
Helpfu",,5.0,5.0,5.0,5.0,5.0,5.0,Recommends,Positive Outlook,Approves of CEO
Thu Jan 14 2021, Creative Director,"New York, NY",Former Employee ,Great company,0,"a progressive company, very interesting to work for
","Lots of work to keep me busy
Helpfu",,5.0,5.0,5.0,5.0,5.0,5.0,Recommends,Positive Outlook,
Thu Jan 14 2021, IT Support Associate II,,Current Employee ,IT Help Desk,0,"Job security
Family-like team structure
Opportunities to assist on site launches 
Opportunity to move up
Assistance with schooling or certifications.
Health insurance 
Opportunity to purchase stocks
","No cons to report at the moment.
Helpfu",,5.0,4.0,5.0,4.0,5.0,4.0,Recommends,Positive Outlook,Approves of CEO
Thu Jan 14 2021, Software Development Engineer (SDE),"Arlington, VA",Current Employee ,"Great pay, excellent atmosphere",0,"Pay
Work Environment
Work-life balance (depending on team)
Growth opportunity
","Benefits could be better
Onboarding can be rough
Helpfu",,5.0,5.0,5.0,4.0,4.0,4.0,Recommends,Positive Outlook,Approves of CEO
Thu Jan 28 2021, Picker,"Sparrows Point, MD",Former Employee ,Ehh. An easy-access job. Good for financial,0,"Many learning opportunities doot doot.
","Mediocre pay for effort. You are a number. Even if your manager cares about you, your manager's manager doesn't.
Helpfu",,2.0,1.0,1.0,1.0,4.0,1.0,Doesn't Recommend,Negative Outlook,Disapproves of CEO
Thu Jan 28 2021, FC Associate I,"Edgerton, KS",Former Employee ,It is a paying job.,0,"It is a paying job.
They will hire almost anyone.
","The benefits change after being hired.
The minimum working rate continuosly increases.
There is only minimal promotion from within.
They are continously looking for reasons to terminate full timers that have been there longer than a couple of years.
Advice to Management
Be honest. It's a temporary job.
Helpfu","Be honest. It's a temporary job.
Helpfu",2.0,1.0,1.0,3.0,1.0,2.0,Doesn't Recommend,Neutral Outlook,Disapproves of CEO
Thu Jan 28 2021, Software Engineer,"Boulder, CO",Current Employee ,Know Your Trade-offs,0,"High comp
Challenging technical problems
Very Smart colleagues
Sky is the limit if you are willing to sell your soul, grind, and play the game
","Work life balance - no surprise here, the rumors and news reports are true
Beaurocracy (promotions require a lot of ""self-advocacy"", aka politics)
Benefits - very bad (as an example, 401k matches are clawed back until you hit 3 years, and they are small to begin with)
Competition over collaboration environment - people are looking out for themselves and don't mind stepping on you in the process here. It's just the personality type this corporate culture attracts and nurtures.

I've been talked down to in ways I would never dream of speaking to a colleague here, and it's common. Make sure you have a tough skin before accepting that job offer. If you're like me and enjoy helping others grow professionally and don't mind sacrificing in terms of your short term performance, Amazon does not reward this mindset.
Helpfu",,2.0,1.0,2.0,3.0,4.0,4.0,Doesn't Recommend,Positive Outlook,Approves of CEO
Thu Jan 28 2021, Amazon Area Manager II,,Current Employee ,Hard on managers,0,"pays the bills - barely
","burn out culture, promotions through networking vs merit and experience
Helpfu",,2.0,1.0,2.0,2.0,2.0,2.0,Doesn't Recommend,Neutral Outlook,Disapproves of CEO
Thu Jan 28 2021, Senior CopyWriter,"Seattle, WA",Former Employee ,"Well compensated, but you pay your dues",0,"Incredible pool of talent with your coworkers.
","Incredibly competitive with your coworkers, everyone wants to be Jeff B.
Helpfu",,2.0,2.0,1.0,2.0,2.0,5.0,Doesn't Recommend,Positive Outlook,Disapproves of CEO
Thu Jan 28 2021, N/A,"West Jefferson, OH",Current Employee ,"Benefits are fantastic, expected to work like robots",0,"The benefits are great. Health insurance etc.
","But 12 hour shifts standing with expected rates are hard. Managers are very young with little life experience. They do not understand how to talk to someone. Its all about making rates.
Helpfu",,2.0,,,,,,,,
Sat Jan 09 2021, Delivery Driver,"Richmond, CA",Former Employee ,A lot of work,1,"Great way to make a lot of money
","Sometimes the hours can catch up to you and a lot of people can’t work long hours
Advice to Management
More organization please... just not enough
Helpful (1","More organization please... just not enough
",5.0,5.0,5.0,5.0,5.0,5.0,Recommends,Positive Outlook,Approves of CEO
Sat Jan 09 2021, Delivery Driver,,Current Employee ,Great Experience!,1,"always an adventure working here
","sometimes it can be a bit tiring
Helpful (1",,5.0,,,,,,,,
Sat Jan 09 2021, Operations Manager,"Rialto, CA",Current Employee ,Great Company,1,"Growth opportunities with plenty of relocation options.
","Long hours and can be stressful at times.
Advice to Management
Continue to promote professional growth within the company.
Helpful (1","Continue to promote professional growth within the company.
",5.0,3.0,4.0,4.0,5.0,5.0,Recommends,Positive Outlook,
Wed Jan 13 2021, Leave Administrator,"Las Vegas, NV",Former Employee ,Good Company,0,"The pay is really good, benefits are amazing, for the most part your team is amazing
","No work life balance 
It felt like high school at times
Helpfu",,4.0,1.0,4.0,5.0,4.0,5.0,Recommends,Positive Outlook,No opinion of CEO
Wed Jan 13 2021, Associate,"Oklahoma City, OK",Former Employee ,Great company,0,"Good environment to work in
","A lot of physical work with little breaks
Helpfu",,4.0,,,,,,,,
Wed Jan 13 2021, Operations Manager,"Seattle, WA",Current Employee ,Lots of opportunities but hard work is required.,0,"Challenging with numerous opportunities for growth.
","Emphasizes customer needs over employees. Development models are not well established and make it difficult to settle in to new roles.
Advice to Management
Listen to employees more and take personal interest in their growth/success.
Helpfu","Listen to employees more and take personal interest in their growth/success.
Helpfu",4.0,2.0,3.0,3.0,5.0,4.0,Recommends,Neutral Outlook,No opinion of CEO
Wed Jan 13 2021, Seasonal Associate,"Chicago, IL",Current Employee ,Blue badge,0,"Fast money, lots of good people
","Hard work, you must be able
Advice to Management
Don’t keep all the good positions for your friends
Helpfu","Don’t keep all the good positions for your friends
Helpfu",4.0,3.0,4.0,4.0,4.0,4.0,Recommends,,Approves of CEO
Wed Jan 13 2021, AWS Developer,"Austin, TX",Current Employee ,"Good Company, Great People, Grueling Schedule",0,"Very supportive organization full of ambitious people. You will learn a LOT in a short period of time.
","It will burn out most people sooner than later. They structure compensation based on that expectation. Most stock is not granted until 3 to 4 years in. Most people don't make it that long.
Helpfu",,4.0,,,,,,,,
Wed Jan 13 2021, FC Associate,"Chicago, IL",Former Employee ,amazon review,0,"pick your shift each week
","not many shifts available to pick
Helpfu",,4.0,3.0,3.0,3.0,3.0,3.0,Doesn't Recommend,Neutral Outlook,No opinion of CEO
Wed Jan 13 2021, Inbound Stower,,Former Employee ,Decent paying job,0,"They pay decently, and I had great managers and staff
","Hard labor and gets boring doing the same thing everyday
Helpfu",,4.0,,,,,,,,
Wed Jan 13 2021, Amazon Delivery Associate,"Santa Clara, CA",Current Employee ,Its a Job,0,"flexibility of schedule and
decent hours
","early mornings other than that it's good for what it is
Helpfu",,4.0,,,,,,,,
Wed Jan 13 2021, Security Analyst,"New York, NY",Current Employee ,work like dog,0,"good stock option, good culture
","fast pace environment, do everything
Helpfu",,4.0,2.0,5.0,4.0,4.0,4.0,,,
Wed Jan 13 2021, Warehouse Associate,"Cleveland, OH",Former Employee ,"Good, easy job",0,"Really great pay and hours
","Very boring, on your feet and lifting heavy things
Helpfu",,4.0,3.0,4.0,4.0,3.0,4.0,Recommends,Neutral Outlook,Approves of CEO
Wed Jan 13 2021, In Store Shopper,N/A,Former Employee ,Good but get out and leave,0,"Pay, available times, schedule creation
","Lack of unity, good shifts are taken
Helpfu",,4.0,5.0,2.0,2.0,5.0,4.0,Recommends,Neutral Outlook,Approves of CEO
Wed Jan 13 2021, Solution Architect,"Rhinebeck, NY",Current Employee ,Very well-run company,0,"Living by the leadership principles. Great place to make an impact. You are truly empowered here to take your career into your own hands, learn, grow and contribute. Heavy reliance on data means you know exactly where you stand...no ambiguities or subtleties.
","It's big. That can be daunting for some people.
Helpfu",,4.0,4.0,4.0,3.0,4.0,4.0,Recommends,Positive Outlook,Approves of CEO
Wed Jan 13 2021, Prime Amazon Shopper,"New York, NY",Current Employee ,Shifts,0,"Convenient and flexible job to work
","Hard to pick up shifts at times
Advice to Management
N/A
Helpfu","N/A
Helpfu",4.0,5.0,5.0,5.0,4.0,5.0,Recommends,Positive Outlook,Approves of CEO
Wed Jan 13 2021, Software Development Manager,"Portland, OR",Former Employee ,Fast paced and well paid,0,"Smart co-workers. Good salary. Strong business
","Lots of pressure to move fast
Advice to Management
Pick fewer goals and get them done right
Helpfu","Pick fewer goals and get them done right
Helpfu",4.0,2.0,4.0,3.0,4.0,5.0,Recommends,Positive Outlook,Approves of CEO
Wed Jan 13 2021, Warehouse Associate,"Troutdale, OR",Former Employee ,Alright,0,"Not many pros I must say about this company
","More than I can name
Advice to Management
The only good part
Helpfu","The only good part
Helpfu",4.0,2.0,1.0,2.0,3.0,4.0,Doesn't Recommend,Negative Outlook,
Wed Jan 13 2021, Amazon Warehouse Worker,"San Marcos, TX",Former Employee ,"Long hours, GREAT pay",0,"Friendly environment, competitions, great friendships, easy work
","Long 12 hours, short breaks, fast paced, times restroom breaks and time off task
Advice to Management
Be leanent in restroom breaks, especially ladies. We can not walk to and from AND use the restroom when on the East side in under 5 minutes
Helpfu","Be leanent in restroom breaks, especially ladies. We can not walk to and from AND use the restroom when on the East side in under 5 minutes
Helpfu",4.0,4.0,5.0,5.0,5.0,5.0,Recommends,Positive Outlook,No opinion of CEO
Wed Jan 13 2021, Warehouse Fullfilment Associate,"Buford, GA",Former Employee ,Good Pay,0,"they had pretty good pay
","the hours were really long
Helpfu",,4.0,2.0,2.0,5.0,1.0,1.0,Recommends,Neutral Outlook,Disapproves of CEO
Wed Jan 13 2021,Anonymous,,Current Employee ,Mixed bag,0,"Great professional development. Great principles.
","Bad work/life balance (24/7 oncall rotations), sneaky culture (backstabbing etc), leaders have difficulty prioritizing, use odd metrics and goals. For example: database costs never considered (because AWS is practically free). Leads to overengineering and inefficiency.
Helpfu",,4.0,3.0,5.0,5.0,3.0,2.0,Recommends,Positive Outlook,Approves of CEO
Wed Jan 13 2021, Fulfillment Specialist,"Monroe, OH",Current Employee ,GREAT PLACE TO WORK,0,"I love the fact that Amazon feels like a home. Many may speak down on Amazon and say it's a horrible place to work, but for me, it is the first warehouse environment that I can see myself being in for a while. Usually working in a warehouse environment the shift seems really long, but at Amazon, they break the shifts up into two breaks every four hours allowing the shift to go by faster.
","The only con is that it's far away from my house.
Advice to Management
N/A
Helpfu","N/A
Helpfu",4.0,,,,,,Recommends,Positive Outlook,
Wed Jan 13 2021, Associate,"Seattle, WA",Former Employee ,Amazon work Life,0,"Healthy Compensation for various positions
","Intense Work Life Balance, Have to be commited
Helpfu",,4.0,2.0,3.0,4.0,4.0,4.0,Recommends,Neutral Outlook,No opinion of CEO
Wed Jan 13 2021, Warehouse Associate,"Sarasota, FL",Current Employee ,Excellent place to work,0,"Excellent benefits and options to grow
","The location is far for me
Helpfu",,4.0,4.0,5.0,5.0,5.0,5.0,Recommends,Positive Outlook,Approves of CEO
Wed Jan 13 2021, Wearhouse Clerk,"Union City, GA",Current Employee ,If You Want a Part Time Physical Labor Job,0,"It isn't supervision intense which enables your everyday work routine to be flexible.
","It can be a bit unorganized.
Helpfu",,4.0,4.0,3.0,5.0,4.0,4.0,Recommends,,
Wed Jan 13 2021, Warehouse Associate,"Houston, TX",Current Employee ,Not as bad as you may think,0,"easy job, decent pay, decent benefits, internal hiring opportunities
","Management seems to be chosen at random.
Advice to Management
Be more open to inquiries about internal processes.
Helpfu","Be more open to inquiries about internal processes.
Helpfu",4.0,3.0,4.0,3.0,5.0,4.0,Recommends,Positive Outlook,No opinion of CEO
Wed Jan 13 2021, Accounting/Finance Intern,"Seattle, WA",Former Employee ,"Interesting Challenges, big company, get out what you put in",0,"Great exposure to smart people, team engaged and willing to help, interesting problems
","organization disorganized due to scale and speed
Helpfu",,4.0,,,,,,,,
Wed Jan 13 2021, Area Manager,,Current Employee ,Good job,0,"Great work environment and opportunities
","No cons at the moment
Helpfu",,4.0,4.0,5.0,4.0,5.0,4.0,,,
Thu Jan 14 2021, Software Engineer,,Former Employee ,Amazon Intern,0,"fun project, depends on your team
","Not much work-life balance there
Helpfu",,4.0,3.0,5.0,5.0,5.0,3.0,Recommends,Positive Outlook,Approves of CEO
Thu Jan 14 2021, Front Desk Receptionist,"Fayetteville, AR",Former Employee ,Counter,0,"Great job , great people , easy job .
","Over 12 hours of work over night for 6 days in a row , can’t miss unless you have PTO/Non Paid Time . Rarely let you miss for important family events , hard to get in contact with HR from your building .
Helpfu",,4.0,2.0,3.0,3.0,5.0,4.0,Recommends,Neutral Outlook,
Thu Jan 14 2021, Part Time Package Handler,,Former Employee ,Amazon,0,"Was fun nice people nice staff wasn’t too hot
","Nothing they had a great establishment
Helpfu",,4.0,,,,,,,,
Thu Jan 14 2021, Associate,"Fort Worth, TX",Current Employee ,good job overall,0,"easy going if you listen to the managers.
","always on your feet. if caught sitting down may be fired
Advice to Management
let people sit down
Helpfu","let people sit down
Helpfu",4.0,3.0,3.0,4.0,4.0,3.0,Recommends,Positive Outlook,No opinion of CEO
Thu Jan 14 2021, Warehouse Associate,"Windsor, CT",Former Employee ,One of the better part time,0,"people hours environment temperature labor
","The scale of the company and all the HRs to deal with
Helpfu",,4.0,3.0,4.0,5.0,3.0,4.0,Recommends,Positive Outlook,No opinion of CEO
