date,employee_title,location,employee_status,review_title,helpful,pros,cons,advice_to_mgmt,rating_overall,rating_balance,rating_culture,rating_career,rating_comp,rating_mgmt,recommends,positive_outlook,approves_of_CEO
Fri Jan 29 2021, Whole Foods Team Member,"Montclair, NJ",Current Employee ,Great time working for them,0,"Everything is easy, smooth, and they really make it as uncomplicated of a process to do anything as is possible.
","There is no con I see at this moment!
Helpfu",,5.0,5.0,5.0,5.0,5.0,5.0,Recommends,Positive Outlook,No opinion of CEO
Sun Jan 10 2016,Anonymous,"Seattle, WA",Current Employee ,You Get What You Put In,2642,"Really smart people, a lot of opportunity for growth, always encouraged to be innovative, think big, and create something new. Competitive salary and benefits with other major tech companies. 100% self motivating work environment. No dress code and 4 legged friends are welcome.
","You have to be self motivated. NO ONE will hold your hand and tell you that you're doing a great job. If you need constant affirmations from management, this company isn't for you.
Advice to Management
More on-boarding training before new employees are thrown in the fire. The first couple of weeks can be very confusing on where to find the information you need that pertains to your job.
Helpful (2642","More on-boarding training before new employees are thrown in the fire. The first couple of weeks can be very confusing on where to find the information you need that pertains to your job.
",5.0,4.0,5.0,5.0,5.0,5.0,Recommends,Positive Outlook,Approves of CEO
Sat Feb 20 2016, Senior Engineering Manager,"Seattle, WA",Current Employee ,"Exciting Work, Abusive Culture",2499,"Jeff Bezos and his ""S-Team"" are brilliant and continue to make great decisions for long-term growth. 

You work with smart people, you work on exciting projects, you are pushed to your limits...which can be rewarding when you accomplish great things. The diversity of the potential work and innovation can be very alluring. I've often called Amazon my ""Sexy Mistress...she's emotionally abusive, but she's so sexy that I go back for more punishment.""
","The management process is abusive, and I'm currently a manager. I've seen too much ""behind the wall"" and hate how our individual performers can be treated. You are forced to ride people and stack rank employees...I've been forced to give good employees bad overall ratings because of politics and stack ranking.
Advice to Management
Don't pretend that the recent NY Times article was all about ""isolated incidents"". The culture IS abusive and it WILL backfire once stock value starts to drop. I'm an 8 year veteran and I no longer recommend former peers to interview with Amazon.
Helpful (2499","Don't pretend that the recent NY Times article was all about ""isolated incidents"". The culture IS abusive and it WILL backfire once stock value starts to drop. I'm an 8 year veteran and I no longer recommend former peers to interview with Amazon.
",3.0,3.0,3.0,3.0,4.0,4.0,Doesn't Recommend,Positive Outlook,Approves of CEO
Mon Dec 03 2018, Software Development Manager,"Phoenix, AZ",Current Employee ,Amazing company and the most driven and smartest of the people,756,"- You can learn a lot very quickly in a very short time
- Surrounded with nothing but incredibly smart and driven individuals.
- Compensation is well beyond my expectations, and more than suitable.
- Exciting projects all across the company that keep you interested and focused.
- Amazon is changing the world
","- Can be overwhelming, very steep learning curve
- Can be difficult to keep up if you are not self motivated
Helpful (756",,5.0,3.0,4.0,5.0,5.0,5.0,Recommends,Positive Outlook,Approves of CEO
Fri Feb 23 2018, Software Development Manager,"Phoenix, AZ",Current Employee ,An Amazing Place to Work,782,"I've been at Amazon for a month now, and I've seen none of the horror stories being communicated to the public, although Amazon is a large enough company that I'm sure there are good pockets and bad pockets. Everyone here is really smart, and wants to succeed both personally, and as a company. People collaborate and help each other, focus on data, and truly focus on the customer. Every company I've ever worked for talks about how important the customer is, but on day 2, they're forgotten. Amazon seems to genuinely focus on what's best for the customer, and it's awesome to be in meetings where people actually bring that up, and make decisions focused on long-term customer satisfaction.

The opportunities to learn here are literally unlimited, and the opportunity to take on new responsibility is as well. I honestly believe you can be as awesome as you want here.
","No cons, so far - seriously. Like I said, I'm sure Amazon has some bad pockets in it here and there, but this is an amazing job, an amazing opportunity, and the biggest thing I have to complain about is that it's a little chilly in our building. I can live with that.

Does Amazon demand high quality, measurable results? Yes! Is it hard work? Yes! Is it rewarding? Yes! So I'm not calling that a 'con'. Work/life balance seems comparable to other places I've worked - not worse.
Helpful (782",,5.0,4.0,5.0,5.0,5.0,5.0,Recommends,Positive Outlook,Approves of CEO
Tue Dec 17 2013, Software Development Manager,"Seattle, WA",Current Employee ,"Can be amazing for some people, horrible for others",1493,"Amazon is doing lot's of cool stuff...but lots of boring stuff too. There are really well run teams...and very badly run teams. The experience for software managers and engineers is all over the board, from really run low operational load teams to teams where people burn out after a year.

 - Amazon is built, quite deliberately, to be Darwinian. You can generally expect that anyone who's been here for more than 2 years is competent and motivated or they wouldn't have survived. You can count on them as long as your priorities are aligned. There aren't many slackers here, and they don't survive long.
 - We work on so much stuff that there's always an opportunity to find amazing cool stuff to work on (note that it's an 'opportunity', one that you have to pursue)
 - A chance to make a huge difference
 - A place where you can learn a lot about all kinds of things, both technical and about yourself
 - Amazon encourages high mobility - even your manager can't prevent you from moving to another team within 6 weeks (normally, more than a few months under unusual conditions).
 - Your friends and family have actually heard of the place you work and have at least a vague notion of what Amazon does without you having to explain
","- You're responsible for your own career progression and finding the places and teams that are doing the stuff you want to do. No one is going to take you by the hand and help you with that.
- Amazon is built, quite deliberately, to be Darwinian. The strong survive and the weak perish (metaphorically speaking) and the 'bar' is constantly increasing. The level of performance that would have been acceptable five years ago will get you canned today. It's a kind of crucible that'll help you develop a harder edge, if you can survive, that can serve you well in your career and in life, but it's often not a pleasant experience.

I wouldn't recommend it as a place to work for just anyone.
Advice to Management
Stack ranking is a horrible practice since it's rife with favoritism. It's also not Amazonian in that it's not data based (arbitrarily designating a certain percentage of employees that must be put on performance management isn't a data driven criterion) and it's not frugal (effectively forcing an individual out of the company in one division who would make the grade in another is either retaining someone who doesn't meet the bar or a waste of talent). The goal is to force managers to actually make the hard decisions about how their team members compare with each other (not everyone can be exceptional), but it has more defects than virtues. Replace it with a common comparison of each person against the bar for their position, based on data. The percentages that are assigned to each performance category will turn out how they turn out, but there will be an evaluation mechanism that's fair and frugal.
Helpful (1493","Stack ranking is a horrible practice since it's rife with favoritism. It's also not Amazonian in that it's not data based (arbitrarily designating a certain percentage of employees that must be put on performance management isn't a data driven criterion) and it's not frugal (effectively forcing an individual out of the company in one division who would make the grade in another is either retaining someone who doesn't meet the bar or a waste of talent). The goal is to force managers to actually make the hard decisions about how their team members compare with each other (not everyone can be exceptional), but it has more defects than virtues. Replace it with a common comparison of each person against the bar for their position, based on data. The percentages that are assigned to each performance category will turn out how they turn out, but there will be an evaluation mechanism that's fair and frugal.
",4.0,3.0,3.0,5.0,5.0,4.0,Recommends,Positive Outlook,Approves of CEO
Thu Mar 23 2017,Anonymous,"Seattle, WA",Former Employee ,We are now in a world where we are condescended to by our inferiors,689,"This company gets A list performance from C list employees. The culture is quick and hard charging. You are always working in relevant and meaningful projects.
","Maybe because the company recruits C listers who have neither merit (intelligence, strategic vision) nor pedigree (academic or professional accomplishments), most of those who become successful do so in treacherous, low cunning ways.

Imagine the Lannisters in Game of Thrones attacking the Starks in Game of Thrones; or Rawls and Burrell attacking McNulty and Daniels in The Wire; or Barrow and O'Brien attacking Mr Bates in Downton Abbey. This is every day leadership behavior at Amazon. The culture at Amazon is so infested with these middling talent weasels who have juked the stats and schemed their way to positions of power that new employees coming in actually start thinking that this behavior is normal and expected if you want to ""manage people.""

The work itself was stimulating and fulfilling, but the sneering condescension of the d bags that cheated and skated their way through high school and party colleges, then just converted their winky nod nod good 'ol boy shenanigans into a ""ask no questions, have no introspection"" company culture have made manifest some of the worst criticisms of capitalism. Any left leaning political aspirant would look at this business organism and immediately have content to lash out against the corruption that can come in free enterprise where hard work is not rewarded, and the connected, incestuous, privileged class lounge their way to wealth while treating their employees and customers like some kind of filth their shoe picked up on the street.
Advice to Management
Bezos you bought the Washington Post and hired Jay Carney to be your PR head. There is nothing I can write here that you would deign listen to, because you are a hack. You must be mad that Expedia beat you to the punch and hired Chelsea Clinton to serve on their board of directors.

For those grasping Weasels that have squirmed and back stabbed your way to success, you know who you are. You won't care what is written here because ""You got yours, Eff them.""

For those truly diligent and hard working employees that don't want to believe the story from NY times that called Amazon a ""Snake Pit"" because you don't want to think you actually are involved in such a dystopian landscape of anti-business ethics: ""Always yell with the crowd. It is the only means to be safe.""
Helpful (689","Bezos you bought the Washington Post and hired Jay Carney to be your PR head. There is nothing I can write here that you would deign listen to, because you are a hack. You must be mad that Expedia beat you to the punch and hired Chelsea Clinton to serve on their board of directors.

For those grasping Weasels that have squirmed and back stabbed your way to success, you know who you are. You won't care what is written here because ""You got yours, Eff them.""

For those truly diligent and hard working employees that don't want to believe the story from NY times that called Amazon a ""Snake Pit"" because you don't want to think you actually are involved in such a dystopian landscape of anti-business ethics: ""Always yell with the crowd. It is the only means to be safe.""
",4.0,2.0,2.0,1.0,5.0,1.0,Recommends,Neutral Outlook,Disapproves of CEO
Fri Apr 17 2020, Pre,"Herndon, VA",Current Employee ,"Great company, endless opportunities",123,"Big company with a small company feel. Very entrepreneurial. Management facilitates your ideas that push the business forward
","Big company and yes sometimes it takes a while to find the information you are looking for. Global company and sometimes that information is with someone who is on other side of the world.
Helpful (123",,5.0,5.0,5.0,5.0,5.0,5.0,Recommends,Positive Outlook,Approves of CEO
Wed Jan 27 2021, Data Associate,"Medford, MA",Current Employee ,Good,1,"Good job. Nice teammates. Chill environment
","Too much micromanaging. Sometimes frustrating
Helpful (1",,5.0,,,,,,,,
Wed Jan 27 2021, CSA ,"Miami, FL",Former Employee ,CSA,1,"401(k) for seasonal employees voluntary time off and set schedule
","Could care less if your kids get sick but will let you go and start to rehire new people even though they can train you in that department
",,5.0,4.0,4.0,4.0,4.0,4.0,,,
Wed Jan 27 2021, Warehouse Associate,"Charlotte, NC",Former Employee ,Best warehouse job!,1,"Base pay is on the higher side for warehouse positions, tons of OT, variety of shifts to choose from and good benefits
","Managers were lazy when it came to ensuring their teams were supported from actually complaints being acted on to reviewing time off requests ... Managers abused their power by hanging out in groups or just flat out having AirPods in playing music (against warehouse rules)
Advice to Management
Be more aware and empathetic to your team as we are the ones doing the hard labor and need STRONG support
Helpful (1","Be more aware and empathetic to your team as we are the ones doing the hard labor and need STRONG support
",4.0,,,,,,,,
Fri Jan 29 2021, Area Manager,"Boston, MA",Current Employee ,Great,0,"Great benefits and work experience
","Long hours, toxic environment lots of men
Helpfu",,5.0,1.0,3.0,4.0,4.0,3.0,Doesn't Recommend,Positive Outlook,No opinion of CEO
Fri Jan 29 2021," FC Associate I, Direct",,Current Employee ,Great place to work,0,"Fast pace, friendly, good management, flexible, career growth
","long hours, physical demanding, cold conditions, fast paced, tiring
Helpfu",,5.0,5.0,5.0,5.0,5.0,5.0,Recommends,Positive Outlook,Approves of CEO
Fri Jan 29 2021, Software Development Engineer (SDE),,Current Employee ,Amazing Experience,0,"Awesome place to work at
","Work life balance might be bad depending on how you handle
Helpfu",,5.0,,,,,,,,
Fri Jan 29 2021, Principal Business Development Manager,,Current Employee ,Good Experience,0,"Good Culture, Lots of Growth Opportunities, and Fair Compensation
","There can be a steep learning curve when working at AWS. Take your time to get comfortable
Helpfu",,5.0,4.0,5.0,5.0,5.0,5.0,Recommends,Positive Outlook,Approves of CEO
Fri Jan 29 2021, Senior Manager Solutions Architect,"New York, NY",Current Employee ,Great Place to Work,0,"Amazon truly follows Leadership Principles
","There isn't any large downside
Helpfu",,5.0,5.0,5.0,5.0,5.0,5.0,Recommends,Positive Outlook,Approves of CEO
Fri Jan 29 2021, Software Development Engineer,"Seattle, WA",Current Employee ,FAANG rules,0,"amazon grows fast, FAANG good
","work life balance not so good
Helpfu",,5.0,,,,,,,,
Fri Jan 29 2021, Ship Dock Associate,"Monroe, OH",Former Employee ,Great pay and health benefits,0,"Pays very well, great health insurance
","it's hard work. if you're not afraid of manual labor, you're golden here.
Helpfu",,5.0,2.0,5.0,5.0,5.0,5.0,Recommends,Positive Outlook,No opinion of CEO
Fri Jan 29 2021, Tier III Process Assistant,"Haslet, TX",Current Employee ,Good and Bad,0,"After learning the process it runs smoothly.
","After learning the process, managers will change the process. Constantly changing the work load and expectations.
Advice to Management
Set your expectations, stop trying to raise the bar every single day when the leadership is new and the associates are new. Nobody can keep up with the forever changing.
Helpfu","Set your expectations, stop trying to raise the bar every single day when the leadership is new and the associates are new. Nobody can keep up with the forever changing.
Helpfu",4.0,5.0,1.0,5.0,5.0,4.0,Recommends,Positive Outlook,No opinion of CEO
Fri Jan 29 2021, Business Intelligence Manager,"Seattle, WA",Current Employee ,Find a great team,0,"great mechanism culture that create transparency on how to work, culture, goals, ownership etc
Most transparent promotion process that I have seen in my career
Huge company so able to move around a lot and learn a lot from the way different teams operate
Great benefits e.g. sabbatical, parental leave etc
","Depends on the team, make sure to find team with good leaders and team culture. Meet with as many people as you can on the team.
Advice to Management
There are pockets of non-inclusive leaders that seen to be enabled and put in higher positions of power just because they get results but at what costs e.g. There is flight of diverse talent from those teams. Do something about this please, your org will suffer in the end.
Helpfu","There are pockets of non-inclusive leaders that seen to be enabled and put in higher positions of power just because they get results but at what costs e.g. There is flight of diverse talent from those teams. Do something about this please, your org will suffer in the end.
Helpfu",4.0,3.0,4.0,2.0,5.0,4.0,Recommends,Positive Outlook,Approves of CEO
Fri Jan 29 2021, Inbound Stow,,Current Employee ,Great,0,"The benefits are great,and it's fairly easy work for the pay depending on what department you're in.
","Gets a little busy at the end of the year, which is expected.
Helpfu",,4.0,3.0,3.0,4.0,3.0,4.0,,,
Fri Jan 29 2021, FC Associate I,,Current Employee ,It's a Good but Tough Job for Some,0,"Higher pay job than most places around. Freedom to move about to other areas and train in different things.
","The pace set can be difficult for people. A lot of decisions are machine driven, like firing, most of the time management is just the middleman giving out news that's already been settled.
Advice to Management
Develop some form of buffer in-between the machine decision and humans it affects. Some things are more grey vs black & white.
Helpfu","Develop some form of buffer in-between the machine decision and humans it affects. Some things are more grey vs black & white.
Helpfu",4.0,5.0,3.0,4.0,5.0,4.0,Recommends,Positive Outlook,No opinion of CEO
Fri Jan 29 2021, Prime Amazon Shopper,"San Francisco, CA",Current Employee ,"Flexible job, not bad",0,"You can choose your own shifts, and the job is pretty simple. It's like you are shopping for someone else's grocery order and you pack it up in paper bags and label them.
You get a $25 bonus for working Thanksgiving and a $150 bonus for working Christmas month. Bonuses get heavily taxed tho...
","Hard to get shifts, have to fight with everyone at 6:15pm online to get a shift. You must work 3 shifts a month or get terminated, and it's up to you to be able to get the shift online. Even if you tried your best to get a shift but wasn't able to because everyone took them before you got the chance, you will be terminated.

Not really much opportunity for any career growth. This is basically a side hustle job. Do not quit your day job for this.
Advice to Management
Offer more shifts and priority to those that wasn't able to make 3 shifts a month yet so that people don't face termination just because their internet is slow or something. Some people are able to get multiple shifts a week but others can't even get one and risk getting terminated.
Helpfu","Offer more shifts and priority to those that wasn't able to make 3 shifts a month yet so that people don't face termination just because their internet is slow or something. Some people are able to get multiple shifts a week but others can't even get one and risk getting terminated.
Helpfu",4.0,5.0,3.0,3.0,3.0,2.0,Recommends,Positive Outlook,No opinion of CEO
Fri Jan 29 2021, Picker/Packer,,Current Employee ,My take,0,"Easy to do nothing to hard to learn
","Certain people are annoying in there
Helpfu",,4.0,,,,,,,,
Sat Jan 30 2021, Area Manager,"Texas City, TX",Current Employee ,Good place to work,0,"Everything is prompt. You can see what is going on at Amazon.
","long hours work. Terrible work life balance.
Helpfu",,4.0,2.0,4.0,4.0,4.0,5.0,Recommends,Positive Outlook,Approves of CEO
Thu Jan 28 2021, Amazon Warehouse Worker,"Charlotte, NC",Current Employee ,Long hours but flexible,0,"Work life balance 
Fast paced
","Hard on feet 
Very little room for error
Helpfu",,5.0,,,,,,,,
Thu Jan 28 2021, Outbound Order Picker,,Current Employee ,So far so good,0,"Great benefits, good people, managers are good
","Feet hurt daily, poor pay
Helpfu",,5.0,,,,,,,,
Thu Jan 28 2021, Amazon Process Assistant,"Houston, TX",Current Employee ,Questions,0,"The company has a lot of potential
","Great opportunity to have if you moving forward
Helpfu",,5.0,5.0,5.0,5.0,5.0,5.0,Recommends,Positive Outlook,Approves of CEO
Thu Jan 28 2021, Product Marketing Manager,"Seattle, WA",Current Employee ,Work hard play hard,0,"Smart people, impactful projects, collaborative, growth
","Wish there were better benefits
Advice to Management
Managers are great tbh
Helpfu","Managers are great tbh
Helpfu",5.0,5.0,5.0,4.0,4.0,4.0,Recommends,Positive Outlook,Approves of CEO
Thu Jan 28 2021, Amazon Area Manager,"Newark, NJ",Current Employee ,Great Opportunity,0,"Hard work, excellent pay, upward mobility
","No work life balance, working 5-6 days a week. Not for everyone.
Helpfu",,5.0,1.0,4.0,5.0,5.0,5.0,,,
Thu Jan 28 2021, In Store Shopper,,Former Employee ,Easy Working,0,"Get paid above minimum wage, amazon shopper is a really easy job to do
","the breaks are kinda lame
Helpfu",,5.0,5.0,3.0,5.0,4.0,4.0,Recommends,Neutral Outlook,No opinion of CEO
Thu Jan 28 2021, Area Manager,"Minneapolis, MN",Current Employee ,Great Job!,0,"Lots of excitement and things to learn. Awesome teams to work with, and great growth opportunities
","Im liking it so far. Nothing to complain about
Helpfu",,5.0,5.0,5.0,5.0,5.0,4.0,Recommends,Positive Outlook,No opinion of CEO
Thu Jan 28 2021, Product Manager,,Former Employee ,Depends on your team,0,"Work life balance is solid, but depends on your manager and the team
","Meetings after meetings when actually in the office
Helpfu",,5.0,,,,,,,,
Thu Jan 28 2021, Warehouse Fullfilment Associate,"Miami, FL",Current Employee ,Amazon is Amazing,0,"Great benefits, good pay to start.
","Amazon Flex has very little schedule opportunities.
Helpfu",,4.0,4.0,4.0,5.0,4.0,4.0,Recommends,Neutral Outlook,
Thu Jan 28 2021, Staffing Coordinator,"Denver, CO",Current Employee ,Staffing,0,"Good money for doing such a simple job
","The job is very repetitive/monotonous and there's not much opportunity to grow
Helpfu",,4.0,,,,,,,,
Thu Jan 28 2021, Senior Program Manager,"Seattle, WA",Former Employee ,Not a 40 hr a week job,0,"Amazing pay and opportunity to advance
","Heavy workload on high performers
Helpfu",,4.0,1.0,3.0,5.0,4.0,5.0,Recommends,Positive Outlook,
Thu Jan 28 2021, Lead,"Walnut Creek, CA",Current Employee ,It's OK?,0,"Great coworkers, good benefits, $0.25 raise every 6 mo when you first start
","Employee discount sucks, communication between branches is awful and inconsistent, pay step plan is the worst
Helpfu",,4.0,,,,,,,,
Thu Jan 28 2021, Social Media Specialist,,Former Employee ,Its Cool,0,"Various Benefits, Bonuses, Easy Interview process
","Support while assisting customers is lackluster. There were numerous times where I needed assistance with a customer and the support was hard to pin down. Which in turn caused my handle time to increase. Also, they tend to pass news down without having all the details in order, which causes them to retract and have to get all the information and facts together, then re-issue announcements.
Helpfu",,4.0,3.0,4.0,5.0,4.0,4.0,Recommends,Neutral Outlook,No opinion of CEO
Thu Jan 28 2021, Fulfillment Center Associate,"Monee, IL",Current Employee ,Good job to ride out the recession,0,"Paid time off accrues the more you work (even for part-time employees)
10 hour day / 4 day work week (2 - 3 day part time)
Most people on my shift are nice and easy to work with
","Long days on your feet
Some of the job tasks for people who do things like palletizing or inducting packages are very monotonous
Helpfu",,4.0,,,,,,Recommends,Positive Outlook,
Thu Jan 28 2021, Software Development Engineer,"Seattle, WA",Current Employee ,Good learning opportunities,0,"Good growth opportunities. Better career. Great stock growth.
","Benefits not as good as other tech giants
Helpfu",,4.0,,,,,,,,
Thu Jan 28 2021, Sorter,"Venice, FL",Current Employee ,Good enough,0,"Not difficult work, friendly people
","Wearing the face mask in a hot warehouse isn't ideal for morale. Company HR is a bloated bureaucracy with most of them in India not the USA
Advice to Management
Play the radio the entire shift. This is mundane work. Working in silence is bad for productivity
Helpfu","Play the radio the entire shift. This is mundane work. Working in silence is bad for productivity
Helpfu",4.0,3.0,3.0,5.0,4.0,4.0,Doesn't Recommend,Neutral Outlook,Disapproves of CEO
