date,employee_title,location,employee_status,review_title,helpful,pros,cons,advice_to_mgmt,rating_overall,rating_balance,rating_culture,rating_career,rating_comp,rating_mgmt,recommends,positive_outlook,approves_of_CEO
Wed Aug 03 2016, Systems Analyst,"Cincinnati, OH",Current Employee ,Rock solid,0,"Excellent benefits, clear vision of the future, opportunity for advancement, did I mention excellent benefits?
","The compensation is not always competitive. Benefits make up for some of it, but if you're looking for a big paycheck there may be greener grass somewhere else.
Advice to Management
IT salaries need to be more competitive to attract and retain top talent.
Helpfu","IT salaries need to be more competitive to attract and retain top talent.
Helpfu",5.0,5.0,5.0,5.0,4.0,4.0,Recommends,Positive Outlook,
Wed Aug 03 2016, Project Manager,,Current Employee ,Great place to work,0,"Forward thinking & momentous
","Sometimes it takes time to affect change
Advice to Management
Keep investing in employees
Helpfu","Keep investing in employees
Helpfu",5.0,3.0,5.0,3.0,4.0,4.0,Recommends,Neutral Outlook,Approves of CEO
Wed Aug 03 2016,N/A,"San Bruno, CA","Reimbursement Counselor in San Bruno, CA",Reimbursement Counselor,0,"Good employee benefits, opportunity to grow
","Unstable management (always changing). Remote workers are lost in the wind.
Advice to Management
None
Helpfu","None
Helpfu",4.0,4.0,4.0,4.0,4.0,4.0,Recommends,Negative Outlook,Approves of CEO
Mon Aug 08 2016, Senior Analyst,"Philadelphia, PA",Former Employee ,Good company good office,3,"Good company to work for if you find the right group. Company performs well despite market difficulties. free lunches
","Cattiness in the group that i worked with. Literally some of the worst people ive ever met. Work place was not enojyable and layoffs were looming due to company performance
Advice to Management
its hard to justify layoffs when the company is still spending on capital projects. Even harder to justify layoffs when the company operates in the black for the last 5 years.
Helpful (3","its hard to justify layoffs when the company is still spending on capital projects. Even harder to justify layoffs when the company operates in the black for the last 5 years.
",3.0,3.0,3.0,3.0,4.0,2.0,,,
Fri Jul 29 2016,Anonymous,,Current Employee ,Not everyone can wear the same glove,0,"They are a strong company.
","Management could be a bit complacent, they don't like change. Might be afraid of any negative impact change could make.
Advice to Management
A restructure of departments responsibilities is needed for the current and future growth of amerisourcebergen.
Helpfu","A restructure of departments responsibilities is needed for the current and future growth of amerisourcebergen.
Helpfu",5.0,3.0,4.0,3.0,5.0,2.0,Recommends,Positive Outlook,
Wed Aug 10 2016,Anonymous,,Former Employee ,Pays well,0,"Pays well, several remote positions, overall great people, good benefits
","Office politics are prevalent, if you're not part of the ""in crowd"", you might as well hang it up
Advice to Management
Management needs empathy training. Micromanagement is common as well as favoritism
Helpfu","Management needs empathy training. Micromanagement is common as well as favoritism
Helpfu",3.0,3.0,5.0,2.0,5.0,2.0,,,
Thu Aug 25 2016,Anonymous,"Charlotte, NC",Former Employee ,IT has changed,3,"The non-management team is great. You will enjoy the move to agile and how the team works together. Benefits are good.
","IT management has changed and they no longer care about the employees. Moral is low and if you speak up - you are considered the problem.
Advice to Management
Change back
Helpful (3","Change back
",1.0,3.0,1.0,1.0,4.0,1.0,Doesn't Recommend,Negative Outlook,No opinion of CEO
Thu Jul 21 2016,N/A,"Cicero, IL","Customer Service Representative in Cicero, IL",Customer Support,0,"The staff is awesome! Everyone is so helpful.
","It's really busy as for off training mentors is a great idea.
Helpfu",,5.0,5.0,5.0,5.0,5.0,5.0,Recommends,Positive Outlook,Approves of CEO
Wed Jul 13 2016,Anonymous,,Current Employee ,PCC,1,"Great Work Environment, Always a chance to advance yourself, Reputable Company
","Theirs not too many Cons
Advice to Management
My manager was great , Best Manager I ever had Angelia Birchall
Helpful (1","My manager was great , Best Manager I ever had Angelia Birchall
",5.0,5.0,5.0,5.0,5.0,5.0,Recommends,Positive Outlook,
Mon Aug 15 2016,N/A,"Frisco, TX","ICS IT in Frisco, TX",Not really a good employer,4,"Great employees. Pay needs tone better
","HR, is not neutral (side with mngmnt). Retaliation witching leadership in IT(ICS).
Advice to Management
Let go of biased, unfair, uneducated, non-degreed leadership. VPs really need to be recycled. To manypeopleonthe right bus but in the wrong seat. Satisfaction surveys needtobeadministeredfirployees to rate their leadership and make apart of the merrit increase.
Helpful (4","Let go of biased, unfair, uneducated, non-degreed leadership. VPs really need to be recycled. To manypeopleonthe right bus but in the wrong seat. Satisfaction surveys needtobeadministeredfirployees to rate their leadership and make apart of the merrit increase.
",1.0,2.0,3.0,1.0,4.0,1.0,Doesn't Recommend,Positive Outlook,Disapproves of CEO
Thu Aug 18 2016,Anonymous,,Current Employee ,Worst on Lash side,1,"OT is great when offered.
","Long hours, no appreciation, if you don't know someone that knows someone then move on!
Advice to Management
Learn to appreciate the hard workers and not the butt kissers.
Helpful (1","Learn to appreciate the hard workers and not the butt kissers.
",1.0,1.0,1.0,1.0,2.0,1.0,Doesn't Recommend,Negative Outlook,Disapproves of CEO
Thu Jul 28 2016,Anonymous,,Current Employee ,Huge Company,0,"we service the client greatly
","process changes can be a challenge
Helpfu",,3.0,,,,,,,,
Mon Jul 11 2016,N/A,"Lewisville, TX","Applications Developer in Lewisville, TX",IT,4,"Good employees, good atmosphere, average benefits, advancement opportunities, onsite cafe, office park perks. Upper management trying to regain employee trust.
","Low moral, lack of recognition
Helpful (4",,2.0,1.0,2.0,3.0,3.0,1.0,Doesn't Recommend,Neutral Outlook,No opinion of CEO
Wed Jun 29 2016,N/A,"Temple Hills, MD","Senior Reimbursement Consultant in Temple Hills, MD",Employee,0,,"ltant in Temple Hills, MD
Recommends
Positive Outlook
Approves of CEO
I have been working at AmerisourceBergen for less than a year
Pros
The company is a great place to work, great benefits and great work environment.
Cons
Tele-commute should be a viable option for every employee. The company growth is fantastic so telecommute would be a great addition.
Advice to Management
There is no improvement on perfection. The team coordinators are relate-able and professional. 
They will go out of their way to help you and come up with great solutions for any problem you have.
Helpfu","There is no improvement on perfection. The team coordinators are relate-able and professional. 
They will go out of their way to help you and come up with great solutions for any problem you have.
Helpfu",5.0,5.0,5.0,5.0,5.0,5.0,Recommends,Positive Outlook,Approves of CEO
Wed Jun 29 2016,Anonymous,,Current Employee ,Stable company,0,"Free coffee. Outside activities are planned quarterly. Nice office!
","Management gets promoted before you do.
Helpfu",,4.0,,,,,,,,
Tue Jun 28 2016,N/A,, ,Client services,0,"Good company with great benefits.
","Demanding hours and scheduling. Don't expect all holidays off.
Helpfu",,4.0,3.0,5.0,4.0,4.0,3.0,Recommends,Positive Outlook,Approves of CEO
Thu Jul 07 2016,Anonymous,"Charlotte, NC",Former Employee ,Senior Reimbursement Counselor,2,,"stent work, evaluations are fair and based on work Matrix not opinions.
401K stock dropped to a 3% match and they are holding raises for the year- signs of economic uncertainty even though company is making tons of money.
Cons
you get locked into position and cant\'t really move up unless they make a new team or someone gets promoted or leaves - the work is the same over and over- its a call center mentality with some higher level jobs you get variety but when processing patient assistance applications and doing insurance benefit investigations its based on the numbers you do. Some teams are realistic in goals others push the limits so goals are close to or are unobtainable.
Helpful (2",,3.0,2.0,3.0,2.0,2.0,3.0,Recommends,Neutral Outlook,No opinion of CEO
Fri Jul 01 2016, Manager,"Chesterbrook, PA",Former Employee ,Manager,4,"Great benefits, teamwork atmosphere, opportunities abound
","Top 20 in Fortune 500 resulting in having to answer to investors. Recent layoffs in back office operations and sales helped 'trim the fat'. A lot of good talent lost.
Advice to Management
Be more compassionate to those impacted by layoffs and show them a little dignity.
Helpful (4","Be more compassionate to those impacted by layoffs and show them a little dignity.
",3.0,4.0,3.0,4.0,4.0,2.0,Recommends,Negative Outlook,
Mon Jun 20 2016,Anonymous,"Frisco, TX",Current Employee ,Great industry to be a part of,0,"Great benefits, great place to grow your career, lots of opportunity and encourage movement within, leaders are engaged and want to do the right thing
","Culture is dependent on your location
Helpfu",,4.0,3.0,4.0,4.0,4.0,4.0,Recommends,Neutral Outlook,Approves of CEO
Tue Jun 28 2016, IT Analyst,"Frisco, TX",Current Employee ,Not Great..,3,"Benefits & pay although some of those are starting to be lowered including 401k matching
","Organizational structure hinders the ability to get anything done. Very frustrating work environment with lots of headwinds. Work environment is dark & gloomy. No focus on career growth. Career growth is rarely if ever mentioned.
Advice to Management
Review organizational structure & align teams required to work together under same leadership so that something can actually get done around here.
Helpful (3","Review organizational structure & align teams required to work together under same leadership so that something can actually get done around here.
",3.0,5.0,2.0,2.0,5.0,2.0,Doesn't Recommend,Neutral Outlook,No opinion of CEO
Thu Jun 16 2016, Director,"Rockville, MD",Former Employee ,Experience,0,"Market leader, great people, generous benefits
","None - company doing a good job in a competitive market
Advice to Management
None
Helpfu","None
Helpfu",4.0,4.0,4.0,3.0,3.0,4.0,Recommends,Neutral Outlook,Approves of CEO
Wed Jun 22 2016, Site Coordinator,"Frisco, TX",Former Employee ,No direction,4,"Decent pay. PTO and insurance is great.
Free Coffee and sodas/water in the break room.
","Management has no idea what they are doing.
You ask one a question, and get an answer, ask another manager the same question, get a different answer.
Your job responsibilities will keep piling up as they go through their ""phases""
Lied when you are first hired about Bonuses. Stated you get a 5% salary bonus (if you qualify) but end up getting a .5% bonus.
Said we would only be on In Bound Calls for 3 or 4 days out of the month, 5 months later, we are on phones every day.
Advice to Management
Listen to your employers! we know what we are doing more than you!
Pick up the phone once in a while instead of harassing your employees with emails about how many calls are in queue.
instead of going to meetings throughout the day, try working what your staff works so you know how incompetent you sound when we do the ""team huddles""
Helpful (4","Listen to your employers! we know what we are doing more than you!
Pick up the phone once in a while instead of harassing your employees with emails about how many calls are in queue.
instead of going to meetings throughout the day, try working what your staff works so you know how incompetent you sound when we do the ""team huddles""
",3.0,3.0,3.0,1.0,5.0,1.0,Doesn't Recommend,Negative Outlook,
Fri Jun 24 2016,Anonymous,"Wylie, TX",Current Employee ,Think Twice,5,"Decent Benefits some are a bit costly. Lots to learn, potential to move around.
","No real training but yet expected to be a superstar. Micromanaged, made to feel stupid, walking on eggshells. Will get the whip if you step out of line. Lots of people get away with less than stellar work then others are held to the fire for the smallest mistake or misunderstanding. Basically required that you apologize whether you are wrong or not.
Advice to Management
Stop the pounce on people in lower levels, give them the proper resources to do the job. Some of management has their head in the sand and unaware of what is really going on. Lots of people get away with less than stellar work then others are held to the fire.
Helpful (5","Stop the pounce on people in lower levels, give them the proper resources to do the job. Some of management has their head in the sand and unaware of what is really going on. Lots of people get away with less than stellar work then others are held to the fire.
",2.0,1.0,1.0,3.0,3.0,1.0,Doesn't Recommend,,No opinion of CEO
Tue Jul 19 2016,Anonymous,,Former Employee ,Negativity Environment,2,"decent pay, not great, not bad
","Micromanagers galore, made to feel incompetent and your ideas are never even considered. Boss' way or the highway. No training provided to improve, everything is at your own cost, on your own time and doesn't get recognized either. Very political so if you are at a lower level than the person your speaking with, they will walk all over you. This place has no hesitations on taking benefits away either. Three months after I started they did a ""Global Harmonization"" which meant the lower levels lost 5% of their bonuses while upper levels didn't lose a thing. Now they are doing layoffs, no raises and probably low to no bonuses this year and reduced the company contribution to 401K. No recognition for doing a good job, all the rewards go to upper management with trips and trophies and nothing is given to the people who execute. When you ask your boss about career advancement, they can't answer and direct you to HR. HR says sometimes there is no career path in a particular group and the only thing to do is leave the group or company for career advancement.
Advice to Management
Pretend to care about your employees, provide career paths, training and motivation that people can grow their careers at ABC.
Helpful (2","Pretend to care about your employees, provide career paths, training and motivation that people can grow their careers at ABC.
",1.0,2.0,1.0,1.0,3.0,1.0,Doesn't Recommend,Negative Outlook,No opinion of CEO
Thu Jun 23 2016,N/A,, ,So Much Potential...,1,"The associates are amazing. Everyone works together helping each other to accomplish their goals. The associates understand what ""Customer Service"" means. Good company benefits.
","Politics gets in the way of good decision making. Layoffs and outsourcing of jobs are a recent trend.
Advice to Management
Layoffs and outsourcing of jobs to other countries is not the best way to attract and retain top talent. The need to please ""Wall Street"" is blinding upper management.
Helpful (1","Layoffs and outsourcing of jobs to other countries is not the best way to attract and retain top talent. The need to please ""Wall Street"" is blinding upper management.
",3.0,3.0,3.0,2.0,4.0,1.0,Doesn't Recommend,Negative Outlook,No opinion of CEO
Thu Jun 09 2016,N/A,, ,Best place to work,0,"Great values and mission. Patient focused.
","Absolutely cannot think of anything
Helpfu",,5.0,5.0,5.0,5.0,5.0,5.0,Recommends,Positive Outlook,Approves of CEO
Thu Jun 23 2016,N/A,, ,Project manager,0,"Lots of opportunities for growth within the organization
","Difficult to navigate through the organization for growth
Helpfu",,3.0,,,,,,,,
Tue May 31 2016,N/A,"Collegeville, PA","IT Manager in Collegeville, PA",Overworked,13,"Above average pay and excellent benefits
","ABC will work you like a dog to get their moneys worth out of you. The company strongly believes in the ""do more with less"" work environment. They state they value a work life balance but I rarely saw that. Worked over 80 hrs a week for years. Very political environment, if you are not of the same cut throat cloth, they will axe you off in their ""annual"" layoffs or else keep you where you are (very little upward mobility) .

There is no training and despite what they say online, they are NOT ""knowledge driven"".

At the annual onsite health screening, more than 50% of the people that work there have high blood pressure. Many have left the company and never felt more relieved.
Advice to Management
Stop buying companies and put some time and money into your employees well-being
Helpful (13","Stop buying companies and put some time and money into your employees well-being
",2.0,2.0,2.0,2.0,5.0,1.0,Doesn't Recommend,Neutral Outlook,Disapproves of CEO
Thu Jun 16 2016, Analyst,"Eden Prairie, MN",Current Employee ,Not a bad place to work,0,"Work life balance is pretty nice. Most co-workers are easy to get along with. The paid time off offered by the company is competitive.
","This office can burry you in paper. Many reports are printed and handed out to employees when they could simply send spread sheets via email. There area a few known employees that tend not to pull their weight and cost the company time and resources when their errors need correcting. This small group seems to be protected by their seniority despite their sloppy performances. Change can be difficult to make. Senior management tends to be closed off to altering processes leading to the use of antiquated time consuming tasks.
Advice to Management
There are opportunities within the office to ""trim the fat"". Employees should perhaps have their performance records evaluated to determine the value they bring to the company. Paper use could be cut down to save cost. An environment more nurturing to improvement suggestions may lead to more time saving and cost cutting opportunities.
Helpfu","There are opportunities within the office to ""trim the fat"". Employees should perhaps have their performance records evaluated to determine the value they bring to the company. Paper use could be cut down to save cost. An environment more nurturing to improvement suggestions may lead to more time saving and cost cutting opportunities.
Helpfu",3.0,5.0,3.0,2.0,3.0,2.0,Recommends,Neutral Outlook,No opinion of CEO
Sun Jun 12 2016, Reimbursement Counselor,"Ford City, PA",Current Employee ,Pretty Decent,0,"You work in a stable quiet environment, daily duties are the same usually and little schedule change.
","If you call off from being sick it counts against you, if you are 1 min. late from a car accident or bad weather, it counts against you. Depending on which team you work for some teams are more strict than others.
Advice to Management
Understand that sometimes things happen and that not everything is black and white.
Helpfu","Understand that sometimes things happen and that not everything is black and white.
Helpfu",3.0,4.0,4.0,3.0,4.0,3.0,Recommends,Positive Outlook,Approves of CEO
Sat May 28 2016,N/A,"Frisco, TX"," in Frisco, TX",Solid place to work,0,"Lots of opportunities for growth. Great benefits.
","Some departments can be overly political.
Advice to Management
Weed out management that don't embody the values of the company.
Helpfu","Weed out management that don't embody the values of the company.
Helpfu",4.0,4.0,5.0,5.0,4.0,5.0,Recommends,Positive Outlook,Approves of CEO
Thu Jun 02 2016,N/A,"Coppell, TX","Benefit Verification Specialist/Clinical Operations in Coppell, TX",Great Benefits,4,"Great benefit package; PTO is also wonderful.
It is generally a laid back environment. You learn a lot about specialty drug realm.
","There is a GREAT lack of communication between operations. 
You are not promoted based on your work ethic or experience or great ideas to improve company to drive business efficiently. They want people essentially who are ""yes"" men and women, whom don't like to step on other's toes. This is a business. In order to run a business successfully, there are bound to be toes that will be stepped on. Learn that it isn't a personal attack; only improvisation so employees that are driven to be the best they can be, which only promotes growth for the company. You will learn a great deal as to how to cover yourself, if you don't already know. The managers claim to have meetings with other teams regarding process changes and business acquisitions; however, pertinent information that will make the coordinators job easier and more efficient, is not relayed to the coordinator. It's more of 
who's at whom's desk, which in turn, does nothing. Morale would be better if we ran more like a well oiled machine, not the Titanic, after it hits the iceburg. There is always a knee jerk reaction when managers who have not done what needs to be done and the problem is out of control, which again, make the coordinators suffer. Also, you have intelligent coordinators; listen to their ideas and implement them. Most of the supervisors are on the defense, because they are not doing their job well and their coordinators go to them with their concerns or questions. US Bioservices is run more as a ""mom and pop"" shop pharmacy and that simply does not fly. At times, it seems as though supervisors and/or managers are intimidated by coordinators who happen to be very intelligent and they know it, but don't want their positions put into jeopardy. Those employees that do go to HR fortheir concerns regarding management, or lack thereof, often times are retaliated against and deemed as ""troublemakers"". This must stop.
Advice to Management
My advice to management is to please, please, please, listen to your employees that have worked in other pharmacies and for pharmacy benefit management companies, that have multi-faceted ideas that will improve job functions and let us prosper as a company. Promote those individuals that truly deserve it and whose work shows for it day in and day out; not those individuals whom just happened to know the supervisor or director but work ethic is severely lacking. Quit blackballing key people that will help the pharmacy thrive. You have quality employees that deserve chances. Our upper level management needs to take a look at whom they have in ""charge"". Most of them do not need to be in supervisor or lead roles. Also, acknowledge EVERY employee that receives compliments from internal and external parties; not just those that are on your list of ""favorites"". If this is done more often, morale would be a little higher. Also, mid level managment needs to severely work on communication and delegating work accordingly and not just at the last minute. All that does is cause unnecessary stress that can be avoided.
Helpful (4","My advice to management is to please, please, please, listen to your employees that have worked in other pharmacies and for pharmacy benefit management companies, that have multi-faceted ideas that will improve job functions and let us prosper as a company. Promote those individuals that truly deserve it and whose work shows for it day in and day out; not those individuals whom just happened to know the supervisor or director but work ethic is severely lacking. Quit blackballing key people that will help the pharmacy thrive. You have quality employees that deserve chances. Our upper level management needs to take a look at whom they have in ""charge"". Most of them do not need to be in supervisor or lead roles. Also, acknowledge EVERY employee that receives compliments from internal and external parties; not just those that are on your list of ""favorites"". If this is done more often, morale would be a little higher. Also, mid level managment needs to severely work on communication and delegating work accordingly and not just at the last minute. All that does is cause unnecessary stress that can be avoided.
",3.0,4.0,2.0,2.0,3.0,2.0,Neutral Outlook,,
Sun Jun 26 2016,N/A,,Warehouse Associate ,"Goodbye life, hello corporate.",6,"The benefits are the only thing this company has to offer its employees as a reason to continue to remain there. They are the most comprehensive and top-tier plans that I've ever seen.
","Everything else. Management is completely incompetent in their logic and reasoning skills, which leads to employee frustration which would explain the abhorrently high turnover rate. The work is mind numbing and soul sucking. The managers might as well be hovering over you with the threat of chain whippings if you don't move along in the rat cage fast enough. Politics plays a major role in how management's treatment of their employees when it is a fact that the warehouse does not provide housing for the ones they feel as though it is their lives to work for them, where nothing else is to interfere with the company's productivity. You do not have a brain. You do not have needs. You are a robot who is to slave away for 10-12 hours at a time. You are not to have a life when working here, otherwise you will be looked down upon for not focusing solely on the business. Good luck to those who find this useful.
Advice to Management
Get rid of the politics and come to the realization that you have actual people working for you and are not immune from the day-to-day goings on of this thing we call life.
Helpful (6","Get rid of the politics and come to the realization that you have actual people working for you and are not immune from the day-to-day goings on of this thing we call life.
",1.0,1.0,1.0,1.0,4.0,1.0,Doesn't Recommend,Neutral Outlook,No opinion of CEO
Wed May 25 2016,Anonymous,"Dallas, TX",Former Employee ,Great Company,0,"Knowledgeable, caring people at the top. Good work/life balance stressed. Bonus hit most years. Great benefits.
","large company issues.
Helpfu",,4.0,5.0,4.0,3.0,3.0,4.0,Recommends,Neutral Outlook,Approves of CEO
