date,employee_title,location,employee_status,review_title,helpful,pros,cons,advice_to_mgmt,rating_overall,rating_balance,rating_culture,rating_career,rating_comp,rating_mgmt,recommends,positive_outlook,approves_of_CEO
Wed Jun 10 2015,Anonymous,"Valencia, CA",Current Employee ,"Fast paced and fair, but could get a bit better and we can get another star",7,"There's a system in place that not many companies have, Once you're in, you either make it or you quit, I Like that. People now a days are lazy and opportunistic. Looking for a way to just get a pay check and the less they do the better. Well..NOT HERE BUDDY! ! The best part of it all is that if you do decide to work your behind off, You get rewarded. Yeah raises aren't much to talk about, but incentive will definitely knock out any raise percentage on it's rear. Once the bad seeds are gone the crop will flourish. I HAVE NOT seen an eight hour shift since we lost certain people, but guess what, the corruption amongst employees it's not as strong as it once was. There's always something to do if you wanna complete your shift, but you can go home as you were told on your first interview, if the work is done you can go home. V T O.
","The corruption from unhappy people and their stubbornness. Two faced individuals. Instigators. Basically people that are tired and afraid to move on or be replaced just trying to get by.
Advice to Management
Give a $#!*, don't pretend you don't care. You do. You just gotta be firm and say this it's how it's gonna be and deal with the consequences later. Don't get run by the employees, There's a reason your in charge. But you gotta have heart. If you don't have what it takes move on, someone else will take your place and mine for that matter. But don't forget to reward those who do come through for the company. Oh and Raises could be better.
Helpful (7","Give a $#!*, don't pretend you don't care. You do. You just gotta be firm and say this it's how it's gonna be and deal with the consequences later. Don't get run by the employees, There's a reason your in charge. But you gotta have heart. If you don't have what it takes move on, someone else will take your place and mine for that matter. But don't forget to reward those who do come through for the company. Oh and Raises could be better.
",3.0,3.0,3.0,3.0,4.0,3.0,Recommends,Positive Outlook,No opinion of CEO
Fri Jul 10 2015, MHE,"Sugar Land, TX",Former Employee ,Employment opportunities,6,"There is nothing good about this company. Everithing is a hoax. Stay away if you have a college degree.
","horrible compliance. Very umprofessional, uncouth and ill prepare management. Management will not abdocate for anyone, not even for worngfull discrimination. Legal oriented and risk oriented. If you have a college degree, this company is not for you.
Advice to Management
Be more ethical, moral, and more sensitive toward MHE I and MHE II warrhouse personell.
Helpful (6","Be more ethical, moral, and more sensitive toward MHE I and MHE II warrhouse personell.
",1.0,1.0,1.0,1.0,4.0,1.0,Doesn't Recommend,Negative Outlook,Disapproves of CEO
Mon Jun 01 2015, Minnesota,"Eden Prairie, MN",Former Employee ,Good company,2,"Great benefits, most employees have 5 or more years experience at their jobs
","Pay could be more competative
Advice to Management
Involve employees on the programs that effect their jobs to assist in a more efficient way to complete tasks
Helpful (2","Involve employees on the programs that effect their jobs to assist in a more efficient way to complete tasks
",5.0,5.0,5.0,5.0,4.0,4.0,Recommends,Positive Outlook,
Wed Jun 17 2015,N/A,, ,AmerisourceBergen job,4,"There are no pros to working here
","Management jerked everyone around and didn't properly train.
Advice to Management
Train and don't change the job description
Helpful (4","Train and don't change the job description
",2.0,1.0,1.0,1.0,1.0,1.0,Doesn't Recommend,Neutral Outlook,Disapproves of CEO
Wed Jun 03 2015, Maintenance Technician,,Former Employee ,Maintenance Tech.,0,"I really enjoyed working here. The employees are happy and upbeat and it really shows in their work. This is the direct result of the attitude of middle and upper management team members. All of whom come from the rank and file. I have rarely seen a happier workforce. This is a very large distribution center of several hundred thousand square feet. It is fast paced, but, not in a bad way. It runs like a well oiled machine I know it seems cliche but there it is. There are some orders filled during the day but its not super busy. this is where we (the maintenance staff) perform PMs on conveyor systems, stackers, De-stackers, and strapping machines. during the evening shift and on thru the morning hours, orders are filled. I left Amerisource to return to college and finish my degree. but I would certainly work there again. the benefits are spectacular as well with insurance,401k, ect...Its very hard to explain how happy everyone is and how diverse the workforce is. you will find no discrimination here Race color creed or orientation all are here.
","Very odd hours, very tightly controlled access. very fast paced.
Advice to Management
Tuition reimbursment would be good.
Helpfu","Tuition reimbursment would be good.
Helpfu",5.0,4.0,5.0,4.0,5.0,5.0,Recommends,Positive Outlook,
Fri Jun 12 2015,N/A,"Charlotte, NC","PCC in Charlotte, NC",PCC,3,"Some flexibility in working hours
","A lot of work with less pay
Advice to Management
Pay employees their value. Look at everything they do as a whole.
Helpful (3","Pay employees their value. Look at everything they do as a whole.
",2.0,3.0,2.0,2.0,2.0,2.0,,,
Tue May 26 2015,N/A,, ,Loving my new job/company!,1,"People; Company stability and growth and continuous expansion; challenge.
","internal IT support for employees needs work - but everyone internally knows this - and the necessary changes are being put in place....so this should be fixed soon.
Advice to Management
Keep up the good work
Helpful (1","Keep up the good work
",5.0,5.0,5.0,5.0,5.0,5.0,Recommends,Positive Outlook,Approves of CEO
Fri May 29 2015,N/A,"Chesterbrook, PA","IT Operations Intern in Chesterbrook, PA","Great place to work, friendly environment",0,"The IT Operations team was made up of great people. I had an excellent manager who was very willing to help out when I needed it. The IT office in Chesterbrook has modern facilities, and the environment has a family like atmosphere to it. They treated the ibterns extremely well, and I learned a lot from our lunch conferences
","In IT Operations there would at times be a lack of work. The work can also be very boring. In regards to the IT building, many employees are Indian, and some just keep to themselves. For a building with thousands of employees, there wasn't much interaction between people.
Advice to Management
Get your interns better involved and keep them busy. Other than that, no other issues with management. We (interns) learned a lot.
Helpfu","Get your interns better involved and keep them busy. Other than that, no other issues with management. We (interns) learned a lot.
Helpfu",4.0,5.0,4.0,5.0,5.0,5.0,Recommends,Positive Outlook,
Mon May 25 2015,Anonymous,,Current Employee ,Excellent Company,0,"Great company that is always in a growth pattern.
","Will demand alot of your personal time, but will recognize and reward.
Advice to Management
Think programs through, and dont always rush to deploy them.
Helpfu","Think programs through, and dont always rush to deploy them.
Helpfu",4.0,3.0,4.0,5.0,4.0,4.0,Recommends,Positive Outlook,Approves of CEO
Thu May 21 2015, INV Clerk,"Valencia, CA",Former Employee ,inventory control,0,"great people and productive work environment
","job stability isn't what You'd like.
Helpfu",,4.0,5.0,5.0,4.0,4.0,3.0,Recommends,Positive Outlook,
Sun May 24 2015, Business Analyst,"Chesterbrook, PA",Current Employee ,Growing Pains,5,"Above average benefits, great co-workers, above average pay, fast changing environement. Very busy.
","Lack of transparency from mgmt., quality of life issues, lack of diversity, HR procedural issues with regards to posting positions vs. slotting of positions for new and existing roles. Poor mgmt practices of speaking about HR issues in the presence of associates. Mid year and year review process lacks any substance. No defined career path. Very limited use of post mortem procedures to improve performance on future initiatives. As a result projects are often delayed or the deliverable is not fully realized. Project Management is not used correctly and consistently across departments. As a result PM's come and go frequently once they realize this. Lack of consistency with onboarding procedures for new hires. Lack of outside events for associates (i.e. team building). In short a lot of growing pains.
Advice to Management
Continue to focus on improving management practices within the office environment. Work on improving existing performance evaluations. Mandate and implement the use of post mortem activites for all projects. Re-evaluate the PMO structure with the focus on a more hybrid approach in the organization as many PM's aren't fully utilized and are more project trackers then project managers. This has become a revolving door issue. Encourage more team building events. Encourage smaller town hall meetings with associates can speak in person about issues facing them. Encourage more constructive feedback from associates on ways to excel not only for the customer but also internally within teams. Encourage promoting from within and help associates define their career path so they grow within the company rather then leave to a find a company that will.
Helpful (5","Continue to focus on improving management practices within the office environment. Work on improving existing performance evaluations. Mandate and implement the use of post mortem activites for all projects. Re-evaluate the PMO structure with the focus on a more hybrid approach in the organization as many PM's aren't fully utilized and are more project trackers then project managers. This has become a revolving door issue. Encourage more team building events. Encourage smaller town hall meetings with associates can speak in person about issues facing them. Encourage more constructive feedback from associates on ways to excel not only for the customer but also internally within teams. Encourage promoting from within and help associates define their career path so they grow within the company rather then leave to a find a company that will.
",3.0,3.0,3.0,3.0,4.0,4.0,Recommends,Positive Outlook,Approves of CEO
Thu Jun 18 2015,N/A,, ,Chargeback analyst,1,"East schedule. Nothing else. Some of the people are nice. Good location. Quiet atmosphere
","Management. Unprofessional staff. Rude, ignorant. Self centered.
Helpful (1",,1.0,2.0,1.0,1.0,1.0,1.0,Doesn't Recommend,Negative Outlook,Disapproves of CEO
Fri May 15 2015, Warehouse Associate,"Chesterbrook, PA",Former Employee ,Warehouse,9,"the pay is good. the time time off is excellent. and people will always need drugs so this company is just going to get bigger and bigger, so job security is a plus.
","You will need all 4 weeks of the time off in order to recuperate from the long hours ( 10 - 13 hr days if you work 8 hour shifts and 12 -14.5 hours if you are on the 4 day a week 10 hour shift) and mental exhaustion you will experience here. you will see explicit favoritism and may be bullied…
Helpful (9",,2.0,1.0,2.0,1.0,2.0,3.0,Doesn't Recommend,Negative Outlook,Disapproves of CEO
Wed May 20 2015,N/A,, ,Crapshoot Company,5,"Flexible
Decent pay
Easy 
Growing company
(Insert generic compliment about AmerisourceBergen here)
","Company is not keeping up with growth
Company not as professional as one would like to believe.
Lack of career advancement.
Management favoritism.
Lack of communication and transparency by management.
Asinine attendance policy.
Rapid turnover rate
Advice to Management
Grow up
Helpful (5","Grow up
",2.0,4.0,2.0,2.0,3.0,1.0,Doesn't Recommend,Negative Outlook,No opinion of CEO
Sun May 17 2015,N/A,"Chesterbrook, PA","Director in Chesterbrook, PA",Director,0,"In recent years the senior leadership has made a lot of changes to position us for exceptional growth over the next few years. The new leadership team is not content with how thing used to be done. They are looking for innovation that will secure and keep our status as an industry leader.
","If you don't like change, this isn't the place for you.
Advice to Management
Take care of the customer.
Helpfu","Take care of the customer.
Helpfu",5.0,4.0,5.0,5.0,4.0,5.0,Recommends,Positive Outlook,Approves of CEO
Fri May 08 2015, RN Case Manager,"Carlsbad, CA",Former Employee ,Awesome leadership - knew how to develop teamwork,0,"Outstanding leadership
Good work ethics
Appreciation for job done well
Transparency
","Due to loss of contract with Pharm company many of us were laid off.
Advice to Management
They have it right, this was just a business fluke
Helpfu","They have it right, this was just a business fluke
Helpfu",5.0,4.0,5.0,3.0,4.0,5.0,Recommends,Positive Outlook,
Sun May 10 2015,Anonymous,,Current Employee ,Call Center Assistance Manager,0,"Great people. Others want you to succeed and upper management is generally open and willing to work to assist you.
","Employees work 11:30 to 8:00 until reaching seniority.
Advice to Management
Work to expect more from contracted companies. Be open to questions; if we ask a seemingly superficial question it's because we have weighed hidden potential outcomes already. Continue to maintain open communication with representatives.
Helpfu","Work to expect more from contracted companies. Be open to questions; if we ask a seemingly superficial question it's because we have weighed hidden potential outcomes already. Continue to maintain open communication with representatives.
Helpfu",5.0,3.0,5.0,4.0,5.0,4.0,Recommends,Positive Outlook,
Thu May 07 2015,Anonymous,,Current Employee ,Excellent Company,0,"Great place to work. Friendly coworkers. ABC keeps you well informed. Great benefits
","Very large company so can sometimes seem impersonal
Helpfu",,4.0,4.0,5.0,5.0,4.0,4.0,Recommends,Positive Outlook,
Wed May 06 2015, Client Support Engineer,"Buffalo Grove, IL",Former Employee ,Client Support Engineer,0,"Stable company, decent pay and benefits, fair life/work balance. Bonus eligible. maybe nor a great company but overall a good company
","Unfortunately division was sold. new concern laying off, zero upward mobility 
No complaints with ABC however
Helpfu",,4.0,3.0,3.0,3.0,3.0,3.0,Recommends,Positive Outlook,
Fri Jun 05 2015, Warehouse Associate,"Salt Lake City, UT",Former Employee ,"Warehouse/shipping/scanning, everything...",3,"NONE, but maybe one: The best benefits package I have ever seen, hands down. But, found out why, because the job is terrible. You also usually get two days off a week. Good luck with inventory it is all day and on your day off.
","You might as well be working back 3 centuries ago building pyramids and getting whipped by task masters. WILL BE WORKED TO DEATH AND 10-12 Hour days is the NORM! None of the people are friendly cause they all hate the job, don't expect anything other...People will quit after one day to 90 days to a year. You are a number and will be treated as such. Good luck is all I have to say. If you get put in shipping, especially you will end up hating your life. Probably better off just not even bothering with this job and calling it a day. Because if this is your job for the rest of your life, or the next two years, it might as well be like living in hell. The ol saying smoke em if you got em applies here.
Advice to Management
Pay 18-25 dollars a hour, only way to get people to stay. Give all holidays off, quit making orders so huge and taking 12 hours to complete the process
Helpful (3","Pay 18-25 dollars a hour, only way to get people to stay. Give all holidays off, quit making orders so huge and taking 12 hours to complete the process
",1.0,3.0,1.0,1.0,5.0,1.0,Doesn't Recommend,Negative Outlook,Disapproves of CEO
Sat Apr 18 2015,N/A,, ,Accountant,1,"Company makes you enjoy work. You are in charge of your area of the financial statements.
","Not many terrible things I can say.
Advice to Management
Keep growing the business.
Helpful (1","Keep growing the business.
",5.0,3.0,5.0,5.0,3.0,4.0,Recommends,Positive Outlook,Approves of CEO
Wed Apr 22 2015,Anonymous,,Former Employee ,Warehouse Manager,0,"Fast work pace, good benefits - healthcare, 401k, incentive plan, tuition reimbursement.
","Long hours for supervisors, management
Helpfu",,4.0,3.0,4.0,4.0,4.0,3.0,,,
Tue Apr 21 2015,Anonymous,"Frisco, TX",Former Employee ,great place to work,0,"Very many opportunities to move laterally and veritically within the company. A lot of variety of positions to find what best suits you once in the company
","Standard corporate america work enviornment. Certain departments have a tendency to micor manage.
Advice to Management
Learn to mix up your management style on an individual basis if possible.
Helpfu","Learn to mix up your management style on an individual basis if possible.
Helpfu",4.0,3.0,5.0,4.0,4.0,5.0,Recommends,Positive Outlook,Approves of CEO
Wed Apr 08 2015,Anonymous,"Valley Forge, PA",Current Employee ,Great solid company,2,"Very large company with lots of opportunity, CEO very focused on growth and ambitious goals which I believe he will achieve.
","Like in most large companies sometimes politics get in the way of your future growth, training and development is minimal although they are trying to make this better,
Helpful (2",,4.0,5.0,4.0,4.0,4.0,4.0,Recommends,Positive Outlook,Approves of CEO
Mon Apr 20 2015,N/A,"Frisco, TX"," in Frisco, TX",IT,2,"Great employees. Very friendly to each other.
","IT being outsourced to other countries. Many folks worked for a US company for years to make it great and then get let go.
Advice to Management
The Golden Rule... learn it, use it and support America at the same time
Helpful (2","The Golden Rule... learn it, use it and support America at the same time
",3.0,,,,,,,,
Mon Apr 20 2015, Reimbursement Counselor,,Current Employee ,Not Bad...,0,"Very relaxed company. Just get all your work done and if you want to do more that's up to you.
","It can get really boring. Depending on the team you work for there can be outbound or inbound calls. Some teams are more call center like but not all.
Advice to Management
Be nice to the people on your team and don't ask too much if you don't pay them accordingly.
Helpfu","Be nice to the people on your team and don't ask too much if you don't pay them accordingly.
Helpfu",3.0,3.0,4.0,2.0,3.0,3.0,Doesn't Recommend,Neutral Outlook,No opinion of CEO
Mon Apr 06 2015,N/A,"New York, NY","Customer Service in New York, NY",Non-Competitive Pay. Mom and Pop company that gained corporate status by dumb luck.,4,"Good benefits. Stream Line industry. Will always do well because of the product they sell.
","Clickish. No career path infrastructure in place.
Advice to Management
Hire and retain extraordinary talent, not friends. Unless of course your friends are talented.
Helpful (4","Hire and retain extraordinary talent, not friends. Unless of course your friends are talented.
",3.0,3.0,3.0,2.0,5.0,3.0,Recommends,Positive Outlook,No opinion of CEO
Mon May 04 2015,N/A,"New Hyde Park, NY","Finance in New Hyde Park, NY",How to become disillusioned,2,"It was a job, and it was local.
","Too top heavy with poor managers - who got in because of who they know, not what they know.
Managers do not support their staff.
Everyone out for themselves.
Very poor morale.
Advice to Management
Train your management staff, and review them. Listen to the people who are the ones actually doing the work which sustains your company.
Helpful (2","Train your management staff, and review them. Listen to the people who are the ones actually doing the work which sustains your company.
",1.0,1.0,1.0,2.0,2.0,1.0,Doesn't Recommend,Neutral Outlook,
Fri May 01 2015, Reimbursement Counselor,"Monroeville, PA",Former Employee ,Toxic Work Enviorment,3,"Job Stability
beautiful work setting
in house café
free parking
culturally diverse workforce
","No sense of team, poor leadership skills at many leadership positions Elitist attitude of staff and managers. inconsistent application of corporate policies regarding dress code and monitoring/enforcement of productivity. Blatant disrespect my management. The corporate values are just in word, not deed
Advice to Management
mystery shop the programs by phone, and in person to see. Especially if the person is a highly capable man of color.
Helpful (3","mystery shop the programs by phone, and in person to see. Especially if the person is a highly capable man of color.
",1.0,2.0,1.0,2.0,2.0,1.0,Doesn't Recommend,Positive Outlook,
Mon Apr 27 2015,N/A,, ,Former Chesterbrook employee left in 2014,7,"Great Co workers and Chesterbrook is convenient location for 76, 202, 30, 252 travelers.
","HR leadership is horrible and unethical. Tons of unanswered formal complaints against them. IT is downsizing. There is no dining -only vending machines or food trucks. Executives disliked the location so much, they moved to a fancy office and left everyone else behind. Benefits are way too expensive if you fall between 60k and 100k per year. A lowly coordinator who makes 60k pays same as CEO for benefits. 

Unless you are looking for a job in pharmacy specifically, don't work for Amerisourcebergen. The support teams (IT, L and D, HR, etc.) suffer as cost rather than profit centers.
Advice to Management
Add a gym onsite. Bring back dining room (closed for flood and never reopened) 

Investigate issues in IT and HR. I hear people in HR are afraid of their bosses. People who loved their work and their job are now exceedingly unhappy. Pay attention to formal complaints. 

Value the employees who work their life away to make you obscene amounts on money, ...because it doesn't feel like you do. Create some mid level manager accountability so they fully support their teams. 

Fix the benefits pricing for folks who make 60k or more. Rediculous that the pricing is split at that level and not at 100k or even higher.
Helpful (7","Add a gym onsite. Bring back dining room (closed for flood and never reopened) 

Investigate issues in IT and HR. I hear people in HR are afraid of their bosses. People who loved their work and their job are now exceedingly unhappy. Pay attention to formal complaints. 

Value the employees who work their life away to make you obscene amounts on money, ...because it doesn't feel like you do. Create some mid level manager accountability so they fully support their teams. 

Fix the benefits pricing for folks who make 60k or more. Rediculous that the pricing is split at that level and not at 100k or even higher.
",1.0,,,,,,Doesn't Recommend,Negative Outlook,Disapproves of CEO
Tue Mar 24 2015,Anonymous,,Current Employee ,Excellent company with very collaborative leadership,0,"Company is growing; CEO is very focused on expansion, which creates additional opportunities for career expansion
","Company overcoming some legacy reputation issues of not investing enough in career development
Helpfu",,4.0,4.0,5.0,4.0,3.0,5.0,Recommends,Positive Outlook,
Thu Mar 12 2015, Customer Care Representative,"Naperville, IL",Current Employee ,I'm a customer care representative at the Naperville Illinois location,0,"Company is experiencing tremendous growth and the opportunity for advancement is abundant if you can prove yourself at your current role.
","Things are constantly changing. Sometimes you are showed how to do something one way and then the procedure can change the next day without notice.
Helpfu",,4.0,2.0,4.0,1.0,3.0,1.0,Recommends,Positive Outlook,Approves of CEO
Wed Mar 11 2015, Project Manager,"Valley Forge, PA",Current Employee ,Decent Place to work,3,"People that you work will are very pleasant
The work is challenging 
Company is growing
","Office Politics
Compensation is average
HR seems to into everything and not in a good way
Opportunity seems to be limited depending on area you work in
Advice to Management
Right people are in the right positions
Helpful (3","Right people are in the right positions
",3.0,2.0,3.0,2.0,3.0,3.0,Recommends,Positive Outlook,Approves of CEO
Tue Mar 31 2015,N/A,"Pelham, AL","Order Picker in Pelham, AL",My experience working here this place is so unfair to some people who bust their butts and work hard.,0,"Good benefits that's about the only thing that is good about this company
","Pay is the worst in order to really get paid you have to run like you are on a track team.
Advice to Management
Fire people that do not try to improve their production instead of moving them to some place they like.
Helpfu","Fire people that do not try to improve their production instead of moving them to some place they like.
Helpfu",1.0,1.0,1.0,1.0,5.0,1.0,Doesn't Recommend,Negative Outlook,
Wed Feb 25 2015, Customer Care,"Valencia, CA",Former Employee ,the family atmosphere the have,0,"Management is very approachable and benefits are a plus
","timelines and learning the new typse of merchandise on a day to day basis
Advice to Management
keep up the great work
Helpfu","keep up the great work
Helpfu",5.0,5.0,5.0,5.0,5.0,5.0,Recommends,Positive Outlook,Approves of CEO
