date,employee_title,location,employee_status,review_title,helpful,pros,cons,advice_to_mgmt,rating_overall,rating_balance,rating_culture,rating_career,rating_comp,rating_mgmt,recommends,positive_outlook,approves_of_CEO
Mon Jul 23 2018,Anonymous,,Former Employee ,No loyalty to long term associates,2,"Good growth opportunity if you are a chosen one or agree with management all of the time.
","No loyalty to long term (over 20 years) associates. To save money, your gone.
Advice to Management
You want to be one of the best places to work? Consider retraining instead of displacing.
Helpful (2","You want to be one of the best places to work? Consider retraining instead of displacing.
",1.0,1.0,2.0,1.0,2.0,1.0,Doesn't Recommend,Negative Outlook,Disapproves of CEO
Thu Jun 14 2018,Anonymous,,Current Employee ,Business Analyst,0,"Good Company to work for
","Its too good of a company
Advice to Management
Change is good
Helpfu","Change is good
Helpfu",5.0,5.0,5.0,5.0,5.0,5.0,Recommends,Positive Outlook,Approves of CEO
Thu Jun 28 2018,Anonymous,,Current Employee ,Sales,0,"Pharma distributor, Global company, great benefits. We were acquired recently by ABC so not a lot of details to share at this time
","No Cons to share at this time.
Helpfu",,3.0,,,,,,,,
Sat Jun 09 2018, California,"Los Angeles, CA",Current Employee ,Awesome Company - Don't let the complainers sway you,1,"This company is amazing. I've worked for this company for over 20 years, in many different roles. Yes, there has been change, lots of change, but show me a company that hasn't had change. Yes, people have lost their jobs, lots of people, but AmerisourceBergen continues to hire (and rehire) people as the business needs require. If you find a company that doesn't change or make workforce reductions, I suggest you stay there forever. ABC is a fair, equitable and forward thinking company. ""Most"" leadership is awesome. Every company will have a few bad apples, many have written reviews on this site, but you won't find a company more committed to their hourly associates.
","The only cons that I would share, in hopes that the company would analyze, is that they are not consistent with expense regulations.
Advice to Management
When many Distribution Centers are operating with pennies, other areas (sales and Sr. Leaders) seem to have money to spend on new buildings, new technology, world travel and countless events. ABC should realize that without the Distribution Centers, your revenue is cut in half (even more). Happy to see all the hard work the DC employees are doing so that others can spend their revenue.
Helpful (1","When many Distribution Centers are operating with pennies, other areas (sales and Sr. Leaders) seem to have money to spend on new buildings, new technology, world travel and countless events. ABC should realize that without the Distribution Centers, your revenue is cut in half (even more). Happy to see all the hard work the DC employees are doing so that others can spend their revenue.
",5.0,4.0,4.0,5.0,4.0,4.0,Recommends,Positive Outlook,Approves of CEO
Sun Jul 15 2018, Customer Care Representative,"Naperville, IL",Former Employee ,Keep Looking if you have a choice!!!,2,"You gain experience for the next job.
","Its not structured. Don't you or your loved one ever get sick. If you do take a leave they will make false claims to prevent you of getting paid... ex...""There's a report of you working....meanwhile you laid up in the hospital.... If so, you have to take a short term leave or termination. Everyone there pretty much worked previously at US Cellular. If you're not part of the US Cellular group they're
overlook you. A lot of micromanaging. There's constant favorism. You should be paid much more for the work you do. Most people are unhappy there. The worst company I've worked for.
Advice to Management
Pay more! Treat people with respect and equality! Think of others as how you would treat yourself.
Helpful (2","Pay more! Treat people with respect and equality! Think of others as how you would treat yourself.
",1.0,2.0,1.0,1.0,1.0,1.0,Doesn't Recommend,Positive Outlook,Disapproves of CEO
Tue Jun 19 2018,Anonymous,,Current Employee ,Receiving,0,"Great Benefits PTO, holiday, health, dental, vision, tuition reimbursement etc.. Stable hours 7am-3:30pm. Leadership at the Williamston division is great!
","Not much room for promotions within the company, unless you want to move out of state.
Advice to Management
Try to help promote within.
Helpfu","Try to help promote within.
Helpfu",3.0,3.0,4.0,3.0,3.0,4.0,Recommends,Positive Outlook,Approves of CEO
Wed Jun 20 2018, Patient Care Coordinator,"Frisco, TX",Current Employee ,Patient Care Coordinator,6,"Easy job once you get the hang of it.
","No work life balance. They don't care if you or your child is sick they will count it against your attendance. All they seem to care about is numbers and money - no care for patient's and employees.
Advice to Management
We are not robots, we are humans.
Helpful (6","We are not robots, we are humans.
",1.0,1.0,1.0,1.0,3.0,1.0,Doesn't Recommend,Negative Outlook,Disapproves of CEO
Mon May 28 2018, Reimbursement Counselor,"Fort Mill, SC",Current Employee ,BVS/Reimbursement Counselor,2,"PTO is a handsome amount
Ability to work at your own pace
Amenities are nice (food, water, gym, etc)
","Management is not your friend. Which sounds like common sense but they will try to get to know you better and use it against you. Lack of transparency since the layoffs a few months ago. Constant changes in verification policy. Dwindling feeling of job security.
Advice to Management
Since Tracy left, the company seems to be moving in a direction that is not positive. Give employees the initiative to find promotions instead of forcing them to stay. Be the Lash group that made employees want to build careers, not just another call center environment.
Helpful (2","Since Tracy left, the company seems to be moving in a direction that is not positive. Give employees the initiative to find promotions instead of forcing them to stay. Be the Lash group that made employees want to build careers, not just another call center environment.
",2.0,3.0,2.0,2.0,3.0,1.0,Doesn't Recommend,Negative Outlook,No opinion of CEO
Mon May 14 2018, Internship,"Frisco, TX",Former Employee ,Internship,0,"- Great people in the Frisco location
- Learn a lot about business practices
- ","antly meeting new people
- Great for those who want to go into logistics or pharmaceutical distribution
Cons
As an intern, you do not get the most exciting work but you are also not running around getting coffee for everyone
Advice to Management
You guys are awesome, keep it up!
Helpfu","You guys are awesome, keep it up!
Helpfu",4.0,5.0,5.0,5.0,5.0,5.0,Recommends,Positive Outlook,Approves of CEO
Tue May 29 2018,Anonymous,,Former Employee ,Manager,0,"Stability in some areas of business operations
","Disorganized leadership in IT department.
Helpfu",,3.0,3.0,4.0,3.0,4.0,3.0,Recommends,Positive Outlook,Approves of CEO
Fri Jun 15 2018, Warehouse Associate,"Phoenix, AZ",Former Employee ,My first week at ABC..aaand I'm gone.,6,"The benefits were appealing, moving to a new automated warehouse soon.
","Night management and trainers...how about you guys help us get the work out instead of leaning on the safety guards staring at us and complaining how understaff is stressing you out? You guys are not professional. I'm shocked to hear one supervisor say, 'You gotta be on my good side to get promoted' That's a red flag for me.
Advice to Management
Your staffing issue is a result of OBVIOUS favoritism. I've been here a week and I'm done. Everyone is miserable and I see it. Work on being professional not trying to have a ""Bro"" friendship. Associates strongly perceive that as favoritism.
Helpful (6","Your staffing issue is a result of OBVIOUS favoritism. I've been here a week and I'm done. Everyone is miserable and I see it. Work on being professional not trying to have a ""Bro"" friendship. Associates strongly perceive that as favoritism.
",1.0,3.0,1.0,1.0,3.0,1.0,Doesn't Recommend,Neutral Outlook,No opinion of CEO
Mon May 28 2018,Anonymous,"Chesterbrook, PA",Former Employee ,Team Coordinator,0,"Benefits were nice and the new facility being located near restaurants made, lunch hour nice.
","The change in platform resulted in lost of employment for many. Communication between staff is very poor, company with make changes in operations last minute, sometimes changes are not thought out and excuted poorly. The company is turning into looking at employees as a number and not trying to retained those for quality or growth.
Helpfu",,3.0,2.0,2.0,2.0,3.0,2.0,Doesn't Recommend,Negative Outlook,Disapproves of CEO
Mon Jun 18 2018,Anonymous,"Chesterbrook, PA",Former Employee ,PCC,0,"There are absolutely no Pros
","Too many to list from top to bottom.
Advice to Management
Get rid of the management members that don't apply the same rules to all of their employees.
Helpfu","Get rid of the management members that don't apply the same rules to all of their employees.
Helpfu",1.0,1.0,1.0,1.0,2.0,1.0,Doesn't Recommend,Negative Outlook,No opinion of CEO
Thu Jun 14 2018,Anonymous,,Former Employee ,Reimbursement Counselor,2,"coworker relationships, free drinks, a wonderful outdoor space that is taken care of very faithfully.
","management miscommunication, unfairness, not caring about your well being just money.
Advice to Management
If you want to keep stellar employees, you need to appreciate the work that each employee does for you. Just because someone is not your friend/relative does not mean that they are not capable of performing the duties of a job. I was turned down for promotion after promotion, all while completing work that was a requirement of my superiors. The same response ""you're good, but this person is better"" so I watched for 3 years people get promoted whom I trained. If you want to feel bad about yourself, regret your decisions and waste your time, this is the company to work for.
Helpful (2","If you want to keep stellar employees, you need to appreciate the work that each employee does for you. Just because someone is not your friend/relative does not mean that they are not capable of performing the duties of a job. I was turned down for promotion after promotion, all while completing work that was a requirement of my superiors. The same response ""you're good, but this person is better"" so I watched for 3 years people get promoted whom I trained. If you want to feel bad about yourself, regret your decisions and waste your time, this is the company to work for.
",1.0,1.0,1.0,1.0,1.0,1.0,Doesn't Recommend,Negative Outlook,Disapproves of CEO
Tue Jun 12 2018, Environmental Monitoring Tech,"Memphis, TN",Former Employee ,Beware,0,"Good benefits and good workers
","Very poor management. Very inexperience.
Advice to Management
Hire people that's qualified. Just because the have a degree as a pharmacist doesn't mean they are qualified to lead people.
Helpfu","Hire people that's qualified. Just because the have a degree as a pharmacist doesn't mean they are qualified to lead people.
Helpfu",1.0,3.0,1.0,1.0,5.0,1.0,Doesn't Recommend,Negative Outlook,Disapproves of CEO
Wed May 02 2018, Supervisor,"Kansas City, MO",Current Employee ,Great place to work.,0,"Great manager and associates to work with and for.
","Higher pay scale would be nice.
Helpfu",,5.0,3.0,5.0,5.0,3.0,1.0,,,
Wed Apr 25 2018, District Director,"Charlotte, NC",Current Employee ,District Director,0,"Great Culture, innovative and company on the move
","Highest Dollar ratio per employee in the industry
Advice to Management
Keep investing in our associates and allow our creative approach to continue to be a huge difference between our competition
Helpfu","Keep investing in our associates and allow our creative approach to continue to be a huge difference between our competition
Helpfu",5.0,5.0,5.0,5.0,3.0,5.0,Recommends,Positive Outlook,Approves of CEO
Fri May 04 2018,Anonymous,,Former Employee ,Not as Approachable as Before,1,"Competitive pay and benefits package
","Has moved away from the small company feel that it once had even as a large company.
Advice to Management
Don't rely so heavily on consultants when making decisions, they only see what is on the surface.
Helpful (1","Don't rely so heavily on consultants when making decisions, they only see what is on the surface.
",3.0,2.0,3.0,3.0,4.0,2.0,Approves of CEO,,
Fri May 04 2018, Senior Analytics Consultant,"Fort Mill, SC",Current Employee ,A long-timer,1,,"ltant in Fort Mill, SC
Recommends
Neutral Outlook
No opinion of CEO
I have been working at AmerisourceBergen full-time for more than 10 years
Pros
Amidst a lot of new faces that came with Lash Groups further alignment with AmerisourceBergen, there are some great legacy folks. The variance of skill sets makes for a diverse environment for working and learning.
Cons
New office is in Fort Mill, and the corporate park is very crowded. The 1/3 mile between the highway and the average parking space accommodates for ~15-20 minute (average) of the total commute during highest traffic volume.
Advice to Management
Own it. If you want to manage at Lash, you must be self sufficient.
Helpful (1","Own it. If you want to manage at Lash, you must be self sufficient.
",3.0,2.0,1.0,3.0,4.0,2.0,Recommends,Neutral Outlook,No opinion of CEO
Tue May 15 2018, Insurance Verification,"Frisco, TX",Former Employee ,Don’t rely on Hr to help you with management issues,12,"Awesome health benefit packages. They offer 8hrs of volunteering time and role over PTO balances. I wouldn’t recommend the employer to a friend.
","Management does not provide the best training- sink or swim. If you are being harassed by management team don’t count on HR to have your back. They will railroad you and build a case to fire you. HR and management are shady and don’t like employees who are Opinionated.
Advice to Management
Listen to your employees and if someone is feeling harassed or uncomfortable at work do something about it.
Helpful (12","Listen to your employees and if someone is feeling harassed or uncomfortable at work do something about it.
",1.0,1.0,1.0,1.0,5.0,1.0,Doesn't Recommend,Positive Outlook,Disapproves of CEO
Thu May 17 2018,N/A,, ,Corrupt HR and Bully management,3,"Hah! You ought to be kidding. It’s great place for slackers to waster away their years. If you are boss’s pet you are good too!
","Change all senior management and find patterns of abuse and bias with promotion, eradicate old boys club and hire people with intention of respecting them and not like expandable resources
Advice to Management
HR business partners need to go! Shady company and office politics will be your end for top talent who will go to companies that respect them
Helpful (3","HR business partners need to go! Shady company and office politics will be your end for top talent who will go to companies that respect them
",1.0,3.0,1.0,2.0,2.0,1.0,Doesn't Recommend,Negative Outlook,Disapproves of CEO
Wed Apr 25 2018,Anonymous,,Former Employee ,Billion Dollar Pharma. Company,1,"I can say I have pros for this company.
","Need to pay more. Multi billion dollar company paying IT staff 21hr to be on the phone all day and deal with rude customers.
Advice to Management
Reconsider moving to a less expensive area if you dont want to pay your staff competative salaries.
Helpful (1","Reconsider moving to a less expensive area if you dont want to pay your staff competative salaries.
",2.0,1.0,3.0,1.0,1.0,5.0,Doesn't Recommend,Neutral Outlook,No opinion of CEO
Wed May 16 2018,Anonymous,,Former Employee ,Depends on the company under the Amerisource Bergen umbrella,2,"Best benefits including medical with low costs, wonderful amount of PTO, great location.
","Biased yearly reviews and unfair promotions and bonuses. Company needs to have management rank employees on their contribution scale to the company initiative instead of based solely on personal/biased review.
Advice to Management
Treat your associates fairly and allow all the same opportunities. Allowing favorites in any way (any way perceived as unfair- including hours worked, shift hours, amount of work assigned, etc) will decrease your associates motivation, especially when these associates are in leadership positions and highly visible this will always effect the team.
Helpful (2","Treat your associates fairly and allow all the same opportunities. Allowing favorites in any way (any way perceived as unfair- including hours worked, shift hours, amount of work assigned, etc) will decrease your associates motivation, especially when these associates are in leadership positions and highly visible this will always effect the team.
",1.0,1.0,3.0,1.0,3.0,4.0,Doesn't Recommend,Negative Outlook,Disapproves of CEO
Tue Apr 10 2018,Anonymous,,Former Employee ,Reimbursement Coordinator,5,"The company has many programs that you can climb the cooperate ladder with.
","Work can sometimes be stressful, management has their picks, the company seems to be laying off people left and right. The company is being brought by Walgreens, there is so many times I went above and beyond and did not receive a raise or bonus and I always met my matrix.
Helpful (5",,3.0,2.0,2.0,4.0,3.0,1.0,Doesn't Recommend,Negative Outlook,Disapproves of CEO
Mon Apr 16 2018,Anonymous,,Current Employee ,You work a lot,1,"Benefits package is the best.
","You work a lot of OT
Advice to Management
Better work life balance
Helpful (1","Better work life balance
",3.0,1.0,1.0,1.0,5.0,2.0,,,
Fri May 04 2018, Inside Sales,,Former Employee ,Bad Business Practices,5,"Benefits are ok along with location.
","This company along with their terrible subsidiary Bellco Generics frequently has sales positions posted for a good reason. It's because they fire people at the drop of a hat (after 90 days) if you don't meet the unattainable quotas and metrics. Why would a company invest all the time and effort for on-boarding a new employee, do the training, pay them benefits, give them a laptop, desk, etc and then only give 90 days - this is just bad business all around and fosters bad morale. It takes a little more time than that to get used to a job and develop and nurture relationships with clients. Stop hiring so many people if you know the majority of them will not last. Change the metrics so they can support stability in the sales dept. Supervisors are frequently hostile and behave in inappropriate ways such as discussing reps being fired with staff before that rep is even aware, discussing their metrics with ""favorites"" and just out right gossiping. Very similar to middle school. After reading other reviews (Bellco Generics) it's amazing how this company is still getting away with these unethical tactics . Where is HR in all this mess? The management at the top are surely aware of all this so it speaks volumes about where the company is headed - downward.
Advice to Management
Value your employees.
Helpful (5","Value your employees.
",1.0,1.0,1.0,1.0,3.0,1.0,Doesn't Recommend,Negative Outlook,No opinion of CEO
Thu Mar 22 2018," Vice President, Operations","Phoenix, AZ",Former Employee ,"VP, Operations",1,"Innovative and Collaborative culture. Great variety of work and potential for growth.
","Can be limited by corporate structure and the health care industry is experiencing tremendous expense pressure.
Helpful (1",,5.0,5.0,5.0,5.0,5.0,5.0,Recommends,Positive Outlook,Approves of CEO
Sun Apr 01 2018,Anonymous,"Chesterbrook, PA",Current Employee ,Project Manager,2,"People are wonderful there and makes it easier to work there.
","Just laid off several people and I only been on the job for a week,
Helpful (2",,3.0,,,,,,,,
Thu Mar 29 2018,Anonymous,,Former Employee ,Only work here if you don't have any other options,5,"I used to work with some very talented people. However, they are all leaving or have already left.
","No room for growth. The company DOES NOT invest in their employees.
Helpful (5",,2.0,4.0,1.0,1.0,2.0,1.0,Doesn't Recommend,Neutral Outlook,Disapproves of CEO
Mon Apr 23 2018,Anonymous,"Thorofare, NJ",Current Employee ,Perfect if you don’t have high expectations for your career.,3,"Various selections for health benefits is really nice. Vacation time is pretty standard. You get a paycheck... that’s usually a good thing.
","Unless you kiss butt or know they right people, you are not going to go anywhere. Management plays favorites. All of the good employees are leaving.
Advice to Management
Make the playing field more even. Make promoting about actual work and seniority instead of manager’s favorites.
Helpful (3","Make the playing field more even. Make promoting about actual work and seniority instead of manager’s favorites.
",1.0,3.0,1.0,1.0,3.0,1.0,Doesn't Recommend,Neutral Outlook,No opinion of CEO
Tue Mar 13 2018, Forklift Operator,"Edwardsville, KS",Current Employee ,Forklift operator,1,"It is a fast paced but also dedicated work environment. They have a good dedication to their employees. They pay well.
","At times you will work between 8-12 hours depending on work volume. Call ins make it harder to get the work done & you have to work harder than usual just to get the work done.
Advice to Management
My advice to management is thank your employees for how hard they work to get the work moving and the product out the door to the customers on time. Employees are a big part of the team.
Helpful (1","My advice to management is thank your employees for how hard they work to get the work moving and the product out the door to the customers on time. Employees are a big part of the team.
",4.0,4.0,5.0,4.0,5.0,4.0,Recommends,Positive Outlook,Approves of CEO
Mon Mar 26 2018,Anonymous,,Current Employee ,Sales Executive,1,"Good pay, prompt bonus payout.
","HARD work, too many responsibilities put on Sales.
Helpful (1",,3.0,2.0,4.0,2.0,4.0,3.0,Recommends,Positive Outlook,Approves of CEO
Sat Apr 14 2018, Administrative Assistant,"Chesterbrook, PA",Current Employee ,Do not work for this descrminatory company,5,"After leaving you will appreciate not being there
","Incomp management nation wide, age, race and gender discriminatory, no HR support for employee. Company is a disgrace to the medical field, pill mill connections double dipping fraud. The list is endless!
Advice to Management
Someday there will be a united personnel group nation wide that will force you to face the legal ramifications of your deception.
Helpful (5","Someday there will be a united personnel group nation wide that will force you to face the legal ramifications of your deception.
",1.0,1.0,1.0,1.0,2.0,1.0,Doesn't Recommend,Negative Outlook,Disapproves of CEO
Thu Mar 08 2018,Anonymous,,Current Employee ,Training Manager,0,"Good Benefits
Decent Pay
Good Atmosphere
Good Growth Potential
","Lack of Communication
Not Everyone is aware of changes
Helpfu",,4.0,3.0,5.0,4.0,4.0,4.0,Recommends,Positive Outlook,Approves of CEO
Thu Mar 15 2018,Anonymous,,Current Employee ,"Local Management Cares, Executives?",1,"Good Local Management
Customer focused - listens to what they want and need and delivers
Flexible with work/life items so long as the customer is taken care of
","Strategic direction is not making sense. The mindset is to improve on what we do and stop doing what we don't do well, even if the customer is asking for it. Can work if you have millions of potential customers but when that number is around 100-something...
Advice to Management
Remember that the customer is the boss. Who cares if you don't do it today or do it well today? If the customer is asking for it, and there is only a small handful to be had in the entire market, you better do what they ask and then find a way to do it well.
Helpful (1","Remember that the customer is the boss. Who cares if you don't do it today or do it well today? If the customer is asking for it, and there is only a small handful to be had in the entire market, you better do what they ask and then find a way to do it well.
",3.0,,,,,,Doesn't Recommend,Negative Outlook,
Sat Mar 10 2018, Night Shift Order Filler,"Paducah, KY",Former Employee ,night shift order filler,0,"excellent benefits and a large amount of paid time off
","unfortunately, you need the benefits and every scrap of time off you can get, because the work load is horrendous. They'll wear your body down. Also, any management above line supervisor doesn't care about you, just how much of a bonus they can get from your efforts.
Helpfu",,2.0,1.0,2.0,1.0,4.0,1.0,Doesn't Recommend,Neutral Outlook,Disapproves of CEO
Tue Feb 20 2018,Anonymous,N/A,Former Employee ,Good place,0,"a lot of overtime almost everyday
","there is no a fixed schedule
Helpfu",,4.0,2.0,4.0,3.0,4.0,4.0,Recommends,Positive Outlook,Approves of CEO
Tue Feb 13 2018, Project Manager,,Current Employee ,project manager,2,"work from home - flexible schedule
everyone is nice to work with and willing to do what it takes to get things done
non-hierarchical attitude by management - VPs get into the details to fully understand the project
good benefits - strong health insurance
good PTO - start at 21 days and get 1 more day per year for first 5 years
","few opportunities for advancement 
Standard raises - 2 - 3% per year
Advice to Management
promote from within - consider moving people from areas that might not be their area of expertise to another to learn
Helpful (2","promote from within - consider moving people from areas that might not be their area of expertise to another to learn
",4.0,4.0,5.0,2.0,4.0,4.0,Recommends,Neutral Outlook,Approves of CEO
