date,employee_title,location,employee_status,review_title,helpful,pros,cons,advice_to_mgmt,rating_overall,rating_balance,rating_culture,rating_career,rating_comp,rating_mgmt,recommends,positive_outlook,approves_of_CEO
Tue Jul 17 2018,Anonymous,,Former Employee ,Printer operator,0,"Great pay, good work environment, great co-workers- excellent benefits- awsome paid vacation
","I have nothing negative to say.
Advice to Management
Keep doing what your doing
Helpfu","Keep doing what your doing
Helpfu",5.0,5.0,5.0,5.0,5.0,5.0,Recommends,Positive Outlook,Approves of CEO
Sat Jul 28 2018,Anonymous,N/A,Former Employee ,Applications Developer,1,"Good prospects. Employee stock exchange program, tuition reimbursements and excellent benefits.
","Benefits are not great. Bonuses are based on pay grade. Not everyone gets it.
Helpful (1",,3.0,3.0,4.0,4.0,1.0,1.0,Recommends,,
Fri Aug 17 2018,Anonymous,"Research Triangle Park, NC",Former Employee ,Used to be a great company,4,"Salary and bonus compared to other companies.
","Layoffs every 6 months.
Helpful (4",,1.0,,,,,,Doesn't Recommend,Negative Outlook,No opinion of CEO
Mon Jul 09 2018," Senior Director, Global IT Applications Services","Sparks, MD",Former Employee ,"Sr. Director, Global IT Application Services",1,"Strong quality and customer focused organization with the strategy directly aligned to the advancement of medical device technology for improved patient care. True to the company's core values;
","Overall great company, Recent Merger and acquisitions, solution delivery commitments and other constraints have spread resources very thin.
Advice to Management
Manage the balance of associate in house and outsourcing resource strategy. Associate retention is at risk due to lack of career development planning and vision.
Helpful (1","Manage the balance of associate in house and outsourcing resource strategy. Associate retention is at risk due to lack of career development planning and vision.
",5.0,3.0,4.0,3.0,4.0,3.0,Recommends,Positive Outlook,
Thu Jul 12 2018,Anonymous,,Former Employee ,Good,0,"Good working environment, benefits,
","one or two here and there
Helpfu",,4.0,4.0,4.0,3.0,4.0,3.0,,,
Tue Aug 14 2018, Senior Project Manager,"Hunt Valley, MD",Former Employee ,Old mans club clowns,3,"Impressive work they do. Innovative.
","Really only like you if you fit their mold: white and affluent
Helpful (3",,1.0,3.0,1.0,1.0,2.0,1.0,Doesn't Recommend,Neutral Outlook,No opinion of CEO
Mon Jul 09 2018, Global Marketing Manager,,Current Employee ,Global Marketing Manager,0,"Innovation, high quality products, culture, friendly people
","Bureaucracy, matrix structure, not yet very marketing oriented
Helpfu",,5.0,5.0,5.0,5.0,5.0,5.0,Recommends,,Approves of CEO
Wed Jul 04 2018, Field Service Technician III,"Indianapolis, IN",Current Employee ,All N All A pretty good gig,2,"Having over 30yrs under my belt in Field Service divided among 4 companies after reading the Field Service reviews for BD here I felt I had to set the record straight. It is a big company and actively acquiring new product lines all the time. We are dominate in the product line I service and have a mature well structured system in both equipment and business model. Plenty of OT if you want and a good cluster of FST's around you is essential to maintain work life balance. Base Salary is a little low but the OT brings total up nicely. OT is not that big a burden because BD still bases it on a 8 hour day and not a 40hr week so anything that happens outside 8-5 is OT.
","Lots of management layers and not a lot of focused communication on the intricacies the enterprise system that your product contributes to.
Advice to Management
Learn how to narrow the communication channel. Field people do not need to know that the office furniture in San Diego is being replaced.
Helpful (2","Learn how to narrow the communication channel. Field people do not need to know that the office furniture in San Diego is being replaced.
",4.0,5.0,4.0,4.0,4.0,4.0,Recommends,Positive Outlook,No opinion of CEO
Mon Jul 16 2018,Anonymous,,Current Employee ,Data Scientist,3,"Good vacation for full time employees.
","Don't come with new ideas, just execute what you are told to.
Helpful (3",,3.0,3.0,2.0,2.0,3.0,2.0,Recommends,Neutral Outlook,No opinion of CEO
Thu Jul 12 2018,Anonymous,,Former Employee ,"Great benefits, crappy culture",6,"Benefits are great and got to work with some really smart people.
","Very old school culture that is slow to adopt change. Very manual processes with more emphasis on acquisitions and cost cutting than improvements and/or innovation. 
Not indicative of the majority of people who work there, but there are a few bullies who act with impunity. One such example is a director who called to a lower level employee by a crass word that references a part of the female anatomy and there were no repercussions.
Helpful (6",,2.0,2.0,1.0,3.0,4.0,1.0,,,
Sat Jul 14 2018,Anonymous,,Former Employee ,Great career opportunities,2,"Benefits and coworkers are extremely nice
","Hours, oversight is lacking as well as training
Helpful (2",,3.0,2.0,3.0,4.0,4.0,2.0,,,
Wed Jun 27 2018, Senior IT Auditor,"Franklin Lakes, NJ",Current Employee ,Good Company To Work For,2,"Flexible work schedule. Summer hours. Laid back culture.
","A lot of Red Tape and bureaucracy. Slow to make decisions. Heavy on the process side.
Helpful (2",,4.0,4.0,4.0,4.0,4.0,4.0,Recommends,Positive Outlook,Approves of CEO
Sat Aug 04 2018,Anonymous,,Current Employee ,Clinical Consultant,4,,"ltant""
1.0
★★★★★
Current Employee - Anonymous Employee 
Doesn't Recommend
I have been working at BD part-time
Pros
not sure about the pros yet.
Cons
The San Diego based Alaris training program for per diem Clinical Consultants was an awful experience. It did not resemble corporate training, but rather a flash-back to a freshman nursing class with a mean instructor whose goal was to have at least 2 students cry and drop-out before the semester was over. The instructor was punitive and aggressive. I have never been treated so unprofessionally before in any setting. 

I heard that the goal for per diem medical device educators, is that the attendees who do not move on to be active educators (for whatever reason) at least leave the training as “brand ambassadors”… meaning, experts on the device who had a great experience with the company. That was not the case in our training, we all left with a horrible impression of the company, feeling defeated and mentally exhausted.
Advice to Management
Advice: treat the medical professionals who attend your trainings with professional courtesy; they are an accomplished group of nursing professionals with bachelors and masters degrees. Don’t talk about how the full-time CC’s are “going to eat you alive”. Have realistic expectations of how much the average adult learner can absorb in one day. After throwing a tantrum, don’t ask who is ready to quit; this is not a reality show competition where you see how far you can push someone until they cry. Don’t punish attendees by yelling at them and making the entire class re-do presentations when one is not up to your standards. Don’t raise your voice at your attendees. Don’t require the entire class to physically follow along during each and every single practice presentation, pressing buttons, over and over and over, it caused unnecessary alarm fatigue and sore fingers.
Helpful (4","Advice: treat the medical professionals who attend your trainings with professional courtesy; they are an accomplished group of nursing professionals with bachelors and masters degrees. Don’t talk about how the full-time CC’s are “going to eat you alive”. Have realistic expectations of how much the average adult learner can absorb in one day. After throwing a tantrum, don’t ask who is ready to quit; this is not a reality show competition where you see how far you can push someone until they cry. Don’t punish attendees by yelling at them and making the entire class re-do presentations when one is not up to your standards. Don’t raise your voice at your attendees. Don’t require the entire class to physically follow along during each and every single practice presentation, pressing buttons, over and over and over, it caused unnecessary alarm fatigue and sore fingers.
",1.0,1.0,,,,,Doesn't Recommend,,
Mon Jun 25 2018, Regional Sales Manager,"San Antonio, TX",Former Employee ,Regional Sales Manager,1,"Good training, great benefits, fantastic products
","Never easy to go through a transition from one company to another.
Advice to Management
none
Helpful (1","none
",5.0,5.0,5.0,5.0,5.0,5.0,Recommends,Positive Outlook,Approves of CEO
Tue Jun 26 2018, Production Associate,"Sumter, SC",Former Employee ,good environment,0,"good environment and friendly people to meet
","none at the moment that I can think of
Advice to Management
increase pay
Helpfu","increase pay
Helpfu",4.0,4.0,4.0,4.0,4.0,4.0,Recommends,Positive Outlook,Approves of CEO
Wed Jun 27 2018, Engineer,"San Diego, CA",Current Employee ,Engineer,4,"Good projects to work on, very busy, made good friends
","Top Management is poor, some promoted to management don't have the skills and were promoted without merit and without allowing others to contest for the job. The new building remodeling looks nice but created a caotic environment can hardly concentrate on work as looks like everybody is yelling across the corridor.
There was initially a pension now it is off the table?
Advice to Management
The idea of BD One was exiting however culture on promotion didn't change in Carefusion, reviews were not fair for the hard work done.
Helpful (4","The idea of BD One was exiting however culture on promotion didn't change in Carefusion, reviews were not fair for the hard work done.
",3.0,3.0,2.0,2.0,2.0,1.0,Doesn't Recommend,Neutral Outlook,Disapproves of CEO
Fri Jun 29 2018, Category Manager,"Newark, NJ",Former Employee ,Category manager,2,"Flexible work environment and culture
","Advancement opportunities in some functions limited to headquarters.
Helpful (2",,3.0,3.0,3.0,3.0,4.0,3.0,Doesn't Recommend,Neutral Outlook,No opinion of CEO
Mon Jun 18 2018,N/A,,Sales Director ,Sales Director,0,"Great company and ethics. Solid people
","Sometimes not agile enough but very good products.
Advice to Management
Hang in there
Helpfu","Hang in there
Helpfu",5.0,4.0,5.0,3.0,4.0,4.0,Recommends,Positive Outlook,Approves of CEO
Mon Jun 18 2018, Sales,,Current Employee ,BD sales,0,"Very nice people. Very fair salaries.
","Little vacation. Very process oriented and into checking boxes versus sales.
Advice to Management
Need better focuse on R&D, product launches
Helpfu","Need better focuse on R&D, product launches
Helpfu",4.0,5.0,5.0,4.0,4.0,5.0,Recommends,Neutral Outlook,No opinion of CEO
Fri Jun 15 2018,Anonymous,,Current Employee ,No complaints,0,"Solid benefits, safe job, decent work enviroment
","Quality can shut down opportunities for improvement
Helpfu",,4.0,,,,,,,,
Fri Jun 15 2018,N/A,"Sandy, UT","Retro Team Member in Sandy, UT",Contractors are second-class citizens,9,"Health services
Cafeteria food is great
Clean restrooms
","Many of us were hired under false pretenses. We were told the position would be temp-to-hire, but after starting (and some turned down other positions) it came out that this was absolutely temporary with no option for permanent hire. We were not informed of this until a conversation about academics came up, and although we were brought on with associates degrees, we were told only those with bachelors could be permanent employees. 
Contractors aren't privileged to participate in ANYthing. Discount tickets are constantly advertised, but contractors aren't allowed to purchase. Free BBQ was brought in for employee appreciation week, contractors were turned away. 
They stuck 25 of us in a room, on tables (not desks or cubicles), with electrical cords hanging from the ceiling. 
The only time we saw our direct manager was when he was yelling at us to produce more. He would send the team lead to do some of his dirty work such as telling us something else had changed (at least once per day, sometimes as many as 4 times per day). When the manager was approached to ask about progress, and if we were meeting the daily and weekly goals to achieve the overall goal, we were told ""things are fine, just keep working"". 
Many refused to even give notice, because they would be shamed (""we're losing another one, more work for everyone else"") or other unprofessional embarrassments.
I was given a badge to get in my ONLY the front door. Then I was ticketed for parking in the front parking lot. When I went to security to inquire, it was removed from my employee record (yes, really), and I was THEN given a parking sticker for my vehicle. 
I could go on and on about the poor treatment, but these examples should suffice.
Advice to Management
Management didn't care enough to even be in the same room with us, so advice would fall against the same silent brick wall.
Helpful (9","Management didn't care enough to even be in the same room with us, so advice would fall against the same silent brick wall.
",2.0,1.0,1.0,1.0,1.0,2.0,Doesn't Recommend,Neutral Outlook,No opinion of CEO
Fri Jun 08 2018,Anonymous,,Current Employee ,Lab Operations Specialist,1,"Great atmosphere to work in. Good opportunity to learn and grow.
","Tough to advance promotion-wise. There is a 4-5 year requirement and not based on how well you are performing.
Helpful (1",,5.0,,,,,,Recommends,Positive Outlook,Approves of CEO
Thu Jun 21 2018,Anonymous,,Current Employee ,Very dissapointed,3,"Great Insurance Benefits and other perks
","A lot of travel required
Helpful (3",,2.0,,,,,,,,
Fri Jun 08 2018,Anonymous,,Current Employee ,Baltimore location,0,"Great people to work with
Low stress
","Company moves slowly
Usually behind competitors
Helpfu",,4.0,5.0,5.0,3.0,5.0,3.0,,,
Fri Jun 08 2018, Fill Room Operator,"Columbus, NE",Current Employee ,Operator,0,"Schedule is good. Benefits are good.
","Too many new hires that don’t know what they’re doing.
Helpfu",,4.0,3.0,3.0,3.0,4.0,3.0,Recommends,Positive Outlook,No opinion of CEO
Wed Jun 20 2018,N/A,, ,Program Manager,1,"Nice area, good work partners
","Nothing to report at this time
Helpful (1",,3.0,3.0,3.0,3.0,4.0,3.0,Doesn't Recommend,Neutral Outlook,No opinion of CEO
Mon Jun 04 2018,Anonymous,,Current Employee ,"Benefits are good, no career advancement",1,"Work from home is a plus
","No career advancement to move up towards
Helpful (1",,4.0,2.0,5.0,2.0,3.0,3.0,Recommends,Positive Outlook,Approves of CEO
Sun Jun 17 2018, Analyst,"Salt Lake City, UT",Former Employee ,Mediocre Company,1,"Great benefits, good people, decent salary, flexible work schedule.
","Slow pace work environment, not challenging enough for someone who enjoys learning. I don't advise joining medical industry, especially at Bard, unless you enjoy stress free and slow pace, mediocre management.
Advice to Management
To be more consistent with decisions, treat employees with respect and be more open and honest. Provide constructive criticism and honest conversations so employees can improve performance and develop. Management should hire people who don't lack people skills and personality, especially those at the board level.
Helpful (1","To be more consistent with decisions, treat employees with respect and be more open and honest. Provide constructive criticism and honest conversations so employees can improve performance and develop. Management should hire people who don't lack people skills and personality, especially those at the board level.
",3.0,4.0,3.0,2.0,4.0,1.0,Doesn't Recommend,Negative Outlook,Disapproves of CEO
Tue Jul 03 2018, Complaint Specialist,"Tempe, AZ",Current Employee ,Complaint Dept,8,"None - Not a company to work for
","Nepotism, favoritism, inept management, HR dept. is run by incompetent employees. Management uses temp agencies to fulfill staff to avoid paying benefits and decent wages. Serious compliance issues in complaint dept. Unethical quality directors who like to brush serious quality issues under the rug. FDA needs to visit and close the doors of Tempe office. Over 300 lawsuits for their products received every month, however they continue to sell the product.
Advice to Management
Remove all employees in HR dept. and Quality Management in Tempe.
Helpful (8","Remove all employees in HR dept. and Quality Management in Tempe.
",1.0,1.0,1.0,,,,,,
Sat May 12 2018, Senior Management,"Baltimore, MD",Former Employee ,Senior Manager,27,"The pay and benefits are adequate. The pension, just recently removed, was a perk. There are people who care about their job and the company—-but they have very little support.
","As a senior leader with 25+ years experience, and heavily recruited to join this organization, I was incredibly disappointed. A lack of gender and cultural diversity at the senior levels, 1990’s HR protocols, antiquated systems and processes, arrogance amongst leadership that is staggering, an inability to pivot and make the tough decisions....and that is just the beginning. Until this company embraces a more contemporary and modern culture, they will be weighed down by a homogeneous, old school leadership team incapable of attracting and retaining top talent. During my brief tenure I saw a constant stream of talented and vibrant minds walk out the door in frustration. Think long and hard before joining this company.
Advice to Management
It’s 2018. Evolve.
Helpful (27","It’s 2018. Evolve.
",2.0,3.0,1.0,2.0,3.0,1.0,Neutral Outlook,,Disapproves of CEO
Tue Jun 05 2018, Sales Representative,,Current Employee ,Life Sciences Business Unit,6,"Base salary compensation is adequate.
","Slow moving. Poorly communicated strategy. Support resources (IT, Benefits, etc) are all very difficult to work with. Heavily bureaucratic and lots of politics. Constant changes to commission structure, territory, and management directives. Product support overwhelmed. Terrible CRM. Virtually no support in learning how to 'navigate the company'. Customers are growing more disenchanted and BD is starting to lose foothold as market leader (cytometry).
Helpful (6",,2.0,3.0,1.0,2.0,5.0,2.0,Doesn't Recommend,Negative Outlook,
Mon Jun 04 2018,Anonymous,,Current Employee ,CI Line Lead,5,"There is a 24 hour gym.
","You honestly have no authority other than doing paperwork.
Helpful (5",,2.0,1.0,2.0,2.0,4.0,3.0,Doesn't Recommend,Neutral Outlook,No opinion of CEO
Mon Jun 25 2018,Anonymous,N/A,Former Employee ,Very political and unstable,8,"If you take chances you can rise quickly
","Company lays off people quickly
Helpful (8",,1.0,,,,,,,,
Fri May 18 2018,Anonymous,,Former Employee ,Warehouse Operation,2,"great atomsphere, food court and gym for employees
","temporary, not a lot of advancing going on here
Helpful (2",,5.0,3.0,4.0,3.0,3.0,2.0,Recommends,Positive Outlook,
Mon May 21 2018,Anonymous,"San Diego, CA",Former Employee ,Good company with too much corporate politics,6,"The company does a lot of good in the healthcare space
There are a lot of great people that work here
","Very NJ centric, little regard for timezone, etc for other locations
Very political, it's more about who you know than what you do
Advice to Management
You need more diversity of types of people and of thought. Too much catering to what the boss wants without question. When people do raise issues they aren't listened to which is causing a lot of waste and missed opportunities.
Helpful (6","You need more diversity of types of people and of thought. Too much catering to what the boss wants without question. When people do raise issues they aren't listened to which is causing a lot of waste and missed opportunities.
",3.0,2.0,3.0,4.0,3.0,2.0,Approves of CEO,,
Mon May 28 2018, Systems Verification and Validation Engineer II,"San Jose, CA",Current Employee ,Systems V&V Engineer Review,2,"Good training, good manager, good work/life balance
","Lots of red tape, upper management seemed lost at times
Helpful (2",,3.0,5.0,3.0,4.0,5.0,2.0,Recommends,Neutral Outlook,No opinion of CEO
Wed May 16 2018, Advanced Manufacturing Engineer Co,"Warwick, RI",Former Employee ,N/A,0,"Very good experience. Seniors were helpful
","Cant think of any cons
Advice to Management
N/A
Helpfu","N/A
Helpfu",5.0,4.0,4.0,5.0,4.0,4.0,Recommends,Neutral Outlook,No opinion of CEO
Thu May 03 2018,Anonymous,"Franklin Lakes, NJ",Former Employee ,Great company growing in the medical device industry,2,"Always exciting new opportunities and great people to work with
Life work balance and good vacation packages (better than typical)
Franklin Lakes NJ HQ campus provides a tranquil environment
","Possible outsourcing and layoffs due to acquisitions/strategies
Helpful (2",,5.0,5.0,5.0,4.0,4.0,4.0,Recommends,Positive Outlook,Approves of CEO
Thu May 10 2018,Anonymous,"Cockeysville, MD",Former Employee ,"Good company, but not so good management",7,"Good company, provides a lot of opportunities to learn. Also they organize a lot of social events throughout the year.
","The division I worked in (a smaller division) had a strange culture where the managers, during performance reviews, were focused on the negative. This was very counterproductive and a sure way to destroy the employee morale. After a while, I couldn't take it anymore...
Advice to Management
Value your employees and give them credit when necessary. Don't play favorites.
Helpful (7","Value your employees and give them credit when necessary. Don't play favorites.
",3.0,3.0,4.0,2.0,2.0,2.0,Doesn't Recommend,Neutral Outlook,Approves of CEO
Fri May 18 2018,Anonymous,,Former Employee ,IT Manager,3,"intelligent and conscious teams...company has a strong product line
","low pay even for experienced employees
Helpful (3",,2.0,1.0,3.0,2.0,2.0,2.0,Doesn't Recommend,,
Thu May 10 2018, Operations Manager,"San Diego, CA",Current Employee ,BIG Company,5,"Opportunity to work from home, pretty good benefit package
","Pretty political, very much a silo mentality, expected to put in a lot of hours
Advice to Management
Need to think more about the employees and not so much the bottom line
Helpful (5","Need to think more about the employees and not so much the bottom line
",3.0,3.0,2.0,3.0,3.0,2.0,Recommends,Positive Outlook,No opinion of CEO
Fri May 04 2018,Anonymous,,Current Employee ,BD,0,"Solid Company, Does good work and helps people live healthy lives
","Slow to make changes, under resourced to be effective and efficient.
Helpfu",,5.0,,,,,,,,
Sun May 06 2018, RN ,"Sandy, UT",Current Employee ,AEG - RN MDR writer,10,"Onsite cafeteria and gym. Large company, many benefits.
","Horrible management that makes it very clear that you are replaceable. Company values that do not trickle down. Daily changes, you can never keep up... yes one day, no the next.... they say blue, but you're expected to know they meant red. Horrible communication. Huge workload with daily ""emergency"" projects.
Advice to Management
Value your productive employees. This job takes a long time for someone to become proficient, you would think that that would matter. Get rid of your current managers, ""can't fix stupid"".
Helpful (10","Value your productive employees. This job takes a long time for someone to become proficient, you would think that that would matter. Get rid of your current managers, ""can't fix stupid"".
",2.0,3.0,2.0,2.0,3.0,1.0,Doesn't Recommend,Negative Outlook,Approves of CEO
Tue Jun 05 2018,Anonymous,"Columbus, NE",Current Employee ,Casepack,6,"Pay and benefits are the only good things about this place
","There is nothing good about this place. They work you like a dog, 60+ hrs a week, they don't care if you have kids or family but you damn well better be at work. Only the night shift has mandatory overtime, you get vacation hours but can't use them u less you find someone to cover your shift or unless you just call in for your shift and submit vacation hours, when then in turn that's marked as an absence. In my interview I was told there was a potential for overtime, they did not say there WILL be mandatory ot. Apparently in speaking to others that have been here longer than me have said it goes on all year every year, so basically forget about your kids, life and family. I will be looking for a new job and do not recommend this place to ANYONE!!! This is why they have such am astronomical amount of turnovers.
Advice to Management
Get your crap together and stop forcing only night shift for mandatory ot. Better yet, stop with the all year every year or and give people a god damn break and time with their families. You claim you care about health but it's very apparent you don't, because you sure as hell don't care about your employees health, you just work then to death
Helpful (6","Get your crap together and stop forcing only night shift for mandatory ot. Better yet, stop with the all year every year or and give people a god damn break and time with their families. You claim you care about health but it's very apparent you don't, because you sure as hell don't care about your employees health, you just work then to death
",1.0,1.0,1.0,1.0,3.0,1.0,Doesn't Recommend,Negative Outlook,No opinion of CEO
Thu May 10 2018, Specials Grind Operator,"Columbus, OH",Current Employee ,My job is very boring,4,"The pay is the best part
","Mandatory overtime is a real pain. It's every week.
Advice to Management
Don't give overtime ever week. People need time off.
Helpful (4","Don't give overtime ever week. People need time off.
",3.0,3.0,3.0,3.0,3.0,3.0,Recommends,Positive Outlook,No opinion of CEO
Wed May 02 2018,Anonymous,,Current Employee ,great company to work for,0,"great people to work with
","sub par benefits compared to others
Helpfu",,5.0,,,,,,,,
