date,employee_title,location,employee_status,review_title,helpful,pros,cons,advice_to_mgmt,rating_overall,rating_balance,rating_culture,rating_career,rating_comp,rating_mgmt,recommends,positive_outlook,approves_of_CEO
Thu Oct 11 2018,Anonymous,,Current Employee ,Lots of hours,0,"Good pay, laid back, easy work if you know what you're doing
","Long hours, no work life balance have to work weekends
Helpfu",,3.0,2.0,2.0,2.0,4.0,2.0,Recommends,Positive Outlook,No opinion of CEO
Mon Sep 24 2018,Anonymous,,Former Employee ,Production Enhancement,0,"Good Pay and benefits. Structured work environment. Quality thorough training process and good continuing education.
","Long hours and work rotations. Two weeks on, one week off. 15 plus hour days.
Helpfu",,4.0,2.0,4.0,3.0,4.0,4.0,Recommends,Positive Outlook,Approves of CEO
Tue Oct 02 2018,Anonymous,,Current Employee ,Customer Service,0,"Convenience of island wide company bus. Open Door communication with Superior.
","Processes are a challenge. No time off options when working beyond normal working hours. Working from home without taking leave is not a option too.
Advice to Management
need to work on more staff welfare to have work life balance.
Helpfu","need to work on more staff welfare to have work life balance.
Helpfu",3.0,3.0,3.0,3.0,3.0,3.0,Recommends,Neutral Outlook,Approves of CEO
Mon Oct 01 2018,Anonymous,,Former Employee ,Associate Mechanical Engineer,0,"Cool technology for oil industry
","No career growth opportunities or clear path
Advice to Management
Develop people
Helpfu","Develop people
Helpfu",3.0,,,,,,,,
Thu Sep 13 2018,N/A,N/A, ,Environment,0,"Highly conductive, very respective management
","None, they seem to have a good program.
Helpfu",,5.0,5.0,5.0,4.0,5.0,5.0,Recommends,Positive Outlook,Approves of CEO
Tue Oct 16 2018, Associate Technical Professional,"Rock Springs, WY",Former Employee ,A very interesting place to work,1,"You are going to get the opportunity to drive and see new places. Lots and lots of driving
","Not the best place to work for a person of color.
Advice to Management
Create a better training process, having someone study for themselves and then getting tested by a group is not necessarily the best way to teach. Learning from operators who do not necessarily know what they are doing or have some kind of racial bias towards you can prove rather difficult.
Helpful (1","Create a better training process, having someone study for themselves and then getting tested by a group is not necessarily the best way to teach. Learning from operators who do not necessarily know what they are doing or have some kind of racial bias towards you can prove rather difficult.
",1.0,1.0,1.0,2.0,5.0,2.0,Doesn't Recommend,Negative Outlook,Disapproves of CEO
Fri Sep 07 2018, Senior Research Scientist,"Houston, TX",Former Employee ,Great oil field services company,0,"After recent fall of Baker, Halliburton will surely capture more market share and grow. Great culture, you feel like you are part of the RED.
","Management has the fast follower mentality, and they are conservative. This may not be good if you are looking for adventure.
Helpfu",,5.0,5.0,5.0,3.0,4.0,4.0,Recommends,Positive Outlook,No opinion of CEO
Wed Sep 19 2018, IT Software Analyst,"Houston, TX",Current Employee ,IT Analyst,1,"Great Benefits - flexible schedules
","Dated processes, Title Proud, lack of support from leadership
Advice to Management
Listen to your employees who do they work, do pulse checks on your teams that are struggleing after they've reached out to you.
Helpful (1","Listen to your employees who do they work, do pulse checks on your teams that are struggleing after they've reached out to you.
",3.0,5.0,2.0,3.0,5.0,5.0,Doesn't Recommend,Positive Outlook,Approves of CEO
Tue Sep 18 2018,Anonymous,,Current Employee ,Interview Questions,0,"Good Benefits. Fixed schedule for the year
","Low Pay compared to competition
Helpfu",,3.0,3.0,3.0,3.0,5.0,3.0,,,
Fri Aug 31 2018,Anonymous,,Former Employee ,Looks good on a resume,1,"Great pay
Freedom and autonomy
Customer entertainment
","Phone calls and emails outside of office hours
Lack of guidance that comes with the freedom/autonomy
Boom/bust nature of the industry
The moral compromise of working in the business of fossil fuels instead of looking to the future
Helpful (1",,4.0,1.0,3.0,4.0,5.0,4.0,,,
Sun Aug 26 2018, Project Manager,"Spring, TX",Current Employee ,Good company with diverse product portfolio and international presence.,0,"Diversity, good benefits, well established
","long hours, main campus location
Advice to Management
Company should focus on its core products and services.
Helpfu","Company should focus on its core products and services.
Helpfu",4.0,3.0,3.0,4.0,4.0,3.0,Recommends,Positive Outlook,Approves of CEO
Sun Aug 26 2018, Oa1 and Pump Tech,"El Reno, OK",Former Employee ,Great place to start,0,"Insurance, 401k, 2 weeks vacation every year, and a livable wage
","Always away from home and is a big lifestyle adjustment.
Helpfu",,4.0,3.0,5.0,5.0,4.0,4.0,Recommends,Neutral Outlook,Approves of CEO
Thu Aug 16 2018,Anonymous,,Current Employee ,Great Team,2,"Great Benefits and great team
","Location is expensive and very long hours
Helpful (2",,5.0,3.0,5.0,5.0,4.0,4.0,Recommends,Positive Outlook,Approves of CEO
Thu Sep 06 2018,N/A,"Denver, CO","Account Representative in Denver, CO",17 years in operations and technical sales.,0,"Freedom to be creative in design and management of accounts.
","I work very long hours.
Advice to Management
Know the value of individuals and compensate them in their positions.
Helpfu","Know the value of individuals and compensate them in their positions.
Helpfu",3.0,3.0,5.0,3.0,3.0,4.0,Recommends,Positive Outlook,Approves of CEO
Mon Sep 03 2018, Service Supervisor,"Lafayette, LA",Current Employee ,Horrible management no guidance no promotion pay is low,0,"Benefits insurance direct deposits easy for hire
","Too much to list . You name it its wrong . Chaos . Sneaky underneath management...
Advice to Management
Quit brown nosing . Playing buddy system and pay attention to ALL EMPLOYEES.
Helpfu","Quit brown nosing . Playing buddy system and pay attention to ALL EMPLOYEES.
Helpfu",2.0,1.0,3.0,2.0,2.0,1.0,Doesn't Recommend,Negative Outlook,No opinion of CEO
Mon Aug 20 2018,Anonymous,"Houston, TX",Former Employee ,Assistant Administrator,0,"Oil and Gas learning firm
","Needed a full time to grow with them
Helpfu",,4.0,4.0,5.0,5.0,4.0,5.0,Recommends,Positive Outlook,Approves of CEO
Mon Sep 03 2018, Technical Professional,"Hobbs, NM",Former Employee ,Technical Professional,0,"Made some of the best friends I've ever made, Money
","poor management, poor working conditions
Helpfu",,3.0,4.0,3.0,5.0,5.0,1.0,Doesn't Recommend,Neutral Outlook,No opinion of CEO
Sun Sep 02 2018,Anonymous,,Former Employee ,Technical Professional-Cementing,0,"The growth pattern is good
","The salary negotiation is not followed
Advice to Management
Keep your promise
Helpfu","Keep your promise
Helpfu",3.0,3.0,4.0,5.0,2.0,3.0,,,
Thu Aug 16 2018,Anonymous,,Current Employee ,Senior Project Manager,1,"Benefits, Paid Parental Leave, International Opportunities
","Long Hours with Poor Work/Life Balance, Pay
Helpful (1",,4.0,2.0,4.0,4.0,3.0,4.0,Positive Outlook,,Approves of CEO
Sat Sep 22 2018,Anonymous,,Current Employee ,Greedy company.,1,"Good health insurance and decent benefits.
","Management (especially upper management) is out of touch with the field staff. We are the ones on the front lines sacrificing our time with our families to make the company money. They work you non-stop with little pay and no relief. We were already short staff in the field and numerous people quit. Instead of trying to hire more people to at least replace the ones that left, they make us work more for less pay while saving them money. They leave you out on a job for weeks at a time without know when you will be able to go home to see your family. When you do get home, it's for a couple of days and then they expect you to go back to work again for weeks without any relief. All this while management is sitting back at home spending time with their families and sleeping in their own beds collecting their bonuses that the field employees earn for them. They do not care or listen to us when we all tell them that we are unhappy and will leave. We are just a number to them.
Advice to Management
Hear and appreciate what your employees are trying to tell you (especially the revenue earning ones out on the front lines). We have children too that needs to see their parents. If you were once in the field, don't forget where you came from. Understand what we are trying to tell you. Take care of your employees and they will do anything for the company.
Helpful (1","Hear and appreciate what your employees are trying to tell you (especially the revenue earning ones out on the front lines). We have children too that needs to see their parents. If you were once in the field, don't forget where you came from. Understand what we are trying to tell you. Take care of your employees and they will do anything for the company.
",1.0,1.0,1.0,1.0,3.0,1.0,Doesn't Recommend,Negative Outlook,Disapproves of CEO
Wed Aug 15 2018, Assistant Operator I,,Former Employee ,Training was awesome.,1,"Training training training. I have learned a lot from Halliburton in the frac field that I didn't get from other employers.
","Sometimes management from supervision to team leaders dont really help with questions or concerns.
Helpful (1",,4.0,4.0,5.0,5.0,4.0,3.0,No opinion of CEO,,
Wed Aug 29 2018, Operator Assistant,"Rock Springs, WY",Former Employee ,Wireline Operator Assistant,0,"Starting pay rate was low, but hours made up for lack of wage and paychecks were large. When things are busy, expect to work a lot of hours. Wireline (cased hole) was 14 hour days. My schedule was 2 weeks on, 1 week off. Depending on the type of work, expect 100+ hour weeks. Paychecks were great while it lasted. When there is no work you are expected to put in 40 hours - which is a huge pay cut.
","Lots of hours (good and bad) 
This is a lifestyle that revolves around all work and no play. Be prepared for that
Week off goes by QUICK
Helpfu",,3.0,1.0,2.0,4.0,4.0,2.0,Recommends,Neutral Outlook,No opinion of CEO
Wed Aug 08 2018,Anonymous,N/A,Former Employee ,Technical Professional,1,"Great money and great bonus
","Long hours and dirty field work
Helpful (1",,5.0,3.0,3.0,4.0,5.0,4.0,Recommends,Positive Outlook,Approves of CEO
Sat Aug 11 2018,Anonymous,N/A,Former Employee ,Great,0,"Good job and good pay
","Long hours, away from home
Helpfu",,5.0,,,,,,,,
Fri Aug 10 2018, Floorhand,"India, TN",Current Employee ,Fresher,0,"I want to build my carrer in your company
","No challenges only gan experience from your company
Advice to Management
Only take advice
Helpfu","Only take advice
Helpfu",4.0,5.0,4.0,4.0,4.0,5.0,Recommends,Neutral Outlook,No opinion of CEO
Fri Aug 24 2018,Anonymous,,Former Employee ,Okay Experience,0,"Great benefits, large company with lots of options to work globally.
","Some days you feel like a number, they have tens of thousands of employees.
Helpfu",,3.0,2.0,4.0,4.0,3.0,3.0,Doesn't Recommend,Neutral Outlook,No opinion of CEO
Thu Aug 09 2018,N/A,, ,HAL,0,"good benefits and vacation package
","expect unbalance lifestyle in the salary roles
Helpfu",,4.0,2.0,3.0,4.0,4.0,2.0,Recommends,Neutral Outlook,Disapproves of CEO
Fri Aug 03 2018,Anonymous,,Current Employee ,Always a lot to learn,1,"The company is so large there's always a lot to learn and challenges if you seek them out.
","The culture was hurt in the downturn and has not rebounded. It has lost the family feel there once was.
Helpful (1",,4.0,2.0,2.0,3.0,3.0,3.0,Doesn't Recommend,Neutral Outlook,
Wed Aug 01 2018,N/A,"Odessa, TX","Frac Hand in Odessa, TX",OA 1,1,"Provides Great opportunity for advancement.
","Very hard hours and time away from family
Helpful (1",,5.0,,,,,,,,
Mon Jul 30 2018, Operator Assistant II,"Odessa, TX",Former Employee ,Operator Assistant 2,0,"great pay and benefits, lodging provided
","not enough time to spend home with family
Helpfu",,4.0,2.0,4.0,4.0,4.0,3.0,Recommends,Positive Outlook,
Sun Sep 02 2018,Anonymous,"Houston, TX",Current Employee ,Service Specialist,2,"Good opportunity for growth if you are willing to put in the work.
","Some areas and departments can work off of the “good ol boy” system. 
It can be about who you know, and not what you know.
The environment can be very political.
Management does not stand behind their employees.
You will work outside and far beyond the scope of your job description and not be compensated for it.
A work life balance does not exist. I’ve been gone from home for 8+ weeks with no sign of relief.
Advice to Management
Hire the proper head count for your departments. Working people to death is not a healthy environment.
Helpful (2","Hire the proper head count for your departments. Working people to death is not a healthy environment.
",1.0,1.0,2.0,2.0,3.0,2.0,Doesn't Recommend,Neutral Outlook,No opinion of CEO
Sun Jul 29 2018,Anonymous,,Current Employee ,Provides a great opportunity to learn,0,"Exposure to new concepts and employee accountability is high - you are forced to grow
","Can become stuck in the same position, limited room for upward mobility. Self-promotion is required
Helpfu",,5.0,,,,,,,,
Sun Jul 29 2018,Anonymous,,Current Employee ,Good,0,"Good benefits 
Good pay 
Good people
","Being away from home for two weeks and one week off
Helpfu",,4.0,,,,,,,,
Fri Jul 27 2018,N/A,, ,Great place to work,0,"Great manager to work under. Good pay. Solid benifits
","Like most O&G companies, very susceptible to the market.
Advice to Management
Keep up the good work to my former boss
Helpfu","Keep up the good work to my former boss
Helpfu",5.0,5.0,5.0,5.0,5.0,5.0,Recommends,Neutral Outlook,No opinion of CEO
Fri Jul 27 2018,N/A,, ,Its good,0,"the pay is good and they are upfront
","the hours are crazy and schedule changes a lot
Helpfu",,4.0,,,,,,,,
Thu Aug 09 2018,N/A,, ,New MWD Field Engineer,0,"Good people, good benefits, 401k match up to 4%
","Long hours, hardly a day off, away from everything
Advice to Management
Pay us more.
Helpfu","Pay us more.
Helpfu",3.0,,,,,,,,
Mon Jul 23 2018, Global Advisor,"Houston, TX",Former Employee ,Great company to work for,1,"+ enjoyed multi-disciplinary work environment
+ enjoyed with subject matter specialist
+ had a good relation to management
","- long commute ways (but that's Houston)
Helpful (1",,4.0,4.0,4.0,4.0,3.0,4.0,Recommends,,Approves of CEO
Wed Aug 08 2018, MWD/LWD Field Engineer,"Casper, WY",Current Employee ,MWD/LWD Field Engineer,0,"Good people to work with in the field and office.
","30% more work for equal or less pay than other MWD jobs. Feels like your always fighting for fair pay. Terrible QC.
Helpfu",,3.0,2.0,3.0,2.0,2.0,3.0,Doesn't Recommend,,
Tue Jul 24 2018, Customer Service Representative,"Houston, TX",Former Employee ,Excellent room for opportunity and growth,0,"Halliburton is an excellent company
","I can not think of any
Advice to Management
None
Helpfu","None
Helpfu",5.0,5.0,5.0,5.0,5.0,5.0,Recommends,Positive Outlook,Approves of CEO
Tue Jul 24 2018, Warehouse Supervisor,"Houston, TX",Current Employee ,Warehouse Supervisor,0,"Respectful company to work for
","Long commute from any really neighborhoods
Advice to Management
You're doing well at your job
Helpfu","You're doing well at your job
Helpfu",4.0,4.0,3.0,4.0,3.0,5.0,Doesn't Recommend,Positive Outlook,No opinion of CEO
Mon Aug 27 2018,Anonymous,,Former Employee ,BED BUGS !! Chemicals and lack of safety,0,"Lot's of hours (80-120 a WEEK!) if you want them, if you don't want THAT much you are considered a ""1%er"" ""Looser"" and will NOT be called for any jobs.
","Low hourly pay, working conditions, unhygienic people. BED BUGS ! The mattresses in the trucks are not covered, rarely if ever changed, covered in filth, chew spit, sweat, bed bugs and who knows what else. All that aside, my last day on the job was when they had me pouring 5 gallon containers of acid into the mixing tanks WITHOUT PPE!!! It was a high profile job and because of the particular client and there was no time to locate and don the proper protective equipment. Over the radios (which the client was also on) I was instructed to hurry and start pouring the acid in. NO face shield, NO chemical suit, NO chemical gloves... Yes it splashed while pouring into the bins, yes it was in the air and I was breathing it, and yes it got on my FR's and SKIN as well. 
I was thoroughly impressed during the safety school classes because they were extremely focused on the proper safety precautions and equipment, HOWEVER when you are in the field it is a totally different story. Some of those young kids running the equipment will surely loose their health and possibly their lives because they don't use the safety equipment and its pretty much expected of them to do that because there are 10 guys waiting to do the job if you wont take short cuts. You can't communicate on the radio when you are wearing a respirator so nobody does, just dust masks. Health is not worth any amount of money and its not like they were paying much anyway, the kicker was the amount of hours. You have to work 80-120 hours a week just to make a decent paycheck. 
Its inconsistent as well. You could work 33 hours strait and then not get another call to work for over a week. Killing all your long hours of overtime. 
 A high percentage of the people that work there that were in the field are dismembered, quite a few have died and many have health problems because of the exposure. Absolutely not worth compromising your health for this or any company.
Helpfu",,1.0,1.0,1.0,1.0,2.0,1.0,Doesn't Recommend,Negative Outlook,Disapproves of CEO
Sat Jun 30 2018,Anonymous,,Current Employee ,Awesome,5,"Great company to work for , great benefits, and good pay , plenty of opportunities for advancement.
","the only downside would be working away from the family for two weeks at a time. So out of a month you may only be home for one week.
Helpful (5",,5.0,3.0,5.0,5.0,5.0,4.0,Recommends,Positive Outlook,
Mon Jul 16 2018,N/A,"Houston, TX","Engineer in Houston, TX",Good Place to work,0,"Halliburton as a company offers great work life balance, and tries to find ways to make their employees happy.
","New review process needs improvement
Helpfu",,4.0,,,,,,,,
Thu Jul 26 2018, Executive Director,"Houston, TX",Former Employee ,Strategic Business Manager,1,"Great pay and bonuses for management. Culture is mixed with an apparent lean toward affirmative action and non-American workforce
","large corporation and politics are alive and well. Assembly line mentality. each person only does thier work, not a team approach. Meeting overkill.
Helpful (1",,3.0,2.0,3.0,4.0,5.0,2.0,Recommends,Positive Outlook,Approves of CEO
Fri Jul 27 2018,Anonymous,,Former Employee ,Operator Assistant,0,"Excellent training resources if you are willing to improve yourself.
","Extremely low pay compared to services contributed.
Helpfu",,3.0,2.0,1.0,3.0,3.0,3.0,Doesn't Recommend,Neutral Outlook,
Mon Jul 09 2018, Technical Professional,"Houston, TX",Current Employee ,Technical Professional,0,"Since Halliburton is a global company, there are a lot of opportunities to work anywhere in the world. A large company like Halliburton lends itself to many different avenues from business to technical to HR.
","The oilfield in general still has a lot of the old school mentality. It can be a tough place to express your desire to progress in the company due to managers who believe you should ""do your time"" and not talk about progression.
Helpfu",,4.0,5.0,5.0,4.0,3.0,4.0,Recommends,Positive Outlook,Approves of CEO
Mon Jul 23 2018, OAII,,Current Employee ,It has been an ok experience.,0,"The pay is good and the benefits are good.
","Little to no appreciation of employees. The hours required to work are incredible, 115 to 120 hours per week
Advice to Management
It's better to keep current employees then to replace them with new employees
Helpfu","It's better to keep current employees then to replace them with new employees
Helpfu",3.0,2.0,2.0,4.0,5.0,2.0,Doesn't Recommend,Neutral Outlook,No opinion of CEO
Sun Jul 22 2018,Anonymous,,Former Employee ,coil hand/ rigger,0,"the pay and ability to work overtime
","not a lot of room to move up
Advice to Management
explore new options
Helpfu","explore new options
Helpfu",3.0,3.0,3.0,3.0,3.0,1.0,,,
Sat Jul 21 2018, MWD/LWD Field Engineer,"Lafayette, LA",Current Employee ,OK to work for,0,"Even though pay is lowest in industry, it is still a very good living for the work performed as long as you can handle not being home for long periods of time.
","Tools are ancient, always have issues with tools. Money is the lowest pay in the industry consistently.
Advice to Management
Stop making checklists, that don't help employees actually do their job. Stop the micro-management practices.
Helpfu","Stop making checklists, that don't help employees actually do their job. Stop the micro-management practices.
Helpfu",3.0,1.0,2.0,2.0,2.0,1.0,Recommends,Positive Outlook,Approves of CEO
Tue Jul 03 2018,Anonymous,,Current Employee ,Senior technical professional,0,"Wide range of career paths. Varied projects. Great exposure to high activity NA shale.
","Difficult to get raises.
Advice to Management
Reward top performers.
Helpfu","Reward top performers.
Helpfu",4.0,4.0,4.0,3.0,3.0,3.0,Recommends,Positive Outlook,Approves of CEO
Tue Jul 17 2018,Anonymous,,Current Employee ,Not to bad it is what you make it,0,"Money money money money money
","Hours down time and politics
Helpfu",,2.0,,,,,,,,
Mon Aug 06 2018,Anonymous,,Former Employee ,Mud engineer,0,"Benefits, work, market share, products, experience
","Management , paperwork, politics, lack of enthusiasm , attention to detail
Advice to Management
Good hands keep your work, not sales people.
Helpfu","Good hands keep your work, not sales people.
Helpfu",1.0,3.0,1.0,3.0,5.0,1.0,Doesn't Recommend,Negative Outlook,Disapproves of CEO
Thu Jul 12 2018,Anonymous,,Current Employee ,Halliburton,1,"Decent pay when you are working a lot of hours, the health care is good.
","There isn't any opportunity for a long career. Once a crash hits you'll be stuck looking for a job.
Helpful (1",,3.0,2.0,3.0,2.0,3.0,2.0,Doesn't Recommend,,
Sat Aug 04 2018, Heavy Duty Truck Driver,"Kilgore, TX",Former Employee ,Heavy Duty Pool Driver,0,"Good Pay, fun team and Good Company
","During the interview, you will be told there is plenty of work and you will easily get 40+ hours of work each week based on 6 days on and 3 days off schedule. 

I've seen that your schedule and hours worked is greatly reduced and constantly changing. Dispatchers can call you and tell you to stay home and come in at a much later time or don't come in at all. The heavy-duty driving pool truly an ""on call"" and ""on demand"" service. Your schedule is not consistent so your income is not consistent. This is why drivers in the pool team quit on a regular basis. The hiring managers will lie to you to get you on board so beware.
Advice to Management
Get drivers on a more consistent ""guaranteed paid"" schedule. Change the rotation to 5 on and 2 days off. Get team members that like to work nights on a consistent nightly schedule. Get team members that like to work days on a consistent daily schedule. Don't jack around people's time or pay and your turnover in the group will be much less.
Helpfu","Get drivers on a more consistent ""guaranteed paid"" schedule. Change the rotation to 5 on and 2 days off. Get team members that like to work nights on a consistent nightly schedule. Get team members that like to work days on a consistent daily schedule. Don't jack around people's time or pay and your turnover in the group will be much less.
Helpfu",1.0,1.0,5.0,3.0,3.0,3.0,Doesn't Recommend,Neutral Outlook,No opinion of CEO
Wed Jul 11 2018,Anonymous,N/A,Former Employee ,Senior Scientist,0,"Good Benefits and friendly work environment.
","Barriers to advancement professional development opportunities.
Helpfu",,3.0,,,,,,,,
Wed Jul 11 2018, Real Estate Analyst,"Houston, TX",Current Employee ,Company Rating,0,"good company, geared toward learning
","large turnovers in some departments
Advice to Management
value your employees, it instills loyalty in them
Helpfu","value your employees, it instills loyalty in them
Helpfu",3.0,3.0,4.0,4.0,4.0,2.0,Recommends,Neutral Outlook,No opinion of CEO
Mon Jul 09 2018,Anonymous,,Current Employee ,Good Company,0,"Good career start for engineers fresh out of school.
","Oil and gas lags the industry in technology innovation.
Helpfu",,3.0,1.0,3.0,3.0,1.0,3.0,,,
