date,employee_title,location,employee_status,review_title,helpful,pros,cons,advice_to_mgmt,rating_overall,rating_balance,rating_culture,rating_career,rating_comp,rating_mgmt,recommends,positive_outlook,approves_of_CEO
Sun Aug 16 2020, Account Representative,"Denver, CO",Former Employee ,GREAT TEAM,0,"People! The people are amazing! Local management teams are top notch, because corporate management is so outdated and out of touch.
","overworked, underpaid, bad locations, worse management
Helpfu",,3.0,1.0,5.0,5.0,1.0,1.0,Doesn't Recommend,Negative Outlook,Disapproves of CEO
Sun Aug 16 2020,Anonymous,N/A,Former Employee ,Okay if you like booms and bust,0,"flexible and good secure benefits
","too political and lay offs happen a lot
Helpfu",,3.0,3.0,1.0,1.0,3.0,1.0,Doesn't Recommend,Negative Outlook,Disapproves of CEO
Sat Aug 15 2020, Hydraulic Fracturing Field Engineer,"Little Rock, AR",Former Employee ,Halliburton Review,0,"Company pays well. If you have limited education and willing to work long hours in harsh conditions you will be payed well.
","Economic downturns and the fluctuations in the oil/gas market can leave you looking for a job.
Helpfu",,3.0,1.0,2.0,3.0,4.0,2.0,Doesn't Recommend,Negative Outlook,No opinion of CEO
Fri Jul 31 2020, Operation Material Controller,"Oklahoma City, OK",Former Employee ,Great company,0,"Good atmosphere. Best place to work
","not much growth opportunities to grow
Helpfu",,4.0,,,,,,,,
Tue Aug 11 2020, Cement Bulk Plant Operator,"Houma, LA",Former Employee ,pay is not great,0,"very safe environment great learning experience
","I have been a operator 2 ,and doing senior operator dutys for 7 years and never got promoted ! Always shorthanded
Advice to Management
recognize your employes more get to know them and compensate them for what they are capable of doing , and mostly doing already with the same title and pay
Helpfu","recognize your employes more get to know them and compensate them for what they are capable of doing , and mostly doing already with the same title and pay
Helpfu",3.0,2.0,3.0,3.0,2.0,1.0,Doesn't Recommend,Neutral Outlook,No opinion of CEO
Tue Aug 11 2020,Anonymous,,Former Employee ,Decent company for the pay,0,"Benefits, Training, Bonus pay, company vehicle
","Treated as a number, management has no regard for employees personal life or needs for days kff
Helpfu",,3.0,2.0,3.0,3.0,4.0,2.0,Recommends,Negative Outlook,Approves of CEO
Tue Jul 28 2020, Engineer,,Current Employee ,job demand,0,"work life balance is good. flexible hour as long as you deliver.
","no cons. so far so good.
Helpfu",,4.0,5.0,4.0,3.0,3.0,3.0,Recommends,,
Mon Jul 27 2020, Supply and Demand Planer,N/A,Former Employee ,Great Company to work for.,0,"Always worked with Great people. 3 states and several positions.
","Dot really have any cons from my employment
Helpfu",,5.0,3.0,5.0,4.0,5.0,5.0,Recommends,Positive Outlook,Approves of CEO
Mon Jul 27 2020, Global Master Planner,"Houston, TX",Former Employee ,Great place to work,0,"Excellent training and support from management. Great advancement opportunities.
","This industry is tied directly to oil prices, when the market goes down so do the head counts
Helpfu",,5.0,4.0,5.0,5.0,5.0,5.0,Recommends,,Approves of CEO
Mon Aug 31 2020, Production Group Leader,"Alvarado, TX",Former Employee ,Not all cut out,0,"Pay decent, benefits are OK, could be better for employee size
","will deceive you about job and let you go after years of UN blemished service without offer of another position When closing the location had us pack all up and told us they will move to different location let me go literally while the last load was driving out the drive way. cut the others with in weeks of getting to there new locations.
Advice to Management
cut top fat and keep experienced employees on bottom. too many cheifs.
Helpfu","cut top fat and keep experienced employees on bottom. too many cheifs.
Helpfu",1.0,3.0,1.0,1.0,3.0,1.0,Doesn't Recommend,Negative Outlook,Disapproves of CEO
Mon Aug 31 2020, Manager,,Former Employee ,Terrible,0,"Not much at all to like
","Always laying off people. They don’t care
Helpfu",,1.0,1.0,1.0,1.0,1.0,1.0,Disapproves of CEO,,
Mon Aug 10 2020, Service Supervisor,,Current Employee ,n/a,0,"Benefits and the people you work with
","management is the worst you can see
Helpfu",,2.0,,,,,,,,
Sun Aug 09 2020, BMO Lead,"Brighton, CO",Former Employee ,Great benefits,0,"great benefits and a lot of hours
","management needs to show compassion to their employees
Advice to Management
try caring for the employees
Helpfu","try caring for the employees
Helpfu",3.0,1.0,2.0,3.0,3.0,1.0,Doesn't Recommend,Negative Outlook,Disapproves of CEO
Wed Aug 05 2020, Coordinator,,Former Employee ,Decent,1,"Opportunities to move up if you stay motivated.
","Hard to stay motivated with market conditions.
Helpful (1",,3.0,,,,,,,,
Fri Jul 24 2020, Pump Technician,"Brownfield, TX",Former Employee ,Great place to work,0,"Great people, chances to promote, plenty of hours.
","Pay and how promotions are sometimes decided.
Advice to Management
Increase pay and promote based on talent not relations.
Helpfu","Increase pay and promote based on talent not relations.
Helpfu",4.0,3.0,5.0,5.0,2.0,3.0,Recommends,Positive Outlook,Approves of CEO
Fri Aug 07 2020, Senior BD Manager,"Houston, TX",Former Employee ,Oil annd Gas service Co.,0,"Good opportunities. International. travel. 401k, benefits
","Politics, salary bandwidth, promotion within.
Advice to Management
be more open
Helpfu","be more open
Helpfu",3.0,3.0,3.0,3.0,2.0,2.0,Recommends,Negative Outlook,No opinion of CEO
Thu Aug 06 2020, Materials Manager,"Houston, TX",Former Employee ,Are you a good ole Boy?,0,"Good Pay and Benefits. Nice Campus
","If your not in a click you will have a hard time succeeding
Helpfu",,3.0,,,,,,Doesn't Recommend,Neutral Outlook,No opinion of CEO
Wed Jul 22 2020, Business Development Representative,"Oklahoma City, OK",Former Employee ,BizDev Oil & Gas,0,"Processes and training, extremely fair company culture
","burdened by decades of bureaucracy, creativity by groupthink
Advice to Management
growing managers is not the same thing as growing leaders
Helpfu","growing managers is not the same thing as growing leaders
Helpfu",4.0,4.0,5.0,4.0,4.0,4.0,Recommends,Positive Outlook,Approves of CEO
Wed Aug 05 2020, Wireline Field Engineer,"Odessa, TX",Former Employee ,Good entry job,0,"Training, bonuses, not a lot of out of pocket costs
","Politics, lack of communication, hourly salary
Advice to Management
Better communication and be upfront
Helpfu","Better communication and be upfront
Helpfu",3.0,2.0,2.0,5.0,2.0,3.0,Recommends,Positive Outlook,No opinion of CEO
Wed Aug 05 2020, Truck Driver,,Current Employee ,Decent job,0,"good pay,benefits and contribution from the company
","bad management bad communication between employees and management
Advice to Management
listen to your employees
Helpfu","listen to your employees
Helpfu",3.0,2.0,1.0,4.0,4.0,1.0,Doesn't Recommend,Negative Outlook,Disapproves of CEO
Wed Aug 05 2020, Senior Engineer,,Former Employee ,Top Talent does not matter only years with company,0,"benefits, leaving, lunch, people, free hand sanitizer
","management, company values, work environment, dishonest,
Helpfu",,2.0,2.0,1.0,2.0,3.0,1.0,Doesn't Recommend,Neutral Outlook,Disapproves of CEO
Mon Jul 20 2020, Senior Manager Strategic Procurement,,Former Employee ,Review,0,"Multiple opportunities to grow and explore new positions
","Quick decisions are hamstrung by policies and procedures in place
Helpfu",,4.0,2.0,4.0,4.0,3.0,3.0,Recommends,Neutral Outlook,No opinion of CEO
Tue Jul 21 2020, HSE Director,"Houston, TX",Former Employee ,Great Company,0,"Excellent travel and professional development opportunities, excellent benefits
","Very large company with slow salary and promotion opprtunities
Helpfu",,4.0,2.0,4.0,3.0,4.0,3.0,Recommends,Neutral Outlook,Approves of CEO
Tue Aug 04 2020, Anonymous,,Current Employee ,Overall good company,0,"Good pay and benefits. Room to grow.
","Constantly at risk of layoffs
Helpfu",,3.0,4.0,3.0,4.0,4.0,4.0,Recommends,Negative Outlook,Approves of CEO
Mon Aug 03 2020, Electro,"Houston, TX",Former Employee ,A start to a better oilfield career,1,"It's a start in the oilfield to get your feet wet.
","Pay is low, Moral is of no concern, and everyone is expendable no matter your work knowledge or work ethic.
Advice to Management
Everyone is a part of the puzzle as a company. Your top executives are nothing without the hard work of everyone from the bottom up.
Helpful (1","Everyone is a part of the puzzle as a company. Your top executives are nothing without the hard work of everyone from the bottom up.
",2.0,1.0,2.0,2.0,1.0,1.0,Doesn't Recommend,Neutral Outlook,Disapproves of CEO
Mon Aug 03 2020, Mechanical Engineer,,Former Employee ,Good and bad. Depends on your manager and department.,0,"Good benefits. Top tier company.
","Little to no opportunity/support for lateral or vertical movement. Way too many levels of managers. Management does not care about the career advancement of their direct reports.
Advice to Management
Don't block employees from moving to a different group citing that they are too important and there is no replacement for their experience, and then lay them off months later.
Helpfu","Don't block employees from moving to a different group citing that they are too important and there is no replacement for their experience, and then lay them off months later.
Helpfu",3.0,4.0,2.0,2.0,4.0,2.0,Doesn't Recommend,Neutral Outlook,Disapproves of CEO
Mon Aug 03 2020, Applications Evaluation Specialist,"Houston, TX",Former Employee ,Slow growth and low pay,0,"People are great, good place to start off career
","Too corporate, strange strict HSE rules, hard to get pay increases
Advice to Management
Give managers only 2 levels up direct approval for pay increases. Create a better culture, one that rewards innovation and drives improvement.
Helpfu","Give managers only 2 levels up direct approval for pay increases. Create a better culture, one that rewards innovation and drives improvement.
Helpfu",2.0,4.0,1.0,4.0,2.0,1.0,Doesn't Recommend,Neutral Outlook,Disapproves of CEO
Sun Aug 02 2020, Procurement Specialist,"Odessa, TX",Former Employee ,Procurement Specialist,0,"Good people for the most part, good benefits
","management does not support their employees
Helpfu",,3.0,3.0,3.0,4.0,4.0,2.0,Recommends,Positive Outlook,Approves of CEO
Sat Aug 22 2020, Mechanical Engineer,"Houston, TX",Former Employee ,Beware,0,"There is nothing positive about working here.
","You only get disrespect nothing else.
Helpfu",,1.0,1.0,1.0,1.0,1.0,1.0,Doesn't Recommend,Negative Outlook,Disapproves of CEO
Sat Aug 22 2020, Field Engineer,"Odessa, TX",Former Employee ,Halliburton job,0,"There are no pros to this company.
","Company does not value the work that comes from any worker, especially when things go on a downturn for oil prices, they will lay off most of their personnel . It is a matter of when you get laid off. Get treated without respect most of the time. Tough on your health as well as your profesional career.
Helpfu",,1.0,1.0,1.0,1.0,3.0,1.0,Doesn't Recommend,Negative Outlook,Disapproves of CEO
Fri Jul 17 2020, Field Engineer,,Former Employee ,Great place,0,"Good benefits and High tech
","No work life balance, working for extendended hours
Helpfu",,4.0,1.0,3.0,3.0,4.0,2.0,,,
Fri Jul 17 2020, Service Leader,,Former Employee ,Great Training,0,"Great place to train - they invest a lot into their training and development.
","Long hours and oil field never sleeps.
Helpfu",,4.0,4.0,4.0,,,,,,
Fri Jul 31 2020, Senior Technical Professional,"San Antonio, TX",Former Employee ,Good Place to Learn,0,"Competitive Pay, great place to learn the industry, very solid products delivered to customers
","Constant business direction changes, difficult work/life balance, loyalty towards hard working employees goes as far as the bottom line.
Advice to Management
plot a course and be confident in the direction
Helpfu","plot a course and be confident in the direction
Helpfu",3.0,2.0,4.0,4.0,3.0,2.0,Neutral Outlook,,No opinion of CEO
Thu Jul 16 2020, Service Operator II,"Fort Lupton, CO",Former Employee ,Good company,0,"Great pay for frac hands. Kept jobs going as long as possible even in this climate.
","None really. Some people would complain they pay less than everyone but its real good money.
Advice to Management
Watch for poor performing employees. Nothing gets a crew down more than watching a crappy employee get away with things.
Helpfu","Watch for poor performing employees. Nothing gets a crew down more than watching a crappy employee get away with things.
Helpfu",4.0,2.0,3.0,4.0,4.0,3.0,Recommends,Neutral Outlook,Disapproves of CEO
Thu Jul 30 2020, Field Service Quality Coordinator,"Houston, TX",Former Employee ,Decent company but very little loyalty,0,"Many opportunities for those willing to move a bunch
","Lay offs happen frequently as a way to save money
Helpfu",,3.0,4.0,1.0,4.0,3.0,3.0,Recommends,Negative Outlook,No opinion of CEO
Thu Jul 30 2020, Field Service Representative,"Houston, TX",Former Employee ,Just a number,0,"Decent pay and great benefits and as much OT as you want.
","Management does not care for employees when it comes to cutting costs
Advice to Management
Rely more on retaining employees
Helpfu","Rely more on retaining employees
Helpfu",3.0,3.0,5.0,3.0,5.0,3.0,Recommends,Negative Outlook,No opinion of CEO
Thu Aug 20 2020,Anonymous,"Houston, TX",Former Employee ,"Horrible, horrible culture",0,"Pay is great compared to peers in the region. Awesome office campus.
","Toxic work culture. I am not sure how people are putting up with that level of toxicity in their daily work. Way too much bureaucracy and back stabbing happening everywhere.
Helpfu",,1.0,1.0,1.0,1.0,4.0,1.0,Doesn't Recommend,Negative Outlook,Disapproves of CEO
Mon Aug 17 2020, Mechanical Engineer,,Current Employee ,they have no forward direction,0,"there are no pros here
","get rid of the better workers
Helpfu",,1.0,,,,,,,,
Sat Jul 11 2020, Electronics Technician I,"Brownfield, TX",Former Employee ,"Good Company, Decent Benefits",0,"Ability to work on lots of different electronic components and systems, decent pay, decent benefits
","Job Security is in question due to market volatility.
Advice to Management
Retention of experienced employees is important to the success and longevity of a company.
Helpfu","Retention of experienced employees is important to the success and longevity of a company.
Helpfu",4.0,2.0,4.0,4.0,3.0,4.0,Recommends,Negative Outlook,No opinion of CEO
Sat Jul 25 2020, Senior Product Champion,"Houston, TX",Current Employee ,Product Champion,0,"Many opportunities for role diversity
","Large company, things move slow.
Helpfu",,3.0,3.0,2.0,3.0,3.0,2.0,Doesn't Recommend,Neutral Outlook,No opinion of CEO
Fri Aug 14 2020, Principal Administrative Specialist,,Current Employee ,Worst Company to work for if you don't make the company money.,1,"Benefits are the only pro for the company and they are not that great.
","constantly outsourcing jobs to India, pay is awful, you work long hours with no regard to your family or your health, no ability to move up in the company, very few and very small raises, you are a number and the management of the company does not care about you no matter how many years you have with the company.
Advice to Management
Actually look at your employees, actually care about doing the right thing for your employees. Treat your employees as more than just a number that you can increase or decrease at will. Acknowledge that without your human resources, you have no company and no job.
Helpful (1","Actually look at your employees, actually care about doing the right thing for your employees. Treat your employees as more than just a number that you can increase or decrease at will. Acknowledge that without your human resources, you have no company and no job.
",1.0,1.0,1.0,1.0,1.0,1.0,Doesn't Recommend,Negative Outlook,Disapproves of CEO
Thu Jul 09 2020, Inventory Specialist,,Former Employee ,Great place,0,"Great people to work with
","it is the oil business
Helpfu",,5.0,3.0,3.0,4.0,3.0,4.0,Recommends,,
Fri Aug 14 2020, Tool Tech I,N/A,Former Employee ,Bad,0,"Good pay when times are good
","Bad base pay, poor management, very poor environment
Helpfu",,1.0,,,,,,,,
Thu Jul 09 2020, Pump Technician,"Williston, ND",Former Employee ,Great Place to Work,0,"Tons of Hours and decent pay
","Oilfield driven company so tons of ups and downs in the market freeze upward momentum and raises
Helpfu",,4.0,4.0,2.0,4.0,4.0,3.0,Recommends,Negative Outlook,Disapproves of CEO
Thu Jul 09 2020, Technical Advisor,"Houston, TX",Former Employee ,Great company,0,"Great benefits, great support, working environment.
","Vulnerability to oil price fluctuations.
Helpfu",,4.0,4.0,4.0,4.0,4.0,4.0,Recommends,Neutral Outlook,Approves of CEO
Wed Jul 22 2020, Associate Technical Professional ,,Former Employee ,Good company,0,"Good benefits and time-off packages, self-starter, diverse teams to work with and great learning experience to start
","No career growth opportunities presented and management do not really have time to help individuals grow in terms of support
and no work life balance
Advice to Management
Pay attention to your employees
Helpfu","Pay attention to your employees
Helpfu",3.0,1.0,2.0,3.0,5.0,2.0,,,
Mon Jul 20 2020, Strategic Sourcing Lead,"Houston, TX",Former Employee ,Good Company,0,"Good Benefits and flexible work environment
","When the market is down there will be large amounts of layoffs
Helpfu",,3.0,4.0,4.0,3.0,4.0,3.0,Doesn't Recommend,Negative Outlook,
Fri Jul 03 2020, Wireline Field Professional Engineer,,Former Employee ,Working Offshore,0,"- Having high awareness of safety
- Having experience on working with limited time and under pressure
","- unusual working schedule
- 1 month shift of being away from home
Helpfu",,4.0,3.0,4.0,3.0,4.0,3.0,Recommends,Positive Outlook,Approves of CEO
Tue Jun 30 2020, Equipment Operator,"Odessa, TX",Former Employee ,Great Company,0,"lots of great people and good hours when the price of oil is up
","as with any oilfield service related job, market conditions make it necessary for layoffs/furloughs at times.
Advice to Management
good people to work for
Helpfu","good people to work for
Helpfu",4.0,3.0,4.0,4.0,4.0,4.0,,,
Mon Jun 29 2020, Senior Talent Acquisition Specialist,"Houston, TX",Former Employee ,Great company as forward thinking and aggressive in the industry,0,"Great room for growth and advancement
","don't plan well when market is down and people are dispensable
Helpfu",,4.0,4.0,4.0,3.0,4.0,3.0,,,
Thu Jun 25 2020,Anonymous,"Odessa, TX",Former Employee ,Materials operator II,0,"Good pay & benefits. Enjoyed working with co-workers
","Away from family & dealing with employees with different work habits
Helpfu",,5.0,3.0,3.0,3.0,4.0,2.0,,,
Wed Jun 24 2020, Electronics Technician,"Elmendorf, TX",Former Employee ,"Great company, Team oriented, Like second family",0,"Great pay, great benefits and lots of opportunities to learn, Big on family
","Long hours, but I like overtime
Advice to Management
Focus on growing your employee's skill set to make them more valuable on location and out in the field
Helpfu","Focus on growing your employee's skill set to make them more valuable on location and out in the field
Helpfu",5.0,3.0,5.0,4.0,5.0,4.0,Recommends,Neutral Outlook,No opinion of CEO
Thu Jul 09 2020, Lab Technician,"Odessa, TX",Former Employee ,just a number,0,"good benefits, good career ladder
","you end up being just a number. All about the profit.
Helpfu",,2.0,2.0,2.0,3.0,3.0,2.0,Doesn't Recommend,Negative Outlook,
Wed Jun 24 2020, Applications Support Analyst,"Houston, TX",Former Employee ,Decent company to work for.,0,"The people I worked with were fantasic
","Oil and Gas industry is prone to layoffs.
Helpfu",,4.0,5.0,4.0,3.0,5.0,4.0,Recommends,Neutral Outlook,No opinion of CEO
Wed Jul 08 2020, Senior Account Representative,"Houston, TX",Former Employee ,Company culture has deteriorated due to poor leadership,0,"Provided a premium salary and ability to work globally
","Management shows very little leadership qualities. As a whole the company has begun to react on emotion and not in a rational business decision process.
Advice to Management
Invest in people and not share holders. Halliburton has always been known as the relationship company and now the leadership has turned the culture into a commodities like, cut throat atmosphere.
Helpfu","Invest in people and not share holders. Halliburton has always been known as the relationship company and now the leadership has turned the culture into a commodities like, cut throat atmosphere.
Helpfu",3.0,2.0,1.0,4.0,4.0,1.0,Doesn't Recommend,Negative Outlook,Disapproves of CEO
Mon Jun 22 2020, Associate Technical Professional,,Former Employee ,Good company,0,"Willing to devote time into your career development
Takes care of employees
","Work/life balance could be better
Advanced training wasn't available for some products
Helpfu",,5.0,3.0,4.0,5.0,4.0,5.0,Recommends,Positive Outlook,No opinion of CEO
Mon Jun 22 2020, MWD Field Engineer,"Oklahoma City, OK",Former Employee ,Great place to work with exceptional pay,0,"Pay is great, learn a lot,
","rarely home for holidays or weekends
Helpfu",,5.0,2.0,4.0,5.0,5.0,4.0,Recommends,Positive Outlook,
Tue Jul 07 2020, Senior Manager,"Columbus, OH",Former Employee ,Pros and cons,0,"and cons""
2.0
★★★★★
Former Employee - Senior Manager in Columbus, OH
Doesn't Recommend
Negative Outlook
Disapproves of CEO
I worked at Halliburton full-time for more than 10 years
Pros
Good pay at senior levels
","Poor initial pay for employees compared to industry standard 
No work life work balance in the USA
 people are dispensable again USA side, despite what the company says when hiring
Advice to Management
Need a long hard look at where the company is headed and the way senior and middle management works seems to be a disconnect at present
 used to be people are our greatest assets we seem to have strayed from that concept
Helpfu","Need a long hard look at where the company is headed and the way senior and middle management works seems to be a disconnect at present
 used to be people are our greatest assets we seem to have strayed from that concept
Helpfu",2.0,2.0,2.0,4.0,4.0,4.0,Doesn't Recommend,Negative Outlook,Disapproves of CEO
Mon Jul 06 2020, Chemist,"Midland, TX",Former Employee ,Bad company,0,"I like the color red
","Bad management, impossible to move up, racial inequality mostly colorism and low pay salaries. One of the managers was literally complaining that he couldn't say inappropriate words in front of his employees because he didn't see why/ how that hurt other races.
Advice to Management
Work on your racial inequality
Helpfu","Work on your racial inequality
Helpfu",3.0,1.0,1.0,1.0,3.0,1.0,Doesn't Recommend,Negative Outlook,No opinion of CEO
Fri Jul 03 2020, Continuous Improvement Associate,"Duncan, OK",Former Employee ,Unstable,1,"Coworkers were great people to work with
Complimentary coffee
","Managers play favorites, you have to be part of the good ole boy club to advance.
Unstable job, constantly doing layoffs and rehires
Advice to Management
Advance people based off their performance at work, not on the golf course.
Helpful (1","Advance people based off their performance at work, not on the golf course.
",3.0,3.0,1.0,2.0,5.0,1.0,Doesn't Recommend,Negative Outlook,No opinion of CEO
Wed Jun 17 2020, R&Amp; D Engineer,,Current Employee ,Slow and Steady,0,"Friendly environment, challenging work, great people
","Short sited economic goals, change is slow throughout
Helpfu",,4.0,4.0,4.0,4.0,3.0,2.0,Recommends,Negative Outlook,
Thu Jun 18 2020, Associate Tech Professional,"Alvarado, TX",Former Employee ,"Overall Decent, but a few drawbacks",0,"The pay and benefits are decent, and the work is interesting. Management does a good job and preparing you for future opportunities. Good opportunities to learn and gain experience as an engineer.
","Don't expect to ever receive a promotion, you have to switch departments in order to move up within the organization. The company is unwilling to give promotions without the approval of a VP or higher so stay away from small locations if you want your career to advance. The oil industry is volatile and Halliburton is not immune. Expect to be expendable as an employee. Morale is pretty bad at times.
Advice to Management
Give employees the opportunity to rise through the company in their current role. You are losing good talent due to your resistance to letting people advance. Listen to your Professionals more, and your marketing guys less. Make changes at lower levels to improve morale.
Helpfu","Give employees the opportunity to rise through the company in their current role. You are losing good talent due to your resistance to letting people advance. Listen to your Professionals more, and your marketing guys less. Make changes at lower levels to improve morale.
Helpfu",4.0,4.0,4.0,2.0,4.0,2.0,Doesn't Recommend,Negative Outlook,No opinion of CEO
Thu Jul 02 2020, Field Service Technician,"Houston, TX",Former Employee ,Stay Away,0,"Benefits and pay were good
","Uncertain future due to external forces
Helpfu",,2.0,3.0,3.0,1.0,4.0,3.0,Doesn't Recommend,Negative Outlook,No opinion of CEO
