date,employee_title,location,employee_status,review_title,helpful,pros,cons,advice_to_mgmt,rating_overall,rating_balance,rating_culture,rating_career,rating_comp,rating_mgmt,recommends,positive_outlook,approves_of_CEO
Fri May 01 2020, Senior Manager,"Palo Alto, CA",Former Employee ,Good company,0,"Global and industry standards in process and systems
","Pay and career, promotion path not consistent
Advice to Management
More clear strategy for as a service model
Helpfu","More clear strategy for as a service model
Helpfu",5.0,4.0,4.0,3.0,4.0,3.0,Recommends,Negative Outlook,
Sat Jun 06 2020, IT Architect,"Pontiac, MI",Former Employee ,HPE Review,0,"HP has a strong connection to product stacks due to its position
","Pay cuts, poor morale, low benefits package. Projects are over committed and clients use the vendor as a scapegoat for their own failings.
Helpfu",,1.0,1.0,1.0,2.0,2.0,1.0,Doesn't Recommend,,
Wed May 13 2020, Account Manager,"Plano, TX",Current Employee ,avergae,0,"good benefits and resources for pros
","can't think of anything tfor cons
Helpfu",,3.0,3.0,3.0,3.0,3.0,3.0,Recommends,Positive Outlook,Approves of CEO
Mon May 11 2020, Marketing,,Former Employee ,Marketing at HP,0,"very supportive boss and collegial team
","tons of boring meetings. takes forever to get stuff done
Helpfu",,2.0,,,,,,,,
Tue Apr 21 2020, Field Sales Representative,"Atlanta, GA",Former Employee ,Great People to work with,1,"great training and passionate people
","constant reorgs , layoffs, and management change
Advice to Management
offer your sales reps to go through technical training if you're going to lay off sales engineers and leave us with little to no support
Helpful (1","offer your sales reps to go through technical training if you're going to lay off sales engineers and leave us with little to no support
",5.0,5.0,5.0,4.0,5.0,4.0,Recommends,Neutral Outlook,No opinion of CEO
Fri May 08 2020, IT Operations Manager,"Plano, TX",Former Employee ,IT Operations Manager,0,"Business casual atmosphere was quite open
","Spun off to Micro Focus
Advice to Management
Listen to all ranks of Direct Reports
Helpfu","Listen to all ranks of Direct Reports
Helpfu",3.0,3.0,3.0,3.0,3.0,2.0,Recommends,Neutral Outlook,No opinion of CEO
Thu Apr 23 2020, Software Engineer,,Current Employee ,Nice place to work,0,"Management was very supportive and friendly.
","Nothing that I'm aware of
Helpfu",,5.0,5.0,5.0,5.0,4.0,5.0,,,
Thu Apr 23 2020, Senior Mechanical Engineer/Designer,"Houston, TX",Former Employee ,HPE Houston,0,"Good pay and better people
","Working within a cube farm makes to help to concentrate
Advice to Management
Go back to separate offices
Helpfu","Go back to separate offices
Helpfu",4.0,4.0,5.0,4.0,5.0,4.0,Recommends,Neutral Outlook,
Wed May 27 2020, Field Manager,"Miami, FL",Former Employee ,Awful,0,"Good pay. good benefits, time off
","Constant threat of lay offs, lack of concern of employees
Advice to Management
value employees
Helpfu","value employees
Helpfu",1.0,2.0,1.0,1.0,5.0,1.0,Doesn't Recommend,Negative Outlook,
Wed May 06 2020, Account Manager,"Plano, TX",Former Employee ,Cultish,0,"Great paycheck, great coworkers, mostly great leaders with diversity.
","They often bite off more than they can chew. No real progression program unless you know who to get close to. Lots of office politics.
Helpfu",,2.0,2.0,3.0,2.0,3.0,1.0,Doesn't Recommend,Negative Outlook,Approves of CEO
Sun May 24 2020, Software Engineer,"Fort Collins, CO",Former Employee ,"Great people, but bad corporation.",1,"Great strong teams, super knowledgeable leads, and great team management. Flexible schedule, good work environment.
","Very bad upper management. Upper menages do not care about people. They are care about they bonuses. Often layoffs, project cuts etc. Employees just a units for the company. No personal recognition, no promotions.
Advice to Management
Company drives by metrics. No one listening for feedback from customers and regular employees. Everything looks good on paper and during talks, but realistically company going down.
Helpful (1","Company drives by metrics. No one listening for feedback from customers and regular employees. Everything looks good on paper and during talks, but realistically company going down.
",1.0,3.0,3.0,2.0,3.0,1.0,Doesn't Recommend,Negative Outlook,Disapproves of CEO
Mon May 04 2020, Senior Mechanical Engineer,"Houston, TX",Current Employee ,Great People but company in transition,0,"Interesting work, great people,you are never bored.
","Company in transition. No company growth so opportunities are few and far between.
Helpfu",,3.0,3.0,5.0,3.0,3.0,4.0,Recommends,Neutral Outlook,Approves of CEO
Fri Apr 10 2020, Cloud Engineer,"Alpharetta, GA",Former Employee ,Good company but outdated tools,2,"Work from home (if desired) Strong salary, good coworkers
","Tools were outdated and HPE was losing market share to AWS and Azure.
Helpful (2",,4.0,5.0,5.0,3.0,5.0,4.0,Doesn't Recommend,Negative Outlook,Disapproves of CEO
Wed Apr 22 2020, Systems/Software Engineer V,"Seattle, WA",Current Employee ,"Decent W/L Balance, cheap on benefits",3,"It's a big company with resources if you need it. My part of the company was purchased recently (former HPC company), and that group has been exceptional to work with.
","It's a big company with a massive emphasis on only one thing: shareholder value. This is good from an investors point of view, but bad when it comes to investing in anything that will add true value down the road. 

Every chance they get, they attempt to decrease costs in a way the is not transparent. Health benefits seemed acceptable, until I started using them. The (high) deductible is split into 4 groups, in-network/out of network and medical vs pharmacy, and all that costs me (for myself and my husband) around $500/mo. All other benefits tanked after the acquisition as well, and my old company wasn't a big, they just treated people right. 

Work/life balance is reasonable, but most people that have been there long enough seem to just be getting through it. Not much excitement for innovating or doing anything new. It seems like a great place to be a salesman, not a great place to be an engineer, as all the innovation they make is purchased from other companies. 

There's also a massive hierarchy and tons of red tape for almost everything. My manager has been great at keeping it from being my issue, but I can see the toll it's taken on him and others in management.
Advice to Management
Be more transparent with people and invest in new technologies. Try to break down the silos between different groups that de-incentivizes collaboration. There's a chance for this company to do great things, but massive changes are needed from the top level down.
Helpful (3","Be more transparent with people and invest in new technologies. Try to break down the silos between different groups that de-incentivizes collaboration. There's a chance for this company to do great things, but massive changes are needed from the top level down.
",3.0,5.0,1.0,3.0,2.0,1.0,Doesn't Recommend,Negative Outlook,No opinion of CEO
Fri Apr 10 2020, Senior Software Engineer,"Tinton Falls, NJ",Former Employee ,Excellent Company to work for,0,"Always worked on current technologies
","Depending on senior management at that time cared for the bottom line vs employees
Helpfu",,4.0,,,,,,Recommends,Neutral Outlook,Approves of CEO
Tue Apr 21 2020, Senior Director,"Houston, TX",Former Employee ,"Solid company, below average benefits",1,"Well managed, traditional company, respectful
","20 years behind other high-tech companies, some questionable managers
Helpful (1",,3.0,3.0,3.0,3.0,3.0,3.0,Recommends,Negative Outlook,Approves of CEO
Wed Apr 22 2020, Customer Experience and Quality Leader,"Plano, TX",Former Employee ,History of poor and costly decisions at executive level,2,"Good products and quailty. Great teammates.
","Extremely bureaucratic and overly complicated processes. Employees continue to bear the burden of poor executive decisions.
Advice to Management
Stop talking at your people and customers and start listening to them. Stop acquiring companies that aren't worth what you pay for them, e.g. Autonomy. Start sharing the wealth with your people.
Helpful (2","Stop talking at your people and customers and start listening to them. Stop acquiring companies that aren't worth what you pay for them, e.g. Autonomy. Start sharing the wealth with your people.
",2.0,3.0,3.0,1.0,2.0,2.0,Doesn't Recommend,Neutral Outlook,No opinion of CEO
Mon Apr 13 2020, Inventory Control Coordinator,"Houston, TX",Former Employee ,some good some bad,0,"good medical coverage in the beginning....very flexible on hours and time in most cases
","the manufacturing side got dumped on a lot...but rewarded every blue moon
Advice to Management
treat your manufacturing folks good...they are the heartbeat of the company
Helpfu","treat your manufacturing folks good...they are the heartbeat of the company
Helpfu",3.0,4.0,4.0,2.0,3.0,2.0,Recommends,Neutral Outlook,No opinion of CEO
Wed Mar 25 2020, Channel Manager,"Lincolnshire, IL",Current Employee ,"Owners only! You will succeed only if you are willing to own every aspect of your business, there are no group projects",0,"You can do anything you think will help the business, with very little pushback or roadblocks. Great portfolio thats easy to win with & great channel spiffs. Storang Channel leadership are organized and have a great go-to-market strategy that the entire company should adapt
","Lack of diversity. Not allot of room for upward mobility. Lots of the same peopl in leadership get shifted around every few years.
Advice to Management
Keep focusing on the culture, its working! Develope more opportunities for regional employees get together and can connect
Helpfu","Keep focusing on the culture, its working! Develope more opportunities for regional employees get together and can connect
Helpfu",5.0,5.0,5.0,5.0,5.0,5.0,Recommends,Positive Outlook,Approves of CEO
Tue Mar 31 2020, Project Manager,"Austin, TX",Former Employee ,It was alright,0,"Work from home, flexibility, etc.
","Corporate politics hinder this company.
Helpfu",,3.0,5.0,1.0,2.0,3.0,1.0,,,
Tue Mar 17 2020, Senior Mechanical Engineer,"Houston, TX",Former Employee ,ME @ HPE,0,"High pay for a good job done
","Upper management is not consistent. They keep on changing direction.
Helpfu",,4.0,3.0,1.0,4.0,5.0,1.0,Doesn't Recommend,Negative Outlook,Disapproves of CEO
Thu Mar 12 2020, Finance Director,"Plano, TX",Former Employee ,Very talented team. Good work culture,0,"Enjoyed the team and opportunities to rotate between groups.
Great talent and good culture
","Continuous job cuts
Falling revenue
Helpfu",,4.0,,,,,,,,
Wed Mar 11 2020, Tech Consultant,"Newark, NJ",Current Employee ,good workpalce,0,,"ltant in Newark, NJ
Recommends
Positive Outlook
Approves of CEO
I have been working at Hewlett Packard Enterprise | HPE full-time for more than 8 years
Pros
Good learning place and friendly environment
Cons
nothing so bad to express
Helpfu",,4.0,4.0,5.0,3.0,4.0,4.0,Recommends,Positive Outlook,Approves of CEO
Wed Mar 11 2020,Anonymous,,Former Employee ,It was a good experience,0,"Good training and good people there
","Non really , more space and parking
Helpfu",,4.0,,,,,,,,
Wed Mar 04 2020, Master Software Engineer,"Amherst, NH",Current Employee ,"Solid company, lots going on",0,"Strong commitment to ethics, broad portfolio, lots of opportunity
","Caught behind by cloud service strategy migration, scrambling to catch up, which has been very disruptive to established groups. Seems likely to continue for a while, but will eventually stabilize.
Helpfu",,4.0,5.0,5.0,4.0,4.0,4.0,Recommends,Positive Outlook,Approves of CEO
Thu Feb 27 2020, Research Data Analyst,"Little Rock, AR",Former Employee ,NA,2,"The Experience was nice and helpful
","The pay was low and substantially below market value
Helpful (2",,4.0,5.0,3.0,3.0,3.0,3.0,,,
Sun Mar 15 2020, Senior Financial Analyst,"Houston, TX",Former Employee ,Salary,0,"Fast-paced, dynamic, good learning environment
","Unending restructurings and downsizing, shrinking market share
Helpfu",,3.0,4.0,3.0,2.0,3.0,3.0,Recommends,Neutral Outlook,No opinion of CEO
Wed Feb 19 2020, Inside Account Executive,"Plano, TX",Current Employee ,Excellent Company,3,"Lots of PTO, state of the art office, emphasis on work/life balance, collaborative/friendly culture (which I’ve found rare in many sales organizations). Largely have felt welcomed and valued. Appreciate the emphasis on an “open door,” policy.
","Huge company, so can be difficult to stand out or feel like a true individual. Job security feels threatened with changing initiatives and organizational structure. Training & advancement structure changes fairly frequently, making it difficult for people to get their feet in the ground and progress upwards as their career grows.
Advice to Management
Transparency is important. Some feel nervous about their future given some organizational changes.
Helpful (3","Transparency is important. Some feel nervous about their future given some organizational changes.
",5.0,5.0,5.0,5.0,4.0,4.0,Recommends,Positive Outlook,Approves of CEO
Tue Feb 25 2020, Systems Analyst,"Seattle, WA",Former Employee ,Good company,0,"Could learn a lot from project
","Some of the techniques are not up to date.
Helpfu",,4.0,5.0,3.0,4.0,3.0,3.0,Recommends,Neutral Outlook,Approves of CEO
Wed Mar 11 2020, Manager,"Somerset, NJ",Current Employee ,Good Company to Work for,0,"Professional, Somewhat Employee Focussed
","Sinking Ship , public cloud is eating their cake
Advice to Management
Wake up !
Helpfu","Wake up !
Helpfu",3.0,5.0,4.0,3.0,3.0,2.0,Doesn't Recommend,Negative Outlook,Disapproves of CEO
Sun Mar 08 2020, Support Account Manager,"San Francisco, CA",Current Employee ,A job you can make your own,0,"Working with a variety of customers
","Careful not to let others define the role for you.
Helpfu",,3.0,,,,,,,,
Sun Mar 08 2020, Engineering Program Manager,"Houston, TX",Former Employee ,Boring,0,"Work isn't hard for the pay
","Leaders are not willing to change
Advice to Management
Listen to your employers; be open to change; stop the layoffs
Helpfu","Listen to your employers; be open to change; stop the layoffs
Helpfu",3.0,3.0,3.0,3.0,3.0,3.0,Recommends,Negative Outlook,No opinion of CEO
Tue Mar 03 2020, Business Analyst,"Denver, CO",Current Employee ,Typical Public Tech Company,1,"perks of being with a large organization that's been around forever
","lots of management turnover; company direction changes
Helpful (1",,3.0,2.0,3.0,2.0,3.0,2.0,Recommends,Neutral Outlook,Approves of CEO
Tue Mar 24 2020, Senior Software Engineer,,Current Employee ,Okay for Short-Term but Prepare for Turmoil,3,"Good work life balance
Supports working from home but depends on manager
","I would not recommend this company because the pay and benefits are lower than average and definitely not competitive, the company does not invest in tools for their engineering groups and the type of work you mostly end up doing is cleaning up other people's messes.

* Company is behind on the technology curve with their products, trying to catch up with distributed system design with microservices
* The recent company change laid off almost all their senior engineers and increased the amount of lower paid, less experienced, offshore engineers from 30% to 60%. Now this new group is expected to transform their monolith products to a microservice architecture???
* Engineering groups are asked to develop leading products with poor tools and limited budgets. This is a company that supports business people, not engineers.
* Engineers spend most of their time fixing someone else's defects and rarely get to work on something new.
* Below average pay for what you are asked to do. Benefits (especially insurance) are more expensive and not competitive.
* The company makes it difficult to move positions within the company for career growth.
Advice to Management
* Invest in good tools for your engineers or what you get is ""garbage in, garbage out"".
* Offer competitive pay and benefits are truly reflective of the market versus lowest common denominator 
* Build a culture of software quality (more CI/CD) so engineers are not frustrated with cleaning up other people's messy code with lots of defects.
Helpful (3","* Invest in good tools for your engineers or what you get is ""garbage in, garbage out"".
* Offer competitive pay and benefits are truly reflective of the market versus lowest common denominator 
* Build a culture of software quality (more CI/CD) so engineers are not frustrated with cleaning up other people's messy code with lots of defects.
",1.0,3.0,3.0,1.0,2.0,1.0,Doesn't Recommend,Negative Outlook,Approves of CEO
Tue Feb 18 2020, Senior Financial Analyst,,Current Employee ,Highly competitive med-large scale company,0,"Medium-Large company with opportunity to gain different experiences
","Highly competitive environment, needs more focus on widespread talent improvement.
Helpfu",,4.0,,,,,,,,
Sat Feb 15 2020, Intel Process Engineer,,Current Employee ,positive,0,"good environment, nice salary, good
","bad culture, work load no improvement in career
Helpfu",,5.0,5.0,5.0,5.0,5.0,5.0,Recommends,Negative Outlook,
Sat Feb 29 2020, Senior Software Engineer,,Former Employee ,It's not HP anymore,1,"In its heyday, up until around 2006, HP was THE place to work. ""The HP Way"" was that management's job was to tell their people what the objective was, then ""let them loose"" to accomplish it. And it worked, exceedingly well. Management was there to provide support and enable their people. ""Micro-management"" didn't exist at HP. People felt proud to contribute, to ""break rules"" if needed, and innovation was a ""given."" Bill & Dave treated everyone as a friend or family. This type of managment was unheard of back when HP was just beginning, and at the time other CEOs literally laughed at their business model. They stopped laughing very quickly, but found it difficult to become ""Another HP;"" It takes very unique skills that the founders were blessed with.
","However, eventually Bill & Dave passed on and we brought in a CEO who outright disliked everything HP was. (One example: HP had ""profit sharing"" and we had a good year and the rewards were quite good. The new CEO was angry at ""having"" to spend those monies on people and rushed to make profit sharing a thing of the past.) And we purchased, in an attempt to ""be bigger"" a company that also didn't fit the HP Way model. From there, the company changed almost overnight. And the change took away what was truly a unique company and replaced it with becoming just another cold, even heartless one. I left HP as a result, as did most of my coworkers. The HP I left had promised me my job back, and I followed up only to find they had a ""policy change,"" and once you left you were not welcomed back. Instead they hired new people, people who know nothing about the old HP, and assumed all companies were the same, job security was always a concern, rewards are rare, and you felt ""disposable."" My heart breaks to see such a miracle disappear.

And my title here, ""It's not HP anymore"" was something a friend who stayed. When she heard I was thinking of coming back she said I shouldn't, and she too wished she had left but was getting closer to retiring. But like most of us ""Old timers,"" seeing what happened to HP is, in a word, painful.
Advice to Management
Watch (At least) one documentary, I suggest ""HP Origins."" It does a very good job about how HP started, about Bill & Dave, and primarily, what ""The HP Way"" truly is. It's well-worth the 1/2 hour. Good luck to all.
Helpful (1","Watch (At least) one documentary, I suggest ""HP Origins."" It does a very good job about how HP started, about Bill & Dave, and primarily, what ""The HP Way"" truly is. It's well-worth the 1/2 hour. Good luck to all.
",2.0,2.0,1.0,1.0,4.0,3.0,Doesn't Recommend,Neutral Outlook,Approves of CEO
Sat Feb 15 2020, Technical Support Specialist,"Alpharetta, GA",Former Employee ,Great place to get your IT career of the groung,0,"HPE has alot of products and technologies that one could learn. The benefits a good plus there is a good work life balance
","Sometimes there are to many chefs in the kitchen.
Helpfu",,4.0,5.0,4.0,4.0,4.0,4.0,Recommends,Neutral Outlook,No opinion of CEO
Wed Feb 12 2020, Network Account Manager,"Indianapolis, IN",Current Employee ,Great Sales Environment,1,"Great people always willing to help out.
","It is a huge company, so it takes time to build your internal network.
Helpful (1",,4.0,4.0,5.0,5.0,4.0,5.0,Recommends,Neutral Outlook,Approves of CEO
Mon Feb 10 2020, R&D Section Manager,,Current Employee ,"Outstanding people, technology and products",1,"Stable, interesting projects, great people
","Large company, slow moving sometimes
Helpful (1",,5.0,5.0,5.0,4.0,5.0,5.0,,,
Wed Feb 26 2020, Operations,"Bloomington, MN",Former Employee ,Only there 2 mths and not impressed.,1,"Good pay. OK benefits (minus health because of the surcharge fee they have for adding dependants) Wellness Fridays seemed cool and good idea.
","Our small but mighty tech company was recently acquired by HPe. My position was eliminated in the process. My end date rolled into the first months of them acquiring us, which was odd and didn't seem necessary. We had to enroll in benefits, payroll, IT systems, only to lose them a month later when we ended. Although they provided some career transitional support, it wasnt at all at the level it should have been. Any questions we had around the process we were pushed into a generic ""ask HR"" email address that would get a response 3 weeks later, or not at all. Their never seemed to be anyone who knew answers or could provide help. We were constantly told to ""go to links"" for info. No personable feel at all. It was a terribly disconnected process and the communication was always broken. The right hand never seemed to be talking to the left. You were made to very much feel like just a number during the process and I could feel the growing curve from a small personable company to a cold tech giant company in which no one seemed to care what you did before the acquisition, or know how to help with anything. The culture started to drastically shift, which was sad. The IT onboarding process on our first day was terrible and I have never been treated so rude by IT people. After leaving, I was told my completion bonus would go in on a certain date, and it didnt. I spent hours back and forth with HR trying to get answers as to why that changed and was not communicated to me. On top of that, noone from HPE confirmed with the state the information I submitted for unemployment benefits, so I was left waiting for a response, and finally the state took it in their own hands to confirm the info with me so I could get my eligibility. I was very unimpressed that such a large company like HPe would not have a handle on taking care of the people affected by an acquisition layoff. Once again...they made you feel irrelevant and like a number. I expected more from a company of this size. It has nothing to do with getting laid off. It happens, its the corporate world we live in,but its about ethics, taking care of the people, and making the offboarding experience as easy as possible for those leaving. Didnt happen. It was a circus over there from the second they acquired us, and it was starting to ruin the great culture our company had into place before HPe came in and swallowed us up. I hope they can improve this experience for future situations like this, because I have such a bad taste in my mouth from HPe, I dont think I would ever work there or recommend them to other peers. Whats sad too, is they bought us because they couldn't beat us. I just hope they can carry the legacy and incredible work we did. There is a reason we were number one in our industry. Time will tell if they will carry our flag or sink our ship..
Advice to Management
Better handle on acquisitions and the people affected by them. More personable. Better communication. Better IT customer service.
Helpful (1","Better handle on acquisitions and the people affected by them. More personable. Better communication. Better IT customer service.
",2.0,2.0,2.0,3.0,2.0,2.0,Doesn't Recommend,,
Wed Feb 12 2020, Financial Analyst,,Current Employee ,"Good worklife balance, limited opportunities in Roseville",0,"Good worklife balance, great people, flexible schedule
","Limited opportunities locally, focus on hubs.
Helpfu",,4.0,5.0,5.0,4.0,3.0,4.0,,,
Tue Feb 11 2020,Anonymous,"Boston, MA",Current Employee ,"Great company, needs full focus on transportation",0,"Great company, opportunities for advancement, great work/life balance.
","Needs even more focus of employees on transportation
Helpfu",,4.0,5.0,5.0,5.0,4.0,4.0,Recommends,Positive Outlook,Approves of CEO
Tue Feb 25 2020, Solutions Architect,"Herndon, VA",Former Employee ,"OK, not the same anymore",0,"Some nice tech still but cloud strategy they are following does not appeal to me.
","Not on the leading edge...
Advice to Management
Better strategy...
Helpfu","Better strategy...
Helpfu",3.0,2.0,3.0,2.0,1.0,1.0,Doesn't Recommend,Negative Outlook,No opinion of CEO
Sat Feb 08 2020, Solutions Architect,"Alpharetta, GA",Current Employee ,"Smart People, No Leadership",1,"Worked with some of the smartest people I've ever met and learned a lot about technology and business.
","Leadership is in disarray. Company re-organizations every 6 months leading to layoffs.
Helpful (1",,4.0,4.0,3.0,3.0,3.0,2.0,Recommends,Neutral Outlook,No opinion of CEO
Mon Feb 10 2020, Senior Software Engineer,,Former Employee ,good place to work,0,"good vibe, updated to newer technology
","Bureaucracy was stifling, hard to get green light and move fast on projects.
Helpfu",,4.0,4.0,3.0,3.0,3.0,3.0,Recommends,,
