date,employee_title,location,employee_status,review_title,helpful,pros,cons,advice_to_mgmt,rating_overall,rating_balance,rating_culture,rating_career,rating_comp,rating_mgmt,recommends,positive_outlook,approves_of_CEO
Wed Oct 12 2016,N/A,"Tulsa, OK","Maintenance Supervisor Retired in Tulsa, OK",Retared,1,"Long term professional Employment stability
","Long hours required. Emergency calls can happen 24-7
Advice to Management
Less meetings they interfere with job responsibilities
Helpful (1","Less meetings they interfere with job responsibilities
",4.0,,,,,,Recommends,Positive Outlook,
Wed Oct 19 2016,N/A,N/A, ,SAP Consultant,2,,"ltant""
3.0
★★★★★
 Approves of CEO
I worked at HollyFrontier Corporation
Pros
HFC has a friendly familly like home environment and is enjoyable place to work..
Cons
InternalIT collaboration should be improved to foster better relationships
Helpful (2",,3.0,2.0,3.0,1.0,3.0,2.0,Approves of CEO,,
Wed Sep 07 2016,Anonymous,,Current Employee ,Company Review,2,"-Company provides many resources for professional growth.
-Reasonable work schedule.
-Helpful employees.
","-Pay for certain positions is not as competitive as it could be.
-Corporate structure slows down the process at the plant level.
-There are unspoken benefits, which creates inequality in what benefits are actually received.
Helpful (2",,4.0,4.0,3.0,4.0,3.0,2.0,Recommends,Neutral Outlook,No opinion of CEO
Fri Aug 26 2016,N/A,, ,Good Company,0,"Great work work work environment.
","Jack of all trades job. Expected to do ridiculous things at times.
Helpfu",,5.0,4.0,4.0,4.0,4.0,4.0,Recommends,Positive Outlook,Approves of CEO
Fri Aug 05 2016, Accounting Manager,"Cheyenne, WY",Current Employee ,Accounting,0,"The company is great to those who are dedicated and competent. It is a wonderful place to learn, advance, and
","This is a demanding field. A short week is 50+ hours, but the company and the co-workers make it worthwhile
Advice to Management
We are a great company, and like many great and fast growing companies we could do better at communications.
Helpfu","We are a great company, and like many great and fast growing companies we could do better at communications.
Helpfu",4.0,3.0,4.0,5.0,5.0,4.0,Recommends,Positive Outlook,
Sat May 07 2016, Process Operator,"Tulsa, OK",Former Employee ,Process Operator,0,"Good company. Many options as far as advancement when it comes to your career. I would recommend this company to friends or family.
","I didn't have many cons when it came to my time at Holly Frontier. Work was busy and the schedule was a little tough.
Advice to Management
Hire managers that listen to employees to a certain degree. The employees see the everyday ins and outs of the job so they know what works and doesn't.
Helpfu","Hire managers that listen to employees to a certain degree. The employees see the everyday ins and outs of the job so they know what works and doesn't.
Helpfu",4.0,3.0,3.0,4.0,3.0,2.0,Recommends,Neutral Outlook,No opinion of CEO
Mon Apr 18 2016,N/A,"Artesia, NM","Pipeline Controller in Artesia, NM",Stay Away,7,"Decent pay when they are not trying to screw you out of overtime or holiday pay.
","The control center is highly sexist as there is not a single female controller working within, and on a monthly basis one of their long time employees loves to have very unprofessional/harassing conversations with the other employees. If you are part of the ""club"" you can make as many mistakes as you want and never get fired, however if you are not part of the club you will be crucified after one or two mistakes. Management was virtually non-existent, when they were around micro managing was non-stop, all fellow employees are only looking to cover their own instead of working together as a team and will not hesitate to throw one another ""under the bus"".
Advice to Management
Get someone in to manage the control center that actually cares about the employees and listens to what the controllers have to say about the software problems/includes them in the decision making process on what they think needs to be done. Pay the industry average, stop being so cheap this is an oil company.
Helpful (7","Get someone in to manage the control center that actually cares about the employees and listens to what the controllers have to say about the software problems/includes them in the decision making process on what they think needs to be done. Pay the industry average, stop being so cheap this is an oil company.
",2.0,4.0,2.0,2.0,2.0,1.0,Doesn't Recommend,Neutral Outlook,
Mon Dec 07 2015,N/A,, ,Intern,0,"It was a great opportunity
","Can not think of negatives
Helpfu",,5.0,,,,,,,,
Sun Oct 18 2015,N/A,"Tulsa, OK","Process Safety Management Coordinator in Tulsa, OK",Great company to work for,0,"Good benefits, competitive salary and opportunities for advancement
","Long hours, demanding job, complicated infrastructure
Helpfu",,4.0,4.0,4.0,4.0,4.0,4.0,Recommends,,Approves of CEO
Mon Oct 05 2015,Anonymous,,Current Employee ,Stay away from Cheyenne!,4,"Can quickly gain a lot of experience, as at any refinery. There are some good people who a good to work with and top level management has a good strategy and good stated values.
","The culture at the upper levels is vastly different than the real culture among operators, maintenance and front line engineers. Middle management becomes a wall between what the company says its values and priorities are and what they really are. They also react very poorly to suggestions for safety or improvement from front line workers. The entire middle management team in Cheyenne is ex-military with very little or no refinery experience which causes them to be easily threatened by any suggestions regarding safety or best practices. It also leads them to make some very risky calls without every realizing it. Cheyenne has a very poor safety record and very high risk tolerance (far higher than should be acceptable in this industry) - the only thing between this refinery and a major incident or death is luck. As stated in other comments, crude and racist comments are common both among front line workers and middle management. 

Other refineries in the company seem better, but stay away from Cheyenne!!!
Advice to Management
Hire managers with experience who can lead this refinery into a stronger safety culture and prevent a major accident.
Helpful (4","Hire managers with experience who can lead this refinery into a stronger safety culture and prevent a major accident.
",2.0,1.0,1.0,3.0,2.0,3.0,Doesn't Recommend,Neutral Outlook,Approves of CEO
Mon Sep 21 2015, Engineering,"Cheyenne, WY",Former Employee ,High energy environment,0,"A lot of experience packed into each day. Good benefits. Good people. Opportunity in many departments. Minimal travel. Good pay.
","High stress environment (nature of the business). A lot of changes over the years. Consistent management needed. Old equipment leads to issues.
Helpfu",,4.0,3.0,3.0,4.0,4.0,4.0,Recommends,Neutral Outlook,Approves of CEO
Tue Sep 29 2015,N/A,"Houston, TX","Refinery Process Operator in Houston, TX",So far so good,1,"I did enjoyed my stay at HollyFrontier. Their operator training was top-notch.
","Few of my coworkers were nice but many of them were very racist. Too much ""F"" for every 5 words that comes out from some of the workers mouth. They curse too much.
Advice to Management
Please make respect as a core value as some people do not respect other people's culture or race.
Helpful (1","Please make respect as a core value as some people do not respect other people's culture or race.
",3.0,3.0,1.0,3.0,3.0,4.0,Recommends,Neutral Outlook,
Wed Dec 17 2014,N/A,, ,Exceptional Company,0,"Great environment, hard workers, and opportunity for growth
","Work/Life balance is off, need to consider telecommuting.
Advice to Management
Consider that one can work out of office, thus adding flexibility to those that have to be home sometimes with a sick child, rather then have to use a vacation day.
Helpfu","Consider that one can work out of office, thus adding flexibility to those that have to be home sometimes with a sick child, rather then have to use a vacation day.
Helpfu",5.0,4.0,3.0,5.0,3.0,5.0,Recommends,Positive Outlook,Approves of CEO
Thu Dec 04 2014, Human Resources Manager,,Current Employee ,Great Company,0,"Lots of opportunity as the company develops and grows.
","Still developing a common culture
Advice to Management
Keep up the good work
Helpfu","Keep up the good work
Helpfu",5.0,3.0,4.0,3.0,5.0,4.0,Recommends,Positive Outlook,
Tue Nov 11 2014, Operator,"Artesia, NM",Current Employee ,"Great Company, Great Benefits",6,"-hourly pay and yearly raises
-great insurance plan
-very secure job
-6% 401k match + additional 3% thrift plan contribution
-easy work
","-management doesn't listen to employees much
-safety is definitely not put before production
-favoritism. advancement and hiring comes first to relatives, not qualified individuals
Advice to Management
Listen more to employees before designing equipment and making procedure changes. They are the ones who run the process every day and might be able to make the design more user friendly. You sit in an office, we make this place work. Let us have some say in ways to improve the process.
Helpful (6","Listen more to employees before designing equipment and making procedure changes. They are the ones who run the process every day and might be able to make the design more user friendly. You sit in an office, we make this place work. Let us have some say in ways to improve the process.
",5.0,5.0,4.0,5.0,5.0,4.0,Recommends,Positive Outlook,Approves of CEO
Sun Nov 16 2014, Process Operator,"Tulsa, OK",Former Employee ,Good company overall,4,"I had a good experience with the company throughout my stay and my supervisor was a very nice man.
","Some racism employees are plenty and they displace it to your face. I have to stand my ground and let them know I will not take it from them otherwise I will report to management. Too many white folks working there and few minority. We are 45 employees in my control room and only two of us are people of color. The rest are whites.
Advice to Management
Try to employ more minorities in your company.
Helpful (4","Try to employ more minorities in your company.
",4.0,4.0,1.0,3.0,2.0,4.0,Doesn't Recommend,Neutral Outlook,No opinion of CEO
Fri Aug 15 2014, MAR,"Philadelphia, PA",Current Employee ,Decent pay for type of work you do (customer service)- too much work/stress.,2,"Pay, job stability due to the nature of the industry,benefits, work with nice ppl. Good bonuses. Clean office.
","Overworked, you are an ""hourly"" employee but you cant collect overtime when it is worked, culture is very serious- no joking around its a rather miserable enviornment. Old school approach to things, overly ""professional"". I wouldnt recommend to a friend because I wouldnt want them to be as stressed out as I was. Very demanding job, cant take a lunch break because it will put you behind and you wont be able to leave on time.
Advice to Management
Smile-tell a joke you only live once. Give praise to employees, under staffed. Let employees leave an hour or two early if they have a dr app- dont make them use a vacation day... Coordinate out of work outings to boost morale, be appreciative just because you put in 50 hour weeks doesnt mean others should...
Helpful (2","Smile-tell a joke you only live once. Give praise to employees, under staffed. Let employees leave an hour or two early if they have a dr app- dont make them use a vacation day... Coordinate out of work outings to boost morale, be appreciative just because you put in 50 hour weeks doesnt mean others should...
",3.0,1.0,2.0,3.0,4.0,2.0,Doesn't Recommend,Neutral Outlook,Approves of CEO
Wed Jan 18 2012,N/A,"Tulsa, OK"," in Tulsa, OK",Limited opportunities and respect for technical staff,3,"integrated refinery with capital improvements in progress
","management resists and in some cases refuses to change
very controlling and dictatorship type management style
actions are not consistent with words
opportunites are reserved for favorties rather than qualified
promotions are granted based on senority rather than skill
Advice to Management
servant leadership and respect for employees ideas is needed
Helpful (3","servant leadership and respect for employees ideas is needed
",2.0,3.5,1.5,2.5,1.0,,Doesn't Recommend,,No opinion of CEO
Sat Nov 05 2011,N/A,"Glendale, AZ","Plant Operator in Glendale, AZ",It is going ok!,2,"Pay and Benefits are great
","Its very difficult to get hired on full time the process can take up to a full year!
Helpful (2",,4.0,4.0,4.0,4.0,4.0,,Recommends,,
Thu Sep 08 2011,N/A,"Dallas, TX"," in Dallas, TX",A good company but,4,"A good company tat has potential to be a great employer. Opportunity was abundant when first employed. the benefits package is OK. The Total Compensation Package is OK.
","A good company but it has its quirks and faults. The company is still a good boy company with lots of back scratching going on.
Advice to Management
Learn from your mistakes. no more back scratching. Listen to your employees. You can be a great company if you go through with some changes and better benefits especially in the face of the record profits.
Helpful (4","Learn from your mistakes. no more back scratching. Listen to your employees. You can be a great company if you go through with some changes and better benefits especially in the face of the record profits.
",3.0,1.5,1.0,2.0,3.0,,,,
Tue Feb 02 2021,Anonymous,"Mississauga, ON",Current Employee ,Great organization!,0,"Great leadership, nice people, close knit culture.
","Can be slow moving at times.
Helpfu",,5.0,5.0,4.0,3.0,3.0,5.0,Recommends,Neutral Outlook,Approves of CEO
Wed Feb 10 2021, Warehouse Supervisor,"Toronto, ON",Current Employee ,.,0,"Good pay good bonus lots if vacation
","No movement. Holly keeps. Trying to cut back
Helpfu",,2.0,,,,,,Recommends,Negative Outlook,Approves of CEO
Thu Jan 14 2021, Senior Engineer,"Mississauga, ON",Current Employee ,Excellent company to work for,0,"Safety is number 1 priority
","No cons that jump in my mind
Helpfu",,5.0,4.0,5.0,5.0,4.0,5.0,Recommends,Positive Outlook,Approves of CEO
Mon Aug 10 2020, Operator,"Mississauga, ON",Former Employee ,Great place to work,0,"Salary and benefits and leadership
","Slowly taking away benefits, constant change in reporting
Helpfu",,4.0,1.0,4.0,2.0,4.0,3.0,Doesn't Recommend,Negative Outlook,No opinion of CEO
Tue Jun 16 2020, Production Supervisor,"Mississauga, ON",Former Employee ,Production Supervisor,0,"Growth focused, development is encouraged
","Lots of pressure from senior management and miscommunication with middle
Helpfu",,3.0,4.0,3.0,3.0,3.0,4.0,Recommends,Neutral Outlook,No opinion of CEO
Tue Mar 03 2020, Sales Processing Specialist,"Mississauga, ON",Current Employee ,"Great Pay, No Recognition",0,"Great pay, many different departments and opportunities to grow within the company. Managers do not micro-manage.
","At times very short staffed. Very little recognition for all the extra work and hours put in.
Advice to Management
Recognize your team!
Helpfu","Recognize your team!
Helpfu",3.0,2.0,2.0,4.0,5.0,4.0,,,
Sat Feb 22 2020, Senior Sales Executive,"Edmonton, AB",Current Employee ,Used to be the best place to work in the industry,0,"Co-workers, products, supply network, Training
","Upper Managment, no company vehicle for sales, inequitable salary rates, sales bonuses are being taken away
Helpfu",,2.0,4.0,2.0,3.0,1.0,1.0,Doesn't Recommend,Neutral Outlook,No opinion of CEO
Wed Sep 11 2019, Project Coordinator,"Mississauga, ON",Current Employee ,Great Company - WIP culture and leadership,0,"Growing Company, lots of changes and acquisitions. Headquarters culture sounds promising. Great Compensation and Benefits
","Headquarters culture sounds promising but way's away to be lived at all divisions.
Old school management styles and old boys club practices still prevail over career advancement opportunities.
As you go up the corporate ladder the number of females decreases to 1 at top leadership positions.
External candidates favored over promoting internal talent making it difficult to move up within the company.
Advice to Management
Walk the talk, value your people and promote a culture of inclusion and growth for your own incredibly dedicated talent. The grass is greener where you water it, Invest in your people first and promote a culture of growth for your own.
Helpfu","Walk the talk, value your people and promote a culture of inclusion and growth for your own incredibly dedicated talent. The grass is greener where you water it, Invest in your people first and promote a culture of growth for your own.
Helpfu",5.0,3.0,4.0,3.0,5.0,3.0,Recommends,Positive Outlook,Approves of CEO
Mon Aug 12 2019, Customer Service Representative,"Mississauga, ON",Former Employee ,You would think a company like this would have things figured out pretty well so far,0,"Good Salary, Location, Benefits, Bonus
","Politics
Unpleasant Staff/Colleagues
Not willing to help or encourage growth
No training programs
High turnover
Workload not equal
Advice to Management
Invest in your employees instead of treating them like a number
Helpfu","Invest in your employees instead of treating them like a number
Helpfu",1.0,1.0,1.0,1.0,4.0,1.0,Doesn't Recommend,Negative Outlook,No opinion of CEO
Tue Jul 02 2019, Plant Engineer,"Mississauga, ON",Current Employee ,Plenty to learn,0,"-competitive compensation
-location
-friendly people
-exposure to many types of problems
-excellent engineering experience
","-divide between hourly and salary staff leads to split in culture
Advice to Management
Bridge culture with better incentive programs
Helpfu","Bridge culture with better incentive programs
Helpfu",5.0,4.0,4.0,4.0,5.0,3.0,,,
Fri Apr 19 2019,Anonymous,"Mississauga, ON",Current Employee ,Breaking good people,0,"Good pay. Great benefits and bonus.
","Over worked
Men’s club
Upper management doesn’t listen if the message is outside their vision
Care more about any sale then the right sale 
No work life balance
Advice to Management
You are pushing people out. Everyone is unhappy and stressed out. Haven’t heard one person say happy to be here in a long time.
Helpfu","You are pushing people out. Everyone is unhappy and stressed out. Haven’t heard one person say happy to be here in a long time.
Helpfu",3.0,1.0,2.0,3.0,5.0,3.0,Doesn't Recommend,Negative Outlook,No opinion of CEO
Sat Aug 18 2018,Anonymous,,Current Employee ,Director supply,0,"Fun, challenge, benefit, salary and bonus. The oil and downstream business pay well
","Travel, internal politics and promotional are base on style rather than substance
Advice to Management
Trust knowledgeable people even more. Judge and reward by substance and less on style
Helpfu","Trust knowledgeable people even more. Judge and reward by substance and less on style
Helpfu",4.0,4.0,4.0,3.0,4.0,3.0,Recommends,Negative Outlook,Approves of CEO
Fri Jun 16 2017,N/A,"Toronto, ON"," in Toronto, ON",Sales,0,"good pay, benefits, good amount of vacation and pretty good pension and savings plan. Some of the people are great to work off.
","bad management, a lot of employees will go out of their way to make you look bad so they look good. A lot of broken promises just to get you in to a role.
Advice to Management
Pay attention to your teams and be more present and help with development.
Helpfu","Pay attention to your teams and be more present and help with development.
Helpfu",2.0,4.0,3.0,2.0,4.0,1.0,Doesn't Recommend,Negative Outlook,No opinion of CEO
Thu May 11 2017, Transportation Operations Coordinator,"Mississauga, ON",Current Employee ,Very good Company to work for,0,"Very generous compensation and time off package.
","Very political for climbing the corporate ladder.
Advice to Management
Capability development and growth opportunities for those who want it.
Helpfu","Capability development and growth opportunities for those who want it.
Helpfu",5.0,3.0,4.0,3.0,5.0,3.0,Recommends,Positive Outlook,Approves of CEO
Tue Jun 09 2015,N/A,"King, ON","SQL BI Reporting Developer in King, ON",data analyst,0,"Quick learne,work harder , challenge, trust data
","never stop to learn computer skill so it is not enough with my kids together
Helpfu",,5.0,5.0,5.0,5.0,5.0,5.0,Recommends,Positive Outlook,Approves of CEO
