date,employee_title,location,employee_status,review_title,helpful,pros,cons,advice_to_mgmt,rating_overall,rating_balance,rating_culture,rating_career,rating_comp,rating_mgmt,recommends,positive_outlook,approves_of_CEO
Sat Jan 30 2021, Operator,"El Dorado, KS",Current Employee ,Great Company,0,"Great pay and great people to work with
","There is a lot of drama
Helpfu",,5.0,5.0,5.0,5.0,5.0,5.0,,,
Fri Jan 29 2021, Chemical Engineer,"Bountiful, UT",Current Employee ,I'm not on here to review my company,0,"If you enjoy engineering or oil and gas, it is a fine place to be
","If you don't enjoy those things, you won't like it
Helpfu",,4.0,,,,,,,,
Thu Jan 28 2021, Senior SAP Analyst,"Dallas, TX",Former Employee ,Very good company to work for,0,"Good growth opportunities if you have good team.
","Too many politics at upper management level
Advice to Management
Be transparent
Helpfu","Be transparent
Helpfu",5.0,4.0,2.0,2.0,5.0,1.0,Recommends,Neutral Outlook,No opinion of CEO
Wed Jan 20 2021, Systems Administrator,"Laramie, WY",Current Employee ,Solid Company,0,"They're very loyal to their employees. The company is built on character and it shows.
","On the pay scale they're closer to the bottom than most would like.
Advice to Management
Don't just listen more to the employees, actually consider and use what they tell you. It's easy to discern whether that's actually being done or not.
Helpfu","Don't just listen more to the employees, actually consider and use what they tell you. It's easy to discern whether that's actually being done or not.
Helpfu",4.0,5.0,5.0,5.0,3.0,5.0,Recommends,Positive Outlook,Approves of CEO
Fri Jan 22 2021, Accounting Associate,"Dallas, TX",Former Employee ,Racist,0,"The perks are good nine 80
","This is a very racist company
Advice to Management
Sensitivity training
Helpfu","Sensitivity training
Helpfu",2.0,4.0,1.0,1.0,4.0,3.0,Doesn't Recommend,Negative Outlook,Approves of CEO
Thu Jan 07 2021, Distribution Coordinator,"Tulsa, OK",Current Employee ,very pleased,0,"pay-benefits- time off - four eighty schedules
","stressful at times, can get overwhelming
Helpfu",,4.0,4.0,4.0,4.0,4.0,5.0,Recommends,Positive Outlook,Approves of CEO
Thu Jan 07 2021, Head Operator,"Cheyenne, WY",Current Employee ,Good Pay - Awful Employer,0,"The pay is good, and the hourly people you'll work with are awesome. Even family like. This is the only reason I put two stars instead of one.
","The management team is clueless. And worse yet, they are arrogant in their cluelessness. The money will get you in the door, but you'll be miserable almost every day at the Cheyenne refinery. They lie to you, and do the exact things they tell you not to do. You can't trust hardly anybody in management to actually have your best interest at heart. They are generally snakes and will get somebody hurt as they constantly put production over safety.
Helpfu",,2.0,,,,,,,,
Wed Jan 06 2021, Manager,"Dallas, TX",Former Employee ,Want to change but leaders are stuck,0,"Like a family and where everyone knows everyone
","They like the idea of change but have a hard time executing
Helpfu",,3.0,3.0,2.0,1.0,3.0,3.0,Doesn't Recommend,Neutral Outlook,No opinion of CEO
Thu Dec 10 2020, Scheduler,,Former Employee ,Solid company and culture,1,"Good people and strong culture. Easy to make friends
","Onboarding and training is lacking
Helpful (1",,4.0,4.0,5.0,4.0,4.0,4.0,Recommends,Positive Outlook,Approves of CEO
Sat Dec 26 2020, Reliability Engineer,"Cheyenne, WY",Current Employee ,Political Environment,0,"Great Pay, Challenging Work, a few good people
","Extremely political environment. People will do anything to get ahead
Helpfu",,3.0,2.0,4.0,3.0,3.0,5.0,Doesn't Recommend,Negative Outlook,Disapproves of CEO
Tue Nov 24 2020, Shift Supervisor,"Cheyenne, WY",Former Employee ,Laid off,0,"Great pay and retirement benefits
","No job satisfaction, never felt like I accomplished anything
Helpfu",,2.0,3.0,2.0,3.0,2.0,4.0,Recommends,Neutral Outlook,No opinion of CEO
Fri Nov 06 2020, IT Project Manager,"Dallas, TX",Former Employee ,Great Company to work for,0,"Employees are willing to help each other out.
","Really no con. Just typical Oil and Gas management issues
Helpfu",,5.0,,,,,,Recommends,Positive Outlook,Approves of CEO
Wed Nov 04 2020, Procurement Specialist,"El Dorado, KS",Current Employee ,Great Place to Work,0,"Great relaxed culture focused on productivity.
","Oil & Gas industry comes with it's own issues.
Helpfu",,5.0,4.0,5.0,2.0,3.0,4.0,Recommends,Negative Outlook,Approves of CEO
Fri Oct 30 2020, Procurement Specialist,"Wichita, KS",Current Employee ,Great Place to Work,0,"Good relaxed culture that is focused on productivity.
","Oil and gas industry presents its own issues.
Helpfu",,5.0,,,,,,Recommends,Neutral Outlook,Approves of CEO
Wed Oct 28 2020, Laboratory Technician,"Tulsa, OK",Former Employee ,Quality of work life balance is terrible,0,"Money was great and keeps employees around
","work life balance is terrible
Helpfu",,2.0,1.0,2.0,3.0,1.0,5.0,Doesn't Recommend,Negative Outlook,No opinion of CEO
Fri Jul 24 2020, Senior Manager,,Current Employee ,Good Company Facing Market and Management Headwinds,0,"Great pay, great benefits, good work life balance. The company treats its employees well. Good challenging problems to work on.
","Many decisions at the executive and board level over the past 5-7 years have diluted the company's focus. Oil refining is what originally made the company great but it has heavily invested in other ventures. It's questionable whether these fit with and support the company's core competencies. If you've read Good to Great and specifically about the ""doom loop"", that mentality seems to pervade a lot of the culture and decision-making.

It also doesn't help that regulatory and market conditions have made oil refining an increasingly difficult industry to operate in. The company is adapting the best it can, but some of the conditions have reinforced the negative mentality towards oil refining at the executive and Board of Directors level.
Advice to Management
Remember that oil refining is what originally made the company great. Stick to the basics and, if you believe in your core business, invest heavily in it rather than anywhere else.
Helpfu","Remember that oil refining is what originally made the company great. Stick to the basics and, if you believe in your core business, invest heavily in it rather than anywhere else.
Helpfu",4.0,4.0,2.0,4.0,5.0,2.0,Recommends,Negative Outlook,No opinion of CEO
Wed Jul 08 2020, Process Operator,"Cheyenne, WY",Current Employee ,Great pay,0,"Great Pay and Benefits (401k) contribution
","Management is very out of touch with the employees.
Advice to Management
More managers with the knowledge and skills to do their job.
Helpfu","More managers with the knowledge and skills to do their job.
Helpfu",4.0,3.0,2.0,4.0,5.0,3.0,Recommends,Negative Outlook,No opinion of CEO
Tue Jul 07 2020, Director,"Dallas, TX",Former Employee ,Limited room for career growth,1,"Small company
Exposure to define and execute processes for your department/team
Friendly co-workers
","Lacks diversity, which means sometimes lacks thinking outside the status quo
Good old boy network
Small company so that makes it hard to move up the ranks unless someone quits
Helpful (1",,3.0,4.0,2.0,2.0,4.0,3.0,,,
Sun Jun 14 2020, Operations,,Current Employee ,Good overall company.,0,"Interesting career with great benefits and pay.
","Long hours, shift work, call outs frequently.
Helpfu",,5.0,,,,,,,,
Wed May 13 2020, Track Coordinator,"Cheyenne, WY",Former Employee ,14 years at a Company,2,"I was able to work locally, learn many aspects to the refinery business, meet people from all over the world.
","As the company grows so does the responsibility without compensation or more help,
Advice to Management
Appreciate your employees better, notice their successes for the company.
Helpful (2","Appreciate your employees better, notice their successes for the company.
",3.0,2.0,2.0,2.0,4.0,1.0,Doesn't Recommend,Neutral Outlook,No opinion of CEO
Thu Jan 23 2020,N/A,, ,Bad management,2,"Good people are at the company
","Bad people are at the company
Advice to Management
Listen to your employees more
Helpful (2","Listen to your employees more
",2.0,,,,,,,,
Thu Jun 06 2019, Senior Engineer,,Former Employee ,Benefit,0,"very good in the industry, really a good company to work for
","none, really a good company to work for
Helpfu",,5.0,,,,,,,,
Thu May 02 2019, Operations,"El Dorado, KS",Current Employee ,Salary employees dont care about union employees,1,"Great pay, good benefits
","Terrible management, no staffing minimums, way to much overtime
Advice to Management
Treat your employees better.
Helpful (1","Treat your employees better.
",3.0,1.0,3.0,1.0,5.0,1.0,Doesn't Recommend,Negative Outlook,Disapproves of CEO
Tue Jan 29 2019, Engineering,"Dallas, TX",Former Employee ,Great company with inexperienced management,0,"Great company to work for
","Inexperienced Management and Directors in certain departments
Advice to Management
Promote With In vs hiring inexperienced people
Helpfu","Promote With In vs hiring inexperienced people
Helpfu",2.0,2.0,3.0,3.0,4.0,2.0,Doesn't Recommend,Negative Outlook,Approves of CEO
Thu Dec 20 2018,Anonymous,"Dallas, TX",Current Employee ,Lots of Potential but Disjointed Leadership,6,"Good company with lots of potential to keep growing. Could be awesome with the right leadership.
","Several of the executives are jerks but CEO is great. Long history of favoritism and good ol' boys club mentality. Promo and Hiring is not based on merit or competence, just selection of favorites and people who look just like the manager.
Advice to Management
Request employee feedback and take action - the same problems linger and never get addressed, strengthen your hiring and promo practices to remove favoritism and bias and look at competence and skills
Helpful (6","Request employee feedback and take action - the same problems linger and never get addressed, strengthen your hiring and promo practices to remove favoritism and bias and look at competence and skills
",3.0,3.0,3.0,1.0,4.0,2.0,Positive Outlook,,Approves of CEO
Fri Oct 26 2018,Anonymous,,Current Employee ,Its Getting Better,0,"Great job, great pay, good hours and days off.
","You don't always get your time off because of lack of staffing. You can't read your paycheck to make sure you are being paid right. The benefits are mediocre for this industry. We should have better benefits for the amount of money we make for this company. They promote the worst people for the job, most middle management are clueless to the basics of refining.
Advice to Management
Get aggressive to get the best people to manage your units don't just accept the first guy to put an app in. It will pay off quickly when you have people who actually know what's going on. The same goes for your turnaround planners.
Helpfu","Get aggressive to get the best people to manage your units don't just accept the first guy to put an app in. It will pay off quickly when you have people who actually know what's going on. The same goes for your turnaround planners.
Helpfu",4.0,3.0,4.0,2.0,4.0,4.0,Recommends,Positive Outlook,Approves of CEO
Mon Nov 05 2018,Anonymous,,Former Employee ,Used to be a great place to work,1,"The company benefits are good, work life balance was promoted years ago
","Highly political, it used to be an inclusive environment to work but with change in management things changed.
Advice to Management
Hold leaders accountable. Promote diversity and gender equality
Helpful (1","Hold leaders accountable. Promote diversity and gender equality
",3.0,2.0,3.0,2.0,4.0,2.0,,,
Tue Oct 23 2018,N/A,, ,Good experience,0,"The people really seem to care about you and want to help you learn. Competitive pay
","No cons are associated with Holly
Helpfu",,4.0,,,,,,Recommends,Positive Outlook,Approves of CEO
Mon Nov 05 2018,N/A,, ,Intern,0,"Lots of possible opportunities within the growing company.
","Change management is needed to help the organization.
Helpfu",,3.0,3.0,2.0,3.0,5.0,3.0,,,
Wed Sep 05 2018,N/A,, ,Engineering Intern,0,"This company has a lot of room for growth for engineers. The overall company culture is one of the best I have ever experienced, everyone is so nice and friendly, and upper management truly cares about the individuals.
","There seems to be some limited mobility in the company, and it can take a long time to work your way up.
Advice to Management
Keep course, and this company will see amazing things in the future.
Helpfu","Keep course, and this company will see amazing things in the future.
Helpfu",5.0,5.0,5.0,4.0,5.0,5.0,Recommends,Positive Outlook,Approves of CEO
Wed Sep 19 2018, IT Analyst,"Dallas, TX",Former Employee ,"Has become an awful, awful place to work",5,"Pay and benefits were competitive.
","After years of stability with a stable leadership team, upper management decided to make changes at the top of IT, and it has become a huge mess. Really good SAP resources are leaving in droves or have already left. IT Infrastructure is next. Was a great place to work for years, and now has become a toxic environment. And they are looking at heavy, heavy outsourcing arrangements of IT support, and that never turns out well.

Accounting has been a mess for a decade as well. HFC is likely to be acquired at some point soon anyway, so long term outlook for employees (at corporate at least) is bleak.
Advice to Management
None. It is beyond hope.
Helpful (5","None. It is beyond hope.
",1.0,1.0,1.0,1.0,3.0,1.0,Doesn't Recommend,Negative Outlook,Disapproves of CEO
Fri Sep 21 2018, Project Engineer,,Former Employee ,Engineer,0,"If you like living in Kansas the pay is solid. If you don't care where you live, go find a good place to work elsewhere.
","Management is fairly young and inexperienced which isn't necessarily bad. But many of these ""guys"" don't listen, unfortunately. Additionally, experience doesn't seem to count for anything in their eyes. 
And despite the youth it's a good ol boy system with only favorite son's getting the attention and moving up. Qualifications are largely ignored. Unless you can get plugged you won't do well, stay away.
Advice to Management
Don't have any, they're beyond help.
Helpfu","Don't have any, they're beyond help.
Helpfu",1.0,1.0,1.0,1.0,2.0,1.0,Doesn't Recommend,Neutral Outlook,Disapproves of CEO
Fri Jul 20 2018, Marketing,"Dallas, TX",Former Employee ,"Not bad, but very busy.",1,"Good people, and honest. Occasional free lunch when they cater in food. 6% match on 401k.
","Over worked, poor bonus, 2 weeks of vacation until your 5th year. Managers lack the ability to help you grow.
Advice to Management
Depressed.
Helpful (1","Depressed.
",3.0,1.0,4.0,1.0,3.0,2.0,Doesn't Recommend,Negative Outlook,Approves of CEO
Mon Jul 02 2018,Anonymous,,Current Employee ,Employee,0,"Great benefits - health, dental, vision, 401K
","Refinery runs 24 / 7 
Shift work required
Helpfu",,5.0,5.0,5.0,5.0,5.0,5.0,Recommends,Positive Outlook,Approves of CEO
Sat Mar 31 2018,Anonymous,,Current Employee ,Systems Administrator,2,"The retirement benefits are good at HFC. The people are great to work with very helpful and considerate.
","We are understaffed. The life/work balance is way out of wack. The people talk about balance but being understaffed makes that impossible.
Advice to Management
They need to hire more people. There is too much work for many individuals but no plans to hire additional people in those areas—and not just in IT
Helpful (2","They need to hire more people. There is too much work for many individuals but no plans to hire additional people in those areas—and not just in IT
",4.0,2.0,5.0,4.0,5.0,3.0,Recommends,Positive Outlook,Approves of CEO
Thu Mar 01 2018,Anonymous,,Current Employee ,Day in the life,2,"Paid fairly well and have stable work.
","They expect a lot and will look for reasons not to reward. Rather than reward people for their hard work with bonuses or other perks it usually just ends in more work being required.
Advice to Management
Share company perks downward. We used to be rewarded and talked to as part of the company. Now we are talked to as the lesser folk of corporate enterprise.
Helpful (2","Share company perks downward. We used to be rewarded and talked to as part of the company. Now we are talked to as the lesser folk of corporate enterprise.
",4.0,2.0,3.0,4.0,3.0,3.0,Recommends,Negative Outlook,No opinion of CEO
Wed Feb 21 2018,N/A,, ,Excellent Company to work for,0,"Really great people work here
","Growth is slow, so its hard to move up
Advice to Management
Add vacation for experienced new hires to the 3 week maximum
Helpfu","Add vacation for experienced new hires to the 3 week maximum
Helpfu",5.0,4.0,5.0,3.0,4.0,5.0,Recommends,Neutral Outlook,Approves of CEO
Thu Feb 22 2018, Process Engineer,"Artesia, NM",Current Employee ,"Great people, poor management",2,"The rank and file employees are wonderful
","corporate structure does little to ensure a quality work environment, its primarily left up to individual managers which creates some poor work conditions, company is very focused on industry metrics but wont recognize what it really takes to be elite
Advice to Management
do a better job of fostering a positive culture (and discouraging the negative), be more creative in strategy (don't just do what everyone else did 10 years ago)
Helpful (2","do a better job of fostering a positive culture (and discouraging the negative), be more creative in strategy (don't just do what everyone else did 10 years ago)
",3.0,1.0,2.0,2.0,1.0,1.0,,,
Mon Jan 15 2018, Traffic Coordinator,"Cheyenne, WY",Former Employee ,Traffic Coordinator,0,"Excellent employee benefits. Very family oriented company. Great pay
","I do not find anything wrong with this employer. It was the best employer to work for.
Advice to Management
More employment opportunities
Helpfu","More employment opportunities
Helpfu",5.0,5.0,5.0,3.0,5.0,5.0,Recommends,Positive Outlook,Approves of CEO
Mon Oct 02 2017, Business Analyst,"Dallas, TX",Current Employee ,Good Company but not Great,0,"great benefits, good work life balance, flexible on time
","lack of proper career development. uncertain company future plans
Advice to Management
if a worker is there for 5 years in the same job, its not always his fault.
Helpfu","if a worker is there for 5 years in the same job, its not always his fault.
Helpfu",4.0,4.0,4.0,2.0,4.0,2.0,Recommends,Positive Outlook,
Thu Sep 14 2017,Anonymous,,Former Employee ,Great Place to Work,0,"- Good Benefits and corporate Dallas location
","- Could use increased communication about HQ departments on projects and initiatives.
Helpfu",,5.0,5.0,4.0,3.0,4.0,4.0,,,
Wed Aug 30 2017, Ops,"Tulsa, OK",Former Employee ,Operations,0,"Great leadership and fantastic co workers
","Rotating shifts but not really that bad
Helpfu",,5.0,5.0,5.0,5.0,5.0,5.0,Recommends,Positive Outlook,Approves of CEO
Tue Sep 12 2017,Anonymous,"Cheyenne, WY",Former Employee ,Salaried,0,"Good people who are from WY
","Management will not support employees, thus employees do not support management. HR controlled by corporate, watch your back
Advice to Management
Get your heads out of the numbers and get to know your people. Find out whose doing all the work and reward them. Not just your buddies
Helpfu","Get your heads out of the numbers and get to know your people. Find out whose doing all the work and reward them. Not just your buddies
Helpfu",2.0,,,,,,Doesn't Recommend,Neutral Outlook,No opinion of CEO
Thu Sep 07 2017, Operations,"Cheyenne, WY",Current Employee ,"Good Pay, Terrible Management and High Turnover",0,"Great pay
Genuine people
Nice location close to Denver
","Management, management, management!
People get fired monthly
Management doesn't have the backing from hourly and salaried personnel
Refinery manager brought in people that he used to work with and they do not share the same values and vision of the company and the people that work here
Advice to Management
Get a grip with what is actually happening beneath you
Helpfu","Get a grip with what is actually happening beneath you
Helpfu",1.0,2.0,3.0,1.0,4.0,1.0,Doesn't Recommend,Negative Outlook,Approves of CEO
Mon Jul 31 2017,N/A,, ,Data Analyst,0,"Good People, decent pay...
","Hard to move from contractor to full-time based on my discussions with other contractors.
Helpfu",,4.0,4.0,4.0,4.0,4.0,4.0,,,
Thu Jul 27 2017,N/A,"Cheyenne, WY","Intern in Cheyenne, WY",Great Internship,0,"LOT OF EXPOSURE TO REFINING
","lack of guidance in some areas of the refinery world
Helpfu",,5.0,5.0,5.0,5.0,5.0,5.0,Recommends,Positive Outlook,Approves of CEO
Sat Jul 15 2017,Anonymous,,Current Employee ,Short-term outlook for rewards of pay and benefits is good; long-term outlook for rewards is up in the air,2,"Good pay and great benefits
","A portion of company leadership is knowledgeable about their specific areas of responsibility, but lack skills required to successfully lead the organization. There is a lot of talk about collaboration, but the reality is that focus and efforts are confined to each department, with little thought given to the overall impact on the organization. Many people looking after their individual interests and taking shortcuts on projects in order to check the box and build their resume.
Advice to Management
Lead by example, delegate responsibilities and hold yourself, and others, accountable for walking the talk and meeting performance objectives. Accept that being a SME does not automatically translate into being a great leader and that you have to first acknowledge an area of weakness before you can work to strengthen it. Weaknesses have the potential to become strengths, but can easily become liabilities if they are never acknowledged or addressed.
Helpful (2","Lead by example, delegate responsibilities and hold yourself, and others, accountable for walking the talk and meeting performance objectives. Accept that being a SME does not automatically translate into being a great leader and that you have to first acknowledge an area of weakness before you can work to strengthen it. Weaknesses have the potential to become strengths, but can easily become liabilities if they are never acknowledged or addressed.
",3.0,2.0,2.0,3.0,4.0,2.0,Neutral Outlook,,No opinion of CEO
Wed Jul 19 2017, Refinery Process Operator,"Woods Cross, UT",Current Employee ,So far ok.,0,"Excellent pay. 
Fair amount of time off
Good perks for living close by to plant. 
Good bit of diversity among employees
","Management seems short sighted and seems to claim losses as wins. 
Management says they want input but don't really want it. 
Shift work.
Advice to Management
Start listening to employees.
Helpfu","Start listening to employees.
Helpfu",3.0,3.0,1.0,2.0,4.0,2.0,Doesn't Recommend,Neutral Outlook,No opinion of CEO
Wed May 03 2017, Operations,"Dallas, TX",Former Employee ,Operations,2,"great benefits, culture and team oriented
","long hours out of your ability to control
Helpful (2",,4.0,4.0,4.0,4.0,4.0,4.0,Neutral Outlook,,No opinion of CEO
Wed Nov 30 2016,Anonymous,,Former Employee ,Hmmm?,3,"Lots of good people that want to be more than just average.
","A bunch of good people in Dallas...they need to get out of Dallas and actually talk to the employees that are putting very large checks in their banks. They are good people, they just are out of touch with what is really going on in the field. They are also stuck in the way we have always done it and are afraid to take the transformational steps to be a ""premier refining"" organization as stated in their mission statement.
Advice to Management
Stop hosting a family and start running a business. If you keep relying on the luck of the market your luck will run out someday and you will have a different name on your check...if you are still part of the company.
Helpful (3","Stop hosting a family and start running a business. If you keep relying on the luck of the market your luck will run out someday and you will have a different name on your check...if you are still part of the company.
",2.0,3.0,1.0,3.0,5.0,1.0,Doesn't Recommend,Neutral Outlook,No opinion of CEO
Fri Nov 25 2016, Systems Architect,"Dallas, TX",Former Employee ,"Technically challenged , Egregious spending! Vapid!",2,"Every other Friday off! Excellent location, Parking garage plays classical music. Microscopic stress levels. Vendors will perform all critical tasks for you, Great career if you can drink the vapid kool-aid.
","The IT culture is one that purchases software due to a lack of technical understanding. There are no Open Souce products in the company, like Bind9. The System Architect role is a glorified GUI admin, no understanding of the command line or serious automation. However, this is understandable as there is only about 1500 knowledge works other skilled workers have a small need for local IT services. There is also little understanding of the basics like DNS, DHCP, and the OSI layers. For example, the company just recently just migrated Active Directory over from .com to .local. Infrastructure software and hardware is dated with everything the salesman needed to unload or do to a lack of This company is 99,99% Microsoft shop. There is no tolerance to open source products.
Advice to Management
I would suggest looking for work at Manging a Burger King or McDonald's, technology is not your thing.
Helpful (2","I would suggest looking for work at Manging a Burger King or McDonald's, technology is not your thing.
",1.0,5.0,1.0,1.0,4.0,1.0,Doesn't Recommend,Neutral Outlook,No opinion of CEO
