date,employee_title,location,employee_status,review_title,helpful,pros,cons,advice_to_mgmt,rating_overall,rating_balance,rating_culture,rating_career,rating_comp,rating_mgmt,recommends,positive_outlook,approves_of_CEO
Sun Sep 06 2020, Inbound Customer Service Representative,"Louisville, KY",Current Employee ,InBound Call Center Representative,4,"Opportunity to Work From Home
","Your computer is set up to listen to everyone you say even when you are off work...including video you as well.
Advice to Management
N/A
Helpful (4","N/A
",4.0,4.0,3.0,4.0,4.0,4.0,Recommends,Positive Outlook,Approves of CEO
Wed Sep 30 2020, Care Coordinator,,Current Employee ,NA,1,"Working from home due to covid, bonuses, and the pay is decent but can be much better.
","Schedules changed without even asking you if it works for you. Micromanagement is out of this world. Phone system picks up all calls so if you get up for a second and come back you’ll see there’s been an answered call and might have heard anything you were saying. Change is constant.
Helpful (1",,2.0,1.0,1.0,1.0,2.0,1.0,Doesn't Recommend,Neutral Outlook,Approves of CEO
Tue Sep 15 2020, Provider Installation Professional,"San Juan, TX",Current Employee ,Great,0,"They have grate Benefits for employees
","None that I can mention
Helpfu",,5.0,5.0,5.0,5.0,5.0,5.0,Recommends,Positive Outlook,Approves of CEO
Mon Sep 14 2020, Intern,"Charleston, SC",Former Employee ,Internship,0,"Friendly team members, contact with senior associates
","None it was a wonderful experience
Helpfu",,5.0,,,,,,,,
Mon Sep 14 2020, Activity Coordinator,,Current Employee ,Activity Coordinator,0,"Humana cares about their employees. The pay and benefits are wonderful
","No current cons. I enjoy my job.
Helpfu",,5.0,5.0,5.0,5.0,5.0,5.0,Recommends,Positive Outlook,Approves of CEO
Mon Sep 14 2020, Data Scientist,"Jacksonville, FL",Current Employee ,Good company,0,"Good job and benefits and work life balance
","Takes time to work projects through bueracracy
Helpfu",,4.0,4.0,4.0,4.0,4.0,4.0,Recommends,Positive Outlook,Approves of CEO
Mon Sep 14 2020, Research science lead,,Current Employee ,Great compay to wirk for,0,"Good Benefits
Great work life balance
Great Incentive Program
","Not much investment in employee growth. No defined path for moving forward
Helpfu",,4.0,,,,,,Recommends,,Approves of CEO
Thu Sep 10 2020, API Product Manager,"Louisville, KY",Current Employee ,Excellent work/life balance,1,"Stable, professional, lots of smart and sincere people.
","Older tech culture in many areas; too large, redundancies and competing initiatives can create blockers
Advice to Management
Deepen technology strategies across the enterprise to reduce silos and redundancy; learn the tools and systems involved in selling the product, and treat them to iteration.
Helpful (1","Deepen technology strategies across the enterprise to reduce silos and redundancy; learn the tools and systems involved in selling the product, and treat them to iteration.
",4.0,5.0,,,,,Recommends,Positive Outlook,Approves of CEO
Sat Sep 12 2020, Referral Specialist,"Saint Petersburg, FL",Former Employee ,Great company,0,"Great benefits, very aware of health.
","Overall it was a good experience, no cons for the period I worked at Humana.
Helpfu",,4.0,3.0,5.0,3.0,4.0,3.0,,,
Sat Sep 12 2020, Guidance Center Assistant Coordinator,"Austin, TX",Former Employee ,Humana,0,"Great people
Fun work environment 
Excellent management
Amazing clientele
","Salary and advancement opportunities at the time were the only negatives
Helpfu",,4.0,,,,,,,,
Sat Sep 12 2020, Consultant,,Current Employee ,Consultant,0,,"ltant""
4.0
★★★★★
Current Employee - Consultant 
Doesn't Recommend
I have been working at Humana full-time
Pros
Teamwork was good at times
Cons
Racial Descrepancies were terrible at beat
Helpfu",,4.0,3.0,3.0,4.0,4.0,4.0,Doesn't Recommend,,
Thu Sep 10 2020, Senior Software Developer,"San Diego, CA",Current Employee ,Great company to work for,0,"Transparency, very ethical, well focused management team
","After many years, nothing to complain about
Advice to Management
Keep the great work :)
Helpfu","Keep the great work :)
Helpfu",5.0,5.0,5.0,5.0,5.0,5.0,Recommends,Positive Outlook,Approves of CEO
Wed Sep 09 2020, Pharmacy Technician,,Former Employee ,Good Company,0,"Hours, Competitive Salary, Holidays Off
","Mandatory Overtime, Blackout Calendar Days.
Helpfu",,5.0,5.0,5.0,5.0,5.0,5.0,Recommends,Positive Outlook,No opinion of CEO
Wed Sep 09 2020, RN Case Manager,N/A,Former Employee ,Review,0,"Great Company to work for.
","Mass lay offs when contracts end.
Helpfu",,4.0,,,,,,,,
Wed Sep 23 2020, Licensed Practical Nurse Telephonic Care Manager,"Mansfield, OH",Current Employee ,Eliminating LPNs,0,"Set own schedule very flexible
","Unstable pay scale Paid per telephonic visit
Helpfu",,3.0,4.0,5.0,2.0,3.0,3.0,Recommends,Positive Outlook,No opinion of CEO
Tue Sep 01 2020, Compliance Nursing Coordinator II,"San Antonio, TX",Current Employee ,It's okay,2,"-Lots of resources: discounts while shopping/with companies, wellness coaches, to help you find local resources
-You work closely with your direct supervisor
-Work at home culture is pretty well established
","-Stability is hit or miss, however, if one region suffers losses and needs to downsize, they DO help you find new positions in other areas.
-It's hard to get ahead, to figure what way is career advancement
Helpful (2",,5.0,4.0,5.0,4.0,4.0,4.0,Recommends,Neutral Outlook,Approves of CEO
Tue Sep 08 2020, Claims Review Specialist,"Louisville, KY",Current Employee ,Great entry level company,0,"C suite leaders have a great vision; pay is competitive; education and training is world class; atmosphere is very professional
","Middle management is iffy at best; benefits are surprisingly poor for the industry; poor room for growth without advanced degree
Helpfu",,4.0,3.0,5.0,4.0,4.0,5.0,Recommends,Positive Outlook,Approves of CEO
Mon Sep 21 2020, Inside Sales Agent,"Phoenix, AZ",Former Employee ,Only if you handle stress well and want to sell health insurance,0,"Mostly friendly coworkers, potential for good pay with base+unlimited comm, gift cards for achievers, lots of training and educational resources, covers cost for state licensing, paid VTO/PTO, and a gift card rewards program for maintaining your health/financial life outside of work.
","Bad management with inconsistencies in training materials and job aids that are outdated, not consolidated, long winded, and sometimes difficult to find while interacting with customers. There is also pressure to work unrealistic amounts of over time for up to 3 months at a time even with 6 call centers and 150+ employees at each. Hard to get PTO approved even in the off season with unscheduled black outs and training. Then there's the skilling system that throws new hires under the bus before they can thrive and keeps them there unless you can successfully convert cold calls and leads. Its a constant struggle to find balance between meeting sales quotas while genuinely caring for the needs and well being of your customers. There is a lot of favoritism and unless you can meet and continue to exceed sales goals regardless of the bucket you've found yourself in management pretty much writes you off as someone who well be leaving soon if you're not the type of employee to be terminated for cause.
Advice to Management
Upper management should consider middle management and floor supervisors more carefully or since it is a public traded company perhaps even upper management should be re-evaluated. Within the last few months of my employment there a floor supervisor resigned/was fired, both our associate directors resigned from what I've heard a conflict of interest, the quality assurance manager was terminated for an undisclosed reason, and an employee took his life on-site.
Helpfu","Upper management should consider middle management and floor supervisors more carefully or since it is a public traded company perhaps even upper management should be re-evaluated. Within the last few months of my employment there a floor supervisor resigned/was fired, both our associate directors resigned from what I've heard a conflict of interest, the quality assurance manager was terminated for an undisclosed reason, and an employee took his life on-site.
Helpfu",3.0,2.0,3.0,3.0,4.0,3.0,Doesn't Recommend,Neutral Outlook,No opinion of CEO
Sun Sep 06 2020, Billing Specialist,"Louisville, KY",Former Employee ,Based on multiple years with company,0,"PTO, performance bonuses, remote work
","Insurance benefits, can be difficult to move up
Helpfu",,4.0,5.0,3.0,3.0,,,,,
Thu Sep 03 2020, Inbound Contacts Representative IV,"Green Bay, WI",Current Employee ,Gets Old Fast,1,"Develop a strong understanding of how insurance works and decent pay/benefits.
","Doing the same things every day and dealing with people's tantrums are never fun.
Helpful (1",,4.0,4.0,4.0,4.0,5.0,4.0,Recommends,Positive Outlook,Approves of CEO
Sat Sep 05 2020, Customer Service Representative (CSR),"Tucson, AZ",Current Employee ,Good for military spouses,0,"Flexible, Pay, Culture, Schedule, Coworkers
","None but I guess long hours can be a lot for some
Helpfu",,5.0,,,,,,,,
Fri Sep 04 2020, Insurance Sales Agent,"Gastonia, NC",Current Employee ,Agent,0,"Great company and staff here
","I don't have any cons at the moment
Helpfu",,5.0,,,,,,Recommends,Positive Outlook,Approves of CEO
Sat Oct 10 2020, RN Field Care Manager,"East Chicago, IN",Former Employee ,Nice company to work for,0,"Benefits and 401k match are great
","Long hours and after work hours
Helpfu",,1.0,1.0,1.0,1.0,1.0,1.0,Recommends,Positive Outlook,Approves of CEO
Fri Aug 28 2020, Senior Software Engineer,,Former Employee ,Nice if you don't mind off shore,2,"Work from home any time is a plus
","Lots of offshore team mates - slows everything down.
Helpful (2",,5.0,,,,,,,,
Fri Sep 04 2020, RSO,,Current Employee ,Great company,0,"Great company to work for.
","So far nothing bad to say about the company
Helpfu",,4.0,,,,,,,,
Fri Sep 04 2020, Senior Financial Analyst,,Former Employee ,Great Place to work,0,"Great work life balance, strong PTO, understanding manager.
","The parking downtown was not great.
Helpfu",,4.0,,,,,,,,
Thu Sep 03 2020, Assignment Specialist,"West Palm Beach, FL",Current Employee ,Humana is a good place to work.,0,"Humana has some great benefits. They are a good place to working nice people to work with.
","Humana is closing the department that I am working in on 11/30/2020.
Helpfu",,5.0,5.0,5.0,4.0,5.0,5.0,Recommends,Positive Outlook,Approves of CEO
Thu Sep 03 2020, Senior Data and Reporting Professional,"Louisville, KY",Current Employee ,Great company!,0,"Great money, benefits, culture, opportunities.
","Can be difficult to break out of your department.
Helpfu",,5.0,4.0,4.0,4.0,4.0,5.0,Recommends,Positive Outlook,Approves of CEO
Thu Sep 03 2020, Supervisor,"Louisville, KY",Current Employee ,Great place to grow,0,"Values thinking of all employees and ensuring there is an option to cover everyone’s needs
","No stranger to the short falls of large companies.
Advice to Management
Be clear about communication and make sure all that need to know an update have a way to be informed of the update
Helpfu","Be clear about communication and make sure all that need to know an update have a way to be informed of the update
Helpfu",5.0,5.0,,,,,Recommends,Positive Outlook,Approves of CEO
Sun Aug 30 2020, Anonymous,,Current Employee ,keeps you busy,1,"work from home is a plus
","constant state of change is tough
Helpful (1",,5.0,,,,,,,,
Thu Sep 03 2020, Administrative Assistant,"Richmond, VA",Former Employee ,Looking after their people,0,"Look after their associates, lots of insensitive to work there, people are friendly
","very hierarchical, lots of approvals and chains to get things done
Helpfu",,4.0,4.0,4.0,4.0,4.0,3.0,Recommends,Positive Outlook,No opinion of CEO
Tue Sep 01 2020, Project Coordinator,,Former Employee ,Good company with benefits,0,"Great benefit package and team
","Salary for admin staff was on the lower end
Helpfu",,4.0,5.0,4.0,4.0,4.0,4.0,,,
Tue Sep 01 2020, Customer Service Representative,"Tampa, FL",Former Employee ,Great job,0,"The hours and management were great
","There are no cons about this job
Helpfu",,4.0,4.0,4.0,4.0,4.0,4.0,Recommends,Positive Outlook,Approves of CEO
Mon Aug 31 2020, Delivery Manager,,Current Employee ,Great company to work for.,0,"Great people to work with.
","With Covid, hours are becoming longer.
Helpfu",,5.0,,,,,,,,
Sun Aug 30 2020, Financial Analyst,"Hartford, CT",Former Employee ,Abcde,0,"Good job to start career
","Nothing comes to my mind
Helpfu",,4.0,,,,,,,,
Sun Aug 30 2020, Customer Service Specialist,"Wichita, KS",Former Employee ,Lovely Place 10/10,0,"first job i felt appreciated with the breaks i always received, able to move up tiers fast & very understanding management
","them wanting you to work overtime and get paid the same amount as you usually would
Advice to Management
none only that they need to let me work for them out of state cause i miss humana !! come to oklahoma plzzz
Helpfu","none only that they need to let me work for them out of state cause i miss humana !! come to oklahoma plzzz
Helpfu",5.0,5.0,5.0,4.0,5.0,5.0,Recommends,Positive Outlook,Approves of CEO
Fri Aug 28 2020, Grievance and Appeals Specialist,"San Juan, PR",Current Employee ,Grievance and appeals,0,"Great with all their employees
","Maybe having a low pay
Helpfu",,5.0,4.0,5.0,5.0,5.0,4.0,Recommends,Positive Outlook,Approves of CEO
Fri Aug 28 2020, Claims Specialist II,"Louisville, KY",Former Employee ,Claims,0,"Lots of Opportunities if you look.
","If you do not like change, this is not the place,
Helpfu",,4.0,4.0,4.0,3.0,3.0,4.0,Approves of CEO,,
Tue Aug 25 2020, Humana Cares Manager,"Tampa, FL",Current Employee ,Good company,1,"You are able to Work from home
","There is an Constantly changing work environment
Advice to Management
When making changes please do your best to think through the variables first.
Helpful (1","When making changes please do your best to think through the variables first.
",4.0,4.0,4.0,4.0,4.0,4.0,Recommends,Positive Outlook,Approves of CEO
Thu Aug 27 2020, Inbound Contacts Representative IV,"Louisville, KY",Former Employee ,Humana,0,"Liked the people I worked with
","I do not have any cons
Helpfu",,4.0,4.0,5.0,4.0,5.0,2.0,Recommends,Neutral Outlook,No opinion of CEO
Wed Sep 30 2020, Customer Service Representative (CSR),"Killeen, TX",Former Employee ,More cons,0,"Talking to customers throughout the day
","Managers, Pay, Call volume , Receiving help
Helpfu",,1.0,3.0,3.0,2.0,1.0,1.0,Doesn't Recommend,Negative Outlook,Disapproves of CEO
Wed Sep 09 2020, Customer Service Representative,"Roswell, GA",Current Employee ,Deceptive,0,"It's a job until you find another one
","Expensive Healthcare. Lying to members daily is required
Advice to Management
Update your systems so your staff could efficiently help members. Find better insurance rates for employees
Helpfu","Update your systems so your staff could efficiently help members. Find better insurance rates for employees
Helpfu",2.0,,,,,,Doesn't Recommend,Negative Outlook,No opinion of CEO
Fri Aug 21 2020, Clinical Pharmacist,"Louisville, KY",Current Employee ,N/A,1,"Leadership opportunities and work life balance.
","Difficult to move up within company.
Helpful (1",,5.0,5.0,4.0,4.0,4.0,4.0,,,
Tue Aug 25 2020, Software Engineer,"Fairfax, VA",Current Employee ,Face pace env,0,"Good place to learn more
","Management need to care more
Helpfu",,5.0,,,,,,,,
Mon Sep 07 2020, Financial Analyst,"Miramar, FL",Former Employee ,Ok,0,"Good worklife balance. Good atmosphere
","Low pay and lack of career advancing opportunities.
Advice to Management
Provide career advancing opportunities for employees
Helpfu","Provide career advancing opportunities for employees
Helpfu",3.0,5.0,4.0,1.0,2.0,3.0,Doesn't Recommend,Neutral Outlook,No opinion of CEO
Sun Aug 23 2020, Dms Sales Agent,"Madison, WI",Current Employee ,Medicare inbound sales,0,"Great benefits and pay. Great leadership
","Can be redundant day to day. And a lot of overtime is highly encouraged between October and December in order to meet or exceed tour sales goals for annual election period
Helpfu",,4.0,2.0,4.0,4.0,5.0,4.0,Approves of CEO,,
Fri Aug 21 2020,Anonymous,"Louisville, KY",Current Employee ,Good and Bad (mostly good),0,"There are several pros to working at Humana. They include: 

*career advancement
*learning opportunities
*funds for continuing education
*benefits
*salary
*EAP (employee assitance program)
*discounts
*health and wellness breaks
","*burnout
*lots of confusing/ambiguous information given to employees regarding how to perform their duties
*hiring freezes
Advice to Management
There are certain departments where the work being done is time-sensitive and there is a great deal of inventory. Leadership needs to focus on how to alleviate the strain on employees, give employees safe spaces to voice their concerns, and actually follow up and address employees' concerns.
Helpfu","There are certain departments where the work being done is time-sensitive and there is a great deal of inventory. Leadership needs to focus on how to alleviate the strain on employees, give employees safe spaces to voice their concerns, and actually follow up and address employees' concerns.
Helpfu",4.0,5.0,5.0,4.0,4.0,4.0,Recommends,Positive Outlook,Approves of CEO
Thu Aug 20 2020, Actuary,,Current Employee ,Generally a Good Place,0,"Very flexible leaders. Leaders seem to care about the development of their employees. Humana offers very competitive benefits and compensation.
","Some departments have very busy business cycles. Some leaders plan poorly or fail to give pushback on unnecessary demands.
Helpfu",,5.0,3.0,4.0,5.0,5.0,5.0,Recommends,Positive Outlook,Approves of CEO
Thu Aug 20 2020, Utilization Management Coordinator,,Former Employee ,Nice,0,"Work from home, caring supervisors
","High deductible health insurance coverage
Helpfu",,4.0,3.0,2.0,4.0,4.0,3.0,Recommends,,
Thu Sep 03 2020, Registered Nurse,"Knoxville, TN",Former Employee ,review,0,"co-workers are great to work with
","managers not all but most not supportive
Helpfu",,3.0,3.0,3.0,3.0,4.0,2.0,,,
Wed Aug 19 2020, FCM II,,Current Employee ,Care management,0,"Work life balance is great
","Changes Occur quickly without knowledge
Helpfu",,5.0,5.0,5.0,5.0,5.0,5.0,Recommends,Positive Outlook,Approves of CEO
Wed Sep 23 2020, Inbound Sales Representative,"De Pere, WI",Current Employee ,Employment,1,"Coworkers are nice to work with
","The management do not care about you and you are set up to fail out of the gate
Helpful (1",,1.0,,,,,,,,
Wed Aug 19 2020,Anonymous,,Former Employee ,Good place to work,0,"Work from home, opportunities for growth and development, health & well being
","A lot of layers between different orgs. Some leaders and style can be rigid.
Helpfu",,4.0,4.0,4.0,4.0,4.0,3.0,Recommends,Positive Outlook,Approves of CEO
Mon Aug 17 2020, DCQueue Tech II,"Glendale, AZ",Current Employee ,Great employment that take care of their employees!,0,"Hours, Schedule, Home/Work Balance, Salary/Benefits, OT
","Sometimes OT requirements can be a bit much depending on department/time of year.
Helpfu",,5.0,4.0,5.0,4.0,5.0,4.0,Recommends,Positive Outlook,Approves of CEO
Mon Aug 17 2020, Senior Product Design Professional,"Louisville, KY",Current Employee ,Great place,0,"Great company to work for
","I can't think of a downside
Helpfu",,5.0,5.0,5.0,5.0,5.0,5.0,Recommends,Positive Outlook,Approves of CEO
Fri Aug 28 2020, Direct Care Coah,"Houston, TX",Former Employee ,Ok company,0,"Easy job with good benefits
","The pay could be better
Advice to Management
do better
Helpfu","do better
Helpfu",3.0,5.0,1.0,1.0,2.0,1.0,Doesn't Recommend,Positive Outlook,
Thu Aug 13 2020,Anonymous,,Current Employee ,Great company,0,"love working here, recommend it to friends
","none, just a great company
Helpfu",,5.0,,,,,,,,
Thu Aug 13 2020, Strategy Consultant,,Current Employee ,Cares for associates and customers,0,,"ltant 
Recommends
Positive Outlook
Approves of CEO
I have been working at Humana full-time
Pros
I’ve been incredibly impressed by Humana’s response to COVID and how it made new policies to support both associates and customers in this challenging time.
Cons
Few large offices outside of Louisville
Helpfu",,5.0,5.0,5.0,5.0,5.0,5.0,Recommends,Positive Outlook,Approves of CEO
Thu Aug 27 2020,Anonymous,"Cape Coral, FL",Former Employee ,Care Manager,0,"Able to make my own hours
","Laid off for the second time.
Advice to Management
Don't fall for Humana again they are literally having people work and feel safe and secure then they pull the floor from under you
 Big companies don't care about hardworking employees. As long as the job is done. Very very sad
Helpfu","Don't fall for Humana again they are literally having people work and feel safe and secure then they pull the floor from under you
 Big companies don't care about hardworking employees. As long as the job is done. Very very sad
Helpfu",2.0,5.0,5.0,2.0,1.0,5.0,Doesn't Recommend,Negative Outlook,No opinion of CEO
Tue Aug 11 2020,Anonymous,,Current Employee ,Great Company Overall,0,"Takes care of its employees
","Different departments' processes can be very disorganized.
Helpfu",,5.0,,,,,,,,
Tue Aug 11 2020, Principal Cloud Solutions Architect,"Louisville, KY",Current Employee ,Great Stability,0,"Work Life Balance that exists.
","Work can be bureaucratic and slow.
Helpfu",,5.0,,,,,,,,
Tue Aug 11 2020, Software Engineer,,Current Employee ,Great company !! Great benefits !!,0,"Helpful environment and good benefits
","None i can think of
Helpfu",,5.0,5.0,4.0,5.0,5.0,4.0,Recommends,Positive Outlook,Approves of CEO
Fri Aug 07 2020, Case Management Coordinator,"Miami, FL",Current Employee ,Incredible Company,1,"Benefits, Culture, Work from Home
","None that I can think of
Helpful (1",,5.0,5.0,5.0,5.0,5.0,5.0,,,
Mon Aug 24 2020, Senior Professional,"Louisville, KY",Former Employee ,Constant re-orgs,1,,"ant re-orgs""
2.0
★★★★★
Former Employee - Senior Professional in Louisville, KY
Doesn't Recommend
Negative Outlook
No opinion of CEO
I worked at Humana full-time for more than 5 years
Pros
Most roles have the ability to work from home
Cons
Humana is constantly going through re-orgs, which result in high turnovers, massive layoffs, and low morale. There’s also a large gap in communication, one of the most heard phrases while I was there was “the silence is deafening.” I definitely felt overworked and under appreciated.
Helpful (1",,2.0,3.0,3.0,2.0,1.0,1.0,Doesn't Recommend,Negative Outlook,No opinion of CEO
Mon Aug 10 2020,Anonymous,"Louisville, KY",Current Employee ,Great company that cares about employees,0,"Working from home. Good benefits from money to time off
","Large company sometimes it is hard to find what you are looking for.
Advice to Management
Nothing really.
Helpfu","Nothing really.
Helpfu",4.0,4.0,5.0,4.0,5.0,3.0,Recommends,Positive Outlook,Approves of CEO
Sun Aug 09 2020, Analyst,"Louisville, KY",Former Employee ,Good company overall. Experiences may vary by department.,0,"Higher pay for area. Opportunities to move within company.
","Experiences can vary a lot by department
Helpfu",,4.0,,,,,,,,
Fri Aug 07 2020,Anonymous,,Former Employee ,Overall good place to work,0,"Pay and benefits are extremely competitive. A lot of opportunities for growth.
","Lack of transparency regarding salary ranges.
Helpfu",,4.0,3.0,4.0,5.0,5.0,4.0,Recommends,Positive Outlook,No opinion of CEO
Wed Aug 19 2020, RN Care Manager,,Former Employee ,Too much selling,1,"Work from home, set hours, no weekends or holidays
","Too much policing and have to sell the product too much
Helpful (1",,3.0,5.0,4.0,3.0,3.0,4.0,Doesn't Recommend,Negative Outlook,Disapproves of CEO
Thu Aug 06 2020, Senior Learning Designer,"Louisville, KY",Current Employee ,It’s all about the manager,0,"Great people
Great Values
Career growth opportunities
","Not the best at training managers
Not all managers are great
Advice to Management
Standardized a leader training that is required for all leaders.
Helpfu","Standardized a leader training that is required for all leaders.
Helpfu",5.0,4.0,5.0,5.0,5.0,4.0,Recommends,Positive Outlook,Approves of CEO
Thu Aug 06 2020, RN Care Coordinator,"Louisville, KY",Current Employee ,Great Company,0,"Cares about employees, great benefits, good life/work balance, great management
","Layoffs, constant change in processes and technical systems
Advice to Management
Keeping doing what you are doing. Great management and administration
Helpfu","Keeping doing what you are doing. Great management and administration
Helpfu",5.0,5.0,5.0,5.0,5.0,5.0,Recommends,Positive Outlook,Approves of CEO
Mon Aug 17 2020, Pharmacy Technician,,Former Employee ,Job quality has declined over the last 8 years,1,"Higher pay than retail, many positions are not patient facing
","High deductible insurance, lean staffing, questionable management, mandatory overtime
Helpful (1",,3.0,2.0,2.0,3.0,2.0,2.0,Doesn't Recommend,Neutral Outlook,No opinion of CEO
Wed Aug 19 2020, Communications Specialist,"Tampa, FL",Former Employee ,Good place to work,0,"The salary was good for Florida
","They tend to lay off often
Helpfu",,3.0,4.0,3.0,2.0,4.0,2.0,,,
Mon Aug 17 2020, VSP Agent Support,,Current Employee ,"It’s a good job, the systems are a little out dated",0,"Good pay, great employees, WAH
","No benefits, schedule changes every week
Helpfu",,3.0,2.0,3.0,3.0,2.0,3.0,Doesn't Recommend,Neutral Outlook,
Thu Jul 30 2020, Senior Data Scientist,"Dallas, TX",Current Employee ,Great Company,0,"Positive work environment and great management.
","I don't have any negatives!
Helpfu",,5.0,5.0,5.0,4.0,4.0,4.0,Recommends,Positive Outlook,Approves of CEO
