date,employee_title,location,employee_status,review_title,helpful,pros,cons,advice_to_mgmt,rating_overall,rating_balance,rating_culture,rating_career,rating_comp,rating_mgmt,recommends,positive_outlook,approves_of_CEO
Thu Nov 21 2019, UM Coordinator,,Current Employee ,Good Company,0,"Good company to work for and good pay
","No cons for this company
Helpfu",,5.0,5.0,5.0,5.0,5.0,5.0,Recommends,,
Mon Dec 02 2019, RN Case Manager,,Former Employee ,"Good benefits, good experience, frequent, yearly job reductions including whole departments.",0,"Good benefits, pay, job experience.
","Yearly work force reductions, of large amounts of staff.
Advice to Management
Hang in there.
Helpfu","Hang in there.
Helpfu",2.0,4.0,1.0,1.0,4.0,2.0,Negative Outlook,,Disapproves of CEO
Sun Nov 17 2019, Grievance and Appeals Specialist,,Former Employee ,Grievance and Appeals Specialist,0,"Very Flexible Schedule
Work from home
","Mandatory Overtime during peak season
Helpfu",,4.0,2.0,4.0,3.0,2.0,2.0,Recommends,Positive Outlook,Approves of CEO
Fri Nov 15 2019, Manager,"West Palm Beach, FL",Current Employee ,"Overall, great company to work for but things could be simplified.",0,"Opportunity for growth even though it's a large corporation.
","Health insurance options are poor for their employees.
Helpfu",,4.0,4.0,5.0,5.0,4.0,4.0,Recommends,Positive Outlook,Approves of CEO
Thu Nov 28 2019, RN Care Coordinator,,Former Employee ,Shady dealings,1,"Work from home opportunity, work with an interdisciplinary team
","Lack of trust in leaderahip
Advice to Management
Trust in the folks you hire!! And be transparent with your team.
Helpful (1","Trust in the folks you hire!! And be transparent with your team.
",2.0,1.0,3.0,3.0,1.0,2.0,Doesn't Recommend,Negative Outlook,No opinion of CEO
Sun Nov 03 2019, Supervisor,,Current Employee ,Good Company - Suspect Leadership,4,"Humana is one of the best corporations in the world to work for! The incentives, flexibility, inclusion & diversity initiatives & amenities are ""top shelf"".
","Unfortunately, in the past Humana hired a lot of self-serving, hostile work environment inducing leaders. A few of them are still around in director roles & up, & are still stuck in the corporate stone age mentality of leadership capabilities, tactics & fear-mongering.
Advice to Management
Get a bigger salary broom for your next sweep, because there is tons of dust & mold in the corners.
Helpful (4","Get a bigger salary broom for your next sweep, because there is tons of dust & mold in the corners.
",4.0,4.0,4.0,4.0,4.0,1.0,Recommends,Positive Outlook,Approves of CEO
Tue Nov 12 2019, RN Case Manager,N/A,Former Employee ,Great managment,0,"Remote work, autonomy, decent benefits
","Difficult to get promoted
Helpfu",,5.0,,,,,,,,
Sun Nov 24 2019, Health Coach,"San Diego, CA",Former Employee ,Potential encumbered,1,"WFH option a plus; relatively flexible working hours.
","Difficult to move ahead without being part of a click.
Advice to Management
Call out higher ups when they're making choices that negatively impact members.
Helpful (1","Call out higher ups when they're making choices that negatively impact members.
",3.0,4.0,2.0,3.0,4.0,2.0,Doesn't Recommend,Neutral Outlook,Disapproves of CEO
Mon Dec 16 2019, MAO,"Las Vegas, NV",Former Employee ,Working for Humana call center,0,"Easy job to get through third part.
","Intense work for small pay
Advice to Management
Work else where
Helpfu","Work else where
Helpfu",1.0,1.0,1.0,4.0,2.0,3.0,Doesn't Recommend,Negative Outlook,Disapproves of CEO
Sat Nov 09 2019, Billing Specialist,"Roswell, GA",Current Employee ,"Humana, Inc.",0,"Great place to work to support and listen to Customer in the health journey.
","Great place to learn to support and listen to Customer.
Helpfu",,4.0,,,,,,,,
Thu Nov 21 2019, Dms Sales Agent,"Miramar, FL",Former Employee ,Training was Ideal then it all went down hill,1,"Training is the best, they expose you to all Humana products and services so you do not feel blind sided when you get on the floor.
","If you want micro-management you came to the right place. Everything depends on who your manager is, most of the good senior managers have either quite or have gotten fired trying to protect their employees. CONSTANT revolving door. Humana All-in-All Humana seems to be a good company and has allot of resources for its employees however DMS Miramar was a horrible place to work.
Advice to Management
None- Upper Management is whats wrong with this place. The Few managers who stood up for their employees being harassed got fired.
Helpful (1","None- Upper Management is whats wrong with this place. The Few managers who stood up for their employees being harassed got fired.
",3.0,3.0,1.0,2.0,3.0,1.0,Doesn't Recommend,Neutral Outlook,No opinion of CEO
Tue Nov 05 2019, Insurance Sales Agent,"Tampa, FL",Current Employee ,Nice place to start,1,"Great opportunity for new/upcoming agents
Good training opportunities 
Ergonomic desks/chairs
401k benefits
","The work environment can be hostile 
Consistently poor performing agent tools/underperforming technology 
Lengthy sales process/Red Tape Sales
Advice to Management
More agent perks
Consider AEP/OEP only agents/part time
WAH agent positions
Helpful (1","More agent perks
Consider AEP/OEP only agents/part time
WAH agent positions
",4.0,3.0,1.0,3.0,3.0,2.0,Doesn't Recommend,Positive Outlook,Approves of CEO
Wed Dec 11 2019,Anonymous,"Louisville, KY",Former Employee ,Many bosses and few leaders,1,"Competitive salary 
Louisville downtown 
Tools to do the job
","Micromanage in the name of agile 
Toxic work environment, depends on team and your immediate manager 
Favoritisms 
Tunnel vision without direction
High turnover
Advice to Management
By saying computer jargons or technology names, you cannot be a technology company. Invest in your managers who don’t know how to manage.
Helpful (1","By saying computer jargons or technology names, you cannot be a technology company. Invest in your managers who don’t know how to manage.
",1.0,2.0,1.0,2.0,5.0,1.0,Negative Outlook,,Approves of CEO
Wed Nov 06 2019, Representative IV,,Current Employee ,Great Place,0,"Growth Opportunities, Great Leaders, Great environment
","Some associates need more training,
Helpfu",,4.0,4.0,4.0,4.0,4.0,4.0,,,
Wed Nov 20 2019, Strategic Account Executive,"Louisville, KY",Former Employee ,Company's systems and processes are obsolete,0,"Good benefits, decent salaries, work life balance and alternate work arrangements
","many silos, and duplication of effort. Many leaders are clueless. Constant restructuring
Helpfu",,3.0,3.0,3.0,4.0,4.0,3.0,Doesn't Recommend,Neutral Outlook,No opinion of CEO
Sun Nov 03 2019, Clinical Service Representative,"Springdale, OH",Former Employee ,"Good Place to Work, Friendly Environment",1,"Training, Team Involvement, PTO, Benefits, Ability to Excel
","Breaks are prescheduled when you're on the phones constantly, your hours aren't always taken into consideration.
Helpful (1",,4.0,3.0,5.0,5.0,4.0,5.0,Recommends,Positive Outlook,Approves of CEO
Sun Nov 17 2019, Licensed Sales Agent,,Former Employee ,Great Coworkers,1,"Money is good. Monthly bonuses.
","Micromanaging and stressful environment. No pto during AEP.
Helpful (1",,2.0,1.0,2.0,4.0,1.0,,Doesn't Recommend,,
Sun Oct 27 2019,Anonymous,"Wic-a-te-wah, MI",Current Employee ,"Director, Quality Improvement",2,"Positive work life balance, Excellent leadership, Competitive salary, and Autonomous work environment
","Limited growth opportunities for my clinical director role (at the time)
Helpful (2",,5.0,5.0,5.0,5.0,4.0,5.0,Recommends,Positive Outlook,Approves of CEO
Sun Nov 17 2019, Case Manager,,Former Employee ,Great Training,0,"There is good training for staff
","They always have lay offs
Helpfu",,2.0,4.0,2.0,1.0,4.0,1.0,,,
Sun Nov 10 2019, IT Project Manager,"Louisville, KY",Former Employee ,Cultural and work climate sucks!,5,"WFH opportunities and great employee benefits. Exercise and well-being were greatly emphasized.
","If you are not white or Indian, most likely you will not fit comfortably into this environment. This is a good ole boy network!
Advice to Management
Never place inexperienced supervisors over experienced employees. This combination makes for a nightmare, and a reason for good employees to find new opportunities. Supervisors are so busy trying to pacify others to save face due to lack of knowledge that they belittle subordinates, bargain behind the scene, discard procedures, misappropriate project funds, promote shabby project results, and produce disgruntled employees. Instead of a bunch of useless surveys, take the time to really listen and understand employees.
Helpful (5","Never place inexperienced supervisors over experienced employees. This combination makes for a nightmare, and a reason for good employees to find new opportunities. Supervisors are so busy trying to pacify others to save face due to lack of knowledge that they belittle subordinates, bargain behind the scene, discard procedures, misappropriate project funds, promote shabby project results, and produce disgruntled employees. Instead of a bunch of useless surveys, take the time to really listen and understand employees.
",2.0,2.0,1.0,3.0,3.0,1.0,Negative Outlook,,Approves of CEO
Sat Nov 16 2019, Undisclosed,,Current Employee ,Great job but limited stability,0,"Great pay, benefits and culture
","Too much reorganization and outsourcing.
Advice to Management
People don’t want to always worry their job is on the chopping block.
Helpfu","People don’t want to always worry their job is on the chopping block.
Helpfu",3.0,4.0,3.0,3.0,4.0,3.0,,,
Thu Oct 31 2019, RN Case Manager,"Cartersville, GA",Current Employee ,Great Employer,0,"Work from home
Good pay
Supportive administration
","Workload is high
Population is very sick
Helpfu",,4.0,4.0,5.0,4.0,5.0,5.0,Recommends,Positive Outlook,Approves of CEO
Tue Oct 15 2019, Utilization Review Nurse,"Daytona Beach, FL",Current Employee ,UM Nurse,4,"Great pay and benefits. My managers are amazing like a family.
","They used to do more for the employees. Company picnics, holiday gatherings, things to bring everyone together. Now everything is WFH.
Helpful (4",,4.0,5.0,4.0,5.0,5.0,4.0,Recommends,Positive Outlook,Approves of CEO
Thu Nov 07 2019, Software Engineer,,Former Employee ,***,1,"Humana provides good work lgrowbalance.
","Not enought opportunity to grow
Advice to Management
Management should be more transparent.
Helpful (1","Management should be more transparent.
",2.0,1.0,1.0,1.0,1.0,1.0,,,
Sun Oct 20 2019, Network Engineer,,Former Employee ,Great Job,1,"I really enjoyed working here, the people were great and the work was interesting
","There were no cons when working here
Helpful (1",,5.0,5.0,5.0,5.0,5.0,5.0,Recommends,Positive Outlook,No opinion of CEO
Wed Oct 23 2019, Administrative Services Coordinator,"Fort Wayne, IN",Current Employee ,Wonderful Place to Work,0,"Great pay, great hours, very easy to earn PTO, benefits are overall excellent, technology is up to date, leadership is great, plenty of learning opportunities, incentives to earn free gift cards
","Insurance only covers $10,000 towards barriatric surgery.
Helpfu",,5.0,5.0,5.0,5.0,5.0,5.0,Recommends,Positive Outlook,Approves of CEO
Wed Nov 06 2019, Case Manager,"Selmer, TN",Former Employee ,Over worked.... Over Stressed,1,"Homebased without weekend requirements. Can't really address any other positives
","Although position was work from home, there was little flexibility and constant review and complaints about metrics without regard for patient best interest.
Helpful (1",,2.0,2.0,1.0,2.0,3.0,1.0,Doesn't Recommend,,Disapproves of CEO
Tue Nov 26 2019, Customer Service Representative,,Former Employee ,Terrible work environment,1,"Good health insurance, but then again you could never take off time if you were sick...
","Terrible work environment. Would not recommend.
Helpful (1",,1.0,1.0,1.0,1.0,,,Doesn't Recommend,,
Wed Oct 16 2019, Customer Service Representative,N/A,Former Employee ,Humana,2,"Great Experience had great time there
","Employee Health Insurance is terrible
Helpful (2",,4.0,,,,,,,,
Mon Nov 04 2019, Telesales Agent,"Phoenix, AZ",Former Employee ,Great Culture,0,"Great Culture and committed, caring work force
","New staff restricted primarily to outbound calls outside of peak times.
Helpfu",,3.0,3.0,5.0,3.0,3.0,3.0,Recommends,Positive Outlook,
Sun Oct 20 2019,Anonymous,,Former Employee ,N/A,0,"It was an okay company
","Can’t really think of none
Helpfu",,4.0,3.0,3.0,1.0,3.0,3.0,,,
Mon Oct 14 2019, Technology Analyst,"Louisville, KY",Former Employee ,17 years with a Technical help desk,2,"good salary, worked on projects
","Management changed several times and value to department changed
Helpful (2",,4.0,4.0,5.0,3.0,4.0,3.0,Recommends,Positive Outlook,No opinion of CEO
Tue Oct 29 2019,N/A,"Costa Mesa, CA","Process Manager in Costa Mesa, CA",Okay company,1,"Great benefits and work/life balance
","Too much secrecy across departments. Not willing to share knowledges and too protective of their own team.
Advice to Management
Be open about sharing knowledges
Helpful (1","Be open about sharing knowledges
",3.0,4.0,3.0,3.0,5.0,2.0,Recommends,Neutral Outlook,No opinion of CEO
Wed Oct 30 2019, Work Content Specialist,,Current Employee ,Claims,0,"Flexibility to work at home, quarterly bonuses based on work performance, flex schedule
","Unable to advance unless your a ""favorite"", don't receive annual raises consistently
Advice to Management
Not everyone is meant to be in leadership roles. Good employees don't just leave its the faulty managing that drives them away
Helpfu","Not everyone is meant to be in leadership roles. Good employees don't just leave its the faulty managing that drives them away
Helpfu",3.0,3.0,3.0,2.0,3.0,2.0,Doesn't Recommend,Negative Outlook,Disapproves of CEO
Wed Oct 30 2019, CCR,,Current Employee ,Not bad,0,"Job security busy call center
","Must be Buddy buddy to get promotions
Helpfu",,3.0,2.0,3.0,1.0,4.0,4.0,,,
Sun Oct 13 2019, Consumer Engagement Professional,,Former Employee ,Great company with a mission towards health/wellness!,1,,"mer Engagement Professional 
I worked at Humana full-time
Pros
If you enjoy working with clients, this is a great role. Excellent leadership, strong benefits, and autonomy.
Cons
Length of time to correct group issues
Helpful (1",,4.0,5.0,4.0,4.0,5.0,4.0,,,
Fri Oct 11 2019, Data Quality/Integrity Engineer II,"Louisville, KY",Current Employee ,A great company to work for,1,"Work from home 
Great values
Flexible
","Streamline some processes and work myself out of a job
Helpful (1",,4.0,4.0,5.0,3.0,4.0,4.0,Recommends,,Approves of CEO
Fri Oct 25 2019,Anonymous,"West Chester, OH",Former Employee ,Okay place of employment,2,"Environment job security casual work clothes
","Salary , management , the way you’re treated is replaceable
Advice to Management
Care more about employees
Helpful (2","Care more about employees
",2.0,1.0,1.0,2.0,1.0,1.0,Doesn't Recommend,Positive Outlook,No opinion of CEO
Thu Oct 24 2019, Analyst,"Miramar, FL",Former Employee ,"Pretty good company, managers to many issues",1,"Company has been around a long time, good stock options, insurance is ok.
","To many clicks and manager problems
Helpful (1",,3.0,3.0,3.0,4.0,3.0,2.0,,,
Thu Oct 03 2019, IT Project Manager,"Louisville, KY",Current Employee ,Lots of Changes,3,"Never a dull moment.
","Completely non-standard approach to project management. Weak matrix organization structure.
Helpful (3",,4.0,5.0,4.0,4.0,5.0,3.0,Recommends,Neutral Outlook,Approves of CEO
Thu Oct 10 2019, Architect,,Current Employee ,goood,0,"great company to work for
","none as such working for this company
Helpfu",,5.0,,,,,,,,
Mon Oct 07 2019, IT Applications Architect,"Louisville, KY",Current Employee ,Application architect,1,"Good place to work here ; Good benefits
","Some leaders are bit difficult to deal with .
Helpful (1",,4.0,,,,,,,,
Fri Nov 08 2019, RN Care Manager,"Chicago, IL",Current Employee ,Unstable Employment,7,"Good pay and benefits package.
","Humana hires lots of nurses and when the market turns down, it fires a lot of nurses. This cycle repeats AT LEAST once a year. The criteria for the continual reductions in force are completely opaque and seemingly arbitrary. Management uses double-speak to placate the folks who were spared the mass lay-offs and don't include the feedback of direct-facing nurses in any meaningful way to try to meet the needs of the customer and the $$-hungry board. While Humana makes a big show about how much it supposedly cares about its employees, it's a company that regards its employees as highly expendable resources. This is literally a job that will have you constantly worrying about when you will be laid off...because eventually...you will.
Advice to Management
Start treating nurses like professionals instead of expendable mindless minions
Helpful (7","Start treating nurses like professionals instead of expendable mindless minions
",1.0,1.0,1.0,1.0,3.0,1.0,Doesn't Recommend,Negative Outlook,Disapproves of CEO
Tue Nov 12 2019, Service Desk Technician,"Orlando, FL",Former Employee ,Service Desk Technician 3,1,"Great company to learn industry standards and grow with their learning and development training. I heard about their great benefits too.
","I applied for this position on 6/4/19-their team put the application on hold for 5 months, only to notify me that I was passed up!
Advice to Management
No need for the runaround-remain professional and remember EEOC
Helpful (1","No need for the runaround-remain professional and remember EEOC
",1.0,3.0,1.0,3.0,3.0,1.0,Doesn't Recommend,Negative Outlook,Disapproves of CEO
Tue Oct 08 2019, Front Line Leader,,Former Employee ,Humana Review,0,"Great Leadership and a fantastic work environment
","Trouble communicating with peers at other sites
Helpfu",,4.0,3.0,5.0,4.0,5.0,4.0,Recommends,Positive Outlook,No opinion of CEO
Mon Oct 07 2019, Corporate Accounting Manager,"Louisville, KY",Former Employee ,Great Company,0,"Great culture, competitive pay and solid tenured leadership team
","Learning curve of the business.
Helpfu",,5.0,5.0,5.0,5.0,5.0,5.0,Recommends,Positive Outlook,No opinion of CEO
Tue Nov 12 2019,N/A,, ,Pharm tech,0,"Pay, overtime, and thats it
","No growth, overworked, lied to constantly
Advice to Management
Hire people who can actually manage not based on years worked there
Helpfu","Hire people who can actually manage not based on years worked there
Helpfu",1.0,,,,,,,,
Sun Oct 06 2019, Senior Telesales,"Miramar, FL",Former Employee ,Great organization,0,"Industry best training and support system. Great well-being programs for employees
","Although it comes off as uncapped commissions, based on the low commission structures and the amount of time it takes to write policies versus the amount of hours worked, there is definitely a cap on the amount of money one can make.
Helpfu",,4.0,3.0,5.0,5.0,3.0,4.0,,,
Fri Oct 11 2019, Billing Specialist,"Louisville, KY",Former Employee ,Nice place,1,"Work from home is a good perk
","Micromanaging and constant changing QA standards per team.
Helpful (1",,3.0,2.0,1.0,2.0,3.0,1.0,Doesn't Recommend,Positive Outlook,Disapproves of CEO
Tue Sep 24 2019,N/A,, ,It has been an amazing experience working at Humana.,1,"Fun place to work at
","Don’t get pay enough for everything we do
Advice to Management
Be around more so walking to be visible
Helpful (1","Be around more so walking to be visible
",5.0,,,,,,No opinion of CEO,,
Tue Sep 24 2019, Customer Service Representative,"Tucson, AZ",Current Employee ,It has been very challenging having to prove my title as an Experience Customer Service Agent,1,"Flexible hours, working along side other's, gaining member's trust, giving the upmost all that is pleased for the work that is presented at Humama
","Straying ahead of the trainings, being part of the company, getting upper management to be fair all around not only when they feel it's convenient
Advice to Management
Everyone should be treated equally. All employees should be included when it comes to changes not in just bits and pieces
Helpful (1","Everyone should be treated equally. All employees should be included when it comes to changes not in just bits and pieces
",4.0,5.0,5.0,4.0,4.0,3.0,Recommends,Positive Outlook,No opinion of CEO
Mon Oct 07 2019, Scheduler,"Clearwater, FL",Current Employee ,I think Humana could compensate their employees better,1,"Good hours. No weekends except when mandatory over time is required
","Not paying enough for the job. They hire through staffing companies to avoid any benefits
Advice to Management
Treat employees with more respect. Praise them for their hard work instead of belittling for adherence being off
Helpful (1","Treat employees with more respect. Praise them for their hard work instead of belittling for adherence being off
",2.0,1.0,1.0,1.0,1.0,,Doesn't Recommend,Negative Outlook,Disapproves of CEO
Sun Sep 22 2019, Clinical Services Technician,"Glendale, AZ",Current Employee ,Professional and collaborative environment,0,"Managers care for employees
Voices are heard and change actually implemented to improve systems
","Difficult to receive additional compensation for outstanding performance besides the yearly raises
Advice to Management
Work on compensation and make it easier for managers to give raises. Employees shouldn't have to wait an entire year for a few % yearly raise everyone else receives.
Helpfu","Work on compensation and make it easier for managers to give raises. Employees shouldn't have to wait an entire year for a few % yearly raise everyone else receives.
Helpfu",4.0,5.0,5.0,5.0,2.0,5.0,Recommends,Positive Outlook,Approves of CEO
Sun Oct 06 2019, Field Care Manager,,Current Employee ,Not enough patients,0,"Make your own schedule. Work/Life balance.
","Not enough patients in 1 region.
Advice to Management
pay for mileage
Helpfu","pay for mileage
Helpfu",3.0,5.0,3.0,1.0,1.0,3.0,,,
Thu Sep 19 2019, Strategy Advancement Professional,,Current Employee ,Nice place,1,"Work from home, company truly does promote a good work/life balance.
","Upper leadership cannot make up their minds about anything.
Advice to Management
Upper leadership needs to be better at picking a direction and moving towards it. They are all over their place with decisions, which makes it hard to accomplish anything.
Helpful (1","Upper leadership needs to be better at picking a direction and moving towards it. They are all over their place with decisions, which makes it hard to accomplish anything.
",4.0,5.0,4.0,5.0,5.0,1.0,Recommends,Positive Outlook,Approves of CEO
Tue Sep 17 2019, Senior Data Reporting Professional,,Current Employee ,Good,1,"Good 401k match, PTO bank, VTO, life-work balance. Great development opportunities. Work at home possible.
","Very siloed organization. Need to move around to learn.
Helpful (1",,5.0,5.0,5.0,4.0,5.0,4.0,Recommends,Positive Outlook,Approves of CEO
Wed Sep 18 2019, Care Coach,"Saint Petersburg, FL",Former Employee ,Great Company to work for!,1,"Very competitive salary and benefits
","Disconnected middle management and High caseloads
Advice to Management
Closely monitor middle management
Helpful (1","Closely monitor middle management
",4.0,4.0,5.0,4.0,4.0,2.0,Doesn't Recommend,Positive Outlook,Approves of CEO
Thu Sep 19 2019,N/A,, ,Great work!,0,"Very Good Managers in Puerto Rico. Good Salary and opportunities to grow.
","Limited Space, Noise that makes hard to work with members sometimes. This can limit the quality of the Calls.
Advice to Management
Should Consider WAH for Some Associates to make space.
Helpfu","Should Consider WAH for Some Associates to make space.
Helpfu",5.0,1.0,5.0,5.0,5.0,5.0,Positive Outlook,,
Wed Sep 18 2019, Pharmacy Technician,"Phoenix, AZ",Current Employee ,Pharmacy Tech,0,"Amazing company!!! Great benefits, great schedule, great pay, and great people to work with.
","I didn’t work for Humana sooner
Helpfu",,5.0,5.0,5.0,5.0,5.0,5.0,Recommends,Positive Outlook,Approves of CEO
Fri Sep 13 2019,Anonymous,,Current Employee ,"Best place to work in Louisville, KY!",1,"Promotes talent growth, flexible hours, and most people are great to work with, great culture.
","A few bad apples like all companies.
Helpful (1",,5.0,4.0,5.0,5.0,4.0,,Recommends,Positive Outlook,No opinion of CEO
Wed Sep 25 2019, Care Management Associate,"Colorado Springs, CO",Former Employee ,Good at first,1,"Good salary and 401K match
","Hard to move to a new position internally. Once you have seniority, you become too expensive for them and will be laid off.
Helpful (1",,3.0,5.0,3.0,1.0,4.0,1.0,Doesn't Recommend,Neutral Outlook,Disapproves of CEO
