date,employee_title,location,employee_status,review_title,helpful,pros,cons,advice_to_mgmt,rating_overall,rating_balance,rating_culture,rating_career,rating_comp,rating_mgmt,recommends,positive_outlook,approves_of_CEO
Thu Sep 10 2015,Anonymous,,Current Employee ,Friendly People,0,"It's a noncompetitive environment, full of smart people
","Hard to read people - they aren't necessarily open about problems
Helpfu",,4.0,3.0,5.0,5.0,5.0,5.0,Recommends,Neutral Outlook,Approves of CEO
Wed Sep 23 2015,Anonymous,,Former Employee ,eh,1,"Team leaders and management really encourage work-life balance.
","Environmental sustainability is not a priority - and for a company that relies on paper as a natural resource, this is a concern.
Advice to Management
Take sustainability more seriously or you will not survive competing against P&G. Need to get rid of the coal plant at Chester and commit to moving to 100% renewable energy like P&G just pledged.
Helpful (1","Take sustainability more seriously or you will not survive competing against P&G. Need to get rid of the coal plant at Chester and commit to moving to 100% renewable energy like P&G just pledged.
",2.0,,,,,,,,
Tue Sep 22 2015, Capability Lead,"Alpharetta, GA",Former Employee ,Great Company,0,"Good company, Great benefits, good career option.
","Unstable in the recent past with a lot of good people either leaving the company on their own or laid off due to restructuring.
Helpfu",,3.0,5.0,5.0,4.0,2.0,2.0,Recommends,Neutral Outlook,No opinion of CEO
Fri Sep 04 2015,N/A,, ,Sr engineering manager,0,"Teamwork, flexibility safety of team teamwork safety flexibility flex summer hours working conditions hours pay time off 401k
Plan
","Work life balance, travel manufacturing sites in undesirable locations
Helpfu",,5.0,3.0,4.0,4.0,4.0,3.0,Recommends,Positive Outlook,
Fri Sep 04 2015, Forklift Operator,"Hampton, GA",Current Employee ,About Job,0,"Great company to work for, great higher ups, great pay, and they hire people with good team work ethics and personality.
","There really is not that many cons about the company, if you can get use to working long hours then you will be fine.
Advice to Management
Keep up the great team message and goal for everyone, continue to keep thriving for excellence,and I think our company mission will continue to be successful.
Helpfu","Keep up the great team message and goal for everyone, continue to keep thriving for excellence,and I think our company mission will continue to be successful.
Helpfu",4.0,4.0,4.0,4.0,4.0,4.0,Recommends,Positive Outlook,Approves of CEO
Wed Sep 02 2015,N/A,, ,Great company,0,"Great company to for work
","Not available for any information
Helpfu",,5.0,5.0,5.0,4.0,4.0,4.0,,,
Sun Aug 30 2015,N/A,"Neenah, WI","Procurement in Neenah, WI",Great company,0,"Great work environment, fantastic benefits, flexible work arrangements. Also the procurement organization is trurly world class
","With any large corporations, bogged down in tactical time consuming activities that are not value added.
Helpfu",,4.0,4.0,4.0,4.0,3.0,3.0,Recommends,Neutral Outlook,Approves of CEO
Sun Aug 23 2015,N/A,"Neenah, WI","Senior Account Management in Neenah, WI",Sr. Account Manager,2,"They were mentor ship form senior management as well as working closely with a well known retail chain. The daily interactions between the Retail consumer company and marketing team at Kimberly Clark.
","Change of Senior management. The new President of sales. All of senior management replaced by new president of consumer sales with his own team from past employer. Our teams that had been mentored by our former Senior management was no longer available for personal contact. A lot of senior account managers were replaced by new presidents former employer. Not a customer service team environment anymore.
Advice to Management
Please re-create the 'team' atmosphere between Sr. management, marketing staff and sales team. Stop ruling by intimidation and the four quad rating system. They had a strong sales force, team efforts and strong mentoring opportunities. They threw away a lot of seasoned professionals.
Helpful (2","Please re-create the 'team' atmosphere between Sr. management, marketing staff and sales team. Stop ruling by intimidation and the four quad rating system. They had a strong sales force, team efforts and strong mentoring opportunities. They threw away a lot of seasoned professionals.
",5.0,2.0,4.0,3.0,4.0,2.0,Doesn't Recommend,Positive Outlook,No opinion of CEO
Wed Aug 26 2015, Sales,,Current Employee ,Kimberly Clark Professional Sales,1,"Great work environment. Opportunity to work from home with work/life balance. KC give you the opportunity to work both independently and in group settings. Leadership at KC is good as long as your willing to play the corporate game.
","Sales team could benefit from being able to make more decisions independent of corporate approvals.
Helpful (1",,5.0,5.0,5.0,5.0,4.0,5.0,Recommends,Positive Outlook,Approves of CEO
Mon Aug 24 2015,N/A,, ,Job review,2,"Great work/life balance, flex arrangements available, career development opportunities in different functions, great full-service fitness center onsite
","Culture isn't that great right now due to job losses in early 2015, internal interviewing process needs improvement
Helpful (2",,4.0,4.0,4.0,4.0,4.0,3.0,Recommends,Positive Outlook,
Tue Aug 25 2015,N/A,, ,Engineer,0,"Highly ethical, recognized as one of the best places to work. The recognition is well deserved.
","None that I can think of
Helpfu",,5.0,4.0,5.0,5.0,4.0,4.0,Recommends,Positive Outlook,Approves of CEO
Sun Aug 16 2015, Consumer Insights,"Green Bay, WI",Current Employee ,KC,2,,"mer Insights in Green Bay, WI
Recommends
Positive Outlook
Approves of CEO
I have been working at Kimberly-Clark full-time for more than 3 years
Pros
Flexible work arrangements, casual dress, great co-workers
Cons
Limited mobility due to grade system.
Advice to Management
Several of my Co-workers have left because they are unable to advance to another role due to the grade system. At this time I am also weighing my options. You should consider a system that allows for experience and education, not just current grade.
Helpful (2","Several of my Co-workers have left because they are unable to advance to another role due to the grade system. At this time I am also weighing my options. You should consider a system that allows for experience and education, not just current grade.
",4.0,4.0,4.0,2.0,3.0,3.0,Recommends,Positive Outlook,Approves of CEO
Fri Aug 28 2015,N/A,, ,Continuous Improvement Consultant,4,,"ltant""
3.0
★★★★★
 Doesn't Recommend
Neutral Outlook
No opinion of CEO
I worked at Kimberly-Clark
Pros
Slightly above average pay scale. Dynamic environment with external customer as focus. Willing to discover new ways of conducting business IF the leadership team of the department or functional areas is on board. IF NOT you will get frustrated.
Cons
Depending on what part of the company you work with, there can be a strong influence of an insider's network of career employees. Many have learned how to protect their positions even though they may not be producing results. The organization also goes overboard on having meetings. Seems like they restructure the company every 3-4 years.
Advice to Management
Identify the next set of true leaders and let them run with the company. Stop outsourcing so many important areas to the business such as IT & HR
Helpful (4","Identify the next set of true leaders and let them run with the company. Stop outsourcing so many important areas to the business such as IT & HR
",3.0,4.0,2.0,3.0,4.0,3.0,Doesn't Recommend,Neutral Outlook,No opinion of CEO
Mon Aug 17 2015, Executive Assistant,"Neenah, WI",Current Employee ,Flexible Working Conditions,0,"Employees are empowered. Most teams offer flexible work arrangements.
","A lot of downsizing/reorganizations. Recent changes in senior management.
Helpfu",,5.0,4.0,5.0,3.0,5.0,3.0,Recommends,Neutral Outlook,
Sat Aug 15 2015,N/A,, ,Electrical Engineer,0,"people there are very friendly and helpful, a great place to work.
","didnt get much training on how the machine works, i guess i just need to find out by myself.
Helpfu",,5.0,5.0,5.0,5.0,5.0,5.0,Recommends,,Approves of CEO
Wed Aug 12 2015,N/A,"Dayton, NJ","Machine Operator in Dayton, NJ",Nice people,0,"Great things to say about this company
","Nothing negative to say this company
Advice to Management
Set good example
Helpfu","Set good example
Helpfu",4.0,5.0,4.0,4.0,4.0,3.0,Recommends,Positive Outlook,Approves of CEO
Wed Aug 12 2015,Anonymous,,Former Employee ,Fantastic Foundation,0,"Excellent to learn what good looks like! Great training, smart people and a winning attitude.
","Typical Corporate America - slow to change and a bit internal facing.
Helpfu",,5.0,4.0,5.0,5.0,5.0,4.0,Recommends,Positive Outlook,
Sun Aug 09 2015,N/A,"Irving, TX"," in Irving, TX",Global Senior Marketing Director,1,"The people and the products
","Best offices are in cities far away.
Helpful (1",,4.0,2.0,4.0,3.0,2.0,3.0,Recommends,Neutral Outlook,No opinion of CEO
Sat Aug 08 2015,N/A,, ,Associate Brand Manager,1,"Work-Life balance, friendly co-workers, low cost of living, training, defined career path
","Location, length of time in roles, lack of transparency from senior management on some decisions
Helpful (1",,4.0,5.0,5.0,4.0,3.0,3.0,Recommends,Positive Outlook,Approves of CEO
Mon Aug 24 2015,N/A,, ,kcc,0,"KC- BENEFITS Such as balance day, home office
","- salarie
- balance life vs work
Helpfu",,3.0,2.0,3.0,4.0,2.0,4.0,Doesn't Recommend,Neutral Outlook,Approves of CEO
Wed Aug 19 2015,N/A,"Roswell, GA"," in Roswell, GA",Good People - Lost Company,4,"The people in my team were great.
","Company seems to be a little lost. Cost reductions and restructuring on a 36 month cycle is disruptive and prevents employees from focusing on actually creating innovative new products.
Advice to Management
Get out of the restructuring/cost reduction cycle and think about where the company needs to be and how it can get there without losing what is at the heart of the company.
Helpful (4","Get out of the restructuring/cost reduction cycle and think about where the company needs to be and how it can get there without losing what is at the heart of the company.
",2.0,1.0,3.0,2.0,3.0,1.0,Doesn't Recommend,Negative Outlook,No opinion of CEO
Thu Aug 20 2015, Electrical Engineer,"Neenah, WI",Current Employee ,Electrical Engineer,1,"flexible work hours, comp time, travel (if you like it)
","Ability to move or gain other experiences lacking
Advice to Management
Don't move your people around like chess pieces
Helpful (1","Don't move your people around like chess pieces
",3.0,5.0,4.0,1.0,4.0,3.0,Doesn't Recommend,Neutral Outlook,Approves of CEO
Wed Jul 29 2015, Process Engineer,"Loudon, TN",Former Employee ,Process Engineer,3,"1. It was a safe place to work in.
2. I really enjoyed the process.
3. Had very good benefits for the family.
","I did not feel like I was part of the organization.
Advice to Management
Have an open mind, and be ready to listen to good and bad things when technical problems happened.
Helpful (3","Have an open mind, and be ready to listen to good and bad things when technical problems happened.
",4.0,4.0,5.0,4.0,4.0,2.0,Recommends,,
Thu Aug 06 2015,Anonymous,,Current Employee ,Would recommend,0,"Transparent leadership committed to making better work culture
For the most part, great people and helpful culture
","Complex structure
Decision making is slow but improving
Helpfu",,4.0,5.0,4.0,3.0,4.0,4.0,Recommends,Positive Outlook,Approves of CEO
Tue Aug 18 2015,N/A,, ,Great CPG Start,1,"Good place to start CPG brand management career. Marketing driven environment will provide classic brand foundation. Great cross functionals with strong desire to work together. Large national brands with big budgets. Movement across brands to gain wide variety of experiences.
","Location is great for families or short term experience. Large organization provides good foundation but is slow to make change.
Advice to Management
Give entry level MBAs more autonomy and exposure to senior leadership to enable ownership and faster growth. Provide more structured training.
Helpful (1","Give entry level MBAs more autonomy and exposure to senior leadership to enable ownership and faster growth. Provide more structured training.
",3.0,5.0,5.0,3.0,4.0,4.0,Recommends,Positive Outlook,Approves of CEO
Sun Sep 06 2015, Process Engineer,"Neenah, WI",Current Employee ,High turnover of young and ethnically diverse people in Neenah,5,"Great buildings, great benefits, and work-life balance. Learn something new everyday. Big name and lots of mills in the middle of nowhere.
","Senior management does not havr their priorities aligned. Neenah location it's focused for 40+ married with children white people. High turnover for millennials, and lack of ethnically diverse employees.
Advice to Management
Get your stuff together. Move away from Neenah please. In another 30 years you guys will have an extremely hard time to keep people around or to go work to Neenah. Knowledge is retiring and people aren't sticking around because of the location. Seriously at least relocate to Milwaukee. Do something, fast.
Helpful (5","Get your stuff together. Move away from Neenah please. In another 30 years you guys will have an extremely hard time to keep people around or to go work to Neenah. Knowledge is retiring and people aren't sticking around because of the location. Seriously at least relocate to Milwaukee. Do something, fast.
",1.0,3.0,2.0,2.0,4.0,1.0,Doesn't Recommend,Neutral Outlook,Disapproves of CEO
Sat Sep 05 2015,Anonymous,"Neenah, WI",Former Employee ,Brand Marketing,4,"Likes to hire from outside, has well known brands, low cost of living area.
","High turnover, huge reorgs in 2014 and 2015. Although hires from outside, there is more support for internally grown marketing persons. Leads to less innovative ideas. Long process to launch new products, gets beat out by competition. Too focused on grading for advancement.
Helpful (4",,1.0,4.0,3.0,1.0,3.0,1.0,Doesn't Recommend,Negative Outlook,Disapproves of CEO
Mon Aug 17 2015,N/A,, ,Spin off was a good move.,0,"A solid consumer goods company.
","Poor strategy for the healthcare market
Helpfu",,2.0,,,,,,Recommends,Neutral Outlook,No opinion of CEO
Fri Aug 14 2015,N/A,"Irving, TX"," in Irving, TX",Executive Assistant II,0,"Great campus and office environment
","contractor status ... no cons to state
Helpfu",,3.0,5.0,4.0,4.0,3.0,4.0,,,
Mon Jul 13 2015,N/A,"Dallas, TX"," in Dallas, TX",Massive change in organizational culture,3,"Great company with great heritage, people, teams and achievements.
","Some of the new outside leaders focus on financial assets instead of the great human asset.
Advice to Management
Keep the high level and quality of leaders, and be more selective with the new leaders.
It will help you to maintain your real talents.
Helpful (3","Keep the high level and quality of leaders, and be more selective with the new leaders.
It will help you to maintain your real talents.
",4.0,4.0,4.0,3.0,4.0,3.0,Recommends,,
Tue Jul 21 2015,Anonymous,"Appleton, WI",Current Employee ,Inventory Analyst,0,"Great culture
Given plenty of responsibility
Career advancement opportunities
","It's difficult to create change
Training is inconsistent across departments
Location
Advice to Management
Escalation through management is difficult.
Helpfu","Escalation through management is difficult.
Helpfu",4.0,5.0,5.0,3.0,2.0,3.0,Recommends,Positive Outlook,Approves of CEO
Tue Jul 07 2015,Op,"Marinette, WI",Mechanical Engineering Co,Mechanical Engineering Co-op,2,"Kimberly-Clark has a great HR department. During recruiting and employment as a mechanical engineering co-op, I had a great experience working with the HR department.

The pay is comparable to other internships and co-ops and the work is interesting.
","The town of Marinette, WI is not the most interesting place to have a co-op. I watched a lot of movies that summer and spent a lot of time by the lake and exploring the town.
Advice to Management
Keep things interesting for the co-ops during work, because the town is not going to keep any employees there.
Helpful (2","Keep things interesting for the co-ops during work, because the town is not going to keep any employees there.
",4.0,4.0,5.0,4.0,4.0,3.0,Recommends,,
Mon Jul 06 2015,N/A,, ,"Stable company, easy work",0,"Work has been easy in the first year.. to the point of boredom. Flexible work schedule, good benefits & pay
","Boring.... have to deal with being a small cog in a HUGE machine
Helpfu",,4.0,3.0,3.0,5.0,4.0,3.0,,,
Wed Jul 15 2015,Anonymous,,Current Employee ,Mixed experience,1,"Bonuses started in 2014. I have worked with some exceptionally smart, nice people who embraced the corporate values.
","There are big pockets of the company where the corporate values are just words and politics reign..
Advice to Management
Take a closer look at your leadership teams and the impact they have on corporate culture.
Helpful (1","Take a closer look at your leadership teams and the impact they have on corporate culture.
",3.0,3.0,3.0,2.0,4.0,2.0,Approves of CEO,,
Fri Jun 26 2015,N/A,, ,Location,0,"Great place to work. Friendly environment. Very flexible
","Location was hard to get use to
Advice to Management
Consider moving to a more diverse location
Helpfu","Consider moving to a more diverse location
Helpfu",4.0,5.0,4.0,4.0,4.0,4.0,Recommends,Neutral Outlook,No opinion of CEO
Tue Jul 07 2015,Anonymous,"Lagrange, GA",Current Employee ,No growth potential,2,"Quaterly bonus at 12%...if all goes well.
","Not a great place to work ....human resource team will help as much as they can.
Advice to Management
Lead to make leaders. ..
Helpful (2","Lead to make leaders. ..
",2.0,1.0,1.0,1.0,2.0,,Doesn't Recommend,Negative Outlook,Disapproves of CEO
Wed Jun 24 2015, Sales Account Manager,"Atlanta, GA",Former Employee ,Good enviroment,0,"Great company to work for
","Concentration on concepts and too much theory around the sales process
Helpfu",,4.0,4.0,4.0,5.0,4.0,3.0,Recommends,Positive Outlook,Approves of CEO
Wed Jul 08 2015,N/A,"Neenah, WI","Materials Planner in Neenah, WI",KC Planning,0,"Well paid, decent benefits, nice facilities
","Too many hours expected (salaried hourly wage greatly diminished by this); disparity in internal job posting
Advice to Management
Adopt a European attitude about work and home life - Work to live not live to work! Time off is good for employee morale.
Helpfu","Adopt a European attitude about work and home life - Work to live not live to work! Time off is good for employee morale.
Helpfu",3.0,2.0,3.0,3.0,4.0,3.0,Doesn't Recommend,Neutral Outlook,Disapproves of CEO
Fri Jun 19 2015, Finance Manager,"Neenah, WI",Former Employee ,Finance,1,"Great company! Many good people. Friendly atmosphere. Great place to begin your career. Great entry level positions. Good pay. Good benefits.
","Poor communication from midlevel management. Must believe in and support your people. Lack of trust for midlevel management. Takes too long to make sound decisions. Too many meetings..
Advice to Management
Believe in your people
Helpful (1","Believe in your people
",4.0,2.0,3.0,3.0,3.0,3.0,Recommends,Positive Outlook,Approves of CEO
Tue Jun 16 2015,N/A,"Irving, TX","SAP Analyst in Irving, TX",SAP,0,"Nice environment and benefits. Flexible hours
","Too uch time is needed to do a career inside
Helpfu",,4.0,4.0,3.0,3.0,3.0,3.0,Recommends,Positive Outlook,Approves of CEO
Tue Jun 09 2015, Transportation Analyst Co,"Knoxville, TN",Former Employee ,Great experience with a great team,0,"Very friendly atmosphere and awesome managers. Lots of learning opportunities and a lot of responsibility
","I really can't think of many. I would still be there today if they offered a higher entry level salary.
Advice to Management
Keep doing what you are doing. Kimberly Clark has a great family like atmosphere.
Helpfu","Keep doing what you are doing. Kimberly Clark has a great family like atmosphere.
Helpfu",5.0,5.0,5.0,4.0,3.0,5.0,Recommends,Positive Outlook,Approves of CEO
Wed Jun 17 2015,Anonymous,,Former Employee ,Good place to work,1,"Pay and benefits are decent
","Any raise you get will be very small, and the ability to move up in the company is difficult
Helpful (1",,3.0,3.0,3.0,2.0,4.0,3.0,,,
Mon Jun 01 2015,Anonymous,,Current Employee ,HR Director,0,"Billion $ Brands, Strong Leadership and Employee Engagement
","Organizational change orientation is slow
Helpfu",,4.0,5.0,4.0,4.0,3.0,4.0,Recommends,Positive Outlook,
Wed Jun 10 2015,N/A,"Roswell, GA"," in Roswell, GA",Good benefits and pay,2,"Summer hours, Health Center on site
","Layoffs occur every 4-5 years
Helpful (2",,3.0,4.0,3.0,2.0,3.0,2.0,Neutral Outlook,,Disapproves of CEO
Thu Jun 04 2015,Anonymous,"Irving, TX",Former Employee ,Internal Audit,4,"Travel, good overall team atmosphere at KC, corporate is casual (jeans) attire, plenty of learning opportunities, good clients to work with,the kool-aid is high among most people
","Most all are Big4 (esp EY), if you don't have Big4 experience, it will be hard to fit in. The teams are cliques sometimes so it is hard to connect but most are nice people. There is massive turnover in this group on a constant and continuous basis, not stable. Mainly due to work styles, and not promoting fast enough. Prepare for shifting priorities, long hard hours, extended engagements in the field, also the turnover.
Helpful (4",,3.0,2.0,3.0,3.0,3.0,2.0,Recommends,Neutral Outlook,No opinion of CEO
Mon Jun 08 2015,N/A,"Roswell, GA"," in Roswell, GA",Senior Research Scientist,1,"Great with flex time and summer Friday afternoons off. Nobody is looking over your shoulder making sure you are putting in specific hours it is all about getting your work done.
","As an R& D person, over the years there seems to be less emphasis on doing good experimentation and fundamental research more on outsourcing and project management. It is less rewarding if that is your interest.
Helpful (1",,3.0,5.0,5.0,3.0,3.0,4.0,,,
Mon Jun 01 2015,N/A,"Loudon, TN","Pulper in Loudon, TN",I,1,"Inside work reliable pay and the people are great to work with.
","Pay could be better and shift work will eventually kill you.
Advice to Management
Give back to the little people we are Kimberly Clark.
Helpful (1","Give back to the little people we are Kimberly Clark.
",3.0,2.0,3.0,3.0,2.0,3.0,Recommends,,Approves of CEO
Tue May 12 2015, Senior Operations Consultant,"Neenah, WI",Current Employee ,Global company with strong culture of caring and authenticity,2,,"ltant in Neenah, WI
Recommends
Neutral Outlook
I have been working at Kimberly-Clark full-time for more than 10 years
Pros
Collaborative culture. People care about each other. Stable. Great global opportunities. Strong current focus on driving diversity and diversity of thought.
Cons
Strong focus on cost reduction. Global company wide restructuring every four-five years like clock work. Locations may not be desirable to everyone.
Advice to Management
Do not lose the collaborative culture and teamwork that makes K-C such a good place to work.
Helpful (2","Do not lose the collaborative culture and teamwork that makes K-C such a good place to work.
",4.0,4.0,5.0,3.0,3.0,3.0,Recommends,Neutral Outlook,
Sat May 16 2015,N/A,, ,Good to gain experience,2,"Great life-work balance
Great benefits and perks while on company events
Opportunity for advancement
","Insufficient training for new employees
Not many authentic work relationships
Not a lot of team mindset or team work
Hard to be promoted if not willing to relocate 
Not diverse (ethnicity)
Plans at corporate are at times not achievable at offices
Helpful (2",,3.0,4.0,3.0,3.0,4.0,3.0,Doesn't Recommend,Positive Outlook,Approves of CEO
Wed May 06 2015, Project Electrical Engineer,"Paris, TX",Former Employee ,Great Company,0,"Training opportunities, technical challenges, some leading edge technologies, broad spectrum of electrical disciplines needed, PLC programming/troubleshooting skills highly valued, team oriented, peer mentoring, leadership opportunities, normally light travel requirements.
","sometimes long work hours (greater than 12 hours / day or more than 25 days per month), occasionally medium travel requirements, career development process and performance management is highly controversial among staff and managers alike.
Advice to Management
Continue to evaluate employee performance against goals and achievements. Continue to aggressively pursue growth in new products and new markets 'that make sense.' Congratulations on placing work/life balance policies in place making family life more pleasant for your employees.
Helpfu","Continue to evaluate employee performance against goals and achievements. Continue to aggressively pursue growth in new products and new markets 'that make sense.' Congratulations on placing work/life balance policies in place making family life more pleasant for your employees.
Helpfu",4.0,4.0,3.0,2.0,3.0,3.0,Recommends,Positive Outlook,
