date,employee_title,location,employee_status,review_title,helpful,pros,cons,advice_to_mgmt,rating_overall,rating_balance,rating_culture,rating_career,rating_comp,rating_mgmt,recommends,positive_outlook,approves_of_CEO
Sun Jul 21 2013,Anonymous,"Neenah, WI",Current Employee ,Keep rotating employees - offer minimal raises,3,"Some great products and great potential but unable to maximize due to current working atmosphere. There are a lot of procedure and tools in place to help you succeed, but tough to utilize.
","Layoff after layoff, plants closing........zero loyalty to employees. Current regime is maximizing profit dollars by paying 1% raises to there ""performers"" and now cutting the bonus of those who fail to meet expectations. Products priced higher than competition and main focus is Walmart and Costco. Understand business is business but the misinformation the company puts out to redirect attention away from their shortfalls is not right/moral.
Advice to Management
Your yearly employee review of the company says it all. 4 years in a row your internal survey states no confidence in management.......there is a reason.
Helpful (3","Your yearly employee review of the company says it all. 4 years in a row your internal survey states no confidence in management.......there is a reason.
",2.0,2.0,4.0,2.0,2.0,2.0,Doesn't Recommend,Neutral Outlook,Disapproves of CEO
Fri Jul 19 2013, Manager,,Former Employee ,Risk-averse and slow.,1,"Job stability. Access to wide range of internal expertise.
","Company is non-innovative and will not take even calculated risks. Strategic direction is questionable at best. Compensation is not competitive with other healthcare companies. Culture of brainwashing.
Advice to Management
Take some risks on new products. Toilet paper cash cow is great, but investors will catch on. Innovation is key to real growth.
Helpful (1","Take some risks on new products. Toilet paper cash cow is great, but investors will catch on. Innovation is key to real growth.
",3.0,3.0,1.0,3.0,2.0,2.0,Doesn't Recommend,Neutral Outlook,No opinion of CEO
Tue Jul 09 2013,N/A,, ,"Okay, but not great",0,"Overall, people are really great to work with and pay is competitive
","Definitely some poor management styles, especially at the lower levels. Poor review system at the end of the year that doesn't accurately depict an individual's performance.
Helpfu",,3.0,,,,,,,,
Tue May 28 2013, Machine Operator,"Neenah, WI",Current Employee ,36 years at KC,3,"Good wage. Benefits were good. Eroded the last ten years.
","I have been through facility sales and closures. Do not believe a word they say. Will change tomorrow. Company is always tripping over dollars to pick up a penny. Management is very disconnected with what is going on on the ""floor"" of the manufacturing process.
Advice to Management
Really????
Helpful (3","Really????
",3.0,1.0,1.0,3.0,3.0,1.0,Doesn't Recommend,Positive Outlook,No opinion of CEO
Fri May 03 2013, Senior IT Analyst,"Neenah, WI",Current Employee ,KC A great place to work,0,"Great people, great pay, great benefits not just traditional ones either (example summer hours and flex work). Management seems to have an ear open and has been making great progress in improving the work-life balance.
","Sometimes can be restricive on things you need to get the job done.
Advice to Management
Help empower the employees to be able to make decision and to have the tools at their disposal to do their job.
Helpfu","Help empower the employees to be able to make decision and to have the tools at their disposal to do their job.
Helpfu",5.0,5.0,5.0,5.0,5.0,4.0,Recommends,Positive Outlook,Approves of CEO
Tue Apr 23 2013, Marketing Manager,,Former Employee ,KC Latin America - Great Place to Work,0,"Culture, Leadership and career opportunities
","The Salaries doesn't match the market.
Advice to Management
Need to launch new businesses to compensate the decay of core businesses
Helpfu","Need to launch new businesses to compensate the decay of core businesses
Helpfu",5.0,4.0,5.0,5.0,3.0,5.0,Recommends,Neutral Outlook,No opinion of CEO
Sun May 05 2013, Manager,"Atlanta, GA",Current Employee ,Global relationship manager,0,"Multinational company that gives a lot learning
","The decision making and change is slow
Helpfu",,3.0,4.0,5.0,3.0,3.0,4.0,Recommends,Neutral Outlook,No opinion of CEO
Mon Apr 29 2013, Intermittent,"Neenah, WI",Former Employee ,Long Term Intermittent Employee / No Benefits,0,"Good Wages
Fulfilling work
Many chances for learning
","No benefits 
No Job Security
Advice to Management
Consider Hiring quality Intermittent
Helpfu","Consider Hiring quality Intermittent
Helpfu",3.0,4.0,4.0,1.0,2.0,4.0,Recommends,Neutral Outlook,Approves of CEO
Sat Apr 13 2013, Electrical Engineer,"Jenks, OK",Former Employee ,"Decent place to work, be careful of the politics",0,"Decent salary, lots of projects going on, benefits are good, coworkers help make it feel like a family environment.
","Not very clear on how to get raises and promotions, can get easily pigeonholed into a position. Management tends to tell you one thing in private, then acts a different way in public. Had many experiences with people going directly to senior leadership to get what they wanted done without ever asking their direct supervisor.
Advice to Management
Help work with the people on career development and advancement.
Helpfu","Help work with the people on career development and advancement.
Helpfu",4.0,4.0,3.0,4.0,4.0,3.0,Recommends,Neutral Outlook,Disapproves of CEO
Thu May 02 2013, Material Handler,"Ogden, UT",Former Employee ,kimberley clark ruined my life and forced me to quit and not be able to find another job.,3,"good pay,benefits,and double time sundays
","way too much overtime in the summer can not enjoy summer because you ar always woking at least five twelve hour shifts with only 24 hours off usually.
Advice to Management
upper management needs to communicate better with employees and stop making rules and changes without telling the employees in advance. and fire tom falk and get a CEO that wont drive the company into the ground.
Helpful (3","upper management needs to communicate better with employees and stop making rules and changes without telling the employees in advance. and fire tom falk and get a CEO that wont drive the company into the ground.
",1.0,1.0,4.0,2.0,4.0,1.0,Doesn't Recommend,Negative Outlook,Disapproves of CEO
Wed Mar 20 2013, Project Leader,"Roswell, GA",Former Employee ,Great company!,1,"Challenging environment - great place to work - pays well
","In some areas, risk taking is not encouraged
Not a global company yet, too many silos still
Advice to Management
Get out of headquarters more and visit the regional offices more
Helpful (1","Get out of headquarters more and visit the regional offices more
",4.0,5.0,4.0,3.0,4.0,3.0,Recommends,Neutral Outlook,Approves of CEO
Mon Apr 01 2013, Consumer Service Representative,"Neenah, WI",Current Employee ,Working as a Consumer service representative,0,,"mer service representative""
3.0
★★★★★
Current Employee - Consumer Service Representative in Neenah, WI
Recommends
Neutral Outlook
No opinion of CEO
I have been working at Kimberly-Clark full-time for more than 3 years
Pros
If you like a 9 to 5 position, this is nice. The company also offers summer hours. The job is not physically demanding, nor intellectually demanding, the tasks are pretty routine. Allows you to work on your patience (a great virtue) when dealing with consumers who contact you about trivial things.
Cons
Too mundane, at least for me. Doesn't leave room for creativity. If you have a complaint about your position or you want something to change, you may not be successfull. Everything is standardized. No room for creativity.
Advice to Management
Provide more autonomy to the phone agents
Helpfu","Provide more autonomy to the phone agents
Helpfu",3.0,4.0,4.0,3.0,4.0,2.0,Recommends,Neutral Outlook,No opinion of CEO
Fri Mar 29 2013, Consultant,,Former Employee ,Good as a stepping stone,0,,"ltant 
Recommends
Negative Outlook
Disapproves of CEO
I worked at Kimberly-Clark full-time for more than 10 years
Pros
The compensation and benefits package is good. There is good opportunity to learn new skills as there is always some change taking place.
Cons
Management does not put enough stock in feedback from the front-lines. Upper levels seem to be more concerned with public perception than creating meaningful solutions with internal process improvements.
Advice to Management
Stop worrying about what ""The Street"" thinks and do what is right by your employees and customers. ""The Street"" will eventually come around.
Helpfu","Stop worrying about what ""The Street"" thinks and do what is right by your employees and customers. ""The Street"" will eventually come around.
Helpfu",3.0,4.0,3.0,3.0,4.0,2.0,Recommends,Negative Outlook,Disapproves of CEO
Sun Feb 17 2013, Research Scientist,"Roswell, GA",Current Employee ,Mobility Within Company,1,"Great salary, ability to move jobs within the company.
","Diversity is promoted more than it is valued.
Helpful (1",,5.0,5.0,5.0,5.0,5.0,5.0,Recommends,Positive Outlook,Approves of CEO
Fri Feb 22 2013,Anonymous,"Neenah, WI",Current Employee ,Solid company,0,"Fantastic assembly of people, some of the most iconic brands in the world and, depending on what brand you work for, the ability to independently manage a large swath of the business
","Location relative to other CPG companies is not optimal and for 2-3 brands the amount of layered over-staffing can be stifling.
Advice to Management
Less interference is better, however I've never worked at a company whose people, from the CEO to the Admin, had as much passion for what they do and so much personality doing it
Helpfu","Less interference is better, however I've never worked at a company whose people, from the CEO to the Admin, had as much passion for what they do and so much personality doing it
Helpfu",4.0,4.0,5.0,3.0,5.0,4.0,Recommends,Positive Outlook,Approves of CEO
Tue Mar 19 2013, Individual Contributor,"Roswell, GA",Current Employee ,Management doesn't get it.,10,"-Great coworkers
-Great location for Metro Atlanta area
-Beautiful corporate campus
-Great health center/exercise facility and wellness programs
-Decent benefits; medical/dental/profit sharing
","-Management driven by Street results...regardless of internal ""cost""
-Respect for employees/indviduals marginal at best
-Old boy network; promotion based on who you know/currying favor
-Limited recognition of individual contribution
-Old forced ranking system was deadly; new system is inexplicable
-Average pay now limited by ""Market Based Compensation"" measures
-Internal employee motivation programs based on ludicrous consultant recommendations
-Unresolved struggle between old school and new school management philosophies @ top 
-Lean and mean has become corporate anorexia; too many tasks, too few people
-Top management completely out of touch with day-to-day employee issues, needs and activities
-Ridiculous internal computer/data systems for day-to-day operation with no training; systems change with no announcement, leaving non-IT employees to ""work it out on the ground""
-Team leaders/directors have their eyes pointed upwards; very limited contact/direction for their teams
Advice to Management
Looking down the barrel of a 30+ year career, I've seen good and bad from KC. Right now, it's mostly bad.

The company just reissued an engagenement survey...the same as done 2-3 years ago. The results then were pretty abysmal, but none of that feedback got management action. No doubt, this survey will yield the same results. I'm sure it's a warm feeling in the pants of top management, but when will management really listen? All those employees can't be completely wrong.

Get back in touch. Mill workers feel management is out of touch. Professionals think they're out of touch. Go spend some time on the shop floor...in the marketing and sales offices. See what the real issues are...and meditate on what you fine before making your next cost-cutting decision.

Pick a direction and a corporate mission that's real and home-grown. The consultants are sucking money out of you. You know he business, the assets and capabilities. Whatever you decide, resouce it and stick with it.
Helpful (10","Looking down the barrel of a 30+ year career, I've seen good and bad from KC. Right now, it's mostly bad.

The company just reissued an engagenement survey...the same as done 2-3 years ago. The results then were pretty abysmal, but none of that feedback got management action. No doubt, this survey will yield the same results. I'm sure it's a warm feeling in the pants of top management, but when will management really listen? All those employees can't be completely wrong.

Get back in touch. Mill workers feel management is out of touch. Professionals think they're out of touch. Go spend some time on the shop floor...in the marketing and sales offices. See what the real issues are...and meditate on what you fine before making your next cost-cutting decision.

Pick a direction and a corporate mission that's real and home-grown. The consultants are sucking money out of you. You know he business, the assets and capabilities. Whatever you decide, resouce it and stick with it.
",1.0,2.0,4.0,2.0,3.0,1.0,Doesn't Recommend,Neutral Outlook,Disapproves of CEO
Wed Feb 13 2013, Project Scientist,"Neenah, WI",Current Employee ,A great company to work for in a great location,0,"Very flexable and supportive organization.
","Large company that can seem slow and slugish at times
Helpfu",,5.0,5.0,5.0,4.0,5.0,5.0,Recommends,Neutral Outlook,Approves of CEO
Wed Mar 06 2013, Senior Scientist,"Neenah, WI",Current Employee ,Gross Mismanagement,6,"The people are great. At least the few who haven't left. Tons of talent has been driven out or has left the company. 

Senior Executives are getting incredibly rich.

New Vice Presidents, almost all external hires, pop up almost daily.
","Wave after wave of layoffs and recent mill closings have resulted in a disenchanted work force in many areas.

Cost cutting is now cutting to the bone. Fat was cut away many years ago. 

If you aren't in health care expect ongoing budget cuts to continue. This leadership has no idea how to spend profits to grow the company. Bring your own water - nothing is free.

Layers of management coupled with political correctness gone wild make many groups unbearable to work for.

Performance Management. If you are with KC you know what I'm talking about. This system is a cancer to the company and has sucked the life out of many great workers.
Advice to Management
Senior management has an agenda to make themselves rich and they are executing it at the expense of their ""family"" of employees. 

Do families, like Senior Management regularly pretends we are, really cut off hard working sons and daughters when the financials get tough? ""Son, we have lots of money but I need to please the market so I'm going to have to sell you off"". 

At KC you are not family - you are a headcount and will be cut when needed. Advice: don't blow smoke up you know where. Tell people the truth. Its all about the money - there is no concern for individuals. Simple honesty would be refreshing.
Helpful (6","Senior management has an agenda to make themselves rich and they are executing it at the expense of their ""family"" of employees. 

Do families, like Senior Management regularly pretends we are, really cut off hard working sons and daughters when the financials get tough? ""Son, we have lots of money but I need to please the market so I'm going to have to sell you off"". 

At KC you are not family - you are a headcount and will be cut when needed. Advice: don't blow smoke up you know where. Tell people the truth. Its all about the money - there is no concern for individuals. Simple honesty would be refreshing.
",1.0,1.0,1.0,1.0,2.0,1.0,Doesn't Recommend,Negative Outlook,Disapproves of CEO
Thu Jan 31 2013,N/A,, ,Great for Marketers,0,"Classic brand management training, working with major brands. The company provides great resources for employees and opportunities for advancement.
","Friendly but small community for those used to big cities.
Helpfu",,4.0,,,,,,,,
Thu Feb 07 2013, Packaging Engineer,"Neenah, WI",Current Employee ,Engineer,0,"Great work and life ballance
","Not much opportunity to learn outside of personal care products
Neenah, WI
Advice to Management
Management was very good in providing feedback, but not driven on continuous improvement of employees.
Helpfu","Management was very good in providing feedback, but not driven on continuous improvement of employees.
Helpfu",3.0,5.0,3.0,3.0,2.0,3.0,Doesn't Recommend,Neutral Outlook,No opinion of CEO
Wed Jan 23 2013, Operations Consultant,"Roswell, GA",Former Employee ,Wonderful career with an established company who is constantly reinventing itself,0,,"ltant in Roswell, GA
Recommends
Positive Outlook
Approves of CEO
I worked at Kimberly-Clark full-time for more than 10 years
Pros
There are many good and conscientious people in the upper management who support diversity. Competitive compensation and benefits package. Great gym and wellness facility (in the Roswell, GA area).
Cons
Because it is a public company, it is always under pressure to show good performance now! Employee performance review deemed by many as not producing better performing employees.
Helpfu",,5.0,4.0,4.0,3.0,4.0,4.0,Recommends,Positive Outlook,Approves of CEO
Sat Jan 19 2013, Business Analyst,"Neenah, WI",Current Employee ,Great company with lot's of opportunities,0,"Many different career paths to choose. Freedom to set how you want to do your job without too many procedures.
","Work at times requires lots of hours. Still some red tape to deal with but it has been reducing every year
Helpfu",,4.0,3.0,4.0,5.0,3.0,4.0,Recommends,Positive Outlook,No opinion of CEO
Sun Jan 20 2013,Op,"Beech Island, SC",Engineering Co,"Good company, great people",0,"Caring employees and everyone's willing to help. good emphasis on safety and sustainability. Rarely see business confrontations.
","workplace may seem boring and not many new hires/co-op get a lot of instruction when they first come in. Their role is a little undefined in the workplace. Seems like more meetings than productivity sometimes.
Advice to Management
be aware of small ideas from lower employees that could lead to great success, take more time into improving the liveliness of the workplace atmosphere - innovate ways to make people want to come to work everyday. Start hiring more new talent with fresh ideas.
Helpfu","be aware of small ideas from lower employees that could lead to great success, take more time into improving the liveliness of the workplace atmosphere - innovate ways to make people want to come to work everyday. Start hiring more new talent with fresh ideas.
Helpfu",4.0,,,,,,Recommends,,
Fri Jan 18 2013, Accountant,"La Habra, CA",Current Employee ,accountant,0,"good environment , and team work
","bad salary, no promotion, bad distance
Helpfu",,5.0,3.0,3.0,2.0,3.0,3.0,,,
Tue Jan 15 2013, Administrative Assistant II,"Neenah, WI",Current Employee ,Nice Place to work just don't get stuck on a PIP,0,"Great place to work with work/life balance
","Performance Review system is horrible. You get put into boxes that rate you.... However, there HAS to be a certain % of folks that fall within the low boxes. If you end up as one of those folks you are digging yourself out of a hole for at least a year or more and you are not allowed to even apply for another area within the company.
Benefits are a bit pricey.
Advice to Management
Stop with the politics of performance management!
Helpfu","Stop with the politics of performance management!
Helpfu",4.0,5.0,4.0,3.0,3.0,3.0,Recommends,Neutral Outlook,No opinion of CEO
Fri Jan 04 2013, Senior Systems Analyst,"Neenah, WI",Current Employee ,VERY Satisfied!,0,"Great place to work.
Great People.
People are high quality and caring. Everyone wants to do a great job and yet everyone understands there is life outside of work too.
","This is a very large organization so sometimes getting things done takes much longer than I was used to in a smaller corporation. It can be difficult to keep big picture in mind.
Advice to Management
Keep doing everything the same and continue the great organizational and people focused efforts!
Helpfu","Keep doing everything the same and continue the great organizational and people focused efforts!
Helpfu",5.0,5.0,5.0,4.0,4.0,5.0,Recommends,Positive Outlook,Approves of CEO
Mon Jan 14 2013,Anonymous,"Everett, WA",Former Employee ,Great place to work until they closed the mill.,0,"Good wages and benefits, emphasis on safety in the mill, good people to work with. The company likes to hire recent college grads and does provide internships/coop experience.
","Kimberly-Clark closed the Everett mill site in April of 2012, putting 750 people out of work. They are rumored to be closing more sites in the future.

Local managers are good but often hampered by direction from corporate headquarters.

24/7 operation hard on family life. 

No help from the corporation in finding work at other KC mills when the Everett mill closed.

If you are a salaried employee, you can not move up in the company unless you relocate to other locations around the country. Hourly (union) employees can not move up out of production jobs without a degree.
Helpfu",,3.0,2.0,4.0,3.0,4.0,2.0,Doesn't Recommend,Neutral Outlook,No opinion of CEO
Wed Dec 19 2012, Supply Chain Analyst,"Atlanta, GA",Former Employee ,KC is a great company to advance in.,0,"The company has provided great opportunities for advancement.
","No complaints at this time.
Helpfu",,4.0,3.0,3.0,4.0,3.0,3.0,Recommends,Neutral Outlook,Approves of CEO
Sun Jan 20 2013, Product Manager,"Roswell, GA",Former Employee ,Would not recommend to anyone. Save your career and stay away.,3,"Some like minded people will gel together, suffer together. Lot of exposure.
","I worked in other large organizations before, never have I seen a more conservative company. Culture is pre 1960's. Undisclosed code of Jewish/Minority hatred. The diversity program is a hack. If you are a person of color, black, brown, yellow or any shade in between, save your career and stay away. There is a reason why there are so many discrimination and wrongful termination lawsuits against this company. The folks who are promoted are mere puppets. Incompetence is constantly rewarded and applauded. If you are a smart and hardworking white guy/gal, be prepared to head out, because you are a threat to the establishment. They will find a way to push you out. If you are Jewish, good luck. Be prepared for some isolation. There is no scale to measure the antisemitic index. Simply put discriminatory environment and racist management. Do not fall for some of the glowing and positive reviews on Glassdoor. Most likely they are paid temps, just loading up on positive ratings so as to keep the average above 3. Yeah, they have done that too. Mckinsey consultants now hold key positions within the company and will most likely split it up and sell it in pieces. So, no future prospects what so ever. Stay away.
Advice to Management
You can't fix stupid. So, no point in giving any advice.
Helpful (3","You can't fix stupid. So, no point in giving any advice.
",1.0,2.0,1.0,1.0,2.0,1.0,Doesn't Recommend,Negative Outlook,Disapproves of CEO
Mon Dec 10 2012, Financial Analyst,"Neenah, WI",Current Employee ,Great Place to Work,0,"I like what I do, feel like I make a difference, good training program
","Can get stuck in same role for awhile, other people are fast tracked and do not spend much time in a role
Helpfu",,4.0,4.0,3.0,3.0,4.0,4.0,Recommends,Positive Outlook,Approves of CEO
Mon Dec 03 2012,Anonymous,"Roswell, GA",Current Employee ,"Great development experiences, now tend to stall out at higher levels",0,"I've had great development experiences across various sectors of the business, and in different locations. Lots of responsibility, even when I was junior with the firm. Good resources to help mentor and grow talent within.
","Trend over the last 5-7 years has been to hire externally (and, usually with dubious success.) Add that to much into narrower career ladders as a result of restructures. So, it's been harder to get development into director level and higher as they've been filling the few positions that exist from outside when they do open up.
Advice to Management
Rethink your development roles below MAAP/director--you need to have them. Create a formal development program for high potential talent and then use it judiciously.
Helpfu","Rethink your development roles below MAAP/director--you need to have them. Create a formal development program for high potential talent and then use it judiciously.
Helpfu",4.0,4.0,4.0,4.0,4.0,4.0,Recommends,Positive Outlook,Approves of CEO
Tue Jan 08 2013, Electrician,"Everett, WA",Former Employee ,Let down,0,"Great people to work with and learn from. place offered a variety of challenges to keep a pulp and paper mill running.
","managers were some of the worst. no real experience in making paper or maintaining a mill. just a bunch of kids out of college trying to get a big company name on there resume. Lots of confusion with in the management structure and high turn over. When they closed the mill upper management lied to its employees and said they were 2years out from closing. turn out to be 12 months or less for sum
Advice to Management
cant give any to them.. they already know it all.
Helpfu","cant give any to them.. they already know it all.
Helpfu",1.0,1.0,1.0,1.0,1.0,1.0,Doesn't Recommend,Negative Outlook,Disapproves of CEO
