date,employee_title,location,employee_status,review_title,helpful,pros,cons,advice_to_mgmt,rating_overall,rating_balance,rating_culture,rating_career,rating_comp,rating_mgmt,recommends,positive_outlook,approves_of_CEO
Tue Apr 11 2017, Sales Associate,"Miami, FL",Current Employee ,Hard Sell,1,"Great management, family orientated work environment.
","Low pay for years of experience.
Advice to Management
Pay employees based on experience.
Helpful (1","Pay employees based on experience.
",3.0,1.0,4.0,3.0,3.0,2.0,Doesn't Recommend,Neutral Outlook,
Sun Jun 23 2019, Interior/Furniture Coordinator,Tokyo,Former Employee ,I will coordinate furniture,0,"Have great knowledge and connections of furniture industries.
","It is difficult to go overseas business trip for a while.
Helpfu",,4.0,,,,,,,,
Fri Aug 10 2018, Human Resources Manager,Pune,Former Employee ,Work culture,1,"Nice store, good products, good location
","Lack of leadership, single entrepreneur business with dictatorship attitude Of owner, delayed salaries, no work life balance, no respect for hard workers,
Helpful (1",,2.0,1.0,1.0,2.0,5.0,5.0,Doesn't Recommend,Neutral Outlook,
Fri Jul 15 2016,N/A,Pune, in Pune,cook,0,"lots to learn, very good chef to lean under and develop yourself.
","very low pay, no growth.
Helpfu",,3.0,3.0,2.0,1.0,1.0,2.0,Doesn't Recommend,Neutral Outlook,
Mon Sep 07 2015,N/A,"Ottawa, ON","Junior Sous Chef in Ottawa, ON",Good learning experience,0,"Lots to learn. The Chef is really helpful and full of knowledge.
","Very small space to work in.
Helpfu",,4.0,4.0,3.0,4.0,2.0,3.0,Recommends,Neutral Outlook,
Sun Oct 26 2014, Developer,Pune,Current Employee ,Get to learn more in a small scale industry,0,"Get to learn more
Strict rules and regulation
","Less PayScale 
Work more for what you get paid
Advice to Management
Consider revising your policies and treat your employee much better of what they deserve.
Helpfu","Consider revising your policies and treat your employee much better of what they deserve.
Helpfu",2.0,2.0,3.0,2.0,2.0,2.0,Recommends,Positive Outlook,
