date,employee_title,location,employee_status,review_title,helpful,pros,cons,advice_to_mgmt,rating_overall,rating_balance,rating_culture,rating_career,rating_comp,rating_mgmt,recommends,positive_outlook,approves_of_CEO
Thu Aug 20 2015,Anonymous,"Milwaukee, WI",Former Employee ,Worst Professional Experience Ever,2,"It was a paycheck and that was all it was.
","This was by far the worst professional experience of my life. ManpowerGroup is a very poor employer.

There is absolutely no career development. The company requires you to fill out performance development plans every year along with answering questions about your life goals and where you want to be and what you want to do. They basically expect you to be in the same role forever.

Their performance development plans are pointless. It’s the same process ever year with absolutely no perceived benefit to the employee. It only benefits the company because if you can’t meet every single lofty expectation, which is usually quite the challenge, it is used as the basis as another excuse for not being able to provide a compensation increase. 

There are no such things as promotions, at least that I witnessed in 10 plus years. The only people that seem to move from position to position are the executive staff. Quite frequently, the company will hire from outside before supporting the development of its internal employees.

The company thinks that a year-end increase of is a “bonus.” I guess they’re not aware of something called inflation. They’re a $20.8 Billion dollar company and they can’t afford to provide bonus incentives. 

They make very poor choices in management figures. In many instances, management figures are condescending and rude. In my own experience I experienced a manager question whether I had Alzheimers because of an email that I sent that she found confusing. That is not a joke.

Most if not all company employment policies are geared towards the benefit of the company. You cannot roll over vacation. No bonuses. In many instances, you have to schedule your vacation months in advance. If you read the employee handbook, it’s apparent that ManpowerGroup has carefully thought out each policy in order to make sure the company benefits in the end while the employee sees little benefit.

Finally, if you care about a work/life balance, then this is not the place for you. There is zero work/life balance…..it’s only work. They’re expectation of 50--60 hours a week on a consistent basis (in my case over 4-5 years) is absurd. In my opinion after more than a decade, it seemed as though the company was trying to take over my life. 10-12 hour days and most weekends. Just not worth it. Life it too short.
Advice to Management
Employees want two things: money and time off. A work/life balance also helps. Recognition in the form of certificates and ""spot awards"" is irrelevant.
Helpful (2","Employees want two things: money and time off. A work/life balance also helps. Recognition in the form of certificates and ""spot awards"" is irrelevant.
",1.0,1.0,1.0,1.0,2.0,1.0,Doesn't Recommend,Neutral Outlook,No opinion of CEO
Wed Jul 22 2015,Anonymous,,Current Employee ,experience,0,"Good company. Great work environment
","Needs to be a permanent position.Good company
Helpfu",,3.0,4.0,5.0,4.0,3.0,5.0,Neutral Outlook,,Approves of CEO
Mon Jul 20 2015,N/A,"Milwaukee, WI","Experis Associate IT Recruiter in Milwaukee, WI",Great Culture,0,"Culture is great! Unlimited overtime.
","Low pay, but if you are contracted you can work overtime.
Helpfu",,2.0,2.0,4.0,3.0,2.0,,No opinion of CEO,,
Tue Aug 04 2015, Executive Assistant,"Milwaukee, WI",Current Employee ,Ethical Nightmare of a Company,7,"HQ atmosphere is pleasant and corporate amenities are good.
","The violations of the ethics policies at the top of the organization are astounding. Even after incidents are reported through the proper HR channels, by numerous employees, HR turns their collective head. Examples include: fraudulent business trips, falsified expenses, retaliation, blatant disrespect for corporate and IRS regulations on things like the relocation policy. The more people I speak with about ManpowerGroup the more I realize that this is common at the top level of the global sales organization. Disgraceful for a company that prides itself on it's ethics.
Advice to Management
If you choose to have ethics policies, enforce them.
Helpful (7","If you choose to have ethics policies, enforce them.
",1.0,2.0,1.0,2.0,2.0,3.0,Doesn't Recommend,Neutral Outlook,No opinion of CEO
Thu Jul 16 2015, Recruiter,"Milwaukee, WI",Current Employee ,Associate Recruiter,0,"Great people with great culture and innovative and allow you to use creativity
","Starting pay isn't a lot especially if you doing career change. Previous experience always not looked at.
Helpfu",,3.0,5.0,5.0,5.0,1.0,5.0,Recommends,Positive Outlook,
Wed Jun 24 2015, Payroll Coordinator,"Milwaukee, WI",Current Employee ,Payroll Coordinator,2,"Great employee groups, plenty of opportunity to get involved, and regular one on one meetings with your manager. Company has a great vision and goals for what it would like to accomplish.
","Some departments have strict rules regarding time management. Departments can be somewhat segregated, and exposure to new tasks can be limited. The culture is over-dependent on acronymns.
Advice to Management
Encourage more growth and communication between departments. Offer more flexible job options, like we recommend to our clients. Stop using buzz words and set real goals.
Helpful (2","Encourage more growth and communication between departments. Offer more flexible job options, like we recommend to our clients. Stop using buzz words and set real goals.
",4.0,4.0,5.0,3.0,3.0,4.0,Recommends,Positive Outlook,Approves of CEO
Fri Jun 19 2015, Onsite Manager,"Los Angeles, CA",Former Employee ,OnSite Manager,2,"They are a big company with years of know how...They insist on making sure their employees are educated and do not mind sending you where you need to go to get it. I loved that about them.
","Its all about the client. They can care less about employees, contractors or anything else. They will fire you to make the client happy.
Helpful (2",,4.0,3.0,5.0,5.0,5.0,1.0,Recommends,Positive Outlook,Approves of CEO
Tue Jun 16 2015, Equipment Assistant,"Bakersfield, CA",Current Employee ,building maintenance yard maintenance operations manager,0,"it always gives you a piece of mind to that you always have a job if you lose the one that you are all that being a part of Manpower who teen
","I didn't really have any down problems one thing the first kind of upset me is the way we get paid it supposed to be on Friday but we get it a day or two earlier which is Tuesdays or Wednesdays and sometimes we don't even get them then
Advice to Management
good afternoon ladies and gentlemen you have a very experienced determined young man moving up in the world thank you for taking a look at my application in considering me being a part of your team
Helpfu","good afternoon ladies and gentlemen you have a very experienced determined young man moving up in the world thank you for taking a look at my application in considering me being a part of your team
Helpfu",5.0,4.0,3.0,3.0,5.0,4.0,,,
Wed Jul 08 2015,Anonymous,,Former Employee ,"If you want to work for a company which values people, this one is not for you",7,"Company values are People, Knowledge and Innovation. When the company founder Elmer Winter was alive, the culture truly reflected those values. ManpowerGroup was created from the original staffing business (Manpower) and a group of companies purchased to diversify and update the services provided. Those additional businesses are now the growing sectors and future of the company.
","The staffing side of the business was years behind the competitors in innovating, lost market share for many years and has been in chaos. Major restructure of staffing business model was announced in 2013 then retracted at the end of the year. The top heads rolled in 2014 only after major chaos in the field and significant cuts of talent and experience throughout the country. Top staffing exec's LI profile brags about cutting headcount but can't say the business client base grew. Current CEO used to say the company couldn't 'shrink ourselves to greatness' but the company continues to use staff cuts to achieve numbers/quarterly earnings for stockholders. Not surprising that within Manpower there is a culture of fear. If you are looking for a company which values people, do not look here.
Advice to Management
It's hard to be successful in a people business when there is a culture of fear.
Helpful (7","It's hard to be successful in a people business when there is a culture of fear.
",1.0,1.0,1.0,,,,Doesn't Recommend,,Disapproves of CEO
Wed Jun 03 2015,N/A,"Vacaville, CA","Machine Operator in Vacaville, CA",machine operator,0,"they are good people to for
","Dedicated, Reliable, Respectful, Trustworthy Dependinble
Advice to Management
N/A
Helpfu","N/A
Helpfu",5.0,5.0,5.0,5.0,5.0,5.0,Recommends,Positive Outlook,Approves of CEO
Fri May 29 2015, Geschäftsführer / Consultant,"Columbus, GA",Current Employee ,Great Place,0,,"ltant in Columbus, GA
Recommends
Positive Outlook
Approves of CEO
I have been working at ManpowerGroup full-time for less than a year
Pros
Hours, pay, coworkers, mangers
Cons
benefits.... health insurance way too expensive
Helpfu",,5.0,5.0,5.0,5.0,4.0,5.0,Recommends,Positive Outlook,Approves of CEO
Tue May 26 2015, Receptionist,"Ironton, OH",Current Employee ,Temporary Employee,0,"Good when you need quick employment, weekly pay, very nice employees, easy to work for and felxible with schedule. Easy employment process. A very good way to get your foot in the door with a company so that they might want to hire you in the future.
","Most jobs are temporary, with more jobs being related to manual labor opposed to administrative. Pay start out on the low side.
Helpfu",,5.0,5.0,5.0,2.0,3.0,5.0,,,
Tue Jun 16 2015,N/A,"Remote, OR","Recruiting Coordinator in Remote, OR",Horrible experience,4,"The first account I worked on was great; however, I was asked to go help a new account and it has been an absolute nightmare. So, depending on the account and the manager, it can really affect your job.
","I was asked to go help a new account and it has by far been the worst experience I've had at a job. In the first 8 weeks on the account, the account manager never once spoke with a single person on the team and was completely unresponsive to any emails/messages sent to her. After 8 weeks, many of us still did not have access to all of the systems we needed in order to do our job, even though we asked for help and updates every day. I tried speaking with HR about my concerns and they did not help at all, just said I needed to speak with my supervisor, who never once returned a single email sent to her regarding concerns.
Advice to Management
As a virtual employee, it was impossible to do a good job with a supervisor that was completely unresponsive and oblivious to the problems on the account. I would strongly suggest having regular team meetings when a new account is launched so that everyone is on the same page. I've never worked on an account before where there was no leadership or team meetings at all.
Helpful (4","As a virtual employee, it was impossible to do a good job with a supervisor that was completely unresponsive and oblivious to the problems on the account. I would strongly suggest having regular team meetings when a new account is launched so that everyone is on the same page. I've never worked on an account before where there was no leadership or team meetings at all.
",1.0,3.0,1.0,2.0,3.0,1.0,Doesn't Recommend,Neutral Outlook,No opinion of CEO
Sun May 03 2015,Anonymous,,Current Employee ,Just another corporation,3,"Awesome HQ building. I suppose it's size lends itself to more easily making lateral moves.
","The last three years have been layoffs in critical areas like IT and HR but with they still expect everyone complete the same amount of work. I saw layoffs where the new VP didn't even know what people did before letting them go. Stress and instability is now the norm in many areas.
Advice to Management
You cannot outsource your way to profitibility.
Helpful (3","You cannot outsource your way to profitibility.
",2.0,3.0,2.0,3.0,2.0,2.0,,,
Fri Apr 17 2015, Branch Manager,,Current Employee ,Branch Manager,1,"Once you prove yourself, you are left to run things as you would your own business. Provides autonomy with national recognition. Reimbursement is good with potential to take trips as awards for top 3% of the company.
","The environment can be stressful as in all staffing. Expectations are high for the Branch Manager to bring in sales as well as manage operations.
Helpful (1",,4.0,4.0,4.0,4.0,4.0,3.0,Recommends,Positive Outlook,Approves of CEO
Fri Apr 17 2015,Anonymous,,Former Employee ,Talent Acquisition,0,"Great opportunities for dedicated, hard working, professionals. Amazing people and leaders. Strong vision and commitment to client-first services. Great place to learn and grow.
","Some roles can become ""locked in"" and your skills can not be fully utilized. If you are not vocal you may become ""stuck"" in your role.
Advice to Management
Proactively approach staff and discover their true ambitions and goals. There are many people who are working in roles well beyond their true capabilities. Make sure you adequately pay your employees. Inevitably, they will talk, and there are some discrepencies with compensation. Most people are there because they love their jobs, but they should also feel that they are being paid justly.
Helpfu","Proactively approach staff and discover their true ambitions and goals. There are many people who are working in roles well beyond their true capabilities. Make sure you adequately pay your employees. Inevitably, they will talk, and there are some discrepencies with compensation. Most people are there because they love their jobs, but they should also feel that they are being paid justly.
Helpfu",5.0,3.0,5.0,3.0,3.0,4.0,Recommends,Positive Outlook,Approves of CEO
Thu Apr 09 2015,Anonymous,,Current Employee ,Gets Worse by the Year,8,"-Most colleagues are fantastic, good people. 
-Diversity is valued and encouraged--and it's not just words, but truly seen in action.
-There are a lot more remote work opportunities than most places (depending upon the department).
-Quite a bit of autonomy as a whole (though some managers can be an exception, of course).
","-Senior leadership has transitioned to focus solely upon profit and not upon people.
-Company culture has diminished to where it's actually unpleasant to work here. 
-There is ZERO company loyalty to employees.
-So much time is wasted rolling out ineffective strategies and projects developed at the leadership level that never have a chance for success in the field due to leadership's disconnect with what is really happening in the field.
-Layoffs and staff cuts have become a norm; anyone with seniority gets cut due to the need to reduce salary spend.
-The company used to care about putting people to work because they cared about people--now it's just a numbers game to try to beat the competition.
-The company doesn't follow the same expert advice it gives to clients and the public, to the point it's actually comical.
-Lower pay than the competition, despite claiming to be on par with market pay.
-Promises aren't honored; if you're told you're working towards an advancement, they will inevitably come up with an excuse to make it so that the advancement NEVER happens. It seems to be a game of having you relentlessly chase a carrot you'll never get.
Advice to Management
Company leadership: stop going to your direct reports for feedback from the field. Instead, go to the field employees themselves. Also, realize that saving a buck or two by outsourcing a lot of the functions not only ruins employees' confidence in the organization, but doesn't save anything in the end, as the outsource providers don't know the brands, procedures, or company politics like those of us inside the company. It's beyond frustrating. And outsourcing the IT department and internal help desk to India? One of the worst ideas ever. YOU try to get help from them and see how it goes. Good luck.
Helpful (8","Company leadership: stop going to your direct reports for feedback from the field. Instead, go to the field employees themselves. Also, realize that saving a buck or two by outsourcing a lot of the functions not only ruins employees' confidence in the organization, but doesn't save anything in the end, as the outsource providers don't know the brands, procedures, or company politics like those of us inside the company. It's beyond frustrating. And outsourcing the IT department and internal help desk to India? One of the worst ideas ever. YOU try to get help from them and see how it goes. Good luck.
",3.0,4.0,1.0,3.0,2.0,1.0,Doesn't Recommend,Negative Outlook,Disapproves of CEO
Fri Apr 10 2015, Associate Recruiter,"Milwaukee, WI",Former Employee ,I learned a lot more about myself while working here and what I will and will not accept.,6,"Flexible & quick raises
","Management plays favoritism and there is definitely ""white"" privilege in the workplace. Just look at management, there is only one African American manager, everyone else is a white male or female. This lack of diversity in management makes it very difficult for current recruiters to advance as they are often pitted against their white counterparts. I personally have witnessed some less senior recruiters get away with constantly being late to work and being promoted to staff or other recruiters who struggle with meeting their goals or number of people submitted be promoted simply because they asked over and over. The turnover here is extremely high as it is very rare that the people you start with will be there in 6 months. They have this career path that is set up for you but if you are not a top performer, some managers will hold you back from completing your training thus making it impossible for you to advance and receive an increase in pay. Speaking of opportunities for advancement, don't you dare try to look for other opportunities in the company because to your face your manager may tell you to go ahead but behind your back they will do everything they can to make sure you do not leave their client. I understand wanting to keep good people on your team, but people also want to grow and explore other opportunities. Overall, my biggest issues were with management from the top all the way down to the one I worked with closely. Unless you are one of their favorites, they will walk past you as if you are nothing. I think management can definitely undergo some training on how to effectively communicate with their teams and how to treat their staff. It is not what you say, but how you say it.
Advice to Management
Take the time to properly train your staff before they start a new pod which will likely decrease turn over rates and promote a positive experience. Nothing is worse than sitting in a day of training and the next day you are expected to work on a project with little to no training. Also, value your employees who have been there a while with a simple great job or I can see your hard work as that type of recognition can go a long way. Lastly, what you do for one employee you should be willing to do for others: good and bad.
Helpful (6","Take the time to properly train your staff before they start a new pod which will likely decrease turn over rates and promote a positive experience. Nothing is worse than sitting in a day of training and the next day you are expected to work on a project with little to no training. Also, value your employees who have been there a while with a simple great job or I can see your hard work as that type of recognition can go a long way. Lastly, what you do for one employee you should be willing to do for others: good and bad.
",2.0,3.0,2.0,2.0,3.0,1.0,Doesn't Recommend,Neutral Outlook,
Thu Mar 26 2015,N/A,"Milwaukee, WI","Sourcing Manager in Milwaukee, WI",Enjoyable,0,"Great location and place to work. Very flexible and accomadating
","Could have provided more learning oppurtunities
Advice to Management
none
Helpfu","none
Helpfu",5.0,5.0,5.0,4.0,3.0,5.0,Recommends,Positive Outlook,
Wed Apr 01 2015, Manager,"Milwaukee, WI",Current Employee ,Decent Co-Workers & Work Environment But Obsessed With Off-Shore IT,3,"It's a decent facility (DT Milwaukee HQ) with some very friendly co-workers and some perks like free parking, some workouts and an OK cafeteria. It's a rapid and dynamic industry as well.
","The main con is their off-shore IT obsession. They constantly try to move things off-shore and then pull back some when it fails. Most of the company accepts it and works around the sub-par help desk and IT support as a result. However, other managers get frustrated and escalate to IT management who then force the on-shore IT staff to cater to the managers at the expense of their regular duties. If your management doesn't like the work of the off-shore resources, then don't use that model or at least tell those managers to stop complaining about IT spend.
Advice to Management
Stop with the off-shoring. You are a staffing firm, figure out how to be more efficient instead of just moving bad processes off-shore.
Helpful (3","Stop with the off-shoring. You are a staffing firm, figure out how to be more efficient instead of just moving bad processes off-shore.
",2.0,4.0,3.0,2.0,4.0,3.0,Doesn't Recommend,Positive Outlook,
Mon Mar 16 2015,N/A,"Milwaukee, WI","Change Management in Milwaukee, WI",My Experience,3,"Great people work there, so it was fun working with them
","Hard to move up as a woman
Advice to Management
Succession planning is necessary!
Helpful (3","Succession planning is necessary!
",3.0,4.0,3.0,2.0,3.0,2.0,Doesn't Recommend,Neutral Outlook,No opinion of CEO
Tue Mar 03 2015,N/A,"Dallas, TX","Recruiter in Dallas, TX",It's been fine. I'm a consultant and pay comes in consistently.,0,"They have multiple clients in my field, and I feel comfortable that if my contract ends they can help me find a new opportunity with one of there existing clients.
","None thus far... At this time I do not have any cons that comes to mind. My interaction with Manpower is extremely limited.
Advice to Management
None thus far... At this time I do not have any advice that comes to mind. My interaction with Manpower is extremely limited.
Helpfu","None thus far... At this time I do not have any advice that comes to mind. My interaction with Manpower is extremely limited.
Helpfu",5.0,3.0,3.0,3.0,3.0,3.0,Recommends,Neutral Outlook,Approves of CEO
Thu Mar 12 2015,N/A,"Milwaukee, WI","Associate Recruiter in Milwaukee, WI",ASSOCIATE RECRUITER,1,"Everyone who works here is extremely nice and I really enjoy working with my coworkers. The building is AMAZING!
","They promise you promotions that really aren't possible for you to get. Communication here is weak. Management seems very separate. PAY VERY LOW FOR COLLEGE DEGREES
Helpful (1",,2.0,4.0,3.0,2.0,1.0,1.0,Recommends,Negative Outlook,No opinion of CEO
Mon Mar 16 2015, Virtual,"Milwaukee, WI",Senior Recruiter,Recruiters Beware...,6,"opportunity to work in a virtual environment
","Consistently pay lower than industry standards. RPO is always in fire-drill mode- no planning. I got tons of calls needing someone the same or next day. They think they are getting business because of their reputation- but they are underbidding the market. This company is a classic example of 'you get what you pay for'. They lack any sort of consultative approach with their clients- letting them call all the shots when they are supposed to be the experts! No planning means benched with no warning several times. Won't make that mistake again...
Advice to Management
Get a grip on your clients! Stop trying to be the low price leader. Your reputation within the recruiting community is costing you.
Helpful (6","Get a grip on your clients! Stop trying to be the low price leader. Your reputation within the recruiting community is costing you.
",1.0,3.0,1.0,1.0,1.0,2.0,Doesn't Recommend,Neutral Outlook,No opinion of CEO
Fri Feb 13 2015,N/A,"East Lansing, MI","Trainer in East Lansing, MI",Trainer,2,"There is sometimes work available.
","not very much, and they don't negotiate for you. They see the client as their employer. They work for them, not you. and it shows.
Helpful (2",,2.0,4.0,2.0,3.0,2.0,,Doesn't Recommend,Neutral Outlook,No opinion of CEO
Wed Feb 04 2015,N/A,"Milwaukee, WI","Business Operations in Milwaukee, WI",Good Benefits and opportunities to learn,6,"Manpower offered competitive benefits, fair compensation and opportunities to learn new things.
","Things were constantly changing, and not always for good reasons. At one point, I has six managers within the same year, and I didn't change jobs; they just keep reorganizing my department! They regularly eliminate jobs at their global headquarters in Milwaukee. At least 350 jobs have been eliminated since 2008. Complete departments and divisions have been eliminated or outsourced. Really great employees with 10, 20 or even 30 years of experience have been cut with no notice at all!
Advice to Management
Listen to your employees and retain the good ones!
Helpful (6","Listen to your employees and retain the good ones!
",2.0,1.0,1.0,3.0,3.0,1.0,Doesn't Recommend,Neutral Outlook,No opinion of CEO
