date,employee_title,location,employee_status,review_title,helpful,pros,cons,advice_to_mgmt,rating_overall,rating_balance,rating_culture,rating_career,rating_comp,rating_mgmt,recommends,positive_outlook,approves_of_CEO
Tue Mar 05 2019, CSC,"Tampa, FL",Current Employee ,Lots of work,0,"Work from home 1 day a week
","No training, or help, ppl can be rude
Advice to Management
Give clear direction
Helpfu","Give clear direction
Helpfu",3.0,2.0,3.0,5.0,3.0,1.0,Recommends,Neutral Outlook,No opinion of CEO
Mon Feb 18 2019,Anonymous,N/A,Former Employee ,Good company to work for,0,"The pro is it is a steady place to work, a predictable workload and good benefits
","Metlife is slow to adapt to new forms of technology that helps make quality of life better.
Helpfu",,4.0,5.0,3.0,3.0,3.0,3.0,,,
Sun Feb 17 2019, Implementation Manager,"Aurora, IL",Current Employee ,Excellent Emploer,0,"Great benefits, people work together, locations all over the world.
","Smaller raises, bonuses. High turnover.
Advice to Management
Listen more to longtime employees.
Helpfu","Listen more to longtime employees.
Helpfu",5.0,5.0,5.0,5.0,5.0,5.0,Recommends,Positive Outlook,Approves of CEO
Thu Feb 28 2019, P&C,,Former Employee ,Insurance,1,"Great employees, good benefits
","Micro managed and poor pay
Advice to Management
Need to move away from the micro management
Helpful (1","Need to move away from the micro management
",3.0,4.0,3.0,2.0,2.0,4.0,,,
Fri Feb 15 2019, Director,"Cary, NC",Former Employee ,Great company to work for,0,"Great benefits and work life balance
Nice people to work with
","- Can't think of any :-)
Helpfu",,4.0,5.0,5.0,4.0,4.0,5.0,Recommends,Positive Outlook,Approves of CEO
Tue Feb 26 2019, Operations,,Current Employee ,Par for the course,1,"lunch , parking, office, bathroom , walls
","its still work hello nice to meet you
Advice to Management
keep it up
Helpful (1","keep it up
",3.0,3.0,3.0,3.0,3.0,3.0,Doesn't Recommend,Neutral Outlook,No opinion of CEO
Mon Feb 25 2019, Worker,,Current Employee ,Met Life,2,"used to be a strong and valuable and great Company
","none of the above since we went public
Helpful (2",,2.0,,,,,,Disapproves of CEO,,
Thu Feb 07 2019, Associate Director,"Nashville, TN",Current Employee ,Admirable Fortune 500 employer with all the expected benefits,2,"Metlife has processes to take good care of employees- competitive pay, health insurance, retirement plan, etc.
","It is a reall big, compartmentalized company, thus there is a heirarchical chasm between executive leadership and the boots on the ground- few people get to know their senior leadership or feel like they get more than just the scripted insights into what is happening in the company.
Helpful (2",,4.0,5.0,3.0,4.0,5.0,4.0,Recommends,Neutral Outlook,Approves of CEO
Tue Feb 12 2019,Anonymous,,Current Employee ,Good Learning Experience,0,"Really Great Work Life Balance
","Too large to make rapid change
Helpfu",,4.0,,,,,,,,
Sun Feb 03 2019, Proposals,"Aurora, IL",Current Employee ,Wonderful Company,1,"MetLife is a fabulous company to work for that walks the walk. The department I work in really believes in work-life balance. I believe we are compensated fairly and there is always room to move to different positions.
","They took away our HMO option.
Helpful (1",,5.0,5.0,5.0,5.0,5.0,5.0,Recommends,Positive Outlook,Approves of CEO
Thu Feb 07 2019, Claims Specialist,"Oriskany, NY",Current Employee ,Looking for a job? Come apply!,0,"First day training and I already knew a whole bunch of people. The team I was put on is so helpful, they are always there when a question needs to be answered. My UL and CSS are amazing as well. I couldn't ask for a better team. The best part is that there is no required outfit attire. The first day I was dressed up with nice black pants and a nice shirt but they told us that we can wear whatever we want but no flip flops, sweats, leggings or shirts with graphics.
","Honestly there arent many cons. The only thing that I could think of is that the parkinging isnt all that great and one of the many vending machines is always broke haha.
Helpfu",,5.0,3.0,4.0,4.0,4.0,4.0,Recommends,Positive Outlook,Approves of CEO
Sat Feb 09 2019,Anonymous,"Bridgewater, NJ",Former Employee ,Constant reorganizations,5,,"ant reorganizations""
3.0
★★★★★
Former Employee - Anonymous Employee in Bridgewater, NJ
Doesn't Recommend
Neutral Outlook
Disapproves of CEO
I worked at MetLife full-time for more than 10 years
Pros
Time off
401k matching
Cash balance retirement plan
Cons
Leadership 
Limited opportunities 
Constant reorganizations
Helpful (5",,3.0,3.0,3.0,2.0,3.0,2.0,Doesn't Recommend,Neutral Outlook,Disapproves of CEO
Mon Jan 28 2019, TAM Case Specialist,,Current Employee ,Rewarded if you excel at your work,3,"Understanding management
Flexible scheduling
Opportunity to work on projects
Good pay
","High stress for extended periods
No monetary reward for taking on additional projects
Advice to Management
Upper management should listen more to what the people on the ground who have the most interaction with the customer as they know what works and what doesn't to meet the standards set by upper management
Helpful (3","Upper management should listen more to what the people on the ground who have the most interaction with the customer as they know what works and what doesn't to meet the standards set by upper management
",4.0,3.0,4.0,3.0,3.0,2.0,Doesn't Recommend,Neutral Outlook,No opinion of CEO
Sat Feb 02 2019,N/A,, ,Growth,0,"Allow to work from home
","Poor communication to the employees
Advice to Management
Be open and honest to allow room for growth
Helpfu","Be open and honest to allow room for growth
Helpfu",4.0,,,,,,,,
Fri Mar 01 2019, Information Technology,"Tampa, FL",Former Employee ,This is the worst employer I have ever had.,12,"Cafeteria is nice
I liked my coworkers
","My goodness, where do I even begin?

First, there’s no training in any meaningful way, for anything. Tasks are just kind of tossed at you with poorly-written instruction documents and you’re essentially told “good luck”. There is a revolving door of staff that moves so quickly that I’m surprised the revolving door hasn’t flown off its hinge. Top-to-bottom, this company is a disaster.

Second, management is way overworked by their superiors so they don’t have the time to help you at all. You’re expected to just ask for help from *other* temps that joined just a couple months before you. It’s a chain of people not really knowing 100% of what they’re doing. 

Lastly, the biggest problem: every system is a nightmare. Any basic task is a herculean effort due to things just breaking at any given time, and a help ticket system that is painfully sluggish. The kicker? If you’re untrained or the systems break and tasks aren’t done perfectly or right on time, the fault is dropped on *you*. Being here was a constant, confusing circus of failure and disappointment. 

Overall, this company is rotting from the inside. It’s a mess in every conceivable way. I’m sure they’ll do fine financially though, even though morale is at its nadir. Hopefully their clients don’t find out about just how terrible of a patchwork shamble show this place is.
Advice to Management
Immediate management was amazing, just worked into the ground and gridlocked in back to back meetings all day every day. Higher-ups need to stop over-working them, and this entire company needs to re-evaluate its culture.
Helpful (12","Immediate management was amazing, just worked into the ground and gridlocked in back to back meetings all day every day. Higher-ups need to stop over-working them, and this entire company needs to re-evaluate its culture.
",1.0,1.0,1.0,1.0,3.0,3.0,Doesn't Recommend,Negative Outlook,Disapproves of CEO
Thu Jan 24 2019,N/A,"Cary, NC","Production Management Consultant in Cary, NC","Great Place to work, but with corporate bureaucracy",3,,"ltant in Cary, NC
Recommends
Neutral Outlook
No opinion of CEO
I worked at MetLife for more than 3 years
Pros
Fair Salary
Great benefits
Comfortable working conditions in HQ
Open door management
Cons
Must wade through red tape usually associated with large corporations to do anything
Slow moving
Wants to act like a startup, but is too large
Management sets unrealistic goals
Advice to Management
Pay attention to the employees
Helpful (3","Pay attention to the employees
",4.0,3.0,5.0,4.0,4.0,3.0,Recommends,Neutral Outlook,No opinion of CEO
Fri Feb 01 2019," Director, Actuary","Wilmington, DE",Current Employee ,Global exposure,0,"MetLife gives global exposure and opportunities
","It has a very complex org structure
Helpfu",,4.0,3.0,3.0,3.0,3.0,3.0,Approves of CEO,,
Wed Feb 06 2019, Anonymous,"New York, NY",Former Employee ,Good Potential with better management,3,"Company with High Integrity and good people
","Performance management process is unproductive and demoralizing
Advice to Management
Place higher value on all employees and not just the stars
Helpful (3","Place higher value on all employees and not just the stars
",3.0,3.0,4.0,2.0,3.0,2.0,Doesn't Recommend,Neutral Outlook,Disapproves of CEO
Sat Mar 02 2019,Anonymous,,Former Employee ,Misleading,3,"I have none to share
","The vision was great, but the reality was disheartening.
Helpful (3",,1.0,2.0,1.0,1.0,2.0,1.0,Doesn't Recommend,Negative Outlook,No opinion of CEO
Mon Feb 04 2019, Systems Consultant,"Denver, CO",Former Employee ,It all depends on local management,5,,"ltant in Denver, CO
Doesn't Recommend
Negative Outlook
No opinion of CEO
I worked at MetLife full-time for more than 10 years
Pros
Co-workers are usually very good, health care and pension WERE good as well. Typical 401K.
Cons
Totally different environment after going public. Clueless management not knowing what's involved in a task. 'Surprise' annual ratings without ongoing feedback. Really too many to tell.
Advice to Management
Pound salt.
Helpful (5","Pound salt.
",2.0,2.0,3.0,3.0,3.0,1.0,Doesn't Recommend,Negative Outlook,No opinion of CEO
Fri Jan 25 2019, Business Analyst,"New York, NY",Former Employee ,Good place to work,0,"Benefits, organized, respectful and nice people
","I was there when there were layoffs happening.
Helpfu",,4.0,4.0,4.0,4.0,4.0,4.0,Recommends,Positive Outlook,Approves of CEO
Thu Feb 07 2019, GSR,"Dayton, OH",Former Employee ,Great company minor tweeks needed,0,"Work from home, incentives, upper management very approachable.
","Hard to get time off due to business needs.
stagnate no movement. Not for the ambitious.
Advice to Management
Invest in technology, allow rest room breaks in schedule, and follow up time.
Helpfu","Invest in technology, allow rest room breaks in schedule, and follow up time.
Helpfu",3.0,3.0,5.0,3.0,5.0,5.0,Recommends,Neutral Outlook,No opinion of CEO
Wed Jan 23 2019, Senior Analyst,"Warwick, RI",Former Employee ,Senior Analyst,0,"A lot of opportunities for advancement.
","Not very flexible for work life balance.
Helpfu",,5.0,3.0,5.0,5.0,5.0,5.0,Recommends,Positive Outlook,Approves of CEO
Tue Jan 22 2019, Project Manager,,Former Employee ,Slow and steady company culture but changing with new leaders from outside.,0,"Usually a friendly work environment.
","Too slow to make changes.
Helpfu",,4.0,4.0,4.0,4.0,4.0,3.0,,,
Mon Jan 28 2019, Senior Claim Assistant,"Aurora, IL",Former Employee ,ABUSIVE MANAGEMENT AND UNREALISTIC GOALS,6,"My coworkers were wonderful to work with. Our team of four worked all together and did the work that was expected.
","Unrealistic goals set at 98%. If you do not have 98-100%, you are put on written review and then fired. Abusive supervisor that belittled you and your self-esteem. Hovered over computer which would make mistakes and he would yell in front of people making you feel horrible and belittled.
Advice to Management
Too hard on staff to obtain 98% or better. All supervisors were fine, but a certain supervisor in LTD should be fired immediately as he is a horrible supervisor and he does not know how to manage people.
Helpful (6","Too hard on staff to obtain 98% or better. All supervisors were fine, but a certain supervisor in LTD should be fired immediately as he is a horrible supervisor and he does not know how to manage people.
",2.0,5.0,1.0,3.0,4.0,1.0,Doesn't Recommend,Neutral Outlook,No opinion of CEO
Thu Jan 31 2019, Marketing Manager,"Bridgewater, NJ",Former Employee ,Hoping the new CEO will improve morale,2,"The benefits are good, and there are opportunities to learn and build your career through working in different areas.
","Too many times, senior leaders who can't lead are allowed to have a bad affect on good lines of business and the people who work under them.
Advice to Management
When leaders can't lead, they should be moved into different roles.
Helpful (2","When leaders can't lead, they should be moved into different roles.
",3.0,4.0,3.0,3.0,4.0,2.0,Doesn't Recommend,Neutral Outlook,Disapproves of CEO
Wed Jan 30 2019,N/A,, ,Financial Service Representative,4,"Benefits and pay are pretty good
","Everything else. Too much micromanagement drives off workers and leaves a rotating door new hires. Nothing you do is ever good enough. Very negative work environment.
Helpful (4",,2.0,3.0,1.0,2.0,3.0,1.0,Doesn't Recommend,Negative Outlook,Disapproves of CEO
Wed Feb 20 2019, Business Systems Analyst,,Former Employee ,"Be Afraid, Be very Afraid",7,"Co-workers, Benefits, Heading home everyday
","Management absolutely sucks!! There are people in director roles who have been with MetLife since high school. WHY!!!!
Advice to Management
Get rid of the people that have been there for years (20+) to allow new ideas!!!
Helpful (7","Get rid of the people that have been there for years (20+) to allow new ideas!!!
",1.0,,,,,,,,
Wed Jan 16 2019, Senior Customer Service Specialist,"Aurora, IL",Current Employee ,"Great company, benefits, co-workers and mgmt!",1,"My co-workers are a dream - very diverse workforce at MetLife and from what I can see everyone is treated fairly. Health benefits are fairly priced and there is a good choice of options, including vision, dental, short-and-long term disability, profit sharing match, etc. Management at this office is APPROACHABLE and visible. If you are punctual, professional, and actively trying to excel at your current position, your efforts are rewarded. Opportunities for advancement exist and your manager will even come to you when they feel you are ready to move up. 

There is some overtime but not excessive. PTO is generous as are paid holidays and personal days. There is some flexibility if you need to request time off for kid stuff or doctor appts. People are treated well here; no matter their position in the company, everyone is respectful. The workplace is clean. Customers are generally nice to speak with and I leave each day knowing I really did help 1 or 2 (or more) people.
","Pay and raises could always be higher. Would love work-from-home option, especially during blizzards!
Advice to Management
Keep on watching who your top performers are and reward them. But keep in mind, everyone brings something to their employer so support and assist new hires and those who may be struggling a bit so they can succeed.
Helpful (1","Keep on watching who your top performers are and reward them. But keep in mind, everyone brings something to their employer so support and assist new hires and those who may be struggling a bit so they can succeed.
",5.0,4.0,5.0,4.0,3.0,3.0,Recommends,Positive Outlook,Approves of CEO
Fri Jan 18 2019, New Business Development,"Charlotte, NC",Former Employee ,New Business Specalist II,0,"Environment, many departments to learn from, work balance
","little bit of perks, low pay, slow business
Advice to Management
more opportunities
Helpfu","more opportunities
Helpfu",5.0,5.0,5.0,4.0,2.0,5.0,Recommends,Positive Outlook,Approves of CEO
Thu Jan 31 2019, Senior Business Procedures Consultant II,,Current Employee ,Good Company - Limited Opportunity,0,,"ltant II 
I have been working at MetLife full-time for more than 5 years
Pros
Salary, Benefits, Vacation, Work-at-Home Ability
Cons
Small chance for promotion, difficult to move up or post to other positions, can be demanding with long hours
Advice to Management
Recognize good performers and promote their accomplishments
Helpfu","Recognize good performers and promote their accomplishments
Helpfu",3.0,4.0,3.0,1.0,5.0,2.0,,,
Wed Jan 16 2019, Sales,"Hartford, CT",Former Employee ,great training,0,"excellent management and training provided
","long hours needed to be successful
Helpfu",,4.0,3.0,4.0,4.0,5.0,5.0,Recommends,Positive Outlook,No opinion of CEO
Wed Feb 13 2019, Senior Customer Service Representative,"Des Moines, IA",Former Employee ,"Not a great place for single parents, or parent with small children.",11,"Nothing really good I can say
","Not a place for single parents.
Advice to Management
I was fired when I had to leave during g training because my daughter was rushed to the emergency room by ambulance. I am a single parent, and I am the only care giving/provider for my daughter.
Helpful (11","I was fired when I had to leave during g training because my daughter was rushed to the emergency room by ambulance. I am a single parent, and I am the only care giving/provider for my daughter.
",1.0,1.0,2.0,1.0,3.0,1.0,Doesn't Recommend,Negative Outlook,No opinion of CEO
Sat Jan 26 2019, IT Program Director,,Current Employee ,Tough place to work in IT,1,"Decent salary, good people, good if you live in NC
","In constant tranformation, mgmt will suck the life out of you
Advice to Management
Appreciate your people and dont be phony about it
Helpful (1","Appreciate your people and dont be phony about it
",3.0,,,,,,,,
Sat Jan 19 2019, Senior Compliance Analyst,,Former Employee ,Just OK,3,"Great benefits, good work life balance.
","Salaries are not competitive. Management does not promote.
Advice to Management
Separate work from friendships and promote because employees do good work. Provide incentive for a job well done. Show appreciation and say Thank you.
Helpful (3","Separate work from friendships and promote because employees do good work. Provide incentive for a job well done. Show appreciation and say Thank you.
",3.0,3.0,2.0,2.0,3.0,1.0,Doesn't Recommend,Neutral Outlook,Disapproves of CEO
Tue Jan 15 2019, Sales Representative,"Florence, KY",Former Employee ,The good and the bad,4,"MetLife is a quality organization and the products are top of the line.
","The pricing makes it difficult to earn a living. Though the MetLife home and auto product is superior it's priced so they serve a very narrow target market. The pricing for that target market is fantastic which leads to low commission payouts couple that with a low closing ratio it's difficult to pay the bills. Dealing with home office is frustrating to say the least, it seems the answer is always no so you have to be relentless in pursuing your matter which takes time away from things that are more important. Trying to get an expense report approved is brutal, expect to submit it between 4-6 times. They are trying to improve the life insurance process but they have a long long way to go.
Advice to Management
You are losing a lot of very good insurance agents, listen to them. Change the atmosphere at home office to be a servant to the field rather than a thorn
Helpful (4","You are losing a lot of very good insurance agents, listen to them. Change the atmosphere at home office to be a servant to the field rather than a thorn
",3.0,,,,,,,,
Mon Jan 21 2019, Assistant Vice President ,"New York, NY",Former Employee ,Good place to work,1,"Organization going through transition. Trying to be world-class with HR practices. Good people that try hard.
","Actions don't always match with the words. Want to be world-class HR, but still need to upgrade some of the systems and processes.
Helpful (1",,3.0,4.0,3.0,3.0,3.0,2.0,Recommends,Neutral Outlook,No opinion of CEO
Wed Jan 16 2019, Financial Services Representative,"Sandy, UT",Former Employee ,So Disappointing,5,"Working with a few of the other reps and the flexibility to have a great work /life balance.
","They bring you in to drain your close contacts and then toss you aside.
Advice to Management
Pay you reps a base wages so they can actually help people without starving.
Helpful (5","Pay you reps a base wages so they can actually help people without starving.
",2.0,3.0,1.0,1.0,1.0,1.0,Doesn't Recommend,Negative Outlook,No opinion of CEO
Mon Dec 24 2018, Senior Operations Analyst,"Whippany, NJ",Current Employee ,Investments division,4,"Great work atmosphere. Benefits better than average.
","Company is going through cost cut restructuring. No job security.
Advice to Management
Stay focused on customers but take care of your people.
Helpful (4","Stay focused on customers but take care of your people.
",4.0,3.0,4.0,3.0,3.0,3.0,Recommends,Negative Outlook,Disapproves of CEO
Sun Jan 13 2019,Anonymous,,Former Employee ,Claims,2,"Great pay, benefits and time off.
","Big brother is always watching. Production based work. Not enough training in actual job function but they expect very strict production goals. Oh there is always mandatory overtime...
Advice to Management
Maybe focus less on your never ending production numbers & more time training your associates.
Helpful (2","Maybe focus less on your never ending production numbers & more time training your associates.
",2.0,1.0,3.0,3.0,5.0,2.0,Doesn't Recommend,Neutral Outlook,No opinion of CEO
Fri Jan 11 2019, Short Term Disability Case Manager,,Current Employee ,Good job if you do not have a family.,2,"Good Benefits, flexible start time.
","Zero work life balance. Overtime is mandatory and if you don't work it your work will fall behind to the point of being terminated. Hiring new people at a higher pay rate than the loyal long time employees are being paid.
Advice to Management
When people quit or are terminated replace them.
Helpful (2","When people quit or are terminated replace them.
",3.0,1.0,3.0,4.0,3.0,,Doesn't Recommend,Neutral Outlook,No opinion of CEO
Fri Dec 28 2018,Anonymous,,Current Employee ,Good company,1,"Flexible work environment for working mothers.
","There could be more career opportunities for people who want to grow within the company.
Helpful (1",,4.0,5.0,4.0,3.0,3.0,3.0,Recommends,Positive Outlook,Approves of CEO
Wed Jan 09 2019,Anonymous,"Cary, NC",Current Employee ,Finance,2,"Work life balance is great
","Politics at the company, and career path is not defined
Helpful (2",,3.0,3.0,3.0,3.0,3.0,3.0,Recommends,Neutral Outlook,Approves of CEO
Wed Jan 09 2019, Director,"Cary, NC",Current Employee ,"All that glitters is NOT gold at MetLife in Cary, NC",34,"Competitive compensation and modern facilities
","If I only knew now what I didn’t know then, I would have never taken a job at MetLife. The problem lies squarely at the top of the pyramid where an impenetrable ‘circle of trust’ is responsible for the (mis)management of the Global Technology organization. The regional hub in Cary is infested with corporate politics centered around mind-games, manipulation and constant pressure from the top.
The unwritten criteria required to be a member of this inner circle is possessing at least two of the following: being formerly employed at the Royal Bank of Canada, or over 15 years of tenure at MetLife or being a male. Rather than focussing on compassionate and empathetic leadership, the priority for this ‘boy’s club’ is their egos, their paychecks, their corporate survival and protecting this aforementioned inner circle.

Don’t just take my word for it, do your own homework. Look at the share price (MET) that has been languishing in the low to mid 40’s for the last several months. The share price is the lowest it’s been since 2011. You should understand the commitment made to Wall Street by Chairman and CEO Steve Kandarian in Q2, 2016 to take out ~$1 BLN in operational costs by end of 2019. You should realize there is a major gap between this cost reduction commitment and what has been delivered thus far. You should know that management is under a significant amount of pressure to close this gap and unfortunately the only way to close it will be an ongoing and continued reduction in force/layoffs.

So why does MetLife continue to hire in Cary if layoffs are forthcoming? The corporation has no choice based on the commitment made to the state of North Carolina when establishing a regional hub in the state. MetLife is obliged to employ a specific number of employees in North Carolina in order to reap the benefits of a significant corporate tax break from the state. MetLife scrambled towards the end of 2017 to hit this this FTE target. This inevitably creates the revolving door that is MetLife in Cary today. Once new hires realize the culture they have stepped into, they make their way out the door shortly thereafter. MetLife has forced itself into a conundrum in North Carolina where they are desperate to take out costs, but want to continue to reap the tax benefits for employment targets.
Don’t be fooled by the new buildings and campus…all that glitters is NOT gold.
Advice to Management
Hopefully your new CEO, Michel Khalef can get wise to the disaster that is MetLife in Cary. Stop being misled by those that are in-charge of Global Technology in North Carolina.
Helpful (34","Hopefully your new CEO, Michel Khalef can get wise to the disaster that is MetLife in Cary. Stop being misled by those that are in-charge of Global Technology in North Carolina.
",1.0,2.0,3.0,1.0,4.0,1.0,Doesn't Recommend,Negative Outlook,Disapproves of CEO
