date,employee_title,location,employee_status,review_title,helpful,pros,cons,advice_to_mgmt,rating_overall,rating_balance,rating_culture,rating_career,rating_comp,rating_mgmt,recommends,positive_outlook,approves_of_CEO
Tue Jan 14 2020, Confirmation Team Representative,,Former Employee ,Lots of physical work,2,"Weekly pay
2 days off per week (Either friday/Saturday or Sunday/Monday)
","Long hours
Early start times (4am or 5am)
Very physical
1 week of PTO after 6 months
Advice to Management
Add help for the sales reps. The work should honestly be a 2 person job for the amount of physical energy and size of the stores being serviced.. Also PTO should be more than 1 week
Helpful (2","Add help for the sales reps. The work should honestly be a 2 person job for the amount of physical energy and size of the stores being serviced.. Also PTO should be more than 1 week
",3.0,2.0,3.0,3.0,4.0,,,,
Sat Feb 08 2020, Associate Tax Analyst,"Plano, TX",Former Employee ,Worked in Plano Tax Dept. Horrible Team and enviornment.,0,"Great benefits, good overall PepsiCo culture
","Very micro managed team environment. Your hard work will not get appreciated by your manager and upper management. You will stuck in your role for years without promotion.
Advice to Management
Value your team and value their work
Helpfu","Value your team and value their work
Helpfu",1.0,1.0,2.0,,,,Doesn't Recommend,,Approves of CEO
Thu Jan 02 2020, Associate Supervisor,"Johnstown, PA",Current Employee ,Good Work Environment Good Team,0,"Good Team that promoted growth at all times.
","Minimal work life balance.
Helpfu",,4.0,3.0,2.0,4.0,3.0,4.0,Positive Outlook,,No opinion of CEO
Mon Jan 13 2020, BCR,"Altoona, PA",Former Employee ,management ruined my life,2,"Great company. learn alot of how to be great at sales, as well as how to be a territory sales manager, too.
","pay declined every single year.
personally, my tsm didnt do his job. He ran the business like the mafia ""keep it in house"" 
Any issues you have with your merchandiser, they will never be addressed due to the TSM- this is not speaking of all tsms, just my experience.
I would advise anyone, to never trust anyone! Do your job, take pictures .
Deal with some down right nasty customers. They will treat you bad, some store mgmt memebers get too big of a head, and treat you like trash!
A lot of stress managing a route, and keeping customers happy
Advice to Management
Find the members of mgmt that refuse to leave their offices.
I loved all my mgmt team, except for my tsm- he got me real good, which is why im no longer employed there. I snapped from too much being on my plate at once.
Helpful (2","Find the members of mgmt that refuse to leave their offices.
I loved all my mgmt team, except for my tsm- he got me real good, which is why im no longer employed there. I snapped from too much being on my plate at once.
",2.0,1.0,1.0,5.0,3.0,1.0,Doesn't Recommend,Positive Outlook,No opinion of CEO
Tue Dec 31 2019, IT Project Manager,"Puerto Rico, TX",Former Employee ,Great Company to Work With,0,"Above the average Salary and performance bonus
","On my site, management need new people to bring new ideas
Helpfu",,5.0,5.0,4.0,5.0,5.0,3.0,Recommends,Neutral Outlook,Approves of CEO
Tue Dec 31 2019, Delivery Driver,,Former Employee ,Its what you make it,0,"Home everyday. Decent pay. Take care of their employees
","Hard work. Can be long hours
Advice to Management
Get rid of commission pay. Better trucks
Helpfu","Get rid of commission pay. Better trucks
Helpfu",4.0,3.0,4.0,4.0,4.0,3.0,,,
Tue Jan 14 2020, Computer Network Engineer,,Current Employee ,High likelihood of working an off-shift and the weekend,0,"They offer competitive pay and benefits. You start with 3 weeks of vacation.
","There is a terrible lack of work-life balance. You'll likely work an off-shift for multiple years as well as be required to work a weekend rotation.
Helpfu",,2.0,1.0,2.0,3.0,4.0,2.0,Doesn't Recommend,Positive Outlook,No opinion of CEO
Mon Dec 30 2019, Senior Analyst,"Purchase, NY",Current Employee ,"Relatively new, going well",0,"Flexibility, rotational, strong culture is present
","Pay is probably slightly below market
Helpfu",,4.0,4.0,4.0,3.0,3.0,4.0,Neutral Outlook,,Approves of CEO
Mon Jan 13 2020, Human Resources,"New York, NY",Former Employee ,Company Culture,0,"Smart people, challenging roles allow for learning & development.
","Lacking team culture and work/life balance doesn't exist.
Helpfu",,3.0,2.0,3.0,3.0,3.0,3.0,Recommends,Positive Outlook,No opinion of CEO
Sun Dec 29 2019, Route Sales Representative,,Current Employee ,Great company with good benefits and perks,0,"Good management, great schedule with weekends off, good commission structure
","Long hours during holiday weeks
Helpfu",,5.0,,,,,,,,
Mon Jan 13 2020, Consultor Pre Vendas,,Current Employee ,"Long hours, weekends, and lack luster support",0,,"ltor Pre Vendas 
Doesn't Recommend
Neutral Outlook
No opinion of CEO
I have been working at PepsiCo full-time for more than 3 years
Pros
Pay and benefits are good
The expectations are low
Lots of opportunity to advance
Cons
Large portion of employees seem to not care
If you're new, you will be on an off-shift with a lack of support
People pass their problems onto others constantly instead of owning them
Union employees are very protected, and implementing change is unheard of
Helpfu",,2.0,1.0,2.0,4.0,4.0,3.0,Doesn't Recommend,Neutral Outlook,No opinion of CEO
Thu Jan 09 2020,N/A,, ,Millennials Dream,0,"If you’re in the program, results don’t count. Average is the new excellent. You can move on before the results come in, never having to be accountable. Every thing about the company is window dressing.
","This company subscribes to the theory of chaos creates a competitive workplace. Blame lies with whomever is subservient.
Advice to Management
Treat all employees with respect or you will lose your market standing
Helpfu","Treat all employees with respect or you will lose your market standing
Helpfu",2.0,,,,,,,,
Sun Dec 22 2019, Scientist,,Current Employee ,OK company,0,"Flexible working hours and friendly coworkers.
","Not so great pay, and heavy workload.
Helpfu",,4.0,3.0,3.0,3.0,2.0,3.0,Approves of CEO,,
Tue Jan 21 2020, Merchandiser,"South Burlington, VT",Former Employee ,No work/life balance AT ALL,2,"Okay starting wage, benefits are good and affordable
","Work life balance, upper management
Advice to Management
Check out your South Burlington location. Literally the worst run business I have ever worked for. My termination date was incorrectly logged into the system, because they didn't want to pay out my wages until it was convenient for them. I have been trying to get my paystub's from them for over a week without any success. This location is genuinely a dumpster fire, and it was the worst decision of my life to work here.
Helpful (2","Check out your South Burlington location. Literally the worst run business I have ever worked for. My termination date was incorrectly logged into the system, because they didn't want to pay out my wages until it was convenient for them. I have been trying to get my paystub's from them for over a week without any success. This location is genuinely a dumpster fire, and it was the worst decision of my life to work here.
",1.0,1.0,1.0,1.0,1.0,1.0,Doesn't Recommend,Neutral Outlook,No opinion of CEO
Tue Dec 17 2019, Sales Representative,"Winston-Salem, NC",Former Employee ,Sales Representative,0,"Great work environment 
PTO
Nurse on staff
","Very hectic at times
Advice to Management
Keep it fair and consistent
Helpfu","Keep it fair and consistent
Helpfu",5.0,5.0,5.0,4.0,4.0,4.0,Recommends,Positive Outlook,Approves of CEO
Tue Dec 31 2019, IT Analyst,,Former Employee ,Company is always going through restructuring,0,"Very good work and days off benefits. Good insurance. Average benefits.
","Company has off shored many of their jobs to India.
Advice to Management
Management needs to be a little more caring and pay attention to their employees. Treats employees as numbers and not people.
Helpfu","Management needs to be a little more caring and pay attention to their employees. Treats employees as numbers and not people.
Helpfu",2.0,4.0,2.0,3.0,3.0,1.0,Doesn't Recommend,Negative Outlook,No opinion of CEO
Mon Dec 16 2019, Projects,,Current Employee ,go for it,0,"Competitive pay rate for this line of work
","long hours of work. Personal time needs to be sacrificed.
Helpfu",,4.0,,,,,,,,
Mon Dec 16 2019, Key Account Manager,"Norfolk, VA",Former Employee ,Great Company,0,"Career growth, if willing to relocate
","Growth depending on who will sponsor you. If you do not have a person who will help you move up you will not be promoted
Helpfu",,4.0,5.0,4.0,3.0,3.0,3.0,Recommends,Positive Outlook,No opinion of CEO
Sun Dec 15 2019, Warehouse Loader,"Conroe, TX",Former Employee ,It's a great place to earn good money.,0,"Great pay, job security, will help you get in shape
","Very little upward mobility, equal pay for unequal work
Advice to Management
The front line workers need more incentives for effort.
Helpfu","The front line workers need more incentives for effort.
Helpfu",4.0,2.0,5.0,3.0,5.0,2.0,Recommends,Positive Outlook,Approves of CEO
Sat Dec 14 2019, Administrative Associate,"Columbia, MO",Current Employee ,...,0,"Work/Life Balance and Opportunity for growth
","Under compensated for the variety and complexity of responsibilities
Helpfu",,5.0,5.0,4.0,5.0,3.0,5.0,Recommends,Positive Outlook,Approves of CEO
Wed Dec 11 2019, Field Service Technician,"Colorado Springs, CO",Former Employee ,Great place to work,0,"Great work atmosphere. Enjoyed working for Pepsi
","None There are no cons
Helpfu",,5.0,3.0,5.0,5.0,4.0,4.0,Recommends,Positive Outlook,Approves of CEO
Mon Dec 09 2019, District Sales Leader,,Current Employee ,Good Benefits + Experience,1,"Strong resume builder, as there are plenty of ways to get promoted. Teaches you customer relationship building.
","People are not held responsible for their actions. Hard to make a lot of $$.
Helpful (1",,4.0,,,,,,,,
Wed Dec 11 2019, General Manager,"Des Moines, IA",Current Employee ,General manager,0,"Good benefits and flexible
","pay is low for the job title, management is sometimes unreal
Helpfu",,4.0,4.0,5.0,2.0,2.0,2.0,Recommends,Positive Outlook,Approves of CEO
Sun Dec 22 2019, Sales Manager,,Former Employee ,Not the place to work if you have experience,1,"Corporate lifestyle. They preach work/life balance but there isn’t much time for that.
","Up at 430am get home after 6pm. Working some weekends and holidays. No work/life balance whatsoever.
Advice to Management
It’s not that serious. Stop forcing everyone to neglect their families and take some initiative and lead by setting an example of a family first environment.
Helpful (1","It’s not that serious. Stop forcing everyone to neglect their families and take some initiative and lead by setting an example of a family first environment.
",3.0,1.0,3.0,3.0,2.0,2.0,Doesn't Recommend,Neutral Outlook,No opinion of CEO
Thu Dec 05 2019, Sales Associate,,Current Employee ,Pros,1,"
5.0
★★★★★
Current Employee - Sales Associate 
I have been working at PepsiCo full-time
Pros
Flexible hours and Monday through Friday
","Have to deal with customers daily
Advice to Management
Good management overall no complains
Helpful (1","Good management overall no complains
",5.0,5.0,5.0,5.0,5.0,5.0,,,
Sat Dec 07 2019, Finance Supervisor,,Current Employee ,Great place to grow your career,0,"Competitive salaries, great benefits, flexible schedules for most teams
","Long hours required to stay ahead of job demands
Helpfu",,4.0,3.0,4.0,5.0,,,Recommends,,
Fri Jan 10 2020,N/A,, ,"I was terminated for violating a company policy that had never been updated, after I was told that I did nothing wrong.",1,"As long as you don’t have a life or any other obligations outside of work, then it’s a decent place to work.
","Forced to come in four hours early and/or stay four hours over, mandatory. Forced to work 80+ hours per week. Huge lack of communication in every department.
Advice to Management
Supervisors are never forced to work early or late or weekends. They treat the employees like they’re not humans.
Helpful (1","Supervisors are never forced to work early or late or weekends. They treat the employees like they’re not humans.
",1.0,,,,,,,,
Thu Dec 05 2019, Presales Representative,,Current Employee ,Great place to work,0,"Place has good benefits and takes care if it’s people.
","Somewhat regular management turnover, other employees with less perspective on what a ‘hard’ job cause some drama
Helpfu",,4.0,5.0,4.0,4.0,4.0,4.0,Recommends,Positive Outlook,No opinion of CEO
Wed Dec 04 2019, Maintenance Director,,Current Employee ,My salary at Pepsico,0,"Great benefits and salary. The people are also very nice.
","Very demanding work. High pressure environment.
Helpfu",,5.0,,,,,,,,
Thu Jan 09 2020, Community Worker,"Gainesville, GA",Current Employee ,Not a place to grow,0,"A check every week. Paid holidays
","Insurance cost too high for the pay. Cost Over 100.00 a week for benefits so your net pay is too low.
Advice to Management
Stop taking from frontline employees to make bonuses. Take a good look at the wasted product and turn it into profit revenue
Helpfu","Stop taking from frontline employees to make bonuses. Take a good look at the wasted product and turn it into profit revenue
Helpfu",1.0,2.0,1.0,1.0,2.0,1.0,Doesn't Recommend,Negative Outlook,Disapproves of CEO
Mon Dec 02 2019, Crew Member,N/A,Former Employee ,Good,0,"Great people, good hours and family environment
","Managers cared for themselves
Helpfu",,4.0,,,,,,,,
Sun Dec 01 2019, Merchandiser,"Youngwood, PA",Former Employee ,Early hours,0,"Great boss’s and coworker and free pop at their location
","Too early to get up and didn’t go by where I lived
Advice to Management
Flex hours
Helpfu","Flex hours
Helpfu",5.0,2.0,4.0,4.0,1.0,4.0,Recommends,Positive Outlook,No opinion of CEO
Sat Nov 23 2019, Warehouse Person,"Seattle, WA",Former Employee ,Know What You're in For,3,"• Total, affordable benefits & perks, including a free on-site clinic
• High base-pay
• Large, annual pay increases
• Union job security (assuming you make rate)
• Helpful, close-knit crew
","• Extremely long hours (often 10-13+ depending on volume & staffing)
• No training process
Advice to Management
To start, be upfront about business needs and potentially long hours. The aim should be to retain workers who are content with all realistic expectations, even if it means scaring other candidates off.

Finally, incorporate a formal training process. Current training consists of shadowing for six hours, and then they're on their own to strikeout. Give new hires one designated mentor for the first week to help build confidence through hands-on practice and guidance. Having one teacher will help to keep new hires from becoming overwhelmed since everybody has their way of doing things. It's easy for some trainees to feel like they're doing nothing right sometimes because of this, even if they have made notable improvements. Throughout the second week, touch base on factors such as what the trainees can improve on and what they've done well.

In conclusion, don't tell candidates to expect consistent eight hour nights if that isn't realistic, and make the first two weeks on the job manageable and controlled. Aim to retain with honesty and attentiveness.
Helpful (3","To start, be upfront about business needs and potentially long hours. The aim should be to retain workers who are content with all realistic expectations, even if it means scaring other candidates off.

Finally, incorporate a formal training process. Current training consists of shadowing for six hours, and then they're on their own to strikeout. Give new hires one designated mentor for the first week to help build confidence through hands-on practice and guidance. Having one teacher will help to keep new hires from becoming overwhelmed since everybody has their way of doing things. It's easy for some trainees to feel like they're doing nothing right sometimes because of this, even if they have made notable improvements. Throughout the second week, touch base on factors such as what the trainees can improve on and what they've done well.

In conclusion, don't tell candidates to expect consistent eight hour nights if that isn't realistic, and make the first two weeks on the job manageable and controlled. Aim to retain with honesty and attentiveness.
",4.0,2.0,4.0,4.0,5.0,3.0,Recommends,Positive Outlook,No opinion of CEO
Sun Dec 01 2019, PSAM,"New York, NY",Former Employee ,Great opportunity,0,"The route is like having your own business, without having total control over decisions, and there are great resources to be successful. It pays well, but there are a lot of hours to balance it out. It also has great benefits and a lot of prestige for working and being successful there. You're surrounded by other top performers.
","Long hours and sometimes cutthroat. Some managers focus more on what numbers they need to promote their career instead of the customer. There is a lot of balancing needs between departments with conflicting goals and it can be political to advance. College recruits have the best promotion opportunities.
Advice to Management
Create a way for more people who have consistently performed and been with the company longer opportunities for management positions.
Helpfu","Create a way for more people who have consistently performed and been with the company longer opportunities for management positions.
Helpfu",4.0,2.0,4.0,4.0,4.0,4.0,Recommends,Positive Outlook,Approves of CEO
Sun Dec 15 2019, PSR,,Current Employee ,Working as a frontline employee,0,"Time off. Work schedule. Access to information
","Hours are way to long. Our salary is not enough for the hrs we work
Helpfu",,3.0,1.0,2.0,3.0,2.0,3.0,Recommends,Positive Outlook,No opinion of CEO
Fri Nov 22 2019, Machine Operator,"Dallas, TX",Current Employee ,Machine operator,1,"Benefits career advancement and pay is great
","Overtime is paid in chinese variation
Helpful (1",,5.0,3.0,5.0,5.0,5.0,5.0,Recommends,Positive Outlook,Approves of CEO
Mon Dec 09 2019,N/A,, ,PepsiCo gave me a great foundation in R&D,0,"Diversity, fast-paced, challenging projects, solid processes, tuition reimbursement, great name on your resume
","Micromanagement, siloed, difficult to move from one function to another, such a large company that you feel like a dime a dozen, no bonus until L10 (Manager)
Advice to Management
Offer bonus to all full time employees (like most other CPG companies) which encourages your employees to work that much harder to deliver against company goals and KPIs; take a chance and allow broader movement between job functions to grow and empower people
Helpfu","Offer bonus to all full time employees (like most other CPG companies) which encourages your employees to work that much harder to deliver against company goals and KPIs; take a chance and allow broader movement between job functions to grow and empower people
Helpfu",3.0,,,,,,,,
Sun Dec 08 2019, Delivery Driver,"Toledo, OH",Former Employee ,Volatile Working Routes,1,"Start time, employees discounts, insurance
","Pay, not true OT, merchandising, weak union
Helpful (1",,2.0,4.0,1.0,2.0,2.0,2.0,Doesn't Recommend,Positive Outlook,Approves of CEO
Fri Nov 22 2019, Sales Associate Analyst,,Current Employee ,Review,0,"Upward mobility and work-life balance
","Less than desirable pay
Helpfu",,4.0,5.0,4.0,5.0,3.0,4.0,,,
Wed Nov 20 2019, Manager,N/A,Former Employee ,Great company to work with,0,"Professional, Nice, Smart people to work with
","Work duplications, there are a lot of potential to drive efficiency.
Helpfu",,5.0,5.0,5.0,5.0,5.0,5.0,Recommends,Positive Outlook,Approves of CEO
Tue Nov 19 2019,N/A,, ,Sales District Leader (Beverages),0,"Fast past and exciting, great peers, good pay, generous PTO
","Tremendous pressure for sales, poor work life balance, very busy during holidays, lack of diversity in filed locations, poor at promoting, executive overreach
Advice to Management
Make sure your corporate initiatives are being implemented at field locations
Helpfu","Make sure your corporate initiatives are being implemented at field locations
Helpfu",5.0,,,,,,,,
Wed Dec 25 2019, Delivery Driver,,Former Employee ,Driver,0,"Free soda & paid weekly
","Working in the rain
Helpfu",,1.0,,,,,,,,
Wed Dec 04 2019, Sales Coordinator,"Houston, TX",Current Employee ,Pros & Cons,0,& ,"
2.0
★★★★★
Current Employee - Sales Coordinator in Houston, TX
Recommends
Positive Outlook
No opinion of CEO
I have been working at PepsiCo full-time for more than 5 years
Pros
Weekends off, holidays off also
Cons
Racism, unorganized, & communication sucks
Advice to Management
Organization
Helpfu","Organization
Helpfu",2.0,3.0,1.0,3.0,2.0,1.0,Recommends,Positive Outlook,No opinion of CEO
Tue Dec 03 2019, Accounting Operation Supervisor,"White Plains, NY",Current Employee ,Good work life balance,0,"Great people and growth opportunities
","Focused more on increasing numbers rather creating value
Advice to Management
Provide equal opportunities instead preferential treatment to slated candidates
Helpfu","Provide equal opportunities instead preferential treatment to slated candidates
Helpfu",3.0,4.0,4.0,4.0,3.0,4.0,,,
Mon Nov 18 2019, Class A CDL Delivery Driver,,Former Employee ,Hard work good benefits,0,"Very good benefits and people
","To much hard work and plus service store
Helpfu",,4.0,3.0,4.0,3.0,4.0,4.0,Recommends,,No opinion of CEO
Mon Dec 02 2019, Mechanic,,Former Employee ,couldve been better,0,"good pay, union benefits, decent people to work with
","sometimes unqualified supervisors, management unable to deal with bad employees because of union
Helpfu",,3.0,4.0,2.0,4.0,4.0,3.0,No opinion of CEO,,
Mon Dec 02 2019, Merchandiser,"Sacramento, CA",Former Employee ,Good Entry Level Job,0,"Good Pay
Good benefits
Chances to move up within company
","Working with various organizations
Dealing with issues others create
Helpfu",,3.0,2.0,4.0,5.0,4.0,2.0,,,
Sun Nov 17 2019, Key Account Manager,"New York, NY",Former Employee ,Great place to start a career,0,"Innovative, fast paced culture with lots of young people looking to make a difference, makes for a good culture.
","Small incremental raises upon promotion
Advice to Management
Innovation keeps the culture fun and exciting.
Helpfu","Innovation keeps the culture fun and exciting.
Helpfu",4.0,3.0,5.0,5.0,4.0,4.0,Recommends,Positive Outlook,No opinion of CEO
Thu Nov 14 2019, Sales,"Miami, FL",Current Employee ,Sales or merchandiser,0,"Well paid field to be in
","Long hours work field
Helpfu",,5.0,,,,,,,,
Tue Nov 12 2019, Warehouse Loader,"Cumberland, MD",Current Employee ,Warehouse,0,"Great company with great benefits
","You better love working overtime
Helpfu",,5.0,1.0,5.0,5.0,5.0,3.0,Recommends,Positive Outlook,Approves of CEO
Tue Nov 12 2019, Merchandising,,Current Employee ,"Great Company to work for, great benefits and pay",0,"Benefits,Full-time,Mileage Reimbursement, great management, supportive team
","Extremely physically demanding and strenuous on the body.
Helpfu",,5.0,5.0,5.0,5.0,5.0,5.0,Recommends,Positive Outlook,Approves of CEO
Tue Dec 17 2019, Warehouse Worker,,Current Employee ,run far far away from this place,1,"union environment so management can't fire you for low performace
","everything else. management/supervisor play favorites. no work life balance. will work day before and after holidays all night so you'll get a half day off for the holiday. they hire anyone because turnover is terrible due to poor supervisors
Helpful (1",,1.0,1.0,1.0,1.0,2.0,1.0,Doesn't Recommend,Negative Outlook,
Tue Nov 12 2019, Analyst,,Former Employee ,Good company and work atmosphere,0,"PepsiCo is a great company to work for. Lots of learning and growth opportunities. Cross functional projects are encouraged which helps you get a tastes of different functions. Flexible working policy is great.
","As with any large company there is a fair amount of politics. Really have to watch out for what team/manager you work for because that could potentially have a big impact on your career growth. 
Interview process can sometimes be very long, with little to no communication as to cause of delays.
Advice to Management
Better career advancement programs
More transparent interview process
Helpfu","Better career advancement programs
More transparent interview process
Helpfu",4.0,4.0,5.0,2.0,5.0,3.0,Recommends,,
Mon Nov 25 2019, Distribution Supervisor,"Stone Mountain, GA",Current Employee ,Poor work life balance,1,"Money is ok
Benefits are ok
","No time off
Phone rings constantly
Location Leader is not a people person. He does not know how to talk to people
Advice to Management
Listen to the front line and front line supervisors and you wont make so many mistakes
Helpful (1","Listen to the front line and front line supervisors and you wont make so many mistakes
",2.0,1.0,1.0,5.0,3.0,1.0,Doesn't Recommend,Neutral Outlook,No opinion of CEO
Sun Nov 10 2019, Merchandiser,"Mesquite, TX",Former Employee ,Good,0,"Pay was very good to me
","I didn’t have any cons
Helpfu",,5.0,5.0,5.0,5.0,5.0,5.0,Recommends,Positive Outlook,
Sun Nov 10 2019, Senior Analalyst,N/A,Former Employee ,Great place to work,0,"Great work like balance and campus
","low compensation and lack of mobility
Helpfu",,4.0,,,,,,,,
