date,employee_title,location,employee_status,review_title,helpful,pros,cons,advice_to_mgmt,rating_overall,rating_balance,rating_culture,rating_career,rating_comp,rating_mgmt,recommends,positive_outlook,approves_of_CEO
Mon Aug 03 2020, Sales District Leader,"Tampa, FL",Former Employee ,"OK Company, Poor Regional Leadership",2,"Great benefits and co-workers in sales. Will invest in you if your willing to work
","Horrible leadership, treats employees as warm bodies. Reward is given to males over females. This region the South East and specifically Tampa, FL has had numerous examples of females being left behind due to work/life balance and preference given to those without children. For front line employees management gives direction on how to avoid hiring qualified individuals based on bias.
Advice to Management
Join this day and age. It isn't a good ol boys club anymore. You cannot live great off the backs of front line ee's working 80 hr/weeks.
Helpful (2","Join this day and age. It isn't a good ol boys club anymore. You cannot live great off the backs of front line ee's working 80 hr/weeks.
",2.0,,,,,,,,
Tue Jul 21 2020, Delivery Driver,"Newburgh, NY",Current Employee ,Decent company. Better management and pay needed,0,"Pretty good benefits. Cheap package.
","Decent company. Better management and pay needed
Advice to Management
Listen to your workers.
Helpfu","Listen to your workers.
Helpfu",4.0,3.0,3.0,3.0,3.0,2.0,Recommends,Neutral Outlook,
Tue Aug 04 2020, Manager,,Current Employee ,Good Place to work,0,Employee and ,"mer Centric focus
Cons
none that I am aware of
Helpfu",,3.0,,,,,,,,
Tue Aug 25 2020, Child Care Worker,,Former Employee ,When covid hit they let me go immediately,0,"staff seemed really friendly and good health care
","They made it seem like they really cared for their employees, but I was furloughed immediately after all the training's and ghosted.
Helpfu",,1.0,1.0,,,,,,,
Mon Jul 20 2020, Sales Representative,"Garden City, KS",Current Employee ,Pepsi is a great employer,0,"Awesome place to work for
","A lot of extra hours
Helpfu",,4.0,3.0,5.0,3.0,5.0,5.0,Recommends,Positive Outlook,Approves of CEO
Sat Jul 18 2020, Foodservice Sales Representative,"Philadelphia, PA",Current Employee ,Great company,0,"Cares about employees, work life balance, benefits
","90% travel, lack of diversity, difficult to navigate career at times
Advice to Management
More diversity
Helpfu","More diversity
Helpfu",5.0,4.0,4.0,4.0,3.0,4.0,Recommends,Positive Outlook,Approves of CEO
Fri Jul 17 2020,Anonymous,,Current Employee ,PepsiCo,0,"Good time off packages, benefits and pay rate
","Management put a lot on your plate, need to be good with your time.
Helpfu",,4.0,4.0,5.0,4.0,4.0,5.0,Recommends,Positive Outlook,Approves of CEO
Tue Jul 28 2020, GEO BOX DELIVERY DRIVER,"Munster, IN",Current Employee ,Sucks but you get paid,1,"Weekly pay
Decent pay
No need for gym membership just show up to work
","Long physical days
Lack of respect
Lack of organization
Management doesn't care
Helpful (1",,3.0,2.0,4.0,3.0,,,,,
Wed Jul 15 2020, Sales Operations Analyst,"White Plains, NY",Former Employee ,Great experience,0,"Lots of freedom, great culture, fun and cool perks, opportunity to grow
","No training, management was disconnected, raises were awful with no real feedback
Helpfu",,5.0,2.0,5.0,5.0,3.0,3.0,Recommends,Positive Outlook,Approves of CEO
Wed Aug 19 2020,Anonymous,,Current Employee ,Make some money,0,"Make lots and lots of money
","Everything else if you want to work for a place that’s ran by a bunch of entitled idiots this is the place for you
Advice to Management
You all suck everyone of you
Helpfu","You all suck everyone of you
Helpfu",1.0,1.0,1.0,1.0,5.0,1.0,Doesn't Recommend,Negative Outlook,Disapproves of CEO
Tue Jul 14 2020, Communications Specialist,,Current Employee ,hello,0,"i love this place so much
","hate it anywhere else truly
Helpfu",,4.0,3.0,4.0,4.0,4.0,2.0,,,
Mon Jul 13 2020, Account Manager,"Irvine, CA",Former Employee ,Amazing,0,"Great place to work, awesome people
","Spent a lot of time on the road
Helpfu",,5.0,,,,,,,,
Mon Jul 13 2020, Warehouse Worker,"Grand Rapids, MN",Current Employee ,Its ok,0,"The hourly pay is good
","Long hours not for everyone
Helpfu",,4.0,,,,,,,,
Wed Jul 08 2020, Supply Chain Operations Supervisor,"Louisville, KY",Current Employee ,Plenty of opportunities available if you want to earn it!,0,"Very competitive pay, winning culture
","Can be long grueling hours
Advice to Management
Learn to communicate with all staff, not just the managers you know.
Helpfu","Learn to communicate with all staff, not just the managers you know.
Helpfu",4.0,3.0,5.0,4.0,4.0,4.0,Recommends,Positive Outlook,No opinion of CEO
Tue Jul 07 2020, GEObox/Route Driver,"Oklahoma City, OK",Current Employee ,Great place to work,0,"Great schedule, free flowing work days
","Overtime rarely available but solid full-time schedule
Advice to Management
Don't change work environment
Helpfu","Don't change work environment
Helpfu",5.0,4.0,4.0,4.0,4.0,4.0,Recommends,Positive Outlook,Approves of CEO
Tue Jul 21 2020, Merchandiser,,Current Employee ,Solid Company,0,"Easy work, Good Base Pay, Great Culture
","Hours are early and sometimes require large drives.
Advice to Management
Don't overload merchandisers during major push weeks. Some leads are borderline abusive to employees.
Helpfu","Don't overload merchandisers during major push weeks. Some leads are borderline abusive to employees.
Helpfu",3.0,,,,,,Recommends,Neutral Outlook,Approves of CEO
Mon Jul 20 2020, Sales Director,"Chicago, IL",Former Employee ,Great company & experience gained - results driven environment,0,"Great people, great brands and many opportunities available... strong support resources available and great benefit package
","very stressful - need to deliver results or will not succeed. Very challenging to achieve work / life balance. lack of diversity in leadership, hard time retaining female executives.
Helpfu",,3.0,1.0,4.0,5.0,5.0,3.0,Approves of CEO,,
Mon Jul 20 2020, Associate Manager,"Irvine, CA",Current Employee ,Great place to work on big brands,0,"lots of exposure to upper management, and ability to learn quickly
","lack of training, and need to move around geographically to progress
Advice to Management
learn to live with some uncertainty
Helpfu","learn to live with some uncertainty
Helpfu",3.0,3.0,3.0,4.0,4.0,5.0,Recommends,Positive Outlook,Approves of CEO
Sun Aug 09 2020, Driver,,Current Employee ,Not good,1,"Not having to work there anymore
","Have to work for greedy people
Helpful (1",,1.0,1.0,1.0,1.0,1.0,1.0,Doesn't Recommend,Negative Outlook,Disapproves of CEO
Thu Jul 16 2020, Merchandiser,"Piscataway, NJ",Current Employee ,Stable,0,"Nice when you get FT. PT starts at 14.23hr give or take a few pennys. Goes up to 18.23hr when FT and then you go to top rate at a certain point but I don't know when that is. Benefits are good.
","Running into a lot of messy back rooms and deliveries that are not packed out from previous day. Despite complaints sups don't really do anything about it and even the union will protect the bad workers.
Helpfu",,3.0,3.0,5.0,3.0,,,,,
Wed Jul 01 2020, Area Manager,"Purchase, NY",Former Employee ,Results,0,"Leadership Development and project management development
","You will find yourself working with people who are there just because it looks good on their resume.
Advice to Management
Care about the customer
Helpfu","Care about the customer
Helpfu",5.0,4.0,4.0,4.0,5.0,4.0,Recommends,Positive Outlook,No opinion of CEO
Wed Jul 15 2020, Freight Broker,"Plano, TX",Former Employee ,PLCI,1,"Good benefits. Good people to work with.
","Long hours. Stressful environment. Not transparent about hours and job during interview process. Early starts and late nights. No work/life balance.
Helpful (1",,2.0,1.0,2.0,2.0,2.0,3.0,Doesn't Recommend,Neutral Outlook,No opinion of CEO
Mon Jun 29 2020, Associate Engineer,,Current Employee ,Great Place to Start a Career,0,"I'm quite happy I decided to come to Pepsico
","Salary will be lower than expected as a chemical engineer
Helpfu",,5.0,5.0,5.0,4.0,4.0,5.0,Recommends,,Approves of CEO
Sun Aug 02 2020, Forklift Operator,"Tampa, FL",Current Employee ,Terrible management,1,"Money and the guaranteed hours
","Everything else, the management will target you as soon as you say no to covering shifts or doing someone else's work.
Advice to Management
Stop harassing your employees
Helpful (1","Stop harassing your employees
",1.0,2.0,1.0,1.0,5.0,1.0,Doesn't Recommend,Negative Outlook,Disapproves of CEO
Fri Jun 26 2020, Retail Sales Associate,"Fort Pierce, FL",Current Employee ,Great place to work,0,"Challenging work. The benefits are some of the best I have seen. And the pay is better than in many places.
","Very physical. Your body will hurt. With time you will get use to it. Stick it out and see what happens.
Advice to Management
Put a “because” behind what you tell your employees. It is more that explaining your selves, it is giving your employees a reason to do what they do. Every body likes to be useful but only if they understand why.
Helpfu","Put a “because” behind what you tell your employees. It is more that explaining your selves, it is giving your employees a reason to do what they do. Every body likes to be useful but only if they understand why.
Helpfu",4.0,4.0,4.0,3.0,4.0,3.0,Recommends,Positive Outlook,No opinion of CEO
Fri Jul 10 2020, Territory Sales,"Rochester, NY",Former Employee ,Pepsico,0,"Great but your body and time will hurt
","No family life because of hours
Advice to Management
Appreciate employees
Helpfu","Appreciate employees
Helpfu",3.0,1.0,1.0,2.0,5.0,1.0,Recommends,Negative Outlook,Disapproves of CEO
Fri Jul 31 2020, Merchandiser,,Former Employee ,"Could have been great, but the experience was horrible",0,"Benefits and Pay, that’s it. As a merchandiser while I was working was more like slave labor, so the pay didn’t quite match the way work. However, if the training and workload was handled correctly, then it’d definitely be worth it.
","Lack of real training. Sales Merchants gossip about management and each other. Train little about the job and ethics of the stores you work in and moreover just work you like a grunt, because they lost employees due to Covid-19. Don’t pay their employees. In my case my final week there from this review date is now 3 weeks past due on a weekly pay schedule. Now I’m having to report them to my states labor board and contact a labor attorney to be able to come for my wages owed and well past due.

Bottom line.... my opinion as a “Merchandiser” you’re not valued.
Advice to Management
Train your employees correctly. Show them you value their efforts. Answer them when they email, text or call. Pay them wages due. It’s actually the law.
Helpfu","Train your employees correctly. Show them you value their efforts. Answer them when they email, text or call. Pay them wages due. It’s actually the law.
Helpfu",1.0,,,,,,,,
Fri Jul 31 2020, Merchandiser,,Former Employee ,"Could have been great, but the experience was horrible",0,"Benefits and Pay, that’s it. As a merchandiser while I was working was more like slave labor, so the pay didn’t quite match the way work. However, if the training and workload was handled correctly, then it’d definitely be worth it.
","Lack of real training. Sales Merchants gossip about management and each other. Train little about the job and ethics of the stores you work in and moreover just work you like a grunt, because they lost employees due to Covid-19. Don’t pay their employees. In my case my final week there from this review date is now 3 weeks past due on a weekly pay schedule. Now I’m having to report them to my states labor board and contact a labor attorney to be able to come for my wages owed and well past due.

Bottom line.... my opinion as a “Merchandiser” you’re not valued.
Advice to Management
Train your employees correctly. Show them you value their efforts. Answer them when they email, text or call. Pay them wages due. It’s actually the law.
Helpfu","Train your employees correctly. Show them you value their efforts. Answer them when they email, text or call. Pay them wages due. It’s actually the law.
Helpfu",1.0,,,,,,,,
Thu Jul 30 2020, Merchandiser,"Hayward, CA",Former Employee ,Worst Job I've Had,1,"Physically Easy, Plenty of hours
","Blatant Internal Politics, Emotionally Draining
Advice to Management
Conduct yourselves professional and leave racism at the door.
Helpful (1","Conduct yourselves professional and leave racism at the door.
",1.0,1.0,1.0,1.0,4.0,1.0,Doesn't Recommend,Negative Outlook,No opinion of CEO
Thu Jul 09 2020, RSR Route Sales Representative,"Reno, NV",Current Employee ,RSR,0,"good weekly pay and good benefits
","Long tough work days. work/life balance
Helpfu",,3.0,,,,,,,,
Mon Jul 27 2020, Talent Acquisition,,Current Employee ,Rampant outsourcing,4,"Flexibility to work from home, pretty fair salary, good coworkers
","Do you want to join Talent Acquisition or Human Resources at PepsiCo? I’d highly recommend you reconsider. Over the past five years, these departments have become virtually unrecognizable due to the vast amount of outsourcing they are doing - but don’t worry, they won’t call it outsourcing; it’s about efficiency, of course! Because moving hardworking teams to India and Mexico, and asking US teams to train their replacements, no less (the absolute audacity) is definitely the epitome of efficient...

Do not expect upward mobility. Do not expect new opportunities. Do not expect leadership to care about you one iota. You are replaceable and they will make it clear from day one.
Advice to Management
Stop outsourcing, start treating employees with respect, start being transparent for once
Helpful (4","Stop outsourcing, start treating employees with respect, start being transparent for once
",1.0,5.0,1.0,1.0,5.0,1.0,Doesn't Recommend,Negative Outlook,Disapproves of CEO
Wed Jun 24 2020, LD&T Coordinator,"Chicago, IL",Current Employee ,Position Review,0,"Fast paced, competitive, appropriate compensation
","Long hours (expect to work weekends)
Helpfu",,4.0,2.0,4.0,3.0,4.0,5.0,Recommends,Positive Outlook,Approves of CEO
Sun Jun 21 2020, Merchandiser,"San Diego, CA",Current Employee ,Good for young people,1,"Stable hours. Regular OT. Mileage reimbursement
","Commute times. Independent job need to always be thinking on your feet. Very physically demanding.
Helpful (1",,4.0,2.0,4.0,3.0,3.0,4.0,Recommends,Positive Outlook,Approves of CEO
Tue Jul 07 2020, District Sales Manager,"Orlando, FL",Former Employee ,Decent Job,0,"Great pay and great benefits
","Work life balance, 24/7 schedule, on call during weekends
Helpfu",,3.0,2.0,3.0,4.0,5.0,3.0,,,
Tue Jul 07 2020, Product Availability Manager,,Current Employee ,Facility manager,0,"Decent Compensation and benefits annually
","Long hours, work/life balance, leadership
Helpfu",,2.0,1.0,3.0,2.0,4.0,2.0,Doesn't Recommend,Neutral Outlook,No opinion of CEO
Mon Jun 22 2020, Forklift Operator,"Lithonia, GA",Former Employee ,Solid pay,0,"Solid pay and standard routine
","The heat. Untrustworthy management. The heat again no ac
Helpfu",,4.0,4.0,3.0,2.0,4.0,2.0,Recommends,Neutral Outlook,
Wed Jun 17 2020, Sales Representative,N/A,Former Employee ,"Good company, not great home life balance.",1,"Good benefits and Competitive pay
","Not staffed properly at all times.
Helpful (1",,4.0,,,,,,Recommends,Positive Outlook,Approves of CEO
Thu Jun 18 2020, Warehouse Worker,,Former Employee ,Rescinded contract,0,"All the hours you could want.
","You must stay very hydrated because of the bard work.
Helpfu",,4.0,,,,,,,,
Thu Jun 18 2020, Warehouse Worker,"Valdosta, GA",Former Employee ,Great but can be better,0,"Pay, everything good besides schedule
","Schedule, workload, unforeseen absence, bad equipment.
Helpfu",,4.0,3.0,5.0,5.0,5.0,5.0,Recommends,,
Sun Jun 14 2020, Warehouse Loader,"Coppell, TX",Current Employee ,Overall it’s a good job to have,1,"Competitive pay, good benefits, friendly work environment
","Hours are long, standing on your feet for a long period of time
Helpful (1",,4.0,2.0,3.0,4.0,4.0,2.0,Recommends,Positive Outlook,Approves of CEO
Wed Jul 22 2020, Sales Representative,,Former Employee ,Horrible,0,"There really weren't any pros here.
","The long hours. Be ready to work 12 plus hours a day. This is NOT a sales job. You will be expected to merchandise all your accounts. Get ready to be moving products into nasty coolers and build displays. Your territory will be unreasonably large. While that sounds nice for money, you are unable to do your job to the proper standards due to time constraints. The Coke reps had merchandisers and less than half the accounts I did. No matter how well you do, you'll be passed over by a campus hire. The campus program makes promises to recent graduates and promotes them regardless of skill or qualifications. There is literally no incentive for them to perform. So in addition to doing extremely physical work, with long hours away from your family you'll have nothing to show for it. Oh and who can forget early morning safety meetings where managers ask you to sign off on training you never were given. You'll start your day behind and still be expected to finish on time to avoid them having to pay you overtime.
Advice to Management
Promote based on skill and qualification. Not on campus program. Hire merchandisers to take pressure off the sales people. Hire additional sales reps. Our territories are unreasonably large. Actually give safety training instead of forcing us to say we got it. Give a better work life balance.
Helpfu","Promote based on skill and qualification. Not on campus program. Hire merchandisers to take pressure off the sales people. Hire additional sales reps. Our territories are unreasonably large. Actually give safety training instead of forcing us to say we got it. Give a better work life balance.
Helpfu",1.0,1.0,1.0,1.0,1.0,1.0,Doesn't Recommend,Negative Outlook,No opinion of CEO
Sat Jun 13 2020, Vice President Finance,"Purchase, NY",Former Employee ,Amazing place to work!,1,"You are surrounded by really smart people and the teamwork is excellent
","Can be a very political environment that gets in the way of mngmt development and career progression
Helpful (1",,4.0,3.0,4.0,4.0,4.0,4.0,Recommends,Positive Outlook,No opinion of CEO
Mon Jun 15 2020, LD&T Coordinator,"Plano, TX",Current Employee ,AWESOME PLACE TO WORK,0,"Management, benefits, environment, culture, diversity
","I cant think of any cons so far
Advice to Management
Keep it up
Helpfu","Keep it up
Helpfu",5.0,5.0,5.0,5.0,5.0,5.0,Recommends,Positive Outlook,
Thu Jun 11 2020, Operations Manager,N/A,Former Employee ,Awesome,1,"Worked hard but got great rewards.
","Not great work life balance
Helpful (1",,5.0,1.0,3.0,5.0,5.0,3.0,,,
Thu Jun 25 2020, Merchandise Supervisor,"Omaha, NE",Current Employee ,"Great corporate company, location politics get in the way of progress.",1,"Great benefits and opportunities to work your way up
","Location specific politics tend to run off great talent. If you don’t fit in with the veterans if the location you won’t make it far.
Helpful (1",,3.0,1.0,2.0,2.0,5.0,2.0,Doesn't Recommend,Positive Outlook,No opinion of CEO
Fri Jun 26 2020, Warehouse Worker,"Mandan, ND",Former Employee ,Dont work here unless you're absolutely desprate,1,"Benefits are great (401k, insurance, ect.). Once hired, other opportunities for advancement within the company are offered.
","Work/Life Balance is non-existent. Long hours. VROT (Chinese overtime) is a joke. No raises, everyone makes the same for that position. Warehouse Manager is arrogant and lacks common sense.
Advice to Management
Pay employees based on performance. Hold others accountable, not just pickers.
Helpful (1","Pay employees based on performance. Hold others accountable, not just pickers.
",2.0,1.0,1.0,3.0,2.0,1.0,Doesn't Recommend,Negative Outlook,No opinion of CEO
Mon Jun 08 2020, Kam,"Los Angeles, CA",Current Employee ,Great company to work for,1,"Great company to work for
","Very weak training program needs attention
Advice to Management
Need to spend more time supporting the field with training
Helpful (1","Need to spend more time supporting the field with training
",5.0,5.0,5.0,5.0,3.0,4.0,Recommends,Positive Outlook,Approves of CEO
Thu Jul 16 2020, Front End Developer,,Former Employee ,Ok,0,"Job security and I guess free Pepsi
","Too many meetings, not a place you can grow your skill set. Very cheap and demanding.
Helpfu",,1.0,2.0,1.0,1.0,2.0,1.0,Doesn't Recommend,Neutral Outlook,No opinion of CEO
Tue Jun 23 2020, Merchandiser,"Latham, NY",Former Employee ,Short term only,0,"Pay is at or above industry standard
","Weekend work. No significant social life. Hinders relationships or chances of developing one. Great job for short term employment with little opportunity for advancement.
Advice to Management
I think managers do the best they can and are aware of the commitment issues the job entails. Always do their best to remain professional in the face of high turnover and rigorous work environment the job demands. Difficult situation to be tasked with, knowing how much conflict can exist between a commitment to the job and personal life
Helpfu","I think managers do the best they can and are aware of the commitment issues the job entails. Always do their best to remain professional in the face of high turnover and rigorous work environment the job demands. Difficult situation to be tasked with, knowing how much conflict can exist between a commitment to the job and personal life
Helpfu",2.0,1.0,4.0,2.0,4.0,5.0,Doesn't Recommend,Positive Outlook,Approves of CEO
Sun Jun 07 2020, Merchandising Manager,,Current Employee ,Good not Great,0,"Good pay, great coworkers, lots of opportunity to move up.
","Losing the ability to make decisions at the location level.
Helpfu",,4.0,3.0,3.0,5.0,5.0,3.0,Recommends,Positive Outlook,
Thu Jun 04 2020, Management,"Phoenix, AZ",Former Employee ,PepsiCo Career,0,"Growth opportunities at PepsiCo are limitless.
","Worklife balance can be a challenge.
Helpfu",,4.0,3.0,4.0,5.0,4.0,4.0,Recommends,Positive Outlook,Approves of CEO
Mon Jun 01 2020, Service Technician,"Augusta, GA",Current Employee ,Good company but not a lot of movement for techs without relocating,0,"Everyone i work with is friendly and tries to help however they can
","Reducing overtime and removing our on call pay
Advice to Management
Listen to your techs and treat the right as far as pay to retain good technicians
Helpfu","Listen to your techs and treat the right as far as pay to retain good technicians
Helpfu",4.0,3.0,5.0,3.0,4.0,2.0,Recommends,Neutral Outlook,No opinion of CEO
Sat Jun 13 2020, Class A CDL Delivery Driver,"Saint Louis, MO",Former Employee ,Pepsi Driver,1,"They have really great pay
","Terrible work conditions and hours
Advice to Management
Management doesn't care as long as they're off at a decent time.
Helpful (1","Management doesn't care as long as they're off at a decent time.
",2.0,1.0,2.0,3.0,5.0,2.0,Doesn't Recommend,Negative Outlook,No opinion of CEO
Thu May 28 2020, Support,"Knoxville, TN",Current Employee ,Temporary,0,"Pay is one of the pros
","No cons to report at this time
Advice to Management
N/A
Helpfu","N/A
Helpfu",4.0,4.0,4.0,4.0,4.0,4.0,Recommends,Positive Outlook,
Fri Jun 05 2020, RESOURCE,,Former Employee ,Corporate America,2,"Will make sure product is made and delivered
","No work life balance in the field. Manufacturing mentality not healthy in this day and age anymore. For both frontline and managers.
Helpful (2",,3.0,,,,,,,,
Mon Jun 08 2020, Sales Representative,,Current Employee ,Great company,1,"Good benefits 
Good pay
Good hours
","Manager sucks, pushes people out
Helpful (1",,2.0,5.0,5.0,2.0,5.0,1.0,Doesn't Recommend,Negative Outlook,Approves of CEO
Wed May 20 2020, Warehouse Manager,"Detroit, MI",Former Employee ,Great Place to work with a lot of red tape,2,"opportunities to grow and resources, reach out to similar facilities fro projects results
","red tape and margins on product are very small, need to work hard to drive results
Helpful (2",,4.0,4.0,4.0,4.0,4.0,4.0,Recommends,Positive Outlook,Approves of CEO
Mon May 25 2020, Crew,"Las Vegas, NV",Former Employee ,Crew,0,"Everything is great here for sure.
","Nothing is bad whatsoever , especially for the pay.
Advice to Management
Keep it up
Helpfu","Keep it up
Helpfu",4.0,5.0,4.0,5.0,5.0,4.0,Recommends,Positive Outlook,Approves of CEO
Fri Jun 05 2020, District Sales Leader,"Fort Lauderdale, FL",Current Employee ,Good,1,"Flexible at time and nice if you have a good manager
","Long hours, early and late hours
Helpful (1",,3.0,1.0,1.0,1.0,3.0,2.0,Doesn't Recommend,Negative Outlook,Disapproves of CEO
Sun May 31 2020, Financial Analyst,,Current Employee ,ok,1,"Nice people
Great vacation and sick pay
","only bonuses for sales or upper management and execs
Helpful (1",,3.0,4.0,3.0,2.0,2.0,2.0,Doesn't Recommend,Neutral Outlook,No opinion of CEO
Tue Jun 02 2020, Machine Operator,"Indianapolis, IN",Former Employee ,Mostly good,0,"Easy enough jobs. Good pay.
","Awful over time policy. Low communication.
Advice to Management
Spread the work load out a little.
Helpfu","Spread the work load out a little.
Helpfu",3.0,1.0,3.0,2.0,4.0,2.0,Recommends,Positive Outlook,No opinion of CEO
Mon May 18 2020, Warehouse Loader,,Current Employee ,Great,0,"Good pay/benefits. Get you in shape
","Very physical. Hours can be long
Helpfu",,5.0,5.0,5.0,,,,Recommends,,
Sat May 30 2020, Operations Manager,,Former Employee ,Operations Manager,1,"Great people management experience 
Great exposure
Depending on where you begin your career; a lot of different opportunities are offered
","Very demanding job 
Requires a lot of regular hours and on call hours
Helpful (1",,3.0,1.0,3.0,5.0,3.0,3.0,,,
